,Script
1731,"will come again, and the universe will dissolve. Where is the Captain"
1732,of this ship? Where is the Captain to receive the prize? 
1733,DOCTOR: I'm afraid the Captain can't be with us. She met with a rather
1734,unfortunate accident. Both the Captain and the First Mate fell
1735,overboard. I brought the ship into harbour with some assistance. 
1736,BLACK GUARDIAN: You lie! 
1737,DOCTOR: I leave the lies and deception to you. 
1738,"BLACK GUARDIAN: Take care, Doctor. You have not defeated me. You have"
1739,merely won a minor skirmish. The war still goes on. 
1740,"WHITE GUARDIAN: It seems Enlightenment is yours, Doctor. "
1741,"DOCTOR: I'm not ready for it. I don't think anyone is, especially"
1742,Eternals. 
1743,"(Striker, Marriner and Tegan enter.) "
1744,"TEGAN: Doctor, I thought you "
1745,"DOCTOR: Yes. Not now, Tegan. "
1746,"WHITE GUARDIAN: You're right, Doctor. Let the Eternals return to the"
1747,place from which they came. 
1748,MARRINER: No. I want to stay. 
1749,"WHITE GUARDIAN: Back to your echoing void, back to the vastness of"
1750,eternity. 
1751,"MARRINER: Tegan, help me. "
1752,TEGAN: I can't. 
1753,MARRINER: I need you. 
1754,"(As Marriner stretches out his hand to her, he and Striker fade away.) "
1755,TEGAN: Doctor? 
1756,DOCTOR: There's nothing we can do. 
1757,"WHITE GUARDIAN: You were right, Doctor, in judging no one is fit to"
1758,"claim all Enlightenment. I can, however, allocate a share to you,"
1759,Turlough. 
1760,TURLOUGH: Me? 
1761,WHITE GUARDIAN: You assisted in bringing the ship to harbour. 
1762,"(The White Guardian removes a second lid from the glowing ball, to"
1763,reveal a jagged crystal.) 
1764,TURLOUGH: It's diamond. The size. It could buy a galaxy. I can have
1765,that? 
1766,WHITE GUARDIAN: Yes. 
1767,"BLACK GUARDIAN: I would point out that under our agreement, it is mine."
1768,"Unless, of course, you wish to surrender something else in its place."
1769,"The Doctor is in your debt for his life. Give me the Doctor, and you"
1770,"can have this, the Tardis, whatever you wish. "
1771,"WHITE GUARDIAN: Consider, Turlough. Which will you give him? The"
1772,"Doctor, or this? The choice is yours. "
1773,(The White Guardian pushes 'Enlightenment' towards Turlough.) 
1774,"TURLOUGH: Here, take it! "
1775,"(Turlough flings 'Enlightenment' at the Black Guardian, who bursts into"
1776,"flames, screaming.) "
1777,WHITE GUARDIAN: Light destroys the dark. I think you will find your
1778,contract terminated. 
1779,(Turlough gets the crystal from his trouser pocket. It has turned
1780,"black, so he drops it into the flames.) "
1781,TURLOUGH: I never wanted the agreement in the first place. 
1782,DOCTOR: I believe you. 
1783,TEGAN: You're mad. 
1784,TURLOUGH: What I've said is true. 
1785,TEGAN: You believe him because he gave up Enlightenment for your sake. 
1786,DOCTOR: You're missing the point. Enlightenment was not the diamond.
1787,Enlightenment was the choice. 
1788,"WHITE GUARDIAN: Be vigilant, Doctor. Once, you denied him the Key to"
1789,"Time. Now, you have thwarted him again. He will be waiting for the"
1790,"third encounter, and his power does not diminish. "
1791,TURLOUGH: But the Black Guardian is destroyed. 
1792,"WHITE GUARDIAN: While I exist, he exists also, until we are no longer"
1793,needed. 
1794,(The White Guardian fades away.) 
1795,TEGAN: Let's get away from here. 
1796,DOCTOR: Anywhere in particular? 
1797,TURLOUGH: Yes. My planet. My home. 
1798,DOCTOR: Why not?  
1799,
1800,
1801,
1802,
1803,
1804,
1805,<Back
1806,to the episode listing
1807,Doctor Who and related
1808,marks are trademarks of BBC . Copyright 
1809,"1963, Present. The web pages on this site are for educational and"
1810,entertainment purposes only. All other copyrights property of their
1811,respective holders.
1812,
