,Script
1127,china teapot falls out of a cupboard and breaks.) 
1128,"WARNE : I can see you moving, Clancey. I'll give you ten seconds to"
1129,turn about. Ten seconds then I'm sending a missile in. 
1130,"MILO: Ten seconds! The nerve of that green-horn, saying things like"
1131,that to me. 
1132,"WARNE : One, two, three "
1133,DOCTOR: Don't you think it would be wiser to parley with him? 
1134,"MILO: Hold your hiccups, Doctor. Milo Clancey don't take ultimatums"
1135,from nobody. 
1136,WARNE : Five. 
1137,"JAMIE: Well, you can at least see what he wants. "
1138,ZOE: He's going to fire a missile onto us! 
1139,MILO: I got a trick here worth ten missiles. 
1140,"WARNE : Nine. Ten. All right, Clancey, you had your chance. "
1141,"(Milo grabs a large lever and pulls, releasing a cloud of particles"
1142,from Liz's stern.) 
1143,MILO: That's for that young green-horn and his new-fangled toy. Get
1144,"yourself out of that one, boy. "
1145,"ZOE: What happened? What did you do, Mister Clancey? "
1146,"MILO: My own invention, my little chickabiddy. Two tons of copper"
1147,needles I just lay out beside me when one of those new-fangled
1148,spaceships gets too close for comfort. 
1149,ZOE: But how do copper needles stop a spaceship? 
1150,"JAMIE: Aye, and a missile? "
1151,"MILO: Well, you see, they've all got those new-fangled computer"
1152,"guidance systems, you see? The argonite in the spaceship, that attracts"
1153,"all the copper, then all those thousand little needles, they all jigger"
1154,up all their computer scanners. 
1155,ZOE: What's argonite? 
1156,"MILO: What is argonite?! Don't they learn you nothing at school, girl? "
1157,ZOE: They didn't teach me anything about argonite. 
1158,MILO: Oh! 
1159,"ZOE: Have you ever heard of argonite, Doctor? "
1160,"DOCTOR: Well, from what Mister Clancey was saying, I imagine it's a"
1161,metal that's used in the construction of spacecraft. Am I right?
1162,"MILO: Argonite is used for, well, it's used for practically everything."
1163,"It's ductile, it's tensile, it's heat-proof, it's practically"
1164,indestructible. 
1165,DOCTOR: Magnetically polarised for copper. 
1166,MILO: Ah. You mean to say that you have honestly never heard of
1167,argonite? It's the most expensive mineral in the galaxy. 
1168,DOCTOR: I told you already. We don't come from this civilisation. We
1169,are visitors. 
1170,"JAMIE: Aye, and I hope we're not stopping long. "
1171,"MILO: Well, if that doesn't beat jumping grasshoppers. You mean to say"
1172,you travel around in time as well as space? 
1173,"DOCTOR: Well, yes, yes. You've grasped the principle very well. "
1174,"MILO: Hey, hey! That must be a mighty interesting thing to do. "
1175,"JAMIE: Aye, it would be, if we knew where we were going to land up"
1176,every time. 
1177,DOCTOR: It's just a minor fault in the system. I shall 
1178,DOCTOR + JAMIE: Put it right in time. 
1179,JAMIE: Aye. 
1180,ZOE: If we ever see the Tardis again. 
1181,"DOCTOR: Oh, yes. By the way, Mister Clancey, would it be going out of"
1182,"your way to drop us off at the space station, please? "
1183,"MILO: I can't do that. It's all in bits, isn't it. "
1184,"DOCTOR: Oh, dear. Oh, my word. Do you know where they are? "
1185,"MILO: No, no, no. Only the argonite pirates know that. They're toting"
1186,them off for salvage. 
1187,"DOCTOR: Oh dear, well, that will be difficult, won't it. "
1188,"MILO: Hey, we shouldn't be sitting around here. We should be get"
1189,getting the heck out of here before that General Hermack starts to send
1190,"some more Minnows out, and I've used up all my copper needles. "
1191,"JAMIE: Well, who's General Hermack? "
1192,MILO: General Herm? He's the Space Corps. He's trailing those pirates.
1193,"He thinks I'm one of them. That's why I say he's bone-headed. Now look,"
1194,"let's move out of here. Excuse me. Watch out. That's it, get over"
1195,"there. That's it, over there. Come on, boy. "
1196,ZOE: Mister Clancey. 
1197,"MILO: Look, you're a good girl and you promise not to cause me trouble,"
1198,you can call me Milo. 
1199,"ZOE: Oh, well Milo. There's one thing I don't understand. "
1200,"MILO: Well you're very lucky, girl. There's about a hundred thousand"
1201,"things I don't understand, but I don't stand around asking fool"
1202,"questions about them, I do something useful. Why don't you do something"
1203,useful. Why don't you make us all a pot of tea or something? 
1204,JAMIE: The pot was broken. 
1205,DOCTOR: That would be lovely. 
1206,"MILO: Well, there's a metal pot in that cupboard there, made of"
1207,tillium. 
1208,DOCTOR: Tillium? 
1209,"MILO: Yah, that's what this whole spaceship's made of, tillium. Lasted"
1210,me a lifetime round the galaxy. Makes a lousy cup of tea. 
1211,"ZOE: Oh, that's what I couldn't understand. Why your space ship wasn't"
1212,affected by the copper needles. 
1213,JAMIE: What'll happen to us if one of those wee minnow things catches
1214,up with us? 
1215,"MILO: Ah, don't worry lad, they won't. I'm going to go to the one place"
1216,that General will never think of looking.
1217,
1218, [Issigri Mining office]
1219,
1220,(The cloud of copper needles is creating
1221,interference with the communications.) 
1222,"WARNE : He used some kind of anti-missile device, sir."
1223,Jammed all my controls. 
1224,"HERMACK: Major Warne, can you hear me? I repeat, can you hear me? "
1225,"WARNE : Just about, sir. "
1226,HERMACK: You let Clancey make a complete fool of you! Are you still
1227,tracking his ship? 
1228,"WARNE : No, sir. My radar and sonar screens are out of"
1229,action. 
1230,HERMACK: What? 
1231,"WARNE : Well, I can't sit here with just (static) I request"
1232,"assistance immediately, sir. "
1233,HERMACK: Your request is noted. 
1234,(Transmission ends. Madeleine enters with a secretary.) 
1235,MADELEINE: These are the shipping times. Send them out on transprinter
1236,to all branch stations. These are production figures and loading dates.
1237,Code them and send them to head office right away. Priority clear.
1238,"Anything wrong, General? "
1239,HERMACK: Yes. Clancey has escaped. 
1240,MADELEINE: How did that happen? 
1241,HERMACK: I don't know yet but I mean to find out. May I monopolise your
1242,video channel a while longer? 
1243,"MADELEINE: Well, of course. "
1244,HERMACK: Thank you. General Hermack to V forty one. 
1245,"PENN : Yes, General. "
1246,"HERMACK: Ah, Penn. Did you pick up Major Warne's last report on your"
1247,monitor? 
1248,"PENN : Some of it, sir. There was a lot of interference. "
1249,HERMACK: Right. Now I want the rest of the minnow fleet launched and I
1250,want LIZ seventy nine found and destroyed. Is that understood? 
1251,"PENN on monitor]: Yes, sir. "
1252,HERMACK: Report back as soon as the Minnow fleet is clear. I am not
1253,giving Milo Clancey any more chances. 
1254,(The Minnow fighters are launched.)
1255,
1256, [LIZ 79]
1257,
1258,JAMIE: Doctor. 
1259,"DOCTOR: Yes, Jamie? "
1260,JAMIE: I think I'm going to be sick. 
1261,"DOCTOR: Now, now, now, Jamie. Will power, will power. "
1262,ZOE: Any more tea anyone? 
1263,"MILO: I'll have another cup if there's some there, Zoe. There you are,"
1264,that's as good as new. 
1265,(Milo has been making adjustments with a spanner.) 
1266,DOCTOR: Milo? 
1267,MILO: Hello. 
1268,DOCTOR: I've been watching this pressure gauge. It is just a little bit
1269,"high, isn't it? "
1270,"MILO: Yeah, it is a bittie. That's your thermonuclear power, you see."
1271,"Yeah, it's wearing out a bit. Nothing you can do about that. "
1272,"DOCTOR: Well, except slow down. I mean, there could be a nasty"
1273,"explosion, couldn't there? "
1274,"MILO: Ah, don't you worry, Doctor. It's a mighty strong little ship,"
1275,"this. They don't make ships like this these days, you know. "
1276,JAMIE: You can say that again. 
1277,"MILO: Ah, don't you worry, lad. We haven't got far to go. "
1278,ZOE: Where are we going? You haven't said. 
1279,"MILO: Well, ma'am, I'll tell ya. We're going to the one place where"
1280,they'll never think of looking for us. 
1281,(Milo turns on a scanner.) 
1282,MILO: That's the planet called Ta. 
1283,DOCTOR: Oh? Oh yes. Is it inhabited? 
1284,"MILO: Yeah, it is these days. It's the headquarters of the Issigri"
1285,Mining Corporation. 
1286,JAMIE: Why do you say they won't bother to look for us. 
1287,"MILO: Well, you see, Madeleine Issigri, who runs that show now, she's a"
1288,"sworn enemy of mine. Well, so I've been told. Anyway, General Hermack"
1289,will think I'll go anywhere else rather than go there. 
1290,"DOCTOR: Yes, but if she's a sworn enemy, won't she give you away? "
1291,"MILO: We won't be announcing our arrival, Doctor. We'll just lie low"
1292,there until that old Space Corps gets tired of looking for us. 
1293,ZOE: It doesn't look as though there's anything there. This side is
1294,just desert. 
1295,"MILO: No, no, there's no surface life on Ta, girl. There's too much"
1296,"ultra-violet radiation. Don't you worry, don't you worry. We'll be all"
1297,right. We'll be a mile underground as long as I can fall into my old
1298,landing pad. 
1299,"DOCTOR: Oh, you've been there before, have you? "
1300,"MILO: Certainly have, certainly have. Me and my old partner, Dom"
1301,"Issigri, god rest his poor tired old soul, we turned that whole planet"
1302,into a piece of Gruyere cheese between us. 
1303,JAMIE: Gruyere cheese. 
1304,"DOCTOR: Jamie, here. Mining! I see. For argonite, presumably. "
1305,"MILO: Yeah, that's right, argonite. One of the richest strikes we ever"
1306,"found. Took us about ten years to drill that clean. Well, I'd better"
1307,"try to find this old entry shaft then. Now, you'd better brace"
1308,yourselves. Hang onto something. My landing pad's ain't as good as they
1309,used to be. 
1310,JAMIE: Who cares as long as it's quick.
1311,
1312, [Issigri Mining office]
1313,
1314,HERMACK: Bring the ship in on pad three. I'll join
1315,"you there, Penn. "
1316,"PENN : Yes, sir. "
1317,"MADELEINE: I'm sorry your stay was so short, General. "
1318,"HERMACK: Well, I hope on my next visit, my duties will be less"
1319,pressing. 
1320,MADELEINE: So do I. Where do you go from now? 
1321,"HERMACK: Well, first of all I must get young Warne out of that fix he's"
1322,got himself into. Then I must collect my pickets from the beacons. And
1323,"after that, Lobos."
1324,MADELEINE: Lobos! 
1325,HERMACK: Hmm mmm. 
1326,MADELEINE: Milo Clancey's base? 
1327,HERMACK: The pirate's base. Those beacons they've been breaking up will
1328,"be heading there. With a little bit of luck, we shall be able to wipe"
1329,out the whole nest in one operation. 
1330,"MADELEINE: Well, I hope you do. Some of my crews are demanding arms in"
1331,case they're attacked. 
1332,"(On his way to the door, Hermack notices a model of a sleek black"
1333,spaceship.) 
1334,"HERMACK: Is that a, is that a Beta Dart? "
1335,"MADELEINE: Yes. Yes, our company's just bought two. They're our fastest"
1336,freighters. 
1337,HERMACK: Ah. I must bear that in mind. The pirates have a Beta Dart. I
1338,should hate to knock out one of your ships by mistake. 
1339,MADELEINE: Well I don't think that's likely. All our freighters show
1340,the Issigri nose-cone when they're in commission. 
1341,(She slides a pattern nose cone onto the model.) 
1342,MADELEINE: I designed it myself. 
1343,"HERMACK: Ah, very distinctive. How much does it cost? "
1344,"MADELEINE: Oh, a hundred million credits upwards. Depends on the"
1345,fittings. Why do you ask? 
1346,HERMACK: I was just wondering where Milo Clancey got a hundred million
1347,credits. 
1348,MADELEINE: I see. You think he got it by selling the stolen argonite. 
1349,HERMACK: Why not? It's logical. There's an illicit market for them on
1350,"Rita Magnum, I hear. "
1351,"MADELEINE: Yes, but I'm sure you're wrong about Milo Clancey. "
1352,HERMACK: Are you? I'm not. He's selling the stuff and professing
1353,"poverty as a cover. If I find those beacons sections on line for Lobos,"
1354,he'll not live to enjoy his money. 
1355,"MADELEINE: Goodbye, General. "
1356,"HERMACK: Goodbye, Miss Issigri. Thank you for your hospitality."
1357,
1358, [LIZ 79]
1359,
1360,"(The Liz lands with a big bump, throwing everyone"
1361,around again.) 
1362,"MILO: Nice smooth landing, after all. "
1363,JAMIE: Smooth? What do you call a rough landing? 
1364,"MILO: What's the matter with you, sonny? Are you getting soft or"
1365,something? 
1366,"JAMIE: Just let me get my feet back on the ground, that's all. "
1367,"MILO: You stay right here where you're safe, boy. "
1368,JAMIE: Safe? Is that what you call this? 
1369,DOCTOR: You want us to stay here? 
1370,MILO: Yeah. I'm thinking of your own safety. 
1371,JAMIE: Why? 
1372,"MILO: Well, we're a mile underground here. This is the old freighter"
1373,"dock. And there's nothing to see, there's nowhere to go, it's just a"
1374,"whole maze of argonite tunnels, and if you go in there, well, even I"
1375,mayn't be able to find you again. You stay right here in this ship. 
1376,"DOCTOR: Just a minute, where are you going? "
1377,MILO: I've got to go to the generator room. I think one of their
1378,rockets must have gone through my transmitter unit. That radio there's
1379,whistling like some sort of hysterical canary. 
1380,(Milo leaves with his tool bag.) 
1381,"JAMIE: Doctor, do you believe him? "
1382,"DOCTOR: I don't know, Jamie. What do you think? "
1383,"JAMIE: Well, he never did explain how he turned up the way he did, did"
1384,he? And that Space Corp ship was chasing him. 
1385,"DOCTOR: True. But I think we've got to trust him, Jamie. If we leave"
1386,"this ship, we'll never ever have a chance of finding the Tardis again. "
1387,"JAMIE: Well I don't see we've got much of a chance anyway. Look, it's"
1388,up there in space somewhere on a bit of that beacon heading for I don't
1389,know where. 
1390,"DOCTOR: A blast furnace, I imagine. I think I think the pirates are"
1391,probably going to take the pieces and melt them down for the for the
1392,"argonite. The trouble is, we can't guess where their headquarters is. "
1393,"ZOE: There's no need to guess, Doctor. It's easy enough to work out. "
1394,DOCTOR: What? 
1395,ZOE: Applied mathematics. 
1396,"DOCTOR: Applied? Oh, I see. You've been messing about again, have you? "
1397,"ZOE: Oh well, if you don't want to know what I've discovered. "
1398,"DOCTOR: No, no, no, no, no. Come along, surprise us. "
1399,ZOE: This was the position of our bit of beacon when Milo first saw us.
1400,I got the figures from the computer. 
1401,DOCTOR: Oh yes. 
1402,ZOE: And this was our position eight minutes later when he docked along
1403,side. 
1404,"DOCTOR: Yes, circle fourteen. Yes, go on. "
1405,"ZOE: Well, from this data it was simple enough to work out our original"
1406,position and course. Do you see? 
1407,"DOCTOR: Yes, except that after my little experiment, we veered rather"
1408,violently off that course. 
1409,JAMIE: Ah yes 
1410,"ZOE: Yes, but I allowed for that. Look! "
1411,DOCTOR: Oh. 
1412,JAMIE: Oh. 
1413,ZOE: Electromagnetic waves are always at right-angles to the direction
1414,"of propagation, and, as you know, travel at one hundred and eighty six"
1415,"thousand, two hundred and eighty two miles per second. "
1416,"DOCTOR: Do they really? How interesting. Well, what's the answer? "
1417,ZOE: Here! 
1418,DOCTOR: What? 
1419,"ZOE: If we'd stayed on our original course, the Tardis would have"
1420,"landed within ten miles of where we are now. Except, of course, it"
1421,would still be up there because we weren't travelling quite so fast. 
1422,"DOCTOR: Oh, bless my soul! Yes, of course. Yes, as you say, a simple"
1423,calculation. I should have thought of that myself. 
1424,"ZOE: Yes, I wonder why you didn't? "
1425,JAMIE: Did all that talk mean that the Tardis is going to land
1426,somewhere around here? 
1427,"DOCTOR: Jamie, it's all here, written down. It's as plain as a"
1428,pike-staff. 
1429,"JAMIE: Aye, well, in that case, the pirates are going to be round here"
1430,too! 
1431,"DOCTOR: Yes, Jamie, you're right. "
1432,ZOE: Do you think Milo's one of them and that's why he landed here? 
1433,"DOCTOR: Yes, I think it's possible. "
1434,"JAMIE: Aye, he seemed to know all about them, didn't he? Look, I think"
1435,we ought to get out of here before he comes back. 
1436,"ZOE: Yes, so do I. We don't even know if he has gone to the generator"
1437,room. He might just have gone to get his gang. 
1438,JAMIE: Aye. 
1439,(The Doctor checks outside the cabin.) 
1440,"DOCTOR: All right. All right, but if the Tardis has landed here we'll"
1441,"have to find it anyway. Come on, you two, but for heaven's sake don't"
1442,make a noise on the ladder. 
1443,(Jamie falls over something.) 
1444,ZOE: Jamie! 
1445,"JAMIE: We're not on the ladder yet, are we."
1446,
1447,[Mine shaft HQ]
1448,
1449,"(In a nearby tunnel, Dervish approaches a door with"
1450,two other pirates.) 
1451,CAVEN: Wait here! 
1452,(He enters the cavern HQ where Caven is at a communications desk.) 
1453,"DERVISH: What's the panic, Caven? "
1454,CAVEN: No panic. 
1455,"DERVISH: Well, you know what I mean. I got a Red emergency flash. "
1456,"CAVEN: I wanted to talk to you, Dervish. "
1457,DERVISH: Well? 
1458,CAVEN: What's the position at the plant? 
1459,DERVISH: We've just started on the last section of Alpha Two. 
1460,CAVEN: Leave it. 
1461,DERVISH: Leave it? 
1462,"CAVEN: Suledin's capable of taking change down there, isn't he? "
1463,"DERVISH: Well yes, but "
1464,"CAVEN: Right, when you've finished your flight service, I want you to"
1465,take the ship out. 
1466,DERVISH: Me? Where? 
1467,CAVEN: The Alpha Four sections are being re-routed. 
1468,DERVISH: Re-route? 
1469,CAVEN: To Lobos. 
1470,DERVISH: Lobos? But that's impossible! 
1471,"CAVEN: When I give an order, nobody says it's impossible, Dervish. "
1472,"DERVISH: Well, do you know how far Lobos is? I mean, the beacon rockets"
1473,will have to be re-fuelled. 
1474,CAVEN: That's right. That's exactly what I want you to do. 
1475,"DERVISH: Yeah, but the Space Corps have got a V-ship and a flight of"
1476,Minnows up there. It's too dangerous! 
1477,CAVEN: It has to be done. They've got to be drawn off. 
1478,"DERVISH: Well, why can't you do it, then? You're the master pilot. I'm"
1479,only supposed to be the engineer. 
1480,CAVEN: I've got to do things down here. 
1481,"DERVISH: Yes, so I've got to go and risk my life while "
1482,(Caven draws a gun.) 
1483,"CAVEN: You keep arguing, Dervish, and Suledin will be having your job"
1484,permanently. Now are you going to take that ship out or aren't you? 
1485,"DERVISH: Yes, of course, Caven. I was only just trying to point out the"
1486,"dangers, that's all. "
1487,"CAVEN: Well, now you're in more danger here than you ever will be in"
1488,space. 
1489,(An alarm sounds.) 
1490,DERVISH: It's the perimeter alarm. 
1491,MAN : Intruders in perimeter tunnel nine. Perimeter tunnel nine. 
1492,CAVEN: Alert the guards. I'm coming down. 
1493,DERVISH: Is it the Space Corps? 
1494,"CAVEN: I don't know, but whoever it is, we can deal with them in the"
1495,tunnel complex. Now get moving! 
1496,DERVISH: Right
1497,
1498,[Mine shaft]
1499,
1500,"(The Doctor, Jamie and Zoe have arrived in the"
1501,"dark, dank, fissure-strewn lower tunnels.) "
1502,ZOE: I'm sure we should have turned right back there. 
1503,JAMIE: We did turn right. 
1504,ZOE: I mean earlier. We seem to be getting deeper. 
1505,"JAMIE: What do you think, Doctor? Should we go on or turn back? "
1506,DOCTOR: I think we should have done as Milo told us. He said we'd get
1507,lost. 
1508,ZOE: The tunnels probably run for hundreds of miles. 
1509,"JAMIE: Well, if they do, we'll never get ourselves out. "
1510,"DOCTOR: Shush. Just a minute, Jamie. "
1511,ZOE: What? 
1512,DOCTOR: I can hear something. 
1513,JAMIE: There it is. A buzzing noise. 
1514,ZOE: Where's it coming from? 
1515,DOCTOR: Seems to be up ahead there.
1516,
1517, [LIZ 79]
1518,
1519,"MILO: Well, that's all right again, right as rain."
1520,"Hey, where are you? Zoe? Doctor? They ain't here. Oh, why can't some"
1521,people do what they're told. I guess I'd better go out and try and find
1522,them. 
1523,"(Strapping on his gun and taking a haversack from a cupboard, Milo"
1524,leaves.)
1525,
1526,[Mine shaft]
1527,
1528,"JAMIE: Hey, Doctor. There's a wee light there,"
1529,look. 
1530,DOCTOR: Where? 
1531,JAMIE: Just shining through a crack in the wall. 
1532,"ZOE: You're right, it is a light. "
1533,"DOCTOR: Yes, it's reflected through from the other side. I wonder if we"
1534,can 
1535,JAMIE: Too high to see anything. 
1536,ZOE: I'm the lightest. If you can lift me up perhaps I could see
1537,through. 
1538,DOCTOR: All right. You jump onto Jamie's back. 
1539,JAMIE: What? Oh. 
1540,DOCTOR: There we are. Can you see anything? 
1541,ZOE: A bit higher. 
1542,JAMIE: Hurry up. 
1543,"(Peering through to the cavern beyond, Zoe sees three figures in"
1544,welding suits using thermal lances to cut chunks from a large metal
1545,structure.) 
1546,DOCTOR: Well? 
1547,ZOE: There are three men in there and I think they're pirates. 
1548,JAMIE: How do you know? They could be miners. 
1549,"ZOE: No, they're cutting up bits of scrap and it looks like part of the"
1550,beacon. 
1551,"DOCTOR: It looks as though we've stumbled on their headquarters. Yes,"
1552,of course. That noise is an electrical furnace. 
1553,JAMIE: Did you see the Tardis? 
1554,"ZOE: No, just the three men. "
1555,"JAMIE: Doctor, we've got to try and stop them before they start cutting"
1556,it up. 
1557,DOCTOR: Yes. Now the first thing we'd better do is 
1558,(A blaze of light hits them and they turn to see a portable floodlight
1559,"coming their way. The Doctor, Jamie and Zoe retreat, encouraged by"
1560,gunfire.) 
1561,CAVEN: Keep moving! 
1562,DOCTOR: All right! There's no need for that! 
1563,CAVEN: Back! Back! Back! Back! 
1564,ZOE: Quick! Down this passage! 
1565,DOCTOR: Run! 
1566,"(Zoe dives through a crevice. Jamie and the Doctor follow, screaming as"
1567,they fall.) 
1568, Episode Four
1569,
1570,  [Mine chamber] 
1571," (Zoe, Jamie and the Doctor have landed in"
1572,a heap on a hard surface.) 
1573,"ZOE: Oh Doctor, are you all right? "
1574,DOCTOR: No. 
1575,JAMIE: What's the matter? 
1576,DOCTOR: Just a minute. 
1577,(The Doctor takes a broken packet from his back trouser pocket.) 
1578,ZOE: What are you carrying drawing pins for? 
1579,DOCTOR: I like drawing pins. Ouch. Normally.
1580,
1581,[Mine chamber]
1582,
1583,(Caven puts his gun away.) 
1584,CAVEN: Right. They won't give us any more trouble.
1585,
1586, [Lower mine shaft]
1587,
1588,"JAMIE: Oh, my leg! "
1589,ZOE: Are you all right? 
1590,"JAMIE: I must have twisted it when I landed. Oh, now where are we? "
1591,ZOE: It looks like some sort of a prison cell. 
1592,DOCTOR: Yes. 
1593,(Someone groans in the gloom.) 
1594,JAMIE: What's that? 
1595,"ZOE: Oh, Doctor, there's something over there. "
1596,"(Up above, Caven and his men leave, and Milo appears to go and look"
1597,down into the shaft. The Doctor investigates the groaning and finds
1598,someone lying against the wall.) 
1599,DOCTOR: Oh dear. 
1600,JAMIE: What is it? 
1601,DOCTOR: Look. 
1602,"JAMIE: Hey, it's that chap from the beacon. The one that was shooting"
1603,at us. 
1604,"ZOE: Yes, he's injured. Look. "
1605,DOCTOR: I think it's his shoulder. I think it's only a bruise. It's not
1606,"broken. Lift him up, very gently. What's this? "
1607,(The Doctor sniffs at an earthenware bowl.) 
1608,"DOCTOR: Yes, that's all right. "
1609,(The Doctor wets his handkerchief in the water and puts it to Sorba's
1610,forehead.) 
1611,"JAMIE: Ah, he's coming around."
1612,
1613, [Mine shaft HQ]
1614,
1615,(Caven is using his transmitter.) 
1616,"CAVEN: Come in, Beta Buccaneer. "
1617,"DERVISH : I want permission to return to base. Caven, do"
1618,you hear me? I'm bringing this ship in. 
1619,"CAVEN: Calm down, man. Report your position. "
1620,"DERVISH : We're forty three thousand miles out, on course"
1621,for the beacon sections. 
1622,"CAVEN: Well, you should be among them in twenty minutes. What's wrong?"
1623,Why the panic? 
1624,"DERVISH : We're running our heads into a trap, Caven. The"
1625,"Space Corp cruiser is less than three hours away, and on a convergent"
1626,course. 
1627,CAVEN: Those beacon sections have got to be diverted to Lobos. How long
1628,will that take? 
1629,DERVISH : It will take at least two hours. We just can't do
1630,it on time. 
1631,"CAVEN: You'll have to, Dervish. Just find some way of cutting the time."
1632,
1633,DERVISH : Those Minnow fighters will blast us to bits. I'm
1634,bringing the ship in! 
1635,"CAVEN: Now wait, don't be so impulsive. "
1636,(Caven holds up a wired cylinder.) 
1637,"CAVEN: Surely you recognise this, Dervish? You designed it. "
1638,"DERVISH [on monitor: Well, it's a UHF detonator. What are you playing"
1639,"at, Caven? "
1640,"CAVEN: I'm not playing at all. It is a detonator, and it is keyed to a"
1641,charge right under the atomic drives of the Buccaneer. 
1642,DERVISH : I don't believe it. You you're bluffing. 
1643,"CAVEN: If you think I'm bluffing, just you try turning back. You see,"
1644,"Dervish, you've got a fair chance of escaping the V-ship and the"
1645,"Minnows, but you've no chance at all of getting away from this. "
1646,"DERVISH : All right, Caven. "
1647,CAVEN: I knew you wouldn't let me down. Report as soon as you reach the
1648,sections.
1649,
1650, [V-Ship flight deck]
1651,
1652,PENN: All set. Operational? Right. Thank you. Major
1653,"Warne's just come aboard, sir. He's coming up to the bridge. "
1654,HERMACK: Good. Bridge to Power Room. We're under way again. Half boost.
1655,"Set course for Lobos, Penn. "
1656,"PENN: Very good, sir. "
1657,(Warne enters.) 
1658,"WARNE: Thanks for the rescue, sir. "
1659,"HERMACK: Ah. What happened to you, anyway? "
