,Script
1602,"DOCTOR: Well, you've been out in the curfew before, haven't you? "
1603,"ANNE: Yes, but the guards "
1604,DOCTOR: Then you know how to avoid the patrols. You go back to your
1605,aunt. You'll be quite safe. And you take my advice and stay indoors
1606,tomorrow. Now do you understand? It's too dangerous for you to stay
1607,"here. Now off you go, child. Come along, off, off, off. "
1608,"STEVEN: Look, Doctor, I don't think you understand "
1609,"DOCTOR: Ah, sh sh sh sh sh sh sh. "
1610,"ANNE: Goodbye, Monsieur Steven. Safe journey. "
1611,"STEVEN: Doctor, I don't think she should go. "
1612,"DOCTOR: Now off you go, my child. Off you go. "
1613,(Anne leaves.) 
1614,"STEVEN: Goodbye. Look, are you sure she'll be all right? The guards are"
1615,waiting for her. 
1616,"DOCTOR: My dear Steven, the Catholics will have other things on their"
1617,"minds tonight. She will be quite safe. Now then, you and I must leave"
1618,Paris at once. Come! 
1619,"STEVEN: Look, Doctor, what is going on? "
1620,"DOCTOR: There is no time for me to explain. Come along, boy. Come"
1621,along!
1622,
1623, [Tavannes' study]
1624,
1625,(Someone quietly enters the room.) 
1626,TAVANNES: Simon? 
1627,"CATHERINE: No, Marshall. "
1628,"TAVANNES: Madame. I apologise, I thought that "
1629,"CATHERINE: Never mind. I have it here, the order signed by the King."
1630,Our plans for tomorrow can go ahead. 
1631,TAVANNES: Thank God. 
1632,CATHERINE: God had very little to do with it. What is this? 
1633,"TAVANNES: The list, Madame. When those Huguenots are killed we need"
1634,have no further fear of a Protestant France. 
1635,"CATHERINE: We have no need of lists, Marshall. The good people of Paris"
1636,know their enemies. They will take care of them. 
1637,"TAVANNES: The good people? Madame, if you rouse the mob the innocent"
1638,will perish with the guilty. 
1639,CATHERINE: Innocent? Heresy can have no innocents. France will breath
1640,of pure air after tomorrow. 
1641,"TAVANNES: And Navarre, Madame, your son-in-law? Is he to be slaughtered"
1642,with the others? 
1643,CATHERINE: Tomorrow Henri of Navarre will pay for his pretensions to
1644,the Crown. 
1645,"TAVANNES: Madame, we must not kill Navarre. "
1646,CATHERINE: Must not? 
1647,TAVANNES: Protestant Europe will merely shed a pious tear over the
1648,death of a few thousand Huguenots. The death of a prince will launch a
1649,Holy War. 
1650,"CATHERINE: If one Huguenot life escapes me tomorrow, we may both regret"
1651,this act of mercy. 
1652,"TAVANNES: Not mercy, Madame. Policy. "
1653,"CATHERINE: Very well, Marshall. Then you must get him out of Paris."
1654,"After tomorrow, even I could not save him. "
1655,"TAVANNES: I will see to it, Madame. "
1656,"CATHERINE: And Marshall, close the gates of the city now. "
1657,"(The Queen Mother leaves, and Simon enters the study.) "
1658,"DUVALL: Well, my lord? "
1659,TAVANNES: The order has been given. You may begin. 
1660,DUVALL: My men are ready. Where's the list? 
1661,TAVANNES: There is no list. 
1662,DUVALL: But I thought? 
1663,TAVANNES: We are to unleash the wolves of Paris. None are to be spared.
1664,
1665,"DUVALL: Even better, my lord. "
1666,"TAVANNES: Is it? I wonder. And Simon, when you have passed on the order"
1667,I have a special charge for you. 
1668,DUVALL: My lord? 
1669,TAVANNES: Henri of Navarre. 
1670,DUVALL: I am to have the honour? 
1671,"TAVANNES: Yes, but not of killing him. You will escort him out of"
1672,Paris. 
1673,DUVALL: But my lord! 
1674,TAVANNES: You not hear me? You will be responsible for his safety. You
1675,will have to leave tomorrow's work to others. Now get out. 
1676,(Duvall leaves.) 
1677,TAVANNES: At dawn tomorrow this city will weep tears of blood.
1678,
1679,[Street]
1680,
1681,(The Doctor and Steven have stolen through the
1682,"streets of Paris, but their way back to the Tardis is blocked by the"
1683,guards standing outside de Coligny's house.) 
1684,"GUARD 1: Oh, it's nearly dawn. "
1685,GUARD 2: How many more nights have we got to watch over this Huguenot's
1686,house? 
1687,GUARD 1: Till the King decrees otherwise. 
1688,GUARD 2: But why does it have to be us? 
1689,"DOCTOR: Yes, we shall have to get past them to get back to the Tardis. "
1690,STEVEN: Can we make a run for it? 
1691,"DOCTOR: Oh no, no. It's far too dangerous. "
1692,STEVEN: What do we do? 
1693,DOCTOR: For the moment we just wait. 
1694,"GUARD 2: I won't be sorry to see the night over. Hello, what's this? "
1695,(A troop arrives.) 
1696,"GUARD 1: More orders, I expect. "
1697,OFFICER: You're relieved. Go back to your quarters. 
1698,"GUARD 1: Relieved, sir? It's not due for an hour or more. "
1699,OFFICER: Don't argue. Go quickly! 
1700,"STEVEN: Look, if we don't go soon it'll be light. "
1701,"DOCTOR: I know, I know. Just keep quiet. "
1702,(The curfew bell begins to sound.) 
1703,DOCTOR: There's the tocsin! The curfew's been lifted. 
1704,(Steven and the Doctor leave their hiding place and rush to the Tardis
1705,as the soldiers begin hammering on de Coligny's door.) 
1706,OFFICER: Open up! In the King's name! Open this door! 
1707,(The Tardis leaves Paris as the carnage and the slaughter begins.)
1708,
1709, [Tardis] 
1710, STEVEN: Surely there was something we could have
1711,done? 
1712,"DOCTOR: No, nothing. Nothing. In any case, I cannot change the course"
1713,"of history, you know that. The massacre continued for several days in"
1714,"Paris and then spread itself to other parts of France. Oh, what a"
1715,senseless waste. What a terrible page of the past. 
1716,STEVEN: Did they all die? 
1717,"DOCTOR: Yes, most of them. About ten thousand in Paris alone. "
1718,STEVEN: The Admiral? 
1719,DOCTOR: Yes. 
1720,STEVEN: Nicholas? You had to leave Anne Chaplet there to die. 
1721,DOCTOR: Anne Chaplet? 
1722,STEVEN: The girl! The girl who was with me! If you'd brought her with
1723,"us she needn't have died. But no, you had to leave her there to be"
1724,slaughtered. 
1725,"DOCTOR: Well, it is possible of course she didn't die, and I was right"
1726,to leave her. 
1727,"STEVEN: Possible? Look, how possible? That girl was already hunted by"
1728,the Catholic guards. If they killed ten thousand how did they spare
1729,"her? You don't know, do you? You can't say for certain that you weren't"
1730,responsible for that girl's death. 
1731,DOCTOR: I was not responsible. 
1732,"STEVEN: Oh, no. You just sent her back to her aunt's house where the"
1733,"guards were waiting to catch her. I tell you this much, Doctor,"
1734,wherever this machine of yours lands next I'm getting off. If your
1735,researches have so little regard for human life then I want no part of
1736,it. 
1737,DOCTOR: We've landed. Your mind is made up? 
1738,(The Tardis doors open.) 
1739,STEVEN: Goodbye. 
1740,"DOCTOR: My dear Steven, history sometimes gives us a terrible shock,"
1741,and that is because we don't quite fully understand. Why should we?
1742,"After all, we're all too small to realise its final pattern. Therefore"
1743,don't try and judge it from where you stand. I was right to do as I
1744,"did. Yes, that I firmly believe. "
1745,(Steven leaves the Tardis without another word.) 
1746,DOCTOR: Even after all this time he cannot understand. I dare not
1747,"change the course of history. Well, at least I taught him to take some"
1748,precautions. He did remember to look at the scanner before he opened
1749,the doors. Now they're all gone. All gone. None of them could
1750,"understand. Not even my little Susan, or Vicki. And as for Barbara and"
1751,Chatterton. Chesterton. They were all too impatient to get back to
1752,"their own time. And now, Steven. Perhaps I should go home, back to my"
1753,own planet. But I can't. I can't. 
1754,(The Tardis has landed on Wimbledon Common in 1966. A young girl is
1755,running for help. She spots the police box at the roadside and dashes
1756,inside.) 
1757,DOCTOR: Who are you? 
1758,DODO: Where's the telephone? 
1759,DOCTOR: What did you say? 
1760,DODO: The telephone. I've got to ring up. 
1761,"DOCTOR: Oh, pull yourself together, child. I think you've made a"
1762,mistake. 
1763,DODO: Who are you? Are you the police? 
1764,"DOCTOR: Oh, good gracious. Of course not. "
1765,"DODO: Well, this is a police box. It says so outside. "
1766,"DOCTOR: Yes, yes. I know. But, er, it isn't, if you know what I mean."
1767,"Now run along and find another police box. In any case, child, what do"
1768,you want to do with the police? 
1769,DODO: There's been an accident. A little boy's been hurt and I've got
1770,to phone the police. 
1771,"DOCTOR: Oh, well, I'm afraid I can't help you. No, you must run along"
1772,and phone the police somewhere else. And the same time phone for an
1773,ambulance. 
1774,"DODO: Wait a minute, if this isn't a police box, what is it? And who"
1775,are you? 
1776,"DOCTOR: Well, my dear, I'm a doctor of science, and this machine is for"
1777,travelling through time and relative dimensions in space. Now you 
1778,DODO: Come again? 
1779,"DOCTOR: Oh, never mind, my dear, never mind. Run along. "
1780,DODO: There's something odd going on here. 
1781,"DOCTOR: Oh please, child. "
1782,"STEVEN: Doctor, quick! You've got to take off. "
1783,"DOCTOR: Oh, so you've come back, my boy! "
1784,"STEVEN: Yes, yes, I've come back. We can't go into that now. There are"
1785,two policemen coming over the common towards the Tardis. 
1786,DOCTOR: Policemen? Coming here? Good gracious me! They'll want to use
1787,the telephone or something like it. 
1788,(The Tardis doors close and they dematerialise.) 
1789,"STEVEN: Oh, that was close. "
1790,"DOCTOR: Well, tell me, young man, what made you change your mind? "
1791,STEVEN: How did you get in here? 
1792,"DODO: On me feet, same as you did. "
1793,"STEVEN: Look, do you realise what's happening? We've taken off! We"
1794,could land anywhere! 
1795,DODO: We really travelling? Where to? 
1796,STEVEN: But we're travelling in time and space. We're not on Earth any
1797,"more. We could land anywhere, in any age. "
1798,DODO: Tell us another one. 
1799,"STEVEN: Doctor, how could you? "
1800,"DOCTOR: What else could I do, dear boy? You don't want a couple of"
1801,"policemen aboard the Tardis do you? You know, you're the most"
1802,inconsistent young man? Just now you were telling me off for not having
1803,that Chaplet girl aboard! 
1804,"STEVEN: Ah, that was different! This is no joyride you know. You may"
1805,never get home again. 
1806,DODO: I don't care. 
1807,STEVEN: What about your parents? 
1808,"DODO: I haven't got any. I live with me great aunt, and she won't care"
1809,if she never sees me again. 
1810,"DOCTOR: There now, you see? All this fuss about nothing. But don't you"
1811,think she looks rather like my grandchild Susan? 
1812,"STEVEN: You forget, I've never met your granddaughter. "
1813,"DOCTOR: Oh, no, no, no, no, of course not, no. Yes, but she does you"
1814,"know. What is your name, child? "
1815,DODO: Dodo. 
1816,DOCTOR: What? 
1817,"DODO: It's Dorothea, really. Dorothea Chaplet. "
1818,"STEVEN: Chaplet? Yes, but you're not French, are you? "
1819,"DODO: Don't be daft. Me granddad was, though. "
1820,"STEVEN: Doctor, it's not possible is it? Chaplet? Anne's great, great "
1821,"DOCTOR: Yes, yes, it is possible, my boy. Very possible. Welcome aboard"
1822,"the Tardis, Miss Dorothea Chaplet. "
1823,DODO: Dodo! 
1824,"DOCTOR: Oh, my dear! My dear!"
1825,
1826, Next
1827,Episode - The Steel Sky  
1828,
1829,
1830,
1831,
1832,
1833,
1834,<Back
1835,to the episode listing
1836, 
1837,Doctor Who and related
1838,marks are trademarks of BBC . Copyright ©
1839,"1963, Present. The web pages on this site are for educational and"
1840,entertainment purposes only. All other copyrights property of their
1841,respective holders.
1842,
