,Script
1075,"There are animals in the deserts and mountains, but we do not invite"
1076,them in to our palaces. Perhaps these Earth creatures are animals too? 
1077,1ST ELDER: Do not underestimate them. Do we possess a spaceship that
1078,"can cross the barriers of the universe? And this small mechanism, which"
1079,"my men brought to me, looks like an ordinary lock but in point of fact"
1080,is an electronic miracle which reveals a mind of science far beyond
1081,ours. And this new arrival known as the Doctor. His mind was quick to
1082,"realise our weakness in the dark and use it against us, but, I would"
1083,"remind you, not unfairly. Merely to protect the girl called Susan."
1084,"Well, and what does our city administrator say? "
1085,"ADMINISTRATOR: Sir, you were elected to lead our people because of your"
1086,great brain. I would not dare to question your actions. 
1087,1ST ELDER: No opinion can be worse sometimes than a very dogmatic one. 
1088,(The First Elder leaves) 
1089,2ND ELDER: You need not fear me. You may speak your mind. 
1090,"ADMINISTRATOR: I am cautious. You are his second opinion, yet he makes"
1091,his decisions without you. 
1092,2ND ELDER: He makes a wise decision. 
1093,ADMINISTRATOR: Based entirely upon trust. Do you trust these Earth
1094,creatures? No more do I. 
1095,2ND ELDER: The decision of the First Elder cannot be set aside. 
1096,ADMINISTRATOR: I would not suggest such a thing. His mind is pure. We
1097,are realists. That is why I have beamed the disintegrator to this room.
1098,
1099,2ND ELDER: Without permission? You are presumptuous. 
1100,ADMINISTRATOR: I am the city's administrator. It is my duty to protect
1101,the one who rules. Can you say that these Earth creatures will not use
1102,force? I am only guarding the First Elder. One suspicious act and the
1103,disintegrator will destroy them. 
1104,2ND ELDER: Very well. But you will do nothing further until I have
1105,considered the matter. 
1106,(leaves) 
1107,ADMINISTRATOR: I shall not wait. We will not be safe until these Earth
1108,creatures are dead. 
1109, [Courtyard] 
1110," (Strolling through the city, past a fountain) "
1111,DOCTOR: I'm glad to have left those silent people. 
1112,SENSORITE 2: Earth people are not popular. 
1113,IAN: Because your people have been dying? 
1114,SENSORITE 2: Yes. 
1115,"DOCTOR: It must be explained to them. The disease, if that's what it"
1116,"is, isn't anybody's fault. Besides, there's cures and preventives. "
1117,SENSORITE 2: You mentioned explaining to the people. You must not speak
1118,to them. You are forbidden to talk to the lower caste. 
1119,SUSAN: Lower caste? Do you have such distinctions? 
1120,SENSORITE 2: Yes. How else can we tell what each man is best fitted to
1121,"do? The Elders think and rule, the Warriors fight, the Sensorites work"
1122,and play. 
1123,DOCTOR: You make it sound so very simple. 
1124,SENSORITE 2: And all are happy. 
1125,"IAN: But some are happier than others, eh? "
1126,SENSORITE 2: I do not understand. There is no disgrace in being in any
1127,of the castes. It is simply what one is best fitted for. 
1128,JOHN: They're near us now. 
1129,"CAROL: It's all right, John. I'm here. "
1130,JOHN: The evil minds. 
1131,SUSAN: He knows something. 
1132,"CAROL: Oh, it's just a jumble of words. "
1133,"SUSAN: No, Carol, no. Remember, his mind is open. He can tell the"
1134,difference between good and evil people. He's trying to tell us
1135,something. 
1136,CAROL: Come on. Come on. Come on. 
1137, [Disintegrator control] 
1138, ADMINISTRATOR: Is everything prepared? 
1139,ENGINEER: I must test the impulse circuits. Ready to receive power. 
1140,ADMINISTRATOR: Here is the firing key. Beam the disintegrator to the
1141,reception room at the Palace of the Elders. 
1142,ENGINEER: Ready. 
1143,ADMINISTRATOR: Three places have been assigned to the Earth creatures.
1144,Horizontal lines four 
1145,ENGINEER: Four. 
1146,ADMINISTRATOR: Seven and nine. 
1147,ENGINEER: Nine. The vertical positions? 
1148,ADMINISTRATOR: X A two. 
1149,ENGINEER: X A two. 
1150,ADMINISTRATOR: X B three. 
1151,ENGINEER: X B three. And the last? 
1152,ADMINISTRATOR: X C four. 
1153,ENGINEER: X C four. What part of the body do you want the beam to
1154,strike? 
1155,"ADMINISTRATOR: In each case, to the heart. "
1156,ENGINEER: Are the hearts of the human creatures on the right or left
1157,"side of their bodies, or in the centre as in ours? "
1158,ADMINISTRATOR: I do not know. 
1159,ENGINEER: Then I will aim the beam at the centre of the chest in each
1160,case. 
1161,ADMINISTRATOR: And that will prove fatal? 
1162,"ENGINEER: Yes. Two, eight, seven. The disintegrator is beamed and"
1163,ready. They are just entering the corridor to the reception room now.
1164,Impulses working correctly. They are just entering the reception room.
1165,This switch here turns on the beam. 
1166,"ADMINISTRATOR: How can you judge their movements so correctly,"
1167,Engineer? 
1168,ENGINEER: The palace is defended with electrothermal couples. We trace
1169,their movements by the heat of their bodies. 
1170,ADMINISTRATOR: And you can tell exactly when they move into their
1171,places in the reception room? 
1172,ENGINEER: With absolute accuracy. 
1173,"ADMINISTRATOR: Then when they are seated, kill them. "
1174, [Reception room] 
1175," 1ST ELDER: Very well, I agree. "
1176,SUSAN: You can do it? 
1177,"1ST ELDER: Yes. The man John can be exactly as he used to be, but it"
1178,will take time. Conduct him to one of the rest rooms. Say that my
1179,orders are that he must be treated. 
1180,"CAROL: I must go with him, because he needs me. "
1181,1ST ELDER: Very well. You will be given a room near him. 
1182,"CAROL: Thank you. Come on, John. "
1183,JOHN: Good. He is a good man. Not like. 
1184,"DOCTOR: Not like who, John? "
1185,JOHN: He is good. 
1186,(Carol and John leave) 
1187,IAN: Thank you for being so understanding. 
1188,DOCTOR: It doesn't alter the fact that you're responsible for his
1189,condition. I think it's utterly disgraceful. 
1190,"1ST ELDER: Please, do not condemn before you know the facts. "
1191,"DOCTOR: Facts? What facts, sir? "
1192,"SUSAN: Grandfather, please don't. "
1193,DOCTOR: Very well. 
1194,1ST ELDER: Please sit at the places set for you. 
1195, [Disintegrator control] 
1196, ENGINEER: They are just taking their positions. 
1197,ADMINISTRATOR: Get ready to fire. 
1198,2ND ELDER: Stop! Disconnect the disintegrator. 
1199,ADMINISTRATOR: Why? 
1200,"2ND ELDER: Because they are reasonable, they are civilised. "
1201,"ADMINISTRATOR: They are Earth creatures, and dangerous to us. "
1202,"2ND ELDER: I tell you, they're talking with the First Elder, and in a"
1203,most friendly fashion. We need not fear them. 
1204,ADMINISTRATOR: Not whilst we have the disintegrator. It is beamed to
1205,their positions. They can be destroyed in a second. 
1206,2ND ELDER: But they will not be. Dismantle the machine. 
1207,"ADMINISTRATOR: I say that the trust that we give to each other, we"
1208,cannot show to these Earth creatures. 
1209,2ND ELDER: And I order that the machine be dismantled. Give me the
1210,firing key. 
1211,(The Engineer hands it over) 
1212,"2ND ELDER: I am doubtful about you. You question orders, you question"
1213,authority. Take care lest my doubts are become realities. 
1214, [Reception room] 
1215," (The Doctor, Ian and Susan are being served"
1216,refreshments) 
1217,"1ST ELDER: If foreigners visited your planet with intention to steal,"
1218,what would you do? Would you imprison them? Would you kill them? The
1219,man John was like the other humans who came here. He became so excited
1220,when he found that our planet contained a valuable ore that his mind
1221,just opened up and shouted out the secret to us. 
1222,DOCTOR: Molybdenum. 
1223,1ST ELDER: That is correct. He thought of a fleet of spaceships to come
1224,here and mine the metal and transport it back to his own planet. We saw
1225,"the pictures he formed in his mind, and we saw that it was the end of"
1226,our way of life. We had no alternative but to imprison him and his
1227,friends in orbit round the Sensphere. 
1228,"IAN: Yes, but that's no reason for driving him out of his mind. "
1229,"1ST ELDER: Happened only, I assure you, because of his excitement. His"
1230,"mind had no reserve, no defence. We caused the others to sleep, but he"
1231,heard the full power of our voices in his brain. Stop. Do not drink.
1232,Why do you offer insult to our guests? Why do you not give them the
1233,same food and drink that I am given? Who ordered this? The city
1234,Administrator? 
1235,(The serving Sensorite nods) 
1236,1ST ELDER: You will bring them the crystal water and take the other
1237,away. 
1238,"IAN: Tell me, what exactly is the difference? "
1239,"1ST ELDER: In the yellow mountains that surround this city, I"
1240,discovered a pure spring. Very unusual in this planet. I believe the
1241,"water holds special qualities, so I have flagons of it stored for the"
1242,use of the Elders. 
1243,IAN: And this one? 
1244,1ST ELDER: Is very well refined. We are very proud of our aqueduct. It
1245,lies beneath the city. 
1246,IAN: I hope you won't be offended if I drink some. I'm very thirsty.
1247,(drinks) 
1248,1ST ELDER: As long as you taste of the crystal water. It is very fine.
1249,None of the Elders drink anything else. 
1250,DOCTOR: Vintage water. 
1251,SUSAN: This fruit is delicious. It tastes like peaches. 
1252,(The water is exchanged) 
1253,"DOCTOR: Now, sir, let us talk of the future. Our future. "
1254, [Disintegrator control] 
1255, ADMINISTRATOR: We are being bound hand and foot
1256,and given to these people from Earth. Our leaders are grown weak. 
1257,"ENGINEER: I will follow you, the city Administrator. Command me. "
1258,ADMINISTRATOR: I thank you for your loyalty. You shall have my
1259,confidence. 
1260,ENGINEER: I gladly accept. I do not trust these Earth creatures. 
1261,ADMINISTRATOR: The First and Second Elders are deceived. I question
1262,"their leadership. If they do not change their attitude, they may have"
1263,to give way to one of stronger thought and action. 
1264,ENGINEER: Command me. 
1265,"ADMINISTRATOR: For the moment, I am glad of your loyalty. The time for"
1266,action will not be far away. 
1267, [Reception room] 
1268, SUSAN: So you are the senior Elder? 
1269,"1ST ELDER: Signified by the twin sash I wear. The Second Elder, my"
1270,"advisor, wears one sash. Other important professions wear distinctive"
1271,markings. 
1272,DOCTOR: And the ordinary people? 
1273,1ST ELDER: Are contented with their similarity. 
1274,IAN: Would you mind telling us something about the (sudden coughing
1275,fit) I beg your pardon. The disease. 
1276,"SUSAN: Yes, would you tell us about it. We might be able to help you. "
1277,1ST ELDER: I intended to. We need help with this calamity. The disease
1278,"is invisible, and resists all our attempts to stamp it out. It hits all"
1279,"manner of people, irrespective of their tasks. "
1280,DOCTOR: Yes. Does it affect the Elders? 
1281,1ST ELDER: No. 
1282,DOCTOR: I wonder why not? 
1283,1ST ELDER: I cannot imagine. We have been fortunate? 
1284,(Ian coughs again) 
1285,"DOCTOR: Yes, it, er, might be a clue. But what I hope, sir, was this"
1286,"er, that if my friends and I succeed where your scientists failed, will"
1287,you return the lock of my ship? 
1288,SUSAN: It would be a just return. 
1289,1ST ELDER: Your granddaughter speaks well. 
1290,"DOCTOR: Yes, she's a fine young woman. My dear Chesterton, are you all"
1291,right? 
1292,"IAN: My throat, burning. I wonder if you could give me a glass of"
1293,"water, Doctor. "
1294,DOCTOR: Is this a symptom of your disease? 
1295,(Ian collapses) 
1296,"SUSAN: Ian! Grandfather, he's unconscious. "
1297,1ST ELDER: There is no hope. Your friend is dying. 
1298, Episode Four - A Race
1299,Against Death 
1300, [Reception room] 
1301, (Ian is lying face down on the floor) 
1302,DOCTOR: Why has it happened to him and not to us? 
1303,SUSAN: Can you do anything for him? 
1304,"1ST ELDER: The disease hits all manner of people. Suddenly, without"
1305,warning. 
1306,DOCTOR: Never the Elders? 
1307,1ST ELDER: No. 
1308,DOCTOR: It's incredible. The build-up in body temperature. This
1309,"disease, as you call it, is it contagious? "
1310,1ST ELDER: No. 
1311,DOCTOR: I wonder. Is it a germ in the air? 
1312,"SUSAN: Grandfather, it doesn't seem like a disease at all. "
1313,DOCTOR: I agree with you. 
1314,SUSAN: We've done everything together. We've come from the spaceship
1315,"together, we've come through the city together. "
1316,"DOCTOR: Yes, yes, yes. "
1317,SUSAN: This room. The fruit. 
1318,"DOCTOR: No. No, no, no, no, no. You had some of it. "
1319,"SUSAN: Oh, yes. "
1320,DOCTOR: I know. He drank a different kind of water. It's the water! 
1321,1ST ELDER: Then why do not all who drink the aqueduct water die? 
1322,"DOCTOR: Well, it depends on their resistance. In time, of course, all"
1323,will succumb. 
1324,1ST ELDER: You cannot be sure of this. 
1325,"DOCTOR: No, I can't. This is all we have to go on. Send for your"
1326,"servant, please. "
1327,"SUSAN: His eyes are opening, Grandfather. "
1328,IAN: (very hoarse) Susan. 
1329,"DOCTOR: It's all right, Chesterton. Rest quietly. This isn't a disease,"
1330,it's more like poison. 
1331,(The servant arrives and bows) 
1332,"DOCTOR: Oh, go to your scientists now. I want some sodium chloride and"
1333,I want it quickly. 
1334,IAN: What happened to me? 
1335,"SUSAN: Hush, Ian. Just rest. "
1336,1ST ELDER: Do you wish your companion to stay here? 
1337,"DOCTOR: Please, please. "
1338,1ST ELDER: Bring some covers. 
1339,"DOCTOR: Now, sir, your indulgence. "
1340,1ST ELDER: I am distressed by this tragedy. What can I do to be of
1341,assistance? 
1342,"DOCTOR: Well, we must make sure no one drinks anything but the crystal"
1343,water. 
1344,1ST ELDER: Agreed. 
1345,DOCTOR: Fine. And can I work with your scientists? 
1346,1ST ELDER: They will be honoured. 
1347,"DOCTOR: Splendid, splendid. "
1348,SUSAN: How long has he got? 
1349,1ST ELDER: I hear the distress in your mind. I respond to it. I wish I
1350,could be more reassuring. 
1351,SUSAN: How long? 
1352,"1ST ELDER: From the first symptoms, no one has lived longer than the"
1353,third day. 
1354,DOCTOR: As long as that? Then we have time. I have chemicals and
1355,"equipment on my ship. Return the lock and I promise you, sir, I will"
1356,not only cure my young friend but all your people. 
1357,(The servant returns) 
1358,"DOCTOR: Ah, good. "
1359,1ST ELDER: I must discuss this matter with the Second Elder. 
1360,"DOCTOR: Well do not delay any longer than is necessary, please. Thank"
1361,"you. Now, salt and water, Susan. An old-fashioned remedy but I'm sure"
1362,"it'll serve. Thank you. Now, my boy. "
1363,"SUSAN: Ian. Ian, try and sit up. "
1364,"DOCTOR: Come along, old chap. "
1365,"IAN: Feeling very weak, Doctor. "
1366,"DOCTOR: Yes, now I want you to drink all of this. It isn't going to be"
1367,"pleasant, but it's all for your own good. "
1368,IAN: Drink. 
1369,DOCTOR: That's it. 
1370,"(Ian drinks, splutters at the saltiness) "
1371,DOCTOR: Will they let me into my ship? 
1372, [Courtyard] 
1373, 2ND ELDER: Now be guided by me in this matter. The
1374,one they call the Doctor may not be sincere. 
1375,1ST ELDER: But his friend is dying. 
1376,2ND ELDER: Or pretending to die. Then you let the Doctor into his
1377,spaceship. 
1378,1ST ELDER: Would he leave his friends at our mercy? 
1379,"2ND ELDER: But who knows what power he has in the ship? Once inside it,"
1380,we may be at his mercy. 
1381,"1ST ELDER: Well, I believe in him. "
1382,2ND ELDER: The Doctor may go away to fetch an army of human beings and
1383,a fleet of spaceships. 
1384,1ST ELDER: This is a terrible picture you paint. Do you mistrust them
1385,as much as all that? 
1386,"2ND ELDER: I do not trust them as much as you, so I advise caution. "
1387,"1ST ELDER: I will think of your advice, and weigh up the matter. "
1388, [Laboratory] 
1389," (John is in a chair, with a metal crown of"
1390,electrodes on his head) 
1391,SCIENTIST: How may I help the city Administrator? 
1392,ADMINISTRATOR: Why is this creature here? 
1393,SCIENTIST: We are clearing his mind. 
1394,ADMINISTRATOR: On whose orders? 
1395,SCIENTIST: The First Elder. 
1396,"ADMINISTRATOR: It would have been better to kill him than cure him,"
1397,Scientist. 
1398,2ND ELDER: Leave us. 
1399,(The scientist leaves) 
1400,2ND ELDER: Once again you question the voice of authority. 
1401,"ADMINISTRATOR: Sir, the Elders rule this planet while I am only"
1402,"responsible for this city, yet I will do everything within my power to"
1403,protect and defend that city. 
1404,2ND ELDER: Be careful your power is not taken from you. 
1405,ADMINISTRATOR: These intruders threaten us all. This creature is being
1406,cured! 
1407,"2ND ELDER: Yes, we fulfil a promise. "
1408,ADMINISTRATOR: At any moment you will put them in their ship and let
1409,them go! This is madness! 
1410,2ND ELDER: One more insolent word from you and I shall ask that your
1411,collar of office be taken from you. This man is to be cured. As for the
1412,other one. 
1413,ADMINISTRATOR: Which other one? 
1414,2ND ELDER: The one known as Ian Chesterton. 
1415,ADMINISTRATOR: These are absurd names they all have. None of them wear
1416,any signs of authority or badges of position. How are we to distinguish
1417,them? What is wrong with the other one? 
1418,"2ND ELDER: He has caught the disease. Their commander, the Doctor,"
1419,believes our water supply is to blame. 
1420,"ADMINISTRATOR: What a brilliant scheme. Evil, but undoubtedly"
1421,brilliant. 
1422,2ND ELDER: Explain. 
1423,ADMINISTRATOR: To attack our confidence in one of the necessities.
1424,There is nothing wrong with our water supply. Nothing at all. This is a
1425,trick to get us at their mercy.
1426,JOHN: Evil. Evil. 
1427,ADMINISTRATOR: Do you see? Even this half-broken creature here admits
1428,the truth. 
1429,2ND ELDER: I must warn the First Elder. 
1430,(Second Elder leaves) 
1431,"JOHN: No, no. Evil is here. "
1432,ADMINISTRATOR: He cannot hear you. Your mind is closed by the machine.
1433,Your voice is not believed. 
1434,JOHN: You are my enemy. 
1435,"ADMINISTRATOR: I am the enemy of all Earth creatures, and any Sensorite"
1436,who defends them shall be swept away. 
1437,JOHN: I must warn them of your evil. I must. I must! 
1438,(John passes out) 
1439,ADMINISTRATOR: Your brain is too weak to harm me. 
1440,"CAROL: How's John? Oh, I am sorry. I thought you were one of the"
1441,scientists. 
1442,ADMINISTRATOR: You can see my collar of office. I am the city
1443,Administrator. 
1444,"CAROL: Yes, I'm sorry, but when your backs are turned, it's very"
1445,difficult to see. I don't know what we'd all do if you changed your
1446,badges and sashes. We wouldn't be able to tell you apart. 
1447,ADMINISTRATOR: I have never thought of that. 
1448,CAROL: John? 
1449, [Reception room] 
1450, (The Doctor's anger is making the First Elder
1451,cringe. Ian is on a sheepskin covered couch nearby) 
1452,DOCTOR: But he'll die! 
1453,1ST ELDER: No noise! I beg of you. 
1454,SUSAN: Why can't you make up your mind? 
1455,DOCTOR: Just look at that young man. I've done all I can for him at the
1456,moment. Given him salt and water. He's been coughing his heart out. I
1457,"must have chemicals and equipment. His death will be your fault, and"
1458,yours alone. 
1459,"1ST ELDER: Very well, I "
1460,2ND ELDER: Sir. 
1461,(They commune telepathically) 
1462,DOCTOR: What is it now? 
1463,SUSAN: I can't hear very clearly. Their minds aren't open to me. 
1464,"DOCTOR: Do you really mean you can hear their minds talking, Susan? "
1465,"SUSAN: Yes, but it's not very distinct. "
1466,"1ST ELDER: Doctor, I cannot allow you to go to your ship. "
1467,DOCTOR: Don't set yourself against me. 
1468,1ST ELDER: There is a laboratory here. You may prove your poisoned
1469,"water theory there, or not at all. "
1470,DOCTOR: You fool! 
1471,(The Sensorites cringe) 
1472,"SUSAN: Grandfather, please! They think you're attacking them. We're"
1473,sorry. There's so much about your planet we don't understand. 
1474,DOCTOR: It's inhuman. 
1475,SUSAN: Grandfather. 
1476,DOCTOR: Just monstrous. 
1477,SUSAN: We didn't mean to use sound as a weapon. We didn't even know
1478,sound hurt you. 
1479,"1ST ELDER> Very well, but please be careful in future. I wish to"
1480,see regular reports on the progress of this theory. 
1481,"(The First Elder leaves, Second Elder stays) "
1482,DOCTOR: Theory? 
1483,"SUSAN: Grandfather, please! "
1484,"DOCTOR: I know we have no alternative, but such outrageous behaviour!"
1485,"Oh, forget it, child. Now, I want you to stay here and act as nurse."
1486,"Watch his pulse rate, will you, and let me know immediately "
1487,IAN: Doctor. What's happened to me? 
1488,DOCTOR: How are you feeling? 
1489,IAN: My throat's still sore. 
1490,DOCTOR: Any pains elsewhere? 
1491,"IAN: No, but I feel very giddy. "
1492,"DOCTOR: Yes, well, you just rest there quietly. Yes, we'll let him have"
1493,"all the crystal water he wants, and if his breathing gets febrile,"
1494,"artificial respiration. Now, sir. Your laboratory. And I only hope"
1495,there's time to save him. 
1496, [Courtyard] 
1497, ENGINEER: The Second Elder has given the firing
1498,pin to the Chief of Warriors. I saw him. 
1499,ADMINISTRATOR: Then the disintegrator is no longer of any use to us.
1500,How can we destroy these crea 
1501,(First Elder enters) 
1502,ENGINEER: Shh. 
1503,1ST ELDER: I have placed our laboratory at the disposal of the man
1504,called the Doctor. See to it that he is given every cooperation. 
1505,"ADMINISTRATOR: Yes, sir. "
1506,(First Elder leaves) 
1507,ADMINISTRATOR: Your witness. These creatures are defeating us with
1508,smiles and gentle words. Our leaders listen and agree. Soon we shall
1509,all be slaves. 
1510,ENGINEER: What can we do? 
1511,ADMINISTRATOR: Bring the Second Elder to me. Alone. The girl Carol gave
1512,me an idea. How would you recognise the Second Elder at a distance? 
1513,ENGINEER: By the sash he wears. 
1514,ADMINISTRATOR: Bring the Second Elder to me at the disintegrator room. 
1515,ENGINEER: Yes. 
1516,ADMINISTRATOR: We must match cunning with cunning. 
1517, [Laboratory] 
1518," (Lots of twirly glass and rubber hoses on a table,"
1519,and John safely out of sight over on the right of our screen) 
1520,"DOCTOR: Yes, well, I have to say, very comprehensive. Now, gentlemen,"
1521,time is not on our side. I believe your people have been dying because
1522,"there is atropine poison in the aqueduct water. Now, allow me. I've"
1523,made a few notes here which might interest you. Now these are the
1524,symptoms. Atropine causes dilation of the blood vessels. Temperature
1525,rises and pulse rate becomes very rapid. A rash may appear. The mouth
1526,"and throat both become extremely dry. Now what we have to do is this,"
1527,gentlemen. Isolate the poison and then prescribe the remedy. 
1528,SCIENTIST 2: We give you our assistance. 
1529,DOCTOR: Good. 
1530,SCIENTIST: Although we have tested the water already. 
1531,"DOCTOR: Yes, well then we must try again. "
1532,SCIENTIST: Over here is a sample of the aqueduct water. 
1533,"DOCTOR: Ah, yes. You know, a strange thing here is, not all your people"
1534,died. 
1535,SCIENTIST 2: Three in every ten. Last year it was two in every ten. 
1536,"DOCTOR: Yes, of course some may be able to resist it or perhaps some of"
1537,the water is good. 
1538,SCIENTIST: But all the water is the same. 
1539,"DOCTOR: Yes, but surely from different outlets? "
1540,"SCIENTIST 2: There are ten districts in the city, but only one source. "
1541,"DOCTOR: Well, gentlemen, there's a poison at work here. I know the"
1542,signs. Now what you must do is to test samples from each and every
1543,district. Where did that come from? 
1544,SCIENTIST 2: This palace. It is district ten. 
1545,"DOCTOR: I see. Well now, I suggest that you sample that bottle, and"
1546,mark it and then start keeping records. And there's not a moment to
1547,"lose. And remember, I want samples from all the outlying districts."
1548,It's imperative. 
1549,"(And so the testing starts, as Ian becomes delirious. District after"
1550,"district comes back negative for contaminants, until - ) "
1551,"DOCTOR: This one! I've found it. And just as I suspected, atropine"
1552,poison. That's why your people have been dying off. 
1553,SCIENTIST: But why were some of the districts negative? 
1554,"DOCTOR: Because it varies from place to place, and when you made your"
1555,"tests, you didn't discover it. "
1556, [Reception room] 
1557, 1ST ELDER: And can the Doctor discover a cure? 
1558,2ND ELDER: He says so. Caffeine citrate is the antidote. 
1559,1ST ELDER: Remarkable man. Remarkable. 
1560,"2ND ELDER: I have an appointment, then I shall return to the"
1561,laboratory. 
1562,1ST ELDER: Give my Doctor the congratulations on the progress. 
1563,"(Second Elder leaves, and First Elder goes over to Ian's sickbed or"
1564,couch) 
1565,SUSAN: He's much easier now. 
1566,1ST ELDER: The Doctor has had some success. A remedy will be available
1567,soon. 
1568,"SUSAN: Thank goodness. Ian. Ian, you're going to be all right. "
1569, [Disintegrator room] 
1570, ADMINISTRATOR: They are coming now. 
1571,(Second Elder enters) 
1572,2ND ELDER: Why are we meeting here? 
1573,ADMINISTRATOR: Hold him! 
1574,(Two Sensorites grab the Second Elder) 
1575,2ND ELDER: You will be punished for this offence. 
1576,ADMINISTRATOR: I advise you to answer my questions. Your family group
1577,is also in my power. 
1578,2ND ELDER: What have you done with them? 
1579,ADMINISTRATOR: Nothing so far. Has the Doctor completed his
1580,experiments? 
1581,2ND ELDER: Yes. 
1582,ADMINISTRATOR: And the antidote is to be given to the young man Ian? 
