,Script
1190,RAGO: You wanted to destroy. Unnecessary destruction is wasteful. Did
1191,you inspect it? 
1192,TOBA: All relevant details have been recorded. 
1193,RAGO: See if there are any survivors and bring them to me. Alive.
1194,
1195, [Survey unit]
1196,
1197," ZOE: Oh, it's no good. It's jammed. "
1198,"CULLY: Yes, we're trapped in here. "
1199,ZOE: What about the travel capsule? 
1200,CULLY: I can't navigate it. We'll end up back at the Capital. 
1201,"ZOE: Well, that's better than being cooked here. "
1202,"CULLY: Yes, but they'd pick us off easily in that. Come on let's try"
1203,that door again. 
1204,(They manage to get the door to slide open a little.) 
1205,CULLY: Come on. Keep it 
1206,(There is a Quark on the other side.) 
1207,CULLY: Now you know I'm not lying!
1208,
1209, [Council chamber]
1210,
1211, BOVEM: Director Senex asked that you should be
1212,brought to the Council chamber immediately. Please wait here.
1213,"JAMIE: Just a moment. Er, where's Zoe? "
1214,BOVEM: You mean the girl? 
1215,"JAMIE: Yes, Zoe. Is she here? "
1216,BOVEM: No. 
1217,"DOCTOR: Well then, where is she? She did arrive safely? "
1218,BOVEM: Oh yes. 
1219,"JAMIE: Well then? Hey, has anything happened to her? "
1220,"BOVEM: Director Senex will explain, should he think fit. "
1221,"JAMIE: Hey, just "
1222,BOVEM: There is no cause for alarm. I will inform the Director of your
1223,arrival. 
1224,(Bovem leaves.) 
1225,"JAMIE: What do you think's happened to her, Doctor? "
1226,"DOCTOR: Oh, I've no idea, Jamie. But the Dulcians wouldn't have harmed"
1227,"her, of that I'm certain. "
1228,JAMIE: Aye.
1229,
1230, [Saucer]
1231,
1232," KANDO: Are you all right, Balan? "
1233,"BALAN: Oh, yes, but I don't understand what is happening. Why should"
1234,these people wish us harm? 
1235,RAGO: Silence! 
1236,TOBA: The other two specimens for examination. Shall I bring them in? 
1237,RAGO: Wait. Observe the cerebral cortex development in this specimen. 
1238,"KANDO: Oh please, don't hurt him. "
1239,BALAN: If only you would tell us what you wanted. 
1240,"RAGO: I said, silence. Well? "
1241,TOBA: Higher potential than the first two. Not a very resourceful brain
1242,"pattern, but intelligent. "
1243,RAGO: Yes. I will send this information to Fleet Leader for analysis.
1244,It is possible these creatures may be used for slave labour.
1245,Unfortunately their muscular development seems somewhat limited. 
1246,TOBA: Then they're of no use? 
1247,RAGO: We shall test them. Put them to work on the drilling site.
1248,Observe how long they survive. 
1249,TOBA: Command accepted. 
1250,"RAGO: And send a Quark back to the unit. Should any more arrive, I want"
1251,them alive.
1252,
1253, [Council chamber]
1254,
1255,(All the Council members are here now.) 
1256,"SENEX: As far as we know, she left with my son Cully. Presumably they"
1257,have returned to the island. 
1258,DOCTOR: What? 
1259,"JAMIE: Oh, no. Why'd you not tell us? Come on, Doctor. "
1260,SENEX: I do not think that would be advisable. 
1261,"JAMIE: Oh, you mean we're prisoners again? "
1262,SENEX: No. There are no prisoners on Dulkis. 
1263,"DOCTOR: It's not necessary, you see, Jamie. This is a society of total"
1264,pacifism. 
1265,JAMIE: You mean they don't fight? They don't have any armies? 
1266,"DOCTOR: No, no. "
1267,"JAMIE: Oh, that's just great! How then are we going to drive off those"
1268,Quark things? 
1269,SENEX: From your reaction and your lack of knowledge of the way of life
1270,"on Dulkis, it would seem there was some truth in your story that you"
1271,are from another planet. 
1272,"JAMIE: Of course there's some truth. Look, it was your people who"
1273,thought we were friends of Cully's. 
1274,"SENEX: The identity of my son's companions can now been established,"
1275,although what has happened to them is not quite clear. 
1276,DOCTOR: But Cully has told you. They were murdered. And I believe him! 
1277,SENEX: Why? 
1278,DOCTOR: Because I have seen these Dominators. We were taken aboard
1279,"their spacecraft. Believe me, they're callous. Without pity. "
1280,(General consternation.) 
1281,SENEX: I would be grateful if you could tell me what occurred on the
1282,island. 
1283,"JAMIE: Och look here, we've told you. We're just wasting time talking"
1284,while Zoe's in danger.
1285,
1286, [Outside the museum]
1287,
1288,(Zoe and Cully are resting on a large rock while
1289,Quarks stand guard.) 
1290,ZOE: Can't we get away? 
1291,"CULLY: Oh, we wouldn't stand a chance. These Quarks are deadly. "
1292,ZOE: Any idea how they're powered? 
1293,"CULLY: No, why? "
1294,ZOE: Well if we knew we might be able to put them out of action. 
1295,CULLY: Attack them? Are you out of your mind? 
1296,"ZOE: Well, they're only robots. "
1297,CULLY: Only? Do you really think we could destroy one? 
1298,ZOE: It'd be easier if we had a gun of some. The laser gun! 
1299,CULLY: Eh? 
1300,"ZOE: Cully, I think we stand a chance."
1301,
1302, [Saucer]
1303,
1304, TOBA: Take them to the others. 
1305,QUARK: Move. 
1306,"(Belen, Teel and Kando leave with a Quark.) "
1307,TOBA: I'll sent them to work on the drilling site. 
1308,RAGO: Work potential and stamina to be recorded and sent for analysis. 
1309,TOBA: Agreed. If any of them should escape 
1310,RAGO: Then you will report the fact to me. No personal action. Toba! 
1311,TOBA: Command accepted.
1312,
1313, [Outside the museum]
1314,
1315, ZOE: So the Doctor and Jamie are on the mainland? 
1316,CULLY: Yes. It looks as though from now on we're on our own. 
1317,"TOBA: You creatures, follow."
1318,
1319, [Council chamber]
1320,
1321," DOCTOR: And when these horrible tests were over,"
1322,they just let us go. 
1323,SENEX: Did you discover for what purpose these tests were carried out? 
1324,"JAMIE: Yes, to see if we were intelligent enough to use as slaves. "
1325,BOVEM: Evidently you were not. 
1326,DOCTOR: I would like to make a suggestion. I know it is the way of
1327,"Dulkis to discuss and to deliberate, but the situation is urgent. Send"
1328,someone to the island to confirm what we've told you. 
1329,"JAMIE: Yes, and while they're away we can be thinking out some plan to"
1330,tackle those Dominators. 
1331,"SENEX: These Dominators. They let you go free, why should we fear them?"
1332,
1333,"DOCTOR: Because they are aggressive, callous and unfeeling. Don't"
1334,"expect them to act and think as you do. They're alien, from another"
1335,world. 
1336,"SENEX: Well so are you, Doctor. "
1337,"DOCTOR: Oh dear, you've got me there. "
1338,"JAMIE: Oh, for heavens sake! Look, are you going to send someone to"
1339,that island or are you not? 
1340,"SENEX: Patience, young man. Doctor, what in your opinion do this"
1341,Dominators want? 
1342,"DOCTOR: Well I'm not sure, but I heard them say that the material was"
1343,readily accessible. Probably some kind of mineral ore. 
1344,"SENEX: Oh, there are no valuable minerals here. They are welcome to"
1345,whatever they can find. There is no cause for alarm. 
1346,"DOCTOR: Yes, but then there's the matter of the disappearance of the"
1347,radioactivity from the island. That could be significant. 
1348,SENEX: Why seek menace where there may be none? 
1349,JAMIE: But you can't just sit here and do nothing. 
1350,BOVEM: Why not? 
1351,COUNCILLOR 1: Haste is not in the Dulcian tradition. 
1352,COUNCILLOR 2: Better to do nothing than do the wrong thing. 
1353,"JAMIE: Oh you're mad, the lot of you. "
1354,BOVEM: What would you suggest we do? 
1355,"JAMIE: Well for a start, send an armed party over there to rescue Zoe"
1356,and your people. 
1357,BOVEM: An armed party? 
1358,JAMIE: Yes! 
1359,COUNCILLOR 1: But the use of arms on Dulkis is totally unprecedented. 
1360,COUNCILLOR 2: Not totally unprecedented. In the earliest days of our
1361,history we 
1362,"COUNCILLOR 1: Oh, in primitive times perhaps, but impossible to"
1363,consider today. 
1364,"COUNCILLOR 2: Oh yes, of course. "
1365,JAMIE: What are they talking about? 
1366,"DOCTOR: I told you, Jamie. There are no weapons on Dulkis. "
1367,SENEX: For centuries we have lived in peace. We have proved that
1368,universal gentleness will cause aggression to die. 
1369,"JAMIE: Aye, well, the Dominators don't know anything about your"
1370,gentleness. 
1371,"DOCTOR: Jamie has a point there, you know. Now I suggest you try to get"
1372,in touch with Balan on the island again. He must know more by now. 
1373,"SENEX: Oh, very well. "
1374,DOCTOR: Ah. 
1375,JAMIE: Eh? (A view of the inside of the survey unit comes up on a
1376,monitor.) 
1377,"JAMIE: Hey, would you look at that. "
1378,"SENEX: Balan? Balan, are you there? "
1379,(The view pans around to - ) 
1380,DOCTOR: It's no use! 
1381,JAMIE: Look! 
1382,DOCTOR: It's too late! 
1383,BOVEM: What is that? 
1384,DOCTOR: It's a robot! 
1385,"JAMIE: That's a Quark! Now come on, we've wasted enough time. "
1386,DOCTOR: Yes! Now perhaps you'll believe me.
1387,
1388, [Capsule]
1389,
1390,(The Doctor finishes off a bag of sweets.) 
1391,"DOCTOR: Now, Jamie, what did you want to tell me? "
1392,"JAMIE: Well, I suppose you know what you're doing. "
1393,DOCTOR: What do you mean? 
1394,"JAMIE: Well, this contraption's homing back on that survey place,"
1395,right? 
1396,"DOCTOR: Yes, right. "
1397,"JAMIE: Well, there's a Quark there waiting for us!"
1398,
1399, [Outside the museum]
1400,
1401, TOBA: If these tests prove favourable some of you
1402,may be among those chosen to serve the Dominators. 
1403,"ZOE: As slaves, you mean? "
1404,"TOBA: Don't ever interrupt me again. To serve the Dominators, Masters"
1405,of the Ten Galaxies. Your progress here will be reported. 
1406,CULLY: Progress at what? 
1407,TOBA: This area here is to be cleared of debris and rubble. 
1408,ZOE: Why? 
1409,TOBA: Because I command it. 
1410,ZOE: I am not going to work unless I know why you want 
1411,"TOBA: Quiet! Very well. This site is to be cleared for drilling,"
1412,"firstly because we want it cleared, secondly to find out whether you"
1413,have enough strength to make a work force. 
1414,ZOE: And if we haven't? 
1415,"TOBA: You will all be destroyed. So remember, you are working for your"
1416,lives. 
1417,(Toba walks away.) 
1418,"BALAN: We must, for now. "
1419,(Balan picks up a rock and carries it away.) 
1420,ZOE: I wonder why they want to drill here? 
1421,CULLY: Who cares what they want. What are we going to do? 
1422,ZOE: We've got to get away. 
1423,"CULLY: Yes, but how? "
1424,"ZOE: Well, there's only two Quarks. There's five of us. "
1425,BALAN: Escape is pointless. Where would we go? 
1426,KANDO: We can't get off the island. 
1427,TEEL: Perhaps the Capital will send help. 
1428,CULLY: Help? But what can they do? They're just not equipped to deal
1429,"with this sort of thing. No, we've got to get out of this mess"
1430,ourselves. 
1431,"ZOE: And that's just what I mean to do. Cully, how fast can these"
1432,Quarks move? 
1433,"BALAN: Young lady, I cannot allow you to incite my pupils. Resistance"
1434,will only lead to violence. 
1435,"ZOE: And submission leads to slavery. We must fight. How about you,"
1436,Cully? 
1437,CULLY: You can count me in. Kando? 
1438,KANDO: No. Balan is right. Violence is always met with violence. 
1439,CULLY: Teel? 
1440,"TEEL: I accept what you both say, but I'm afraid I also agree with Zoe"
1441,and Cully. Meek submission would be humiliating. 
1442,QUARK: Continue working.
1443,
1444, [Capsule]
1445,
1446,(The Doctor opens up the control panel.) 
1447,"JAMIE: Hey, have you gone daft or something? "
1448,"DOCTOR: No, Jamie, not exactly. Oh dear, this is rather complicated. "
1449,"JAMIE: Hey, you can't just take things to pieces, not when we're flying"
1450,at heaven knows what speed. 
1451,"DOCTOR: Well, Jamie, as you said, this capsule is homing straight back"
1452,"onto the survey unit, and the Quarks are there. "
1453,"JAMIE: Well, I did try to warn you. "
1454,"DOCTOR: Yes, I know. Thank you. Now don't worry. All I've got to do is"
1455,to override the automatic pilot. 
1456,"JAMIE: Oh. Hey, are there not any ordinary controls for flying this"
1457,thing? 
1458,"DOCTOR: Ah, no, no, Jamie, there don't seem to be. But the simplest way"
1459,is to get straight at the control mechanism. 
1460,JAMIE: The simplest? 
1461,"DOCTOR: Yes, now it's all right, Jamie, just leave it all to me. The"
1462,trouble is all the wires seem to be leading up into the nose. Just hold
1463,"this for me for a minute, will you Jamie? Let's see whether I can"
1464,scramble through here. Just wait a minute. we're nearly there. Oh! 
1465,(The Doctor tumbles into the nose cone of the capsule leaving his legs
1466,waving in the air.)
1467,
1468, [Saucer]
1469,
1470,TOBA: Ready for transmission. 
1471,RAGO: Transmit course and point of deviation to Fleet Leader. 
1472,TOBA: Command accepted. 
1473,RAGO: Yes? 
1474,QUARK: Initial report. 
1475,RAGO: Continue. 
1476,QUARK: All prisoners except one showing signs of fatigue. 
1477,TOBA: That will be the young man. 
1478,"QUARK: Correction, Dominator. It is a female that shows the less"
1479,fatigue. 
1480,RAGO: Interesting. 
1481,TOBA: Shall I liven them up? 
1482,"RAGO: No. Work them to the point of exhaustion, note their time of"
1483,"collapse, then bring them to me."
1484,
1485, [Outside the museum]
1486,
1487,(Zoe is still carrying rocks while the others are
1488,barely moving. Cully helps her put it down.) 
1489,CULLY: If we don't get a move on the others will be too tired to even
1490,attempt an escape. Have you got any ideas? 
1491,"ZOE: Well, we'll have to put that Quark out of action for a start or we"
1492,won't stand a chance. 
1493,"CULLY: Yes, but how? "
1494,"ZOE: Well, there's a laser gun in that museum place. Somehow we've got"
1495,to get hold of it. 
1496,(Balan collapses.) 
1497,BALAN: I'm sorry. 
1498,KANDO: Don't worry. 
1499,QUARK: Continue working. 
1500,ZOE: He can't! He's exhausted! 
1501,QUARK: Continue working. 
1502,"CULLY: You stupid tin box, can't you see he's worn out? "
1503,QUARK: Is this specimen broken? 
1504,CULLY: Yes. 
1505,QUARK: Place it on one side. Remainder continue working. 
1506,(They carry Balan to a place by the building.) 
1507,KANDO: There. I'm sorry. We're not used to manual labour on Dulkis. 
1508,"(The Dulcians carry rocks away from the building, leaving Zoe alone."
1509,Cully nods to Zoe when the Quark is looking the other way and she
1510,enters the Museum. Unfortunately there is another Quark inside so she
1511,has to leave again.)
1512,
1513, [Capsule]
1514,
1515,(Jamie tries to hang on to the Doctor's waving
1516,feet.) 
1517,"JAMIE: Hey, what are you doing in there? "
1518,"DOCTOR: I've nearly got it, Jamie. Yes, I think I've got it. "
1519,JAMIE: You think? You mean you're not sure? 
1520,"DOCTOR: Well, there won't be time for another try, you know. Oh, give"
1521,us a hand. Pull me back. 
1522,(Jamie pulls the Doctor out of the nose cone.) 
1523,"DOCTOR: Oh, there we are, yes. Yes, I think I've done it. Now then,"
1524,hold on and I'm going to try and steer this thing. 
1525,JAMIE: With that mess of wires? 
1526,(The capsule veers down and left.) 
1527,JAMIE: Take it easy. 
1528,"DOCTOR: Well, at least we know it works, don't we. "
1529,"JAMIE: Hey, can you land the thing? "
1530,DOCTOR: Of course I can. I'll get us down in no time at all. 
1531,"JAMIE: Aye, but in one piece? "
1532,DOCTOR: Now just hold on.
1533,
1534, [Council chamber]
1535,
1536, COUNCILLOR 2: Perhaps we should do something? We
1537,must be 
1538,"BOVEM: Gentlemen, gentlemen, this is no matter for precipitate action. "
1539,"SENEX: Nevertheless, we must hope that the Doctor may be able to pursue"
1540,some useful course of action. 
1541,"BOVEM: With respect, Director, I am reluctant to rely on the assistance"
1542,of any alien. 
1543,SENEX: You do now admit that he is not a Dulcian? 
1544,"BOVEM: Yes, so I think that our alliance must be placed in the Chairman"
1545,of Emergencies Committee. 
1546,"SENEX: Chairman Tensa? Yes, he is able, but can he deal with this"
1547,crisis? 
1548,"BOVEM: Oh, sir, Tensa has proved his efficiency in the face of fires,"
1549,"droughts, earthquakes. "
1550,SENEX: All natural disasters. All created by forces not inherently
1551,acting from aggressive motives. 
1552,(Intercom chimes.) 
1553,SENEX: Yes? 
1554,SECRETARY : Chairman Tensa is here. Presents his compliments. 
1555,SENEX: Send him in immediately. 
1556,COUNCILLOR 1: He's a very able man. 
1557,(Tensa enters.) 
1558,"TENSA: My greetings, Director Senex. Gentlemen. "
1559,"SENEX: Tensa, you have been informed of the emergency that has arisen? "
1560,TENSA: Yes. 
1561,SENEX: What would you advise? 
1562,TENSA: The facts of this emergency are non-conclusive. 
1563,(Murmurs of agreement.) 
1564,"TENSA: But, as I see it, we have three alternatives. "
1565,SENEX: Which are? 
1566,"TENSA: If these aliens and their robots are aggressive, and as yet this"
1567,"is not a fact. But if they are, then we can either fight "
1568,COUNCILLOR 1: Fight? 
1569,BOVEM: Fight? 
1570,SENEX: Silence! Tensa. 
1571,"TENSA: Fight, submit or flee. "
1572,BOVEM: Flee to where? 
1573,"SENEX: We cannot make war. We are not able. Flight is impossible, we"
1574,have nowhere to hide. And submission? To what? 
1575,TENSA: Who knows? 
1576,SENEX: So we can do nothing? 
1577,"TENSA: Nothing, except wait."
1578,
1579, [Island]
1580,
1581,(The capsule has buried its nose into a sand dune.
1582,The door opens to reveal the Doctor and Jamie in a tangle of wires.
1583,They clamber out.) 
1584,"DOCTOR: Oh, no bones broken. Oh dear. Oh, there we are. Oh, my word,"
1585,"Ah. Well, I think we've done rather well so far, don't you? "
1586,"JAMIE: More by luck than by judgement, if you ask me. What a landing. "
1587,"DOCTOR: It was just a bit bumpy. Oh now then, the main thing is we"
1588,"weren't spotted. Now come along, we've got to find Zoe and the others. "
1589,JAMIE: Aye.
1590,
1591, [Outside the museum]
1592,
1593,(Teel and Cully carry a big rock between them.) 
1594,"TEEL: All right then, I'm with you, but do you think it'll work? "
1595,CULLY: Of course it will. Once we can get hold of the laser and flatten
1596,"these Quarks, and go to ground somewhere. "
1597,"TEEL: But where? It mustn't be far. I mean, look at Kando. "
1598,"ZOE: Yes, and Balan. Is there anywhere near here to hide? "
1599,TEEL: Wait a minute. The shelter. The bomb shelter. I'm sure they built
1600,one here somewhere. Part of the atom test. 
1601,ZOE: It sounds ideal. Where is it? 
1602,TEEL: Can't remember.
1603,
1604, [Island hilltop]
1605,
1606," JAMIE: Hey, would you look down there. "
1607,DOCTOR: It's the ruined building. Hello. 
1608,(The Doctor takes out his pocket telescope.) 
1609,JAMIE: What can you see? 
1610,(Jamie takes it from him before he gets a chance to look.) 
1611,JAMIE: It's Zoe and Cully! 
1612,"DOCTOR: We've got to get down there. Jamie, we'll split up and get"
1613,around the back of them. I'll cut across those cliffs. 
1614,JAMIE: I'll go this way.
1615,
1616, [Outside the museum]
1617,
1618, ZOE: You ready? 
1619,CULLY: Yes. 
1620,ZOE: Once you're inside give me time to get the two Quarks into your
1621,line of fire. 
1622,CULLY: Here we go. 
1623,"(Cully goes to a rock, starts to lift it and then collapses.) "
1624,QUARK: Next one collapsed. Join the other specimens. 
1625,"(Cully staggers over to Balan, Kando and Teel next to the building.) "
1626,"BALAN: This is foolishness, Cully. "
1627,TEEL: All clear. Best of luck. 
1628,"(Cully goes into the museum and takes the laser rifle from its stand,"
1629,"then crouches by a window. Zoe picks up a rock, looks over her shoulder"
1630,"to see if he is in position, then collapses. The rifle sights are on a"
1631,Quark's head.) 
1632,QUARK: All specimens have reached point of collapse. 
1633,"ZOE: Fire, Cully, fire."
1634,
1635, [Museum]
1636,
1637,(Cully has a Quark lined up when someone grabs his
1638,shoulder.) 
1639,JAMIE: What do you think you're doing? 
1640,CULLY: Jamie! 
1641,JAMIE: Zoe's out there. 
1642,"CULLY: I know that, you fool, I was aiming at those Quarks! "
1643,QUARK : All specimens stand up. 
1644,CULLY: I missed my chance. I had them in my sights.
1645,
1646, [Outside the museum]
1647,
1648, TEEL: Why didn't he shoot? 
1649,KANDO: I don't know. 
1650,QUARK: Specimens must all be returned to Dominator Rago. 
1651,QUARK 2: One of them is missing. It is the specimen Cully.
1652,
1653, [Museum]
1654,
1655," CULLY: Oh, it's no good. Balan's in the way now. "
1656,"JAMIE: Well, I said I'm sorry. Anyway I don't think we should do"
1657,anything until the Doctor gets here. 
1658,CULLY: Well he'd better be quick. Those Dominators will be after me
1659,soon. 
1660,JAMIE: Don't worry. He'll get here.
1661,
1662, [Island]
1663,
1664,(The Doctor looks out from behind a rock to see - )
1665,
1666,TOBA: What are you doing? You were told to keep away from the Quarks. 
1667,"DOCTOR: Oh, but I do. Whenever I see one I go away. But they're all"
1668,over the island. Where can I go? 
1669,"(Three Quarks are escorting Zoe, Teel, Kando and Balan along a path.) "
1670,TOBA: Stop. One of them's missing. 
1671,QUARK: The man Cully has escaped. 
1672,"TOBA: Has he. All right, carry on. Take this idiot with you. Quark,"
1673,follow me. 
1674,"(Now with an escort of three Quarks, Toba goes back along the path.)"
1675,
1676, [Museum]
1677,
1678," CULLY: It's no good, Jamie. We daren't wait any"
1679,longer. Something must have happened to the Doctor. 
1680,"JAMIE: Aye, I think you're right. "
1681,TOBA : Cully! 
1682,JAMIE: Down! I told you to stay away from the window. 
1683,CULLY: Do you think he saw me? 
1684,"TOBA : I know you're in there, Cully! "
1685,JAMIE: Give me that. 
1686,(Jamie takes the laser rifle.)
1687,
1688, [Outside the museum]
1689,
1690, TOBA: Now you'll see what happens when the orders
1691,"of a Dominator are disobeyed. Quark, destroy! "
1692,(The Quarks start 'firing' at the building.)
1693,
1694, [Museum]
1695,
1696,(The museum door blows in and the ceiling starts to
1697,come down.) 
1698,"JAMIE: Right, here goes. "
1699,(Jamie fires the rifle.)
1700,
1701, [Outside the museum]
1702,
1703,(A Quark starts spinning with smoke coming out of
1704,"it, then goes Bang!) "
1705,TOBA: Destroy! Destroy! Total destruction!
1706,
1707, [Museum]
1708,
1709, JAMIE: I can't see a thing. If only I could get in
1710,another shot. 
1711,(A girder lands on Cully. Jamie helps him up.) 
1712,JAMIE: Let's get out of here! 
1713,"CULLY: No, this way. "
1714,(They go further into the museum.)
1715,
1716, [Outside the museum]
1717,
1718, TOBA: Stop. 
1719,QUARK: Work completed. 
1720, Episode Four
1721,
1722, [Saucer]
1723,
1724,(Toba and the Quarks have returned.) 
1725,QUARK: On the orders of Dominator Toba the building was destroyed. Also
1726,the man Cully. 
1727,DOCTOR: But Jamie was in that building! 
1728,RAGO: Silence! You deliberately disobeyed my order? 
1729,TOBA: My life was threatened and a Quark destroyed. 
1730,"RAGO: Yes, because of your own actions. "
1731,TOBA: Are you suggesting I should have let him escape? 
1732,"RAGO: And where would he have gone? We are on an island, Toba. These"
1733,"creatures cannot escape. Now listen to me carefully, and this time you"
1734,will obey my instructions. Send these creatures back to the central
1735,bore position. I want it cleared ready for drilling. 
1736,TOBA: But the Quarks will do it more quickly. 
1737,RAGO: We must conserve their energy for drilling purposes. You know the
1738,power levels are low. 
1739,"TOBA: Command accepted. Quark, bring the creatures. "
1740,RAGO: Leave the inferior types. 
1741,(A Quark blocks the Doctor and Zoe's path.) RAGO: Toba. 
1742,"TOBA: Yes, Navigator Rago? "
1743,RAGO: I have not yet dismissed you. 
1744,TOBA: But the creatures! 
1745,"RAGO: Quarks, take these specimens back to the drilling site. Await the"
1746,"arrival of Dominator Toba. You two, over there. "
1747,(The Doctor and Zoe are backed up against a large stellar map wall.) 
1748,"DOCTOR: All right, all right. "
1749,TOBA: May I ask what you? 
1750,RAGO: You may ask nothing. You are here to listen. 
1751,TOBA: I am listening. 
1752,"RAGO: Probationer Toba, I'm far from satisfied with your conduct on"
1753,this mission. 
1754,TOBA: I protest! 
1755,RAGO: Be silent! I am beginning to wonder if you have the qualities of
1756,intelligence and detachment necessary in a Dominator. 
1757,TOBA: Where have I failed? 
1758,RAGO: You have repeatedly destroyed the creatures and installations of
1759,this planet to no purpose. 
1760,TOBA: My purpose was to protect us both. 
1761,RAGO: Protect? These creatures are harmless primitives. You acted out
1762,of your desire to gratify a need for pointless destruction. 
1763,TOBA: Was it by softness that the Dominators became Masters of the Ten
1764,Galaxies? 
1765,"RAGO: It was by ruthlessness, Probationer Toba. That which threatens us"
1766,we destroy. That which is too weak to harm us we ignore. 
1767,"TOBA: Are they so harmless, these primitives? They've disobeyed us,"
1768,"they've attacked us, even here on this small island. The rest of the"
1769,planet may be preparing to attack us even now. 
1770,RAGO: I will investigate the more advanced type of alien for myself.
1771,You will concern yourself with obeying my orders and nothing more. I
1772,will report your conduct to Fleet Leader. 
1773,TOBA: And I shall protest at yours. 
1774,RAGO: What did you say? 
1775,TOBA: You've jeopardised our mission by unnecessary softness. You've
1776,humiliated me before members of an inferior race. Perhaps it is you who
1777,is not fit to be a Dominator. 
1778,RAGO: You have the insolence to threaten me? 
1779,TOBA: It is not unknown for a leader who is unfit to be replaced. 
1780,RAGO: It is not unknown for a mutinous subordinate to be executed. 
1781,TOBA: You would not dare. 
1782,RAGO: Quark! 
1783,"QUARK: Yes, sir. "
