,Script
1133,"the Lords of Time. The Lords of Time destroying them utterly. Well,"
1134,"that's good news. However, when the bodies were counted (gasp) I knew"
1135,"it. Just like the legend said. When the bodies were counted, the King"
1136,"Vampire, mightiest and most malevolent of all, had vanished, even to"
1137,"his shadow, from time and space. Until now. "
1138,"K9: Continue, master. "
1139,DOCTOR: Hence it is the directive of Rassilon that any Time Lord who
1140,"comes upon this enemy of our people and of all living things, shall use"
1141,"all his efforts to destroy him, even at the cost of his own life. "
1142,K9: Query. How may this creature be destroyed? 
1143,DOCTOR: What? That's a good question. Let's see what it says about
1144,battle. 
1145,(He flicks through more punch cards.) 
1146,"DOCTOR: Cattle, rattle, battle. "
1147,(Another readout.) 
1148,DOCTOR: Got it. Energy weapons were useless because the monsters
1149,absorbed and transmuted the energy using it to become stronger.
1150,Therefore Rassilon ordered the construction of bow ships. Ah. Swift
1151,vessels that fired a mighty bold of steel that transfixed the monsters
1152,through the heart. For only if his heart be utterly destroyed will a
1153,vampire die. 
1154,K9: Query. 
1155,DOCTOR: What? What is it? 
1156,"K9: Is this data of practical value, master? "
1157,"DOCTOR: Well, it might come in useful, if we can only lay our hands on"
1158,a mighty bolt of steel. 
1159, [Inner sanctum] 
1160, ROMANA: Surely not so soon. The mutation must take
1161,some time. 
1162,(Adric's eyes open. Romana gasps.) 
1163,TARAK: Maybe he's still under hypnosis? 
1164,"ROMANA: Adric, wake up. "
1165,(Zargo wakes.) 
1166,ROMANA: Wake up! 
1167,(Camilla wakes. Adric groans.) 
1168,ROMANA: I'm trying to rescue you. Come on. 
1169,ADRIC: It's like a kind of dream. Someone was whispering to me about
1170,power and eternal life. 
1171,(Zargo and Camilla sit up.) 
1172,ADRIC: They're going to initiate me at some big ceremony tonight. 
1173,"ROMANA: Come on, Adric. We've got to get out of here. "
1174,ZARGO: I think not. 
1175,TARAK: Look out! 
1176,"(Tarak attacks Camilla, who easily twists his arm behind his back and"
1177,"makes him drop his knife, before throwing him to Zargo who takes him by"
1178,the tunic.) 
1179,TARAK: No! No! No! 
1180,(Zargo lifts Tarak high into the air then throws him onto the stone
1181,bed. Tarak rolls off onto the floor. Zargo and Camilla go to him.) 
1182,CAMILLA: You killed him. The blood of the dead is stale and flat. I
1183,must feed on the living. 
1184,ZARGO: We still have these. 
1185,(Adric throws Tarak's knife into Zargo's shoulder. Camilla advances on
1186,him while Romana backs away. Zargo grabs her and removes the knife from
1187,his shoulder. There is no blood on it.) 
1188, Part Four
1189,
1190, [Inner sanctum] 
1191, AUKON: No. 
1192,"ZARGO: Go, Aukon. It is too late to interfere now. "
1193,"AUKON: I said no. Get back. The boy is the first of the Chosen Ones,"
1194,soon to be one of us. He is not for you. 
1195,"CAMILLA: The girl, then. Let us have the girl. "
1196,AUKON: The girl is a Time Lord. One of the ancient enemies of the Great
1197,One. She is to be held for sacrifice at the time of Arising. 
1198, [Tardis] 
1199, (Punch cards litter the floor. The Doctor stops
1200,pacing and kicks at a pile of them.) 
1201,"DOCTOR: It's no good, K9. "
1202,K9: Master? 
1203,DOCTOR: Listen. I'm going to have to go to the rebels for help. But
1204,"will they help, I ask myself. "
1205,K9: Probability of indigenous dissident group rendering effective
1206,"assistance, very low. "
1207,DOCTOR: Shush. I'm thinking. I've got to make a very impressive
1208,"entrance. Something that'll win them over entirely. Got it! Right, K9,"
1209,we need a slight spatial movement and no temporary displacement. Very
1210,"tricky, these short hops. "
1211,"K9: Information, master. "
1212,DOCTOR: What is it? 
1213,K9: The relative smallness of E-space should render fractional
1214,increments more stable. 
1215,"DOCTOR: But of course. Good boy, K9. "
1216, [Rebel's cave] 
1217, VEROS: We can't let Ivo and the villagers attack
1218,alone. They'll be slaughtered! 
1219,"KALMAR: Will it help if we're slaughtered with them, just as we're"
1220,winning back the old knowledge? I refuse to throw it all away. 
1221,"VEROS: Ivo was right, then. You do prefer these toys to human life. "
1222,KALMAR: Because they are the slow secret of victory. Why do you think
1223,they are so afraid of science? 
1224,"VEROS: The Doctor was a scientist. Like all the rest, he vanished in"
1225,the Tower. 
1226,(The Tardis materialises and the Doctor comes out.) 
1227,"DOCTOR: Halt! Don't move. Look, I'm awfully sorry to drop in on you"
1228,"like this, but we do have a bit of a crisis on our hands. "
1229, [Inner sanctum] 
1230, (Romana and Adric's wrists are bound by chains.) 
1231,AUKON: We stand on the very threshold of our triumph. I have communed
1232,with the mind of the Great One and he is ready. Thanks to the blood and
1233,"souls we have fed to him for so long, his body is healed of wounds,"
1234,regenerated and whole once more. 
1235,ZARGO: And he will arise tonight? 
1236,AUKON: It is certain. When all is prepared we will go to the resting
1237,place and summon him. 
1238,"CAMILLA: When he wakes, he will be hungry. "
1239,ZARGO: Ivo and his faithful villagers will be able to perform one last
1240,service for their masters. 
1241,CAMILLA: And when they are consumed 
1242,AUKON: We shall leave this miserable space trap for the real universe.
1243,"Rich, fat worlds teeming with life. We shall suck their life blood"
1244,"until they are empty husks, and pass on to more worlds, and yet still"
1245,more. 
1246,CAMILLA: Countless inhabited planets all waiting to feed our hunger. 
1247,ZARGO: I have served a thousand years for this. 
1248,"AUKON: At midnight, our servitude will end and our glory begin. But the"
1249,"proper rituals must be carried out, or the Great One will be"
1250,"displeased. Zargo, Camilla, you will initiate the boy, after I have"
1251,sacrificed the girl. 
1252, [Rebel's cave] 
1253," (The Doctor is giving a pep talk to the rebels,"
1254,"whilst borrowing from Henry V, Act 4 scene 3.) "
1255,DOCTOR: Lack of weapons. No experience. Odds almost insurmountable.
1256,But! He who outlives this day and comes safe home shall stand a-tiptoe
1257,when this day is named and rouse him at the name of E-space! 
1258,(Cheers all round.) 
1259,"DOCTOR: Well, that's the problem. There's got to be an answer. "
1260,KALMAR: What? 
1261,DOCTOR: That's the question. 
1262,VEROS: We must join forces with Ivo and attack the Tower. Tarak was
1263,right! 
1264,"DOCTOR: Yes, yes. "
1265,KALMAR: Where is Tarak now? We dare not attack the Tower until we are
1266,ready. 
1267,DOCTOR: You've got to be ready. You people have had a thousand years to
1268,rid yourselves of this evil and now all you've got are three hours. 
1269,KALMAR: Do you really expect us to believe that some great creature
1270,sleeps beneath the Tower and is about to awake and destroy us? 
1271,DOCTOR: Where do you think Zargo and his friends got their powers? 
1272,KALMAR: I don't know. 
1273,"DOCTOR: No, and that's the very devil of it. If I had any instruments"
1274,"with me, I could show you. "
1275,KALMAR: The scanner. 
1276,DOCTOR: Scanner. Scanner? 
1277,KALMAR: The console you got working for us. I discovered another
1278,facility. 
1279,DOCTOR: Range? 
1280,KALMAR: It should reach the Tower. 
1281,"DOCTOR: Right, Now, Kalmar, you'll see I'm telling you the truth."
1282,"Gather round, gentlemen. Hang on a minute, hang on a minute. It'll take"
1283,"a moment or two for the picture to steady. There we are. Oh, it seems"
1284,to scan right through the spectrum. 
1285,KALMAR: There's the Tower. 
1286,DOCTOR: Yes. The spectrum's a bit weak at the moment. Infra-red.
1287,Picking up sleeping life forms. Now we're going into x-ray. Watch the
1288,area below the Tower. 
1289,(An image of a giant bat-like creature with a humanoid head writhing
1290,around appears. There is a throbbing sound and the Doctor turns away.) 
1291,DOCTOR: Oh. 
1292,VEROS: What is it? 
1293,"DOCTOR: The heartbeat of the Great Vampire. Well, Kalmar? "
1294,KALMAR: See if you can raise Ivo on the communicator. 
1295, [State room] 
1296, (Two guards stand with their backs to Romana and
1297,"Adric, who are sitting on the thrones.) "
1298,ADRIC: So the vampires in the stories are just pale imitations of the
1299,real thing? 
1300,ROMANA: If the Doctor's suspicions are right. 
1301,"ADRIC: Oh yes, the Doctor. Is he coming back from the Tardis? "
1302,"ROMANA: Well, we were supposed to join him there after we'd rescued"
1303,you. 
1304,"ADRIC: Only you didn't, did you. "
1305,ROMANA: Didn't what? 
1306,"ADRIC: Rescue me. Tarak got killed, you got caught, and the Doctor's"
1307,safely out of it. He can clear off in the Tardis whenever he likes. 
1308,"ROMANA: How dare you, Adric! "
1309,ADRIC: It looks as if this is one time the goodies don't win after all.
1310,"Still, I'm all right, aren't I. "
1311,"ROMANA: Oh yes, you are all right. You haven't done so much better"
1312,"yourself. You stow away in our Tardis, you expect us to"
1313,ADRIC: Now look! I've been offered a partnership. Power and eternal
1314,"life, they said. "
1315,"ROMANA: They are vampires, Adric. Do you want to become one of them? "
1316,"ADRIC: You said yourself, you're on the menu. If it's a choice between"
1317,"that and joining the diners, I mean, there's no sense in two of us"
1318,getting the chop. 
1319,"ROMANA: When the Doctor gets back from the Tardis, he is going to need"
1320,your help. 
1321,(The Three enter. Zargo and Camilla take back their thrones.) 
1322,"ADRIC: Why am I being kept prisoner like this? She's the sacrifice, not"
1323,me. I'm supposed to be a Chosen One. 
1324,(Aukon doesn't reply.) 
1325,"ADRIC: I'm sorry, Time Lady. One of my family's died for your lot"
1326,already. I reckon one's enough. 
1327,"ROMANA: Adric, do you know what happens to vampires when they die? "
1328,"ADRIC: But they don't die, do they, Aukon. "
1329,"AUKON: Release him, and prepare him for the ceremony. Prepare the"
1330,sacrifice also. 
1331,(The guards take Adric and Romana away.) 
1332,AUKON: It is time. 
1333,"(Down in the Resting place, the ground is starting to crack as the beat"
1334,gets stronger.) 
1335, [Rebel's cave] 
1336, (The rebels have provided a parchment map of the
1337,area. The heartbeat can still be heard.) 
1338,"DOCTOR: Our HQ, the Tower. Now, we can take the Tower between us. "
1339,(All agree.) 
1340,"DOCTOR: Yes, well, I'm pretty sure of that. "
1341,IVO: But what about Aukon? 
1342,DOCTOR: Aukon and his friends will be distracted by the ceremony. 
1343,IVO: But what about the guards? 
1344,"DOCTOR: Well, there are ways of dealing with guards. "
1345,IVO: But how do we deal with that? 
1346,KALMAR: You said your people killed thousands of them. 
1347,"DOCTOR: Yes, but that was after a long and bloody war, and they had bow"
1348,ships that fire mighty bolts of steel and pierced each vampire's heart.
1349,
1350,IVO: Maybe there's another way to kill them? 
1351,KALMAR: Well 
1352,DOCTOR: Their cardiovascular system's incredibly efficient. They can
1353,"just seal over minor wounds. Yes, there's a very practical reason for"
1354,the traditional wooden stake. 
1355,IVO: If we sharpened a tree trunk 
1356,"DOCTOR: No, I doubt if even that would be big enough, and anyway, how"
1357,could we propel it? Mighty bolt of steel. 
1358,IVO: A catapult? 
1359,"DOCTOR: Of course. Of course! An arrow of steel, and I've been looking"
1360,"at it all this time. Right, gentlemen, let's gather round and finalise"
1361,"our plans. Now, we need a group of your best men, a sort of commando"
1362,force. 
1363,"IVO: You'll lead us then, Doctor? "
1364,ALL: Yes! 
1365,DOCTOR: No. 
1366,(Groans all round.) 
1367,"DOCTOR: It's all right, it's all right. I've got other things to worry"
1368,"about. But, I can lend you a very useful tool. Armoured. Immune to"
1369,hypnotism. 
1370,IVO: Yes? 
1371,DOCTOR: And a dead shot with a nose laser. 
1372,IVO: Good. 
1373,DOCTOR: K9. 
1374,"K9: Reconfigured in aggression mode, master. "
1375,(Ivo and Kalmar look at each other.) 
1376, [Tower entrance] 
1377, (A lone guard patrols outside.) 
1378,IVO: Yes. 
1379,(He spots Ivo and Veros.) 
1380,GUARD: Guards! 
1381,(Two guards run along the stone corridor and get shot by K9. The Doctor
1382,and the rebels enter the Tower.) 
1383, [Outside the State room] 
1384, (Ivo and Veros take on two more guards. Everyone
1385,is armed with spears so the fights are at least equal. A third guard
1386,"bursts out of a room and is shot by K9, and a fourth.) "
1387,VEROS: Doctor. 
1388,"DOCTOR: Good, good. "
1389, [State room] 
1390, (The Doctor sits on Zargo's throne.) 
1391,"KALMAR: Stay calm, Doctor. "
1392,"DOCTOR: The others have gone, therefore the ceremony must have started."
1393,"Now listen to me, all of you. I want you to hold this Tower until K9"
1394,gives the signal. 
1395,IVO: We will not take orders from that thing. 
1396,DOCTOR: One day you'll apologise for that. 
1397,IVO: Never! 
1398,"DOCTOR: Shush. Never mind. Just trust me, it'll work. After K9's"
1399,"signal, you evacuate the Tower and make your way round to the caves. If"
1400,"you should find Romana and Adric, see if you can rescue them and get"
1401,away from here as far and as fast as you can. Got it? Good. Go. Stop.
1402,"Don't forget, K9 gives the signal. "
1403,"(Outside, Habris sneaks away.) "
1404, [Resting place] 
1405, (Romana has been dressed in a white mediaeval
1406,style gown. She seems hypnotised.) 
1407,"ADRIC: Listen, I've got a plan. Can you hear me? "
1408,(Habris enters.) 
1409,HABRIS: My lord. 
1410,AUKON: How dare you interrupt us! 
1411,"HABRIS: We are attacked, my lord. The Doctor with rebels and villagers,"
1412,and some strange mechanical beast that shoots men down. 
1413,ZARGO: We must go back. 
1414,AUKON: No. The time of Arising is now. 
1415,"HABRIS: Then send your servants, my lord. Send the bats. "
1416,AUKON: I have need of them. The guards must hold the Tower to the last
1417,man. 
1418,"HABRIS: We are outnumbered. Unless you aid us, we shall all be killed. "
1419,(Aukon looks straight into Habris' eyes.) 
1420,AUKON: Then die. That is the purpose of guards. Go. 
1421,(Habris leaves.) 
1422,"CAMILLA: When they have taken the Tower, they will come to attack us. "
1423,"AUKON: By the time the Tower falls, the Great One will have arisen. We"
1424,shall be invincible. 
1425, [Spaceship] 
1426, (The Doctor climbs the ladder to a platform where
1427,three more ladders lead upwards.) 
1428,"DOCTOR: Three scoutships, three chances. Now, which one first? This"
1429,one. 
1430, [Outside the State room] 
1431," (Ivo deals with another guard and takes his knife,"
1432,then Habris arrives.) 
1433,IVO: Habris. 
1434,HABRIS: Ivo. 
1435,IVO: This is for my son. 
1436,HABRIS: I tried to help him. 
1437,(Ivo throws away the knife and they go hand to hand.) 
1438, [Flight deck 1] 
1439, (The Doctor flicks switches.) 
1440,DOCTOR: Come on. Dead as a dinosaur. The circuits must be corroded.
1441,Have to try one of the others. 
1442, [Resting place] 
1443, (Romana stares at nothing as two guards put her on
1444,a slab and leave.) 
1445,"AUKON: Now, the sacrifice is make ready. "
1446,"(Adric pulls out a knife and tries to rush forward, but Aukon stops him"
1447,with his mind. He drops the knife.) 
1448,AUKON: Seize him. 
1449,(The guards take Adric away.) 
1450, [Flight deck 2] 
1451, DOCTOR: Come on. 
1452,(Even kicking the console makes no difference.) 
1453,DOCTOR: One to go. 
1454, [Resting place] 
1455," AUKON: O Great One, hear us. We celebrate your"
1456,"Arising with the sacrifice of a Time Lord, one of the race of your"
1457,enemies. Drink her soul and grow strong. 
1458,(Bats fly in from outside.) 
1459,"AUKON: Come, O servants of the Great One, come. Drink the blood of the"
1460,sacrifice. 
1461, [Flight deck 3] 
1462, DOCTOR: Come on. Come on! What happened to all
1463,"that Earth craftsmanship, eh? Just because you've been laid up for a"
1464,thousand years. 
1465,(He punches the console and it starts humming.) 
1466,"DOCTOR: A scintilla of power left in the energy cells, a few drops of"
1467,"fuel. Oh, lovely Earth craftsmanship. "
1468, [State room] 
1469, (K9 is on Zargo's throne.) 
1470,K9: Leave at once. Evacuate the Tower. Evacuate. 
1471, [Flight deck 3] 
1472," DOCTOR: That should do it. Short trip, quick flip."
1473,"Time to be going, Doctor. "
1474,"(The rebels rush out of the State room, the first bat lands on Romana's"
1475,"white throat, and the Doctor rushes down the ladders.) "
1476, [Resting place] 
1477," (Everywhere starts to shake, and the bat flies off"
1478,leaving two little puncture marks on Romana's neck. The three turn
1479,round to look at the spaceship's exhaust port behind them.) 
1480,AUKON: The ship! 
1481,ZARGO: What's happening? 
1482,AUKON: No! 
1483,(Romana wakes and Adric helps her away. The Doctor gets out of another
1484,"exhaust port as one third of the rocket nose cone breaks off, fires its"
1485,"engine and lifts off, and runs over to Adric and Romana.) "
1486,"DOCTOR: Romana! Right, time for me to tell you what happened. "
1487,ROMANA: You sent the scout ship on a little trip. 
1488,DOCTOR: Right. Yes. 
1489,"(Meanwhile, the crust is broken.) "
1490,"AUKON: He rises! See, the Great One rises! "
1491,(A giant claw comes out of the ground as the little scout ship reaches
1492,the top of its trajectory and starts to turn.) 
1493,AUKON: He comes! The Great One comes! 
1494,"DOCTOR: Don't worry, don't worry. Have you ever heard the expression"
1495,what goes up must come down? 
1496,ADRIC: No. 
1497,DOCTOR: I wish I hadn't. 
1498,(The scout ship starts its powered descent.) 
1499,AUKON: No! No! 
1500,DOCTOR: Get down! Get down! 
1501,(The pointed little ship pierces the ground by the giant claw. There is
1502,an inhuman gurgling and the claw goes back down again as the heartbeat
1503,stops. 
1504,"The Three are not pleased, and advance on the Doctor, canines bared."
1505,"They back the Doctor into a corner, then start aging in front of his"
1506,eyes before finally crumbling to skeletons.) 
1507,DOCTOR: There was never really anything to worry about. Their time was
1508,"up. Well done. Well done, well done, well done. "
1509,ADRIC: So that's what happens to vampires when they die. 
1510,ROMANA: Glad you didn't join them? 
1511,ADRIC: I'm sorry about that. It was just a bluff. It just so happens I
1512,was trying to rescue you. 
1513,"ROMANA: But you didn't, did you. "
1514,"(Ivo, Kalmar and Veros enter with K9.) "
1515,"IVO: Well, we've dealt with the Tower, Doctor. Now, what about this"
1516,monster? 
1517,(The Doctor points at the scout ship sticking out of the still ground.)
1518,
1519,KALMAR: What did you do? 
1520,"DOCTOR: Well, I just fired off one of the rocket ships, you see, and I"
1521,arranged the controls so that it went straight up 
1522,ROMANA: And came straight down again. 
1523,"IVO: But what about the lords, Zargo and the others? "
1524,"DOCTOR: Ah. Well, they just went to pieces. "
1525,(They go over to the skeletons.) 
1526,KALMAR: Doctor. 
1527,DOCTOR: Yes. 
1528,"KALMAR: As once scientist to another, congratulations. "
1529,DOCTOR: It was nothing. 
1530,"IVO: There is one thing, Doctor. "
1531,DOCTOR: Yes? 
1532,IVO: I feel I really must apologise for the things I said about K9. 
1533,"DOCTOR: Go on, then. "
1534,"(Ivo does a double take, then kneels by K9.) "
1535,"IVO: Well done, dog. "
1536,K9: Your thanks are recorded. 
1537, [Rebel's cave] 
1538," DOCTOR: There, that should do it. "
1539,(The scanner dies. He hits it.) 
1540,"DOCTOR: There, that should do it. Well, Kalmar, there's all the"
1541,"knowledge you'll need in there. Use it well, and if that's what you"
1542,"want, you can be a high technological society in no time. "
1543,"KALMAR: We'll do our best, Doctor. "
1544,"DOCTOR: Good, good. "
1545,KALMAR: Doctor? 
1546,DOCTOR: Yes? 
1547,KALMAR: If we can get the main ship working 
1548,"DOCTOR: Yes? Inside, you two. We just have to get on with this. "
1549,KALMAR: Is there any way out of this E-space? Perhaps one day we can
1550,get back to Earth. 
1551,"DOCTOR: Well, I really don't know. You see, we came here by accident,"
1552,but you were brought here by the Great Vampire's brain and his secret
1553,"died with him. Kalmar, such good luck. "
1554,"KALMAR: Thank you, Doctor. "
1555,"DOCTOR: And you, young man, you're going straight home. "
1556,(The Doctor follows Romana and Adric into the Tardis. 
1557,ADRIC : But Doctor 
1558,DOCTOR : You're going straight back to the Starliner. 
1559,(The Tardis dematerialises.)  
1560,
1561,
1562,
1563,
1564,
1565,
1566,<Back
1567,to the episode listing
1568,Doctor Who and related
1569,marks are trademarks of BBC . Copyright 
1570,"1963, Present. The web pages on this site are for educational and"
1571,entertainment purposes only. All other copyrights property of their
1572,respective holders.
1573,
