,Script
457,"(The Doctor pulls Bill into the round house, then Lucius.) "
458,DOCTOR: Close the trap door. 
459,"(They slam down the wooden door, and the tentacles retreat.) "
460,DOCTOR: Block it off! We have to block it off! 
461,(He starts to put stones on the trapdoor.) 
462,"LUCIUS: Centurions, defence formation. "
463,"DOCTOR: It's fallen back. It's waiting. It's waiting to feed off the sunlight, to grow to its full strength. "
464,(Bill helps Lucius carry a heavy table onto the trapdoor.) 
465,DOCTOR: Hello.  
466,BILL: Hi. I brought you the Ninth Legion. 
467,(Currently in a small defensive square fending off the Picts.) 
468,"DOCTOR: Whoa, there they are. The lost Legion of the Ninth. "
469,BILL: Totally found them. 
470,"DOCTOR: Yeah, you totally did. "
471,(Nardole waves between bites of something.) 
472,"BILL: Nardole, what happened to you? "
473,"NARDOLE: Oh, I'm blending in. (Scots) Welcome to our land. Scotch. "
474,KAR: Drop your weapons. 
475,"DOCTOR: Oh, for goodness' sake! We don't have time for this. "
476,LUCIUS: Stay back! 
477,"BILL: Lucius, stop it! "
478,KAR: Are you their champion now? 
479,BILL: There is no time for fighting! 
480,DOCTOR: Exactly. 
481,"KAR: We never wanted to fight. We lived in peace, and then you came and laid waste to everything and everyone we loved. "
482,All you understand is war. 
483,"BILL: No, he understands. Don't you? Now he's wondering why. "
484,LUCIUS: You speak Latin?  
485,KAR: I don't. 
486,"BILL: Neither do I. Not a word. And I don't speak whatever they speak either. It's him. It's you, isn't it? "
487,"DOCTOR: Yes, it's me. "
488,"BILL: Something to do with the Tardis. Maybe, telepathic field? So now that we all understand each other, how do we all sound? "
489,LUCIUS: You sound like children. 
490,KAR: You sound like children too. 
491,DOCTOR: You all do. 
492,BILL: Is this what happens when you understand what everyone in the universe is saying? Everybody just sounds like children? 
493,DOCTOR: There are exceptions. 
494,NARDOLE: Thank you very much.  
495,"DOCTOR: Not you. Okay, kids, pay attention. She slaughtered your legion. You slaughtered everything that she loves. Now, you all have a choice. "
496,"You can carry on slaughtering each other till no one is left standing, or you grow the hell up! Because there's a new war now. "
497,"I think these creatures are light-eating locusts, looking for rents and cracks between worlds to let themselves into dimensions of light. "
498,"Once they break through, they eat. They will eat the sun, and then they will eat the stars. And they will keep eating until there are no stars left. "
499,"So, whose side are you on now? Because as far as I can see, there's only one side left. "
500,(At least Kar and Thracius are hanging their heads.) 
501,"DOCTOR: If it helps, I do have a plan."
502,
503,[Inside the Cairn]
504,
505,(The tribe gathers.) 
506,DOCTOR: It feeds on light but it homes in on sound. 
507,BILL: So what's going to happen? 
508,"DOCTOR: It's simple. Bit of noise, lure the beast here, drive it back through the gate. "
509,(They light torches.) 
510,"BILL: But how do we keep it there? I mean, you said all those things are going to come through, right? "
511,DOCTOR: They can only come through one at a time.  
512,BILL: I know. 
513,"DOCTOR: That's why guarding the gate worked. One Pict in there, fighting it off for a few minutes, that adds up to sixty or seventy years out here. "
514,"BILL: I get it, yeah, and then the next one goes in. But what do we going to do this time? Or are you going line up Picts sacrificing themselves until"
515,the end of the world? 
516,DOCTOR: I've got a better idea this time. 
517,BILL: Which is the part you never tell me.  
518,DOCTOR: Don't I? 
519,BILL: No. 
520,DOCTOR: I probably just get interrupted. 
521,"(The musicians start up, repeating the same short theme from the top of the show. Bodhran, tin whistle which I hope is made of wood really, and there should be a small harp in there too.) "
522,NARDOLE: This is worse than jazz.
523,
524,[Outside the Cairn]
525,
526,BAN: Nothing. There's nothing. 
527,NARDOLE: Maybe it won't come. 
528,(He sees a crow on a rock.) 
529,NARDOLE: Hello. 
530,CROW: Hello. 
531,NARDOLE: Hello. 
532,CROW: Doc-tor! 
533,"NARDOLE: No, no. Nardole. It's probably a bit tricky for you, that, innit? "
534,CROW: Nar. 
535,NARDOLE: Lovely. Hello! 
536,CROW: Monster! 
537,NARDOLE: Sorry? 
538,CROW: Monster! 
539,(And flies off as feet stomp by the small fires set along the ceremonial route to the Cairn then breaks into a gallop.) 
540,BAN: There! 
541,NARDOLE: Oh!
542,
543,[Inside the Cairn]
544,
545,NARDOLE: It's coming!  
546,BAN: It's here! 
547,DOCTOR: Get ready! 
548,(Lucius takes the 'tv aerial' weapon from Ban.) 
549,DOCTOR: Channel the light! 
550,(Lots of those quartzite prisms are held up to colour and focus the light rays from the torches onto the beast. That stops it dead and annoys it.) 
551,DOCTOR: Keep it here! We've got to hold it here till sunrise. 
552,(Other Picts poke at it with their 'tv aerials'.) 
553,DOCTOR: Keep it there! Keep it there! 
554,(Lucius slashes at the tentacles with his sword. Dawn breaks over the mountains and shines down the passageway.) 
555,"DOCTOR: Turn it, the sun is rising! "
556,(The Doctor focuses the biggest mirror onto its head.) 
557,DOCTOR: Back! Back to the void! 
558,"(The rear wall opens and the beast backs through, then disappears into the vortex.) "
559,DOCTOR: It'll only stay open as long as the sunlight's on it. Give me your weapon. 
560,BILL: What are you doing? 
561,DOCTOR: This is the clever bit. 
562,"BILL: Well, tell me. "
563,"DOCTOR: The gate has to be guarded. There's no other way. The trouble is, human life spans, they're tiny. They're hilarious. You get used up too quickly. "
564,"So what's the answer? Go on, figure it out. The answer's me. I go on for ages. I don't even really die, I regenerate. I can hold that gate till the sun goes out. "
565,"BILL: No, you can't. "
566,DOCTOR: Course I can. I'm going to. 
567,BILL: This isn't your job. 
568,"DOCTOR: No, it isn't, Bill. It's who I am. "
569,"(He moves away from the opening to speak to Bill, and Kar moves towards it.) "
570,"DOCTOR: I've been standing by the gates of your world, keeping you all safe, since you crawled out of the slime. I'm not stopping now. "
571,"(Oh, like the Monks claimed to have done...) "
572,"BILL: Doctor, please. "
573,DOCTOR: Listen. The Tardis will take you home. Return journeys are easy. 
574,BILL: Listen to me. 
575,DOCTOR: Leave the instruments on the current setting. Just hit them with a spanner. (to Kar) The weapon. Now.  
576,KAR: No. 
577,DOCTOR: Give it to me. Come on. You'll be safe. Tomorrow you'll be farming. You can name a cow after me. 
578,BILL: What about the other gates that you have to guard? What about the Vault? 
579,DOCTOR: The Vault will never exist if I let those things come through. 
580,"BILL: Well, then someone else better stop them. "
581,DOCTOR: Nobody else can. 
582,KAR: I can. 
583,DOCTOR: What are you saying? 
584,"KAR: Time to grow up, Doctor. Time to fight my fight. "
585,(The Picts hold the Doctor back at spear point.) 
586,"DOCTOR: I'm sorry, no. No one else can do this, not like I can. "
587,LUCIUS: We can. I'm ready. I'll guard the gate with you. I'll fight by your side. 
588,"DOCTOR: Awesome. Brilliant. You'll be a hero for two seconds, then the whole solar system will be devoured. "
589,KAR: Stop him. 
590,(Spears point at the Doctor's throat.)
591,"KAR: This is my destiny, my fight. "
592,DOCTOR: Out of my way. Now! 
593,LUCIUS: We'll take it in turns. 
594,DOCTOR: Two of you can't hold the gate. 
595,THRACIUS: Two of them? I'm counting more than two. The Legion of the Ninth stands ready to serve. 
596,"DOCTOR: Oh, stop being brave. I can't bear brave people. "
597,"BAN: I'll put the story in the stone. I'll put your name in the air. They'll see it for hundreds of years, and they'll know your name forever. "
598,KAR: Good. (they hug) Ready? 
599,"DOCTOR: No. Listen to me! No, listen "
600,"(A stocky Pict clouts the Doctor over the head, and he falls. Bill picks up his lens.) "
601,"BILL: You're wrong, Doctor. It's their destiny, not yours. "
602,NARDOLE: Sorry. You're going nowhere. 
603,(Nardole binds the Doctor's wrists. Bill gives Kar the lens.) 
604,"DOCTOR: Bill! Bill, stop it! "
605,BILL: Quickly! Quickly! 
606,"LUCIUS: Soldiers of the Ninth, advance! "
607,KAR: Come on! 
608,"(Two Legionnaires lead Kar into the vortex, and the musicans follow. Lucius looks back at Bill and smiles before he disappears. Then the hilltop shakes.) "
609,BILL: What's that? What's happening? 
610,NARDOLE: Too many of them going through at once. This place is unstable. 
611,BILL: We need to get out of here. Now! 
612,(They and the remaining Picts run outside as stones begin to fall.)
613,
614,[Outside the Cairn]
615,
616,(Stones are placed across the ruined entrance to the Cairn.)
617,"NARDOLE: (untying the Doctor) I know you're inclined to bear a grudge, so just remember I know about ten percent of your secrets. The dark secrets. "
618,And I'm the only one in the Tardis who knows where the tea cakes are. 
619,"(Bill comforts the sobbing Ban, who has a crow perched on his hand.) "
620,"BAN: Kar. She's holding the gate. Remember, her name is Kar. "
621,CROW: Kar! 
622,BAN: Kar. 
623,CROW: Kar! Kar! (flies off) 
624,"NARDOLE: There, you were wrong. The crows aren't sulking. The crows are remembering. "
625,CROW: Kar! Kar! Kar! 
626,(They walk off across the moorland.) 
627,
628,[Outside the Tardis]
629,
630,"BILL: I'm sorry, Doctor, but you have a Vault to guard. You can't take on every fight. "
631,"DOCTOR: All right, I was wrong. I didn't know what really happened to the Ninth Legion. "
632,"BILL: No, we were both wrong about that. "
633,"DOCTOR: They were never really missing. They've always been here. The Ninth Legion and the Keeper of the Gate, seizing the day till the sun goes out. Holding back the dark. "
634,(He unlocks the Tardis. A snatch of Pictish music.) 
635,DOCTOR: What? 
636,"BILL: I thought. Do you hear that? I thought I could hear the music, but I can't, can I. They're in another time. "
637,DOCTOR: Music's funny like that. 
638,"(Nardole looks back at a soaring crow, Kar-ing.)"
639,
640,[Tardis]
641,
642,"NARDOLE: Right, shall we go back home? Time you were guarding that Vault. We don't want Missy getting any ideas. "
643,"(Missy is sitting on a recliner chair with footstool on the gallery, reading.) "
644,"MISSY: Oh, one should always try to avoid those. Hello! You lot were ages. I was getting ever so worried. "
645,"NARDOLE: How did you get out of the Vault? Sir, what do we do? How could this happen? "
646,"DOCTOR: It's all right, Nardole. She's been doing some work for me. "
647,"MISSY: Sorry. I'm sorry, I'm sorry, I'm sorry. I assumed they knew. Should I have stayed below decks? "
648,"DOCTOR: No, no, no, no. It's fine. "
649,NARDOLE: She's supposed to be in the Vault! 
650,DOCTOR: How were the engines? 
651,MISSY: (walking down the steps) Better than you deserve. You are naughty. Do you ever do basic maintenance? 
652,"DOCTOR: No, but I've got a plan for that. "
653,MISSY: What? 
654,DOCTOR: You. 
655,"BILL: Seriously? What, she's doing chores for you now? "
656,(Missy gesture to Bill to close her mouth.)
657,"NARDOLE: Sir, I must to protest in the strongest, most upset terms possible. Don't make me go squeaky voiced! "
658,"MISSY: Do relax, you two. I'm bio-locked out of the controls. I can't even get through those doors. I'm as much a prisoner here as I am in the Vault. "
659,"NARDOLE: No, you most certainly are not. "
660,BILL: Doctor. Seriously. Why did you let her out? 
661,DOCTOR: I think you may be forgetting how we got home from Mars. 
662,"BILL: What, so now you trust her? "
663,"MISSY: No, so now he's getting Tardis maintenance for free. Let's not get carried away. "
664,DOCTOR: So what have you been up to? Did you watch us? 
665,MISSY: Some of it. A little bit. 
666,DOCTOR: What did you think? 
667,"NARDOLE: Oh, is she reviewing us now? "
668,"MISSY: All those little people, trapped in a hill, fighting forever. Is that really up to your bleeding heart standards? "
669,"DOCTOR: Well, they're not trapped and they're more than just fighting. And there's music. Always music. "
670,"MISSY: Well, team, who's going to help me hide his gee-tar? "
671,"DOCTOR: See, that's what I'm trying to teach you, Missy. You understand the universe, you see it and you grasp it, but you've never learned to hear the music. "
672,"(The Tardis dematerialises. A rainbow appears. Back in the now, little Judy runs up to the remains of the Cairn, which we now know is just the doorway as "
673,"distant Pictish music plays. Later, the music is also playing in the Tardis, and a tear is rolling down Missy's face. The music stops. The Doctor and Missy are alone.) "
674,MISSY: I don't even know why I'm crying. Why? Why do I keep doing that now? 
675,DOCTOR: I don't know. Maybe you're trying to impress me. 
676,MISSY: Yes. Probably some devious plan. That sounds about right. 
677,DOCTOR: The alternative would be much worse. 
678,MISSY: Really? 
679,"DOCTOR: The alternative is that this is for real, and it's time for us to become friends again. "
680,MISSY: Do you think so? 
681,"(She reaches for him but he steps back. Pause, and then he takes her hands in his.) "
682,DOCTOR: I don't know. That's the trouble with hope. It's hard to resist. 
683,(He lets go and walks away. Another tear falls.)
684,  
685,
686,
687,
688,
689,
690,<Back to the
691,            episode listing
692, 
693,Doctor Who and related marks are
694,"          trademarks of BBC . Copyright © 1963,"
695,          Present. The web pages on this site are for educational and
696,          entertainment purposes only. All other copyrights property of
697,          their respective holders.
698,
699,
700,
701,
