,Script
1062,BLACK: Dalek technology is the most advanced in the Universe. 
1063,CHEN: You still haven't recovered the taranium. 
1064,BLACK: We shall. It is strange that the intruders took your space
1065,vessel. Perhaps they were indeed creatures from Earth. 
1066,"CHEN: My Spar was the last to arrive here, so consequently was in the"
1067,"best position to leave quickly. But to set your mind at rest, I will"
1068,return to Earth now and if I find that the intruders do come from
1069,"there, they will be dealt with quickly and without arousing any"
1070,suspicion. 
1071,BLACK: Very well. A vessel similar to your own craft will be put at
1072,your disposal. 
1073,CHEN: I will return here as soon as all final preparations for the take
1074,over are completed. 
1075,BLACK: All will be in readiness. 
1076,CHEN: Good. We don't want any more mistakes. 
1077,[Spar ship]
1078,
1079, STEVEN: We've shut right down. 
1080,BRET: We're going to be able to make a soft landing. I don't understand
1081,it. 
1082,"DOCTOR: Yes, I'm afraid I do, only too well. "
1083,"STEVEN: Daleks? Well, it's some sort of remote control, I suppose. We'd"
1084,all better prepare for landing. 
1085,"DOCTOR: You're quite right, my boy. "
1086,"BRET: If it's the Daleks, it can only mean one thing. "
1087,"DOCTOR: Yes, it means that they coming after us again. "
1088,[Desperus]
1089,
1090,(Life on Desperus is primitive for those
1091,unfortunate enough to be sent there. In a dank gloomy cave three men
1092,sit around a rough table engaged in a power struggle that focuses on a
1093,crude knife stuck into the centre. After a brief and violent tussle
1094,"Bors is victorious, and tucks the knife into his belt, nodding coarsely"
1095,at two women in the corner.) 
1096,"BORS: It's mine again, and they stay where you are. "
1097,"GARGE: With the soft life you lead, I'll be able to beat you one day. "
1098,BORS: Out on guard! 
1099,GARGE: Why is it always me? 
1100,BORS: I'm the leader. I have the knife. Do you want to argue about it? 
1101,"(Garge looks sourly at Bors then, grumbling to himself picks up a crude"
1102,"club and leaves the cave. His leadership confirmed for now, Bors"
1103,"settles down to sleep. Outside, winged creatures wheel and turn in the"
1104,darkening sky as Garge settles down to guard duty. Soon all is quiet.
1105,"Kirksen, who is still smarting from his earlier humiliation, cannot"
1106,"sleep, but when he's sure that Bors is asleep, Kirksen edges around the"
1107,cave stealthily crawling across the floor to where Bors is lying. He
1108,reaches for the knife in Bors' belt. Bors is instantly awake and grabs
1109,Kirksen roughly by the wrist.) 
1110,"BORS: And you can build up the fire. Kirksen, like the knife, would"
1111,"you? Then you'd be leader. You could tell Garge what to do, like I do."
1112,You can tell me what to do! 
1113,KIRKSEN: I'll get it next time! 
1114,"BORS: Who knows, perhaps you will. Now, get out and get the fuel. "
1115,(Kirksen points to the sleeping women.) 
1116,KIRKSEN: Why don't you send one of them? 
1117,BORS: Get it! 
1118,(Garge has spotted the spacecraft overhead) 
1119,"BORS: I can hear it, now get out before one of the new lot come here"
1120,and take over our place. 
1121,GARGE: That's not a prison ship. It's strange. I haven't seen one like
1122,it before. 
1123,BORS: Where's it landing? 
1124,GARGE: In the swamp by the look of things. 
1125,KIRKSEN: It's a strange ship. We can kill the crew and take over. 
1126,BORS: Possibly. 
1127,KIRKSEN: We can use it to get away. 
1128,BORS: It may be a crash landing. 
1129,KIRKSEN: But you can kill the crew with your knife. 
1130,BORS: Shut up! We'd better get over there right away. Others will have
1131,seen it too. Now on your way! 
1132,KIRKSEN: What about me? If you're leaving this filthy planet so am I. 
1133,"(Kirksen searches the cave for some kind of weapon, then hurries out"
1134,after Bors and Garge.(
1135,
1136,[Spar ship]
1137,
1138,(Steven and Bret are making repairs to the ship
1139,while Katarina watches at the main door.) 
1140,"DOCTOR: Now, you sure you've got spare parts for this? "
1141,BRET: Certain. It's safety regulations. 
1142,DOCTOR: It's the worse of these out-of-date and primitive spaceships.
1143,One little bump and they all fall to bits. 
1144,"BRET: Doctor, what are you talking about? This is a Spar, the most"
1145,technically perfect craft in the history of space travel. 
1146,"DOCTOR: Oh yes, quite so. That's why we are stranded on this pimple of"
1147,"a planet, whilst you footle with that fuse box. "
1148,"STEVEN: Oh, come on, Doctor. The Tardis isn't exactly perfect is it? I"
1149,"mean, you can't even control where's we're going. "
1150,"DOCTOR: Now, you listen to me, young man. Don't you start to criticise"
1151,"my Tardis. And as for space travel, you're still wet behind the ears."
1152,"Oh, do get on with it both of you. "
1153,BRET: What's the matter with Grandpa? 
1154,"STEVEN: Oh, it's nothing, we all have our obsessions, don't we? Now"
1155,"come on, Do you think we're going to have enough drive force to lift"
1156,off here and get us back to Earth? 
1157,"BRET: We've got to. Now, as the Doctor said, let's get on with it. "
1158,(The Doctor finds Katarina staring out of the open door into the
1159,night.) 
1160,"DOCTOR: What are you doing out here, child? I thought I told you to"
1161,keep these doors closed. 
1162,KATARINA: There are lights out there. 
1163,"DOCTOR: Good gracious, so there are. Two. No, three. Yes, we must get"
1164,"on with the repairs to the ship and get away from here. Yes, those men"
1165,will be vicious out there. We're liable to come under attack. That's
1166,marshy ground. Very interesting. Very interesting. Interesting. 
1167,[Dalek Control room]
1168,
1169, DALEK: The exact location of the ship has been
1170,calculated. 
1171,BLACK: Inform the pursuit fleet. 
1172,DALEK: I obey. 
1173,DALEK : Pursuit Fleet Commander calling control. We will land on
1174,planet Desperus at one hundred. 
1175,"BLACK: When the taranium is recovered, the fugitives are to be"
1176,eliminated. Is that understood? 
1177,DALEK : I obey. 
1178,[Desperus]
1179,
1180,"(Out in the swamp, Bors, Kirksen and Garge are"
1181,"huddled under some bushes, observing the Spar from a safe distance. It"
1182,appears that they are the first of the resident convicts to reach the
1183,crash site but they're still wary.) 
1184,"KIRKSEN: We were here first, let's go and get it. "
1185,GARGE: Keep quiet. This part of the swamp is tricky. We must put out
1186,the torches. 
1187,KIRKSEN: What about the screamers? 
1188,BORS: Shut up and put out that light! They're only bats. 
1189,KIRKSEN: Bats! Bats with those wings and that big! 
1190,"BORS: Oh, now follow us or go back to the cave. "
1191,(Bors and Garge move off across the swamp towards the Spar. Kirksen
1192,"remains where he is, frozen with fear. Out of the darkness the"
1193,"screamers attack. Flailing in terror, Kirksen runs off into the night.)"
1194,
1195,[Spar ship]
1196,
1197, KATARINA: Doctor. Doctor! 
1198,"STEVEN: Look, hold that reading steady, I think I can get this fixed. "
1199,BRET: Good. 
1200,"KATARINA: Come on, Doctor. "
1201,(At last the Doctor appears in the doorway and Katarina helps him
1202,clamber back inside.) 
1203,"DOCTOR: Oh, thank you, my dear. Where is your cactic power, rather,"
1204,outlet? 
1205,BRET: What? 
1206,DOCTOR: Cactic outlet? 
1207,BRET: It's there. 
1208,DOCTOR: Where? 
1209,BRET: Under there. 
1210,"DOCTOR: Oh, yes. Thank you, thank you, thank you. Come here, my dear."
1211,"No, round this way, child. Now, do you see that switch? I'll tell you"
1212,when to pull it. 
1213,KATARINA: What are you doing? 
1214,"DOCTOR: Oh, don't ask questions, my dear girl, otherwise you'll become"
1215,like the other two. Just do as you're told. 
1216,(The Doctor pays out a length of cable from the cactic outlet across
1217,"the control room to the door, where he throws the loose end down into"
1218,the swamp below.) 
1219,DOCTOR: Now then. That should repel any boarders. 
1220,[Desperus]
1221,
1222, BORS: It's there. We'll nearly there. 
1223,GARGE: How many do you think are on board? 
1224,"BORS: How should I know? Difficult to say, with a ship of that size. "
1225,GARGE: At least we've got surprise on our side. Pity we lost Kirksen. 
1226,"BORS: Fool's probably gone back to the cave, frightened by the"
1227,screamers. Better just the two of us. 
1228,GARGE: We've in the swamp now. 
1229,"BORS: Yes, but go carefully. "
1230,[Spar ship]
1231,
1232,(Katarina catches sight of the convicts approaching
1233,the ship.) 
1234,"KATARINA: There. Doctor, something moved. "
1235,"DOCTOR: Yes, I think you're right, my dear. Now you go in and stand by"
1236,that switch. Wait until I'll give you an order. 
1237,(Katarina does as she is told. Outside the convicts creep closer to the
1238,"ship, eventually breaking cover. The Doctor waits until he's sure the"
1239,"men are close enough, and then) "
1240,DOCTOR: Now! 
1241,"(Roaring with surprise and pain, Bors and Garge are lit up in a"
1242,"blinding flash of light. They collapse,"
1243,unconscious.) 
1244,STEVEN: What's going on? 
1245,BRET: What do you think you're playing at? 
1246,DOCTOR: Oh you two go back in there and get on with your repairs.
1247,Katarina and I are trying to repel any type of boarders. 
1248,BRET: But cactic power isn't strong enough to kill anyone. 
1249,DOCTOR: But of course not. But it will knock them unconscious. Now just
1250,"you remember, young man, I have no desire to kill anyone. Now go in"
1251,there and get on with those repairs. I want to leave this place
1252,quickly. Hurry up please. Wasting my time. Well I think that should do
1253,"the trick, my dear. Come along, let's get this cable back. There we"
1254,are. 
1255,KATARINA: You show me so many strange mysteries. With you I know I'm
1256,safe. 
1257,"DOCTOR: I hope so, my dear, I hope so. "
1258,(There's a loud screeching noise outside. Doctor crosses to the door in
1259,alarm. Staring into the sky he realises that the Daleks have caught up
1260,"with them. He dashes back into the craft, closing the inner airlock"
1261,door behind him.) 
1262,DOCTOR: It's the Dalek Spaceship! It's bound to land. Hurry up! 
1263,STEVEN: We're being as quick as we can. 
1264,"DOCTOR: Get off, get off, get off! "
1265,"STEVEN: That's it, Bret! "
1266,"BRET: All right. Right, stand by everyone. As this take off is on now"
1267,"manual, it may not be quite so smooth. "
1268,"BRET: Doctor, did you close the outer door? "
1269,"DOCTOR: Oh I'm so sorry, I'm not used to this kind of craft. "
1270,"BRET: It's all right, it doesn't matter. "
1271,"(Bret pulls a lever and a red light on the console stops flashing,"
1272,indicating that the exterior door is now closed. To the scream of
1273,rocket motors the Spar heaves itself away from the surface of Desperus.
1274,"Glancing at the viewing screen, the Doctor is delighted at what he"
1275,sees.) 
1276,DOCTOR: Look! Look! The Daleks' ship made a bad landing. That gives us
1277,the time we need. 
1278,STEVEN: We made it! 
1279,"BRET: Next stop, Earth. "
1280,"DOCTOR: Oh, I'm so glad to hear that, young man. Now, you got some"
1281,"thinking to do. Katarina, check up on that door and see that it is"
1282,secure. 
1283,STEVEN: Do you realise 
1284,(Katarina screams.)
1285,
1286,Episode 4 - The Traitors
1287,
1288,[Spar ship]
1289,
1290," DOCTOR: Remember, Chen will have allies on earth"
1291,and 
1292,KIRKSEN: Keep back! 
1293,(Kirksen holds Katarina in a vice-like grip.) 
1294,DOCTOR: Who are you? What do you want? Release that girl! 
1295,KIRKSEN: Never mind! Who's in charge of this thing? Answer me! 
1296,BRET: I am. 
1297,KIRKSEN: Where are you heading? 
1298,BRET: Earth. 
1299,KIRKSEN: Change course. Change it! 
1300,BRET: Where to? 
1301,KIRKSEN: Not Earth. Go to the planet Kembel. 
1302,DOCTOR: Kembel! 
1303,KIRKSEN: Shut up and do as I say! 
1304,"BRET: Kembel's deserted, man. It's as bad as Desperus. "
1305,KIRKSEN: Nowhere's as bad as Desperus! 
1306,STEVEN: The Daleks are on Kembel! 
1307,KIRKSEN: So? 
1308,"DOCTOR: The Daleks are no help, We're going back to Earth. "
1309,"KIRKSEN: Then I shall be sent back to the Devil's planet! No, whoever"
1310,"the Daleks are, they'll help me. "
1311,STEVEN: You don't know about them. 
1312,KIRKSEN: I said go to Kembel! Kembel! 
1313,[Dalek Control centre]
1314,
1315,(The Daleks receive news from Desperus.) 
1316,DALEK : Only slight damage was sustained. We are ready to continue
1317,pursuit of Earth vessel. 
1318,BLACK: What is course of Earth vessel? 
1319,DALEK: Back on course 707 heading for Earth. 
1320,BLACK: Contact Mavic Chen through secret communication red. He must
1321,recapture the taranium and exterminate creatures who took it. 
1322,DALEK: I obey. 
1323,"BLACK: Pursuit vessel, return to base. "
1324,DALEK : We obey. 
1325,(The Supreme severs the radio link.) 
1326,BLACK: Destroy pursuit ship. They have failed in their mission. We will
1327,not tolerate mistakes.
1328,
1329,[Spar ship]
1330,
1331,(Bret and Steven work at the navigation controls.) 
1332,DOCTOR: We're changing course. Now release that girl. 
1333,KIRKSEN: Do you think I'm a fool? 
1334,STEVEN: Course is changed. We're heading for Kembel. 
1335,KIRKSEN: It doesn't feel as if we've changed. 
1336,"BRET: Well, look up at the screen and you'll see. "
1337,"(Steven launches himself at Kirksen, who shoves him away and drags"
1338,Katarina into the airlock.) 
1339,STEVEN: Well open the door from the control panel. I'll rush him! 
1340,DOCTOR: The girl will be dead before the door's half open! Can we talk
1341,to him in there? 
1342,"BRET: Yes, I've turned on the talkback. "
1343,"DOCTOR: Let's try a little bluff. Now, then! Listen to me, whoever you"
1344,"are. Bring that girl in here, or we will press a button and you will go"
1345,outside the door into space. 
1346,KIRKSEN: Then the girl dies too. If you open the outside door I'll
1347,press the inner release and then we'll all be dead! 
1348,BRET: We can't seem to get through to him. He's crazy. 
1349,DOCTOR: We've got to get Katarina out of there! 
1350,(Bret cuts off the audio link to the airlock.) 
1351,STEVEN: Stop that! Turn the talkback on again! 
1352,BRET: There's no point. 
1353,"STEVEN: Turn it on again, before he really hurts her. "
1354,"BRET: Look, he can't kill her or he hasn't a hostage. "
1355,(Steven turns the talkback back on and shouts) 
1356,STEVEN: You animal! 
1357,KIRKSEN: Now that's just for starters. Do as I say! 
1358,DOCTOR: Change course! 
1359,"KIRKSEN: Now, that's more like it! "
1360,DOCTOR: Take him back to Kembel. Take him back to Kembel! Let the
1361,Daleks deal with him. 
1362,"STEVEN: Yes, and us. "
1363,"DOCTOR: Don't worry, dear boy, We'll find a way out. "
1364,(Katarina has been screaming almost all the time.) 
1365,KIRKSEN: Stop that or you're dead! 
1366,BRET: I can't sacrifice everything for the sake of that one girl. 
1367,"STEVEN: Listen! Without us you wouldn't have got off Kembel at all, and"
1368,nothing would be worth bothering about! 
1369,"BRET: All right, so we all go back together. But without me, I doubt"
1370,that you would have got this far either. 
1371,"STEVEN: Yes, all right, but I won't let you hurt Katarina. We'll head"
1372,back for Kembel as the Doctor says. On the way we may find a way to get
1373,her out of there. 
1374,"(Katarina pulls free of Kirksen, clawing at his face with one hand and"
1375,reaching for the door controls with the other.) 
1376,KIRKSEN: You won't. 
1377,"STEVEN: No, not that one! Katarina! "
1378,"(The outer doors open, and Katarina and Kirksen are sucked out to die"
1379,in the
1380,vacuum of space.) 
1381,STEVEN: Katarina! Too late. 
1382,(There's a stunned silence aboard the Spar as the crew try to
1383,comprehend what has happened.) 
1384,"STEVEN: She pressed the wrong button, Doctor. "
1385,"DOCTOR: She may have wanted to, dear boy. She wanted to save our lives."
1386,
1387,BRET: It must have been quick. 
1388,DOCTOR: I hope she's reached her Place of Perfection. 
1389,"STEVEN: Yes, but not that way. "
1390,DOCTOR: She didn't understand. She couldn't understand. She wanted to
1391,save our lives and perhaps the lives of all the other beings of the
1392,"Solar System. I hope she's found her Perfection. Oh, how I shall always"
1393,"remember her as one of the Daughters of the Gods. Yes, as one of the"
1394,Daughters of the Gods. 
1395,[Dalek Control centre]
1396,
1397," TRANTIS: Dalek Supreme, you have failed to get"
1398,back the core of the time destructor. 
1399,BLACK: We shall get it back. 
1400,TRANTIS: You show too much trust in Mavic Chen. 
1401,BLACK: Mavic Chen is hungry for power. We have offered him more power
1402,than he has ever thought of. He will return to us the taranium core. 
1403,TRANTIS: Supposing he fails? 
1404,BLACK: He will not. He had been given instructions. 
1405,TRANTIS: What instructions? 
1406,BLACK: It is not necessary for you to know. 
1407,"TRANTIS: As Representative of the largest of the outer galaxies, I have"
1408,the right to know! 
1409,BLACK: Representative Trantis. The Daleks will not fail and neither
1410,will any of its' allies. If anything tries to stop us we will destroy
1411,it. Nothing will be allowed to stand in the way of our plan to conquer
1412,the Universe! 
1413,[Spar ship]
1414,
1415,(The mood is sombre. Bret and Steven are at the
1416,controls as it approaches Earth.) 
1417,"DOCTOR: Judging by the position of those planets, we shall land quite"
1418,soon. 
1419,BRET: Yes and that's the problem. It won't be easy. 
1420,"DOCTOR: Oh, haven't we sufficient powerdrive to land safely? "
1421,"BRET: Yes but we can't land at the main landing area. Remember, this is"
1422,Chen's space vessel. 
1423,"DOCTOR: Yes, you've got a point there. Where can we land? "
1424,BRET: An experimental plant a little way off from Central City. I have
1425,a friend there I think will help us. 
1426,[Chen's office]
1427,
1428,"(On his return to Earth, Chen has a meeting in his"
1429,"office with Lizan, and Karlton the Head of the Special Security"
1430,Service.) 
1431,CHEN: So that's our traitor. 
1432,"LIZAN: Yes, Bret Vyon. Bred on Mars Colony 16. Joined Space Security"
1433,Service 3990. Gained First Rank 3995. Gained Second Rank 3998. 
1434,CHEN: You have a good memory. 
1435,"LIZAN: Thank you, Guardian. "
1436,CHEN: And he looks like that? 
1437,"LIZAN: Exactly like that. How can he look otherwise? Guardian, have you"
1438,no faith in computerised data? 
1439,CHEN: Every faith. But this information is vital. The man is dangerous
1440,and must be caught. I would hate there to be any mistake. 
1441,LIZAN: A mistake is impossible. Our computer network contains precise
1442,"chemical details of every man, woman, and child within our Solar"
1443,System. 
1444,CHEN: There are forty billion people in the Solar System. Doesn't that
1445,provide some scope for error? 
1446,LIZAN: There is no scope for error. 
1447,"CHEN: Very well, have it sent out to all stations. Now, what about"
1448,"Gantry, the other traitor? "
1449,LIZAN: We're working on his identity projection now. It should be ready
1450,shortly. 
1451,"KARLTON: Since Vyon is in command, I gave priority to his projection. "
1452,CHEN: Excellent. Excellent! Vyon and Gantry were the two who never
1453,"reported in from the planet, Kembel, am I right? "
1454,"LIZAN: Yes, Guardian. "
1455,CHEN: Then they are the two who took over my Spar. It's possible they
1456,may be in association with some other creatures. But we don't know
1457,where from. 
1458,"KARLTON: When you catch Vyon and Gantry, you catch them, too. "
1459,(Chen turns to gaze benevolently at Lizan.) 
1460,CHEN: You've done well. I want all Space Security agents called back to
1461,"Earth. If the traitors are not caught at the landing zone, then Central"
1462,City must be cordoned off until they are found. And Lizan! They will be
1463,killed on sight. Give out the instructions. 
1464,"LIZAN: Yes, Guardian. "
1465,"(Lizan leaves the office, delighted to have been of service to the"
1466,leader she so admires. Chen turns to Karlton.) 
1467,"CHEN: I think that takes care of that. You know, Karlton, some of your"
1468,agents are getting too good. We don't want to spoil things for
1469,ourselves at this stage. 
1470,KARLTON: They won't. I've already insisted that all future operations
1471,shall be cleared with me before they're begun. 
1472,"CHEN: If you'd done that in the first place, we wouldn't be in this"
1473,spot. 
1474,KARLTON: Cory's mission was one that he kept to himself. It was done
1475,without official sanction of any kind. 
1476,CHEN: And you could hardly have stopped the others after his distress
1477,signal. You must do better than that. I would hate to have to lose you.
1478,
1479,KARLTON: You know you can trust me. 
1480,[Spar ship]
1481,
1482,(Steven and the Doctor are strapped into their
1483,seats in preparation for landing.) 
1484,BRET: The drive force is very weak. 
1485,DOCTOR: But can we land? 
1486,"BRET: Yes, but I don't know what would happen. The pull is too hard. "
1487,STEVEN: We can't crash now! 
1488,BRET: I'm afraid I may not be able to help it. 
1489,"STEVEN: Yes, well remember, Bret, we got some valuable cargo on board. "
1490,"BRET: What, the taranium? "
1491,STEVEN: And the Doctor. 
1492,"DOCTOR: Yes, I heard that. Now, don't concern yourselves over me. I can"
1493,look after myself. The most important factor is this taranium. 
1494,"BRET: Right, stand by. "
1495,[Chen's office]
1496,
1497,(Contemplating the huge map of the Universe that
1498,"dominates the wall of his office, Chen almost forgets that Karlton is"
1499,still in the room with him. His plans for universal domination are now
1500,at risk. Years of careful scheming sabotaged by the theft of the
1501,taranium.) 
1502,CHEN: Only because of the taranium am I on the council. 
1503,KARLTON: It will be returned. 
1504,"CHEN: It's got to be. I want that position, right beside the Daleks."
1505,I'll govern the Universe! 
1506,KARLTON: Surely Trantis will be first after the Daleks? 
1507,CHEN: Trantis? Trantis! They don't like him. Agreed that his is the
1508,"largest galaxy, but he's already demanding too much say in what goes"
1509,"on. They'll want him out of the way now, and I have a plan which may"
1510,"help them to achieve just that. Then it'll be me, Mavic Chen, who'll be"
1511,next in line. 
1512,KARLTON: And I will be there behind you. 
1513,CHEN: Of course. 
1514,KARLTON: Of course. 
1515,CHEN: Is your Special Force dealing with Bret Vyon? 
1516,KARLTON: Not completely. I thought it wiser to use some of the ordinary
1517,security men. 
1518,"CHEN: Hmm, very good. We'll need your men next time. Who's in command? "
1519,KARLTON: Kingdom. 
1520,"CHEN: Kingdom? Ruthless, hard, efficient. And does exactly as ordered. "
1521,KARLTON: Quite. 
1522,(Karlton picks up the communications receiver on the desk and listens
1523,for a moment.) 
1524,KARLTON: Ah ha! I see. Carry out emergency plan B. The traitors have
1525,arrived. 
1526,CHEN: Good. 
1527,KARLTON: But not at the landing area. 
1528,CHEN: What? 
1529,KARLTON: They have crash-landed at the experimental station. 
1530,[Experimental station]
1531,
1532,"(Uninjured despite their bumpy landing, the Doctor,"
1533,Steven and Bret are now inside the main complex.)
1534,BRET: No one here. We'll have to wait. Come on. 
1535,(Bret leads the Doctor and Steven into the empty office of his friend
1536,"Daxtar. As he closes the door, a Special Security agent appears at the"
1537,end of the corridor.) 
1538,[Chen's office]
1539,
1540,"(A little while later, Karlton reports back to"
1541,Chen.) 
1542,KARLTON: Kingdom is here. 
1543,"CHEN: Good. Come in, Kingdom, come in. "
1544,"(Kingdom enters. Sara Kingdom. She is strikingly attractive, dressed in"
1545,"the black cat suit of all SSS operatives but she is unsmiling, her"
1546,blue-grey eyes lacking any warmth. Here is direct descendant of
1547,"Princess Joanna from The Crusades, as she is played by  Jean Marsh.)"
1548,CHEN: You know what's happened? 
1549,SARA: Yes. 
1550,CHEN: Do you know how many there are? 
1551,SARA: Three. Bret Vyon and two strangers. They look as though they
1552,could come from Earth but are oddly dressed. None of them can leave the
1553,plant. 
1554,CHEN: Good. 
1555,SARA: They're in the main block. I'm going to capture them myself. 
1556,"CHEN: Before you do that, there is something you have to know. "
1557,[Daxtar's office]
1558,
1559,(Steven is restlessly pacing around the room as
1560,they wait.) 
1561,"STEVEN: Look, where on earth is this Daxtar? "
1562,BRET: He shouldn't be long. 
1563,DOCTOR: And I think we're just wasting valuable time sitting about here
1564,"waiting for this man, Baxter or Daxtor or whatever he call himself. "
1565,"BRET: Doctor, Daxtar is in a position to help us. "
1566,DOCTOR: Surely everyone must know that Chen's space-ship has
1567,crash-landed only a short distance away from here. There must be
1568,hundreds of people looking for us! 
1569,"BRET: Doctor, there are very few people allowed near this place, it's a"
1570,"restricted area. Look, don't you understand that Chen will probably"
1571,have returned to Earth by this time. He'd have realised that I was the
1572,man on the planet Kembel. I expect we're wanted men by this time. 
1573,"DOCTOR: But this is an experimental plant, There's no scientists, no"
1574,"staff, nobody! We might just as well have landed ourselves on an empty"
1575,planet. What on Earth is happening? 
1576,"BRET: Doctor, I don't know anymore than you do. "
1577,"DOCTOR: Has it occurred to you, by any chance, that we might have"
1578,deliberately walked into an ambush? 
1579,STEVEN: What's the point in standing here just waiting to be caught? 
1580,BRET: Because Daxtar is the only man who will believe our story. 
