,Script
2127,"SARA: You're right, Doctor. They've come. "
2128,DALEK 1: You are surrounded. You will come with us. 
2129,"DOCTOR: I'm afraid, my friends, the Daleks have won."
2130,
2131,Episode 6 - Coronas of
2132,the Sun
2133,
2134,[Planet Mira]
2135,
2136,(The Doctor leads the others out of the cave.) 
2137,DALEK: You will hand over the taranium core. 
2138,"DOCTOR: If I do, what guarantee is there that you won't fire your guns"
2139,afterwards? 
2140,DALEK: There is no guarantee. 
2141,DALEK 2: Seismic detector shows that the object that he is carrying is
2142,the taranium! 
2143,DALEK: You will surrender it! 
2144,SARA: He will not! 
2145,DALEK: Silence! You will not speak! 
2146,"DOCTOR: You dare not fire, because of this taranium! To end this"
2147,"stalemate, may I suggest "
2148,DALEK: There will no more discussion. The core is to be handed over.
2149,Re-form line. Prepare to exterminate them. What is that noise?? 
2150,DALEK 2: The invisible creatures are attacking in force! 
2151,DALEK: Patrol alert! Patrol Alert! Annihilate them! Annihilate them! 
2152,"(The Visians surge forward to attack from all sides, bellowing with"
2153,fury as they smash at the Daleks with rocks and sticks. The Daleks
2154,swing round to counterattack blasting indiscriminately at their
2155,invisible assailants. Those creatures caught in the cross-fire become
2156,"briefly visible before they die. Despite the Visians spirited attack,"
2157,"the Daleks sustain little damage. Whilst the battle rages on, the"
2158,Doctor and his companions
2159,seize the opportunity to make their escape.) 
2160,"DOCTOR: There's a good boy, keep going! "
2161,(A lone Dalek cut off from the rest of the patrol becomes the focus of
2162,the Visian fury. The Dalek is helpless as the unseen creatures shove it
2163,into a bubbling mud pool where it sinks slowly under the surface.
2164,"Ultimately however, the battle is short and the result predictable."
2165,Forming a tight protective circle the remaining Daleks continue to fire
2166,"in all directions until they have decimated their attackers. Very soon,"
2167,the few surviving Visians flee back into the forest.) 
2168,DALEK 2: The invisible creatures have been exterminated. 
2169,DALEK: Search for the fugitives. They must not escape. 
2170,DALEKS: We obey!
2171,
2172,[Dalek Control centre]
2173,
2174, DALEK: Communication received from the planet
2175,Mira. 
2176,BLACK: Are the fugitives still evading capture? 
2177,DALEK: Yes. There has been no further contact. Reinforcements can be
2178,dispatched. 
2179,BLACK: Our force already there is sufficient for the task. Contact them
2180,and order that the taranium is to be recovered. Failure will not be
2181,tolerated!
2182,
2183,[Outside the Dalek pursuit ship]
2184,
2185,"(The Doctor, Steven and Sara have discovered the"
2186,"Dalek pursuit ship in the swamp, and make plans to steal it and escape"
2187,"from Mira. They stand some distance from the ship, staring up at the"
2188,solitary Dalek stationed at the top of the loading ramp.) 
2189,DOCTOR: There's only one guard. Now you know what to do? 
2190,STEVEN: Yes. 
2191,(The Doctor moves away.) 
2192,SARA: It will never work. 
2193,STEVEN: It will. It's got to. 
2194,SARA: The other Daleks will be back here before he can get started. 
2195,"STEVEN: Why should they? They're out looking for us, they won't expect"
2196,us to come back here. 
2197,"SARA: Look, they're not complete fools. They know we got to get off"
2198,Mira and that their ship is our only chance. 
2199,"STEVEN: Don't worry. Like most of the Doctor's plans, this one's"
2200,simple. It won't take long. 
2201,"SARA: Well, why doesn't he get started then? "
2202,"STEVEN: Give him time. He's got to get round there. Look, you must"
2203,learn to trust him. He's had dealing with the Daleks before. 
2204,SARA: I have no choice. Let's hope you're right. 
2205,STEVEN: He should be in position by now. Come on. 
2206,"(As Steven and Sara edge closer to the ship, the Doctor walks from the"
2207,trees into full view of the Dalek guard.) 
2208,GUARD: Remain where you are. 
2209,DOCTOR: I certainly will. I've come to give myself up. 
2210,DALEK GUARD: Do you have the taranium? 
2211,"DOCTOR: I have. I realise of course that I am no match for the Daleks,"
2212,"so if I hand it over, will you help me and my friends to get away from"
2213,this planet? 
2214,DALEK GUARD: Where are the others? 
2215,"DOCTOR: Oh, they will come when I call them. The taranium. Shall I give"
2216,it to you or would you prefer me to hand it to you in your ship? 
2217,DALEK GUARD: You will wait there until the patrol returns. The others
2218,are to join you. If you try to escape you 
2219,"DOCTOR: Escape! Oh, my tin friend. Never. You mustn't forget that I"
2220,came here and surrendered of my own free will. 
2221,(Steven leaps forward and grinds a handful of mud into the Dalek's
2222,eye-stalk.) 
2223,"DALEK GUARD: Help, help, loss of vision, loss of vision, am under"
2224,attack! Am under attack! Patrol alert! Patrol alert! 
2225,(The Doctor and the others dash up the ramp into the Dalek ship. The
2226,"guard fires blindly, nearly wiping out the returning Dalek patrol.) "
2227,DALEK: Cease firing before we sustain damage. Report! 
2228,DALEK GUARD: The fugitives boarded the Pursuit ship!
2229,
2230,[Dalek Pursuit ship]
2231,
2232,DALEK : Alert all patrols. Alert all patrols. 
2233,"SARA: Can you work it, Doctor? "
2234,DOCTOR: Oh don't worry my dear. I'm quite accustomed to this Dalek
2235,technique. Close the hatches please. 
2236,DALEK : Surround pursuit ship. Surround pursuit ship. 
2237,DALEKS : We obey. 
2238,SARA: Doors are not closing! Vacuum-lock reading 2.24. 
2239,DOCTOR: The power build-up is far too slow. Feed in that extra energy. 
2240,SARA: 3.82 rising. 
2241,DALEK : Avoid firing in area of taranium. 
2242,"DOCTOR: It should activate at five, zero, zero. "
2243,DALEKS : We obey. 
2244,STEVEN: They're forming up to attack. 
2245,SARA: 4.32 still rising. 
2246,"DALEK : Form up, attack formation. "
2247,DOCTOR: Splendid! 
2248,DALEK 2 : Prepare to board the ship! 
2249,DALEK : Exterminate them! Exterminate them! 
2250,STEVEN: That was close. It was too close! 
2251,DOCTOR: Autogiro. Giro dynamo. 
2252,"SARA: Coding nine, two. Red, blue, blue. "
2253,DOCTOR: Discharge. 
2254,"SARA: Coding one, zero, zero. All blue reading. Take off now! "
2255,DOCTOR: Splendid! Hold tight! 
2256,(The ship blasts off)
2257,
2258,[Dalek Control centre]
2259,
2260," BLACK: Mavic Chen, you have failed in your task. "
2261,CHEN: Failed? Is this my greeting? I agree that my mission was to
2262,return to Earth and recover the taranium. This I have not done. 
2263,BLACK: Failure will not be tolerated! 
2264,CHEN: But I did notify you of the fugitives' whereabouts. The planet
2265,Mira. There the vital core can be taken from them without suspicion.
2266,Their presence on Earth was a constant danger! At anytime they could
2267,have contacted forces unsympathetic to our plans. 
2268,BLACK: You make your incompetence sound like an achievement. 
2269,"CHEN: Incompetence now, is it? You forget that the original blunder was"
2270,not of my doing. I journeyed to and from Earth to correct a failing
2271,your security force should have dealt with. The core was stolen from
2272,here. My actions have brought about a situation which will allow you to
2273,"recover the missing taranium easily and simply. If that is a failure,"
2274,then I have failed. 
2275,BLACK: Report. 
2276,DALEK: The fugitives have stolen our pursuit ship and left the planet
2277,Mira. 
2278,BLACK: Stolen! Left the planet Mira! Is their course being computed? 
2279,DALEK: It is. 
2280,BLACK: What news of our force? 
2281,DALEK: They are stranded on the planet and under constant attack from
2282,the invisible creatures that inhibit it. 
2283,BLACK: Dispatch a rescue ship to their aid. They will be dealt with on
2284,"their return. Meanwhile, I will personally supervise recovery of the"
2285,core. 
2286,DALEK: I obey. 
2287,"CHEN: And you had the audacity to accuse me, Mavic Chen, of"
2288,incompetence. 
2289,BLACK: It is 
2290,CHEN: A Dalek ship stolen? 
2291,BLACK: It is not 
2292,CHEN: Really? 
2293,BLACK: It is not an emergency! 
2294,CHEN: No. More like a catastrophe! 
2295,"BLACK: They may believe that they have successfully escaped from us,"
2296,"but we, the Daleks, are still in command!"
2297,
2298,[Dalek Pursuit ship]
2299,
2300,(The Doctor makes a full examination of the glowing
2301,"taranium core, taking measurements and writing notes.) "
2302,"STEVEN: Will it work, Doctor? "
2303,"DOCTOR: No, course it won't, my dear boy. That's the whole point. "
2304,STEVEN: I mean your plan. 
2305,"DOCTOR: No, we shall have to make a copy. A copy so exact that we can"
2306,"deceive the Daleks. They'll still want this taranium back, you know."
2307,They won't rest until they get it. 
2308,"STEVEN: Yes, but suppose "
2309,SARA: There isn't time to suppose. I'm sure the Doctor can copy it well
2310,enough. 
2311,"DOCTOR: Yes, thank you, thank you my dear, thank you. I'll have a good"
2312,try. And I think that will give us sufficient breathing space. What's
2313,that? 
2314,SARA: We're changing course. We're moving away on a selected route. 
2315,"DOCTOR: Good gracious, we're on the course for the planet Kembel. You"
2316,"know, I'm very much afraid that we're under the Dalek influence. "
2317,(Steven notices an auxiliary unit attached to the main controls.) 
2318,STEVEN: It's obviously this that's causing the damage. 
2319,"(Cheerfully, Steven smashes the automatic control unit.) "
2320,"STEVEN: Ah, that settles that. "
2321,SARA: Isn't that a rather a drastic way of dealing with things? 
2322,"STEVEN: Sara, the technology of my age may be hundreds of years behind"
2323,"yours and the Doctor's, but there are still some things I can handle. "
2324,"DOCTOR: Yes, of course there is, my dear boy. Of course there is. Come"
2325,"along, young lady, let's get on with our mineral while we still have"
2326,the time. 
2327,[Dalek Control centre]
2328,
2329, DALEK: Pursuit ship has broken free of our
2330,control. 
2331,BLACK: Activate magnetised beam. 
2332,DALEK: Magnetised beam activated. 
2333,CHEN: I sincerely hope there's not been any further bungling? 
2334,"BLACK: We have temporarily lost control, but once the magnetised beam"
2335,"reaches them it will pull them to Kembel, where they will be"
2336,exterminated! 
2337,"CHEN: After we have the core of the Time Destructor in our possession,"
2338,I trust. 
2339,BLACK: Of course! Of course!
2340,
2341,[Dalek Pursuit ship]
2342,
2343,"(Unaware of the new threat, The Doctor concentrates"
2344,"on replicating the taranium, and is pleased with his progress.) "
2345,"DOCTOR: Yes I think so, yes, yes, there. That's a good copy, although I"
2346,say it myself. 
2347,"SARA: Yes, but there's still the problem of charging it. The Daleks"
2348,will know immediately that it isn't the real taranium. 
2349,"DOCTOR: I appreciate that young lady, but this is the right balance and"
2350,the right weight. 
2351,STEVEN: We're still on our own course. The Daleks haven't attempted to
2352,divert us yet. 
2353,"DOCTOR: Oh good, good, good. Well you keep watching, there's a good"
2354,fellow. 
2355,STEVEN: Hey! 
2356,"DOCTOR: No, I should try that one. "
2357,(Steven examines the copy with admiration. The one thing that gives it
2358,away is that it's not glowing with energy like the real mineral.) 
2359,STEVEN: This is excellent. 
2360,DOCTOR: Isn't it. 
2361,STEVEN: How do you propose to activate it? 
2362,"DOCTOR: Oh, we're working on that. Yes, we're working on it. "
2363,STEVEN: We could use the gravity force from the ship's power centre. I
2364,"mean, there's an outlet here. "
2365,SARA: What? 
2366,STEVEN: What's wrong with that? 
2367,"DOCTOR: Too primitive, my boy. Too primitive and far too dangerous. "
2368,"SARA: Gravity force as a source of energy was abandoned, centuries ago."
2369,
2370,STEVEN: We were still using it. 
2371,"SARA: Oh yes, and the Romans used treadmills. "
2372,(Sara follows the Doctor to search for a suitable power source to
2373,safely activate the fake taranium. Steven continues to muse on his own
2374,theoretical solution.) 
2375,STEVEN: I still think G-force would do the trick. 
2376,SARA: We're changing course again. 
2377,"DOCTOR: Back to the planet Kembel but what? You know, it appears that"
2378,we're being affected by magnetization. We're been held in a very strong
2379,beam. 
2380,SARA: That will take us right back to the Daleks. 
2381,"DOCTOR: Let's try and break it, child. Come along. "
2382,"(While the Doctor and Sara do their best to escape from the beam,"
2383,Steven decides to take matters into his own hands and attempt to
2384,energise the fake taranium using G-force.) 
2385,STEVEN: Now we'll see about those treadmills. 
2386,"(Wiring the copy into the G-force outlet, Steven throws the switch."
2387,Argh! Steven collapses instantly.) 
2388,SARA: Steven! 
2389,DOCTOR: My dear boy! What happened? What's happened? He's still
2390,breathing. 
2391,SARA: The fool! He's tried his experiment with G-force and reliance
2392,power. 
2393,"DOCTOR: He's still alive, and lucky at that. "
2394,"SARA: But it worked! Look, Doctor. It's just like the real taranium. "
2395,"DOCTOR: Oh, isn't that wonderful. That's wonderful! Steven's theory has"
2396,proved successful. But what about the poor boy? 
2397,[Dalek Control centre]
2398,
2399, DALEK: Dalek pursuit ship has entered the
2400,atmosphere. 
2401,DALEK 2: Reducing speed. Ten degrees of light. Eight. Six. 
2402,CHEN: It appears that you have at last succeeded in getting the
2403,taranium back. 
2404,BLACK: Of course. And we shall deal with these fugitives as with all
2405,those who oppose us. 
2406,CHEN: No! 
2407,BLACK: Do you challenge us? 
2408,CHEN: Of course not. But might it not be advisable for me to return
2409,them to Earth for trial? 
2410,BLACK: Why? 
2411,CHEN: They will be tried and found guilty as traitors to the Solar
2412,"System. After all, the woman is from Earth. "
2413,"BLACK: The Daleks will deal with them, there is no need for the delay"
2414,in their extermination. 
2415,CHEN: Some people on Earth know that our traitors were transposed to
2416,"Mira. If they disappear for good, those people will be curious and ask"
2417,what happened to them. It's possible that they might find out that the
2418,Daleks executed them. Then your plans could be hindered. 
2419,BLACK: It is essential that you do not allow your Earth people to
2420,become curious. 
2421,CHEN: Human curiosity is something I can have no control over. 
2422,BLACK: You must forestall their questions until it is too late. 
2423,CHEN: Too late? 
2424,BLACK: Yes! We will have conquered the Solar System before our presence
2425,here is discovered. 
2426,CHEN: It is possible. 
2427,"BLACK: Once we have the taranium, there is nothing to stop us! "
2428,CHEN: Very well. I leave their fate to you. 
2429,BLACK: The Dalek reception force should now be in position at the
2430,specified landing point. 
2431,"CHEN: Yes, they should. And I think it's about time we left to join"
2432,"them, don't you?"
2433,
2434,[Dalek Pursuit ship]
2435,
2436,(The Dalek ship nears Kembel. The Doctor and Sara
2437,are powerless to intervene.) 
2438,SARA: Height and speed reducing. 
2439,"DOCTOR: Yes, we should be landing in about five minutes. "
2440,SARA: I'll see how Steven is. 
2441,"(Propped in a corner, Steven seems unable to move but his eyes are"
2442,open.) 
2443,SARA: I think the effect's wearing off. 
2444,"DOCTOR: No, my dear. He's adapting to it. Can you talk, my boy? No."
2445,He's still under the influence of that force field. Nothing further
2446,will happen to you. Now don't worry. 
2447,(The Doctor moves to touch Steven but draws his hand back as if
2448,shocked.) 
2449,"DOCTOR: Yes, nothing further going to happen to him but I must confess"
2450,I I have no cure for that condition. 
2451,SARA: He's enclosed in a forcefield. 
2452,"DOCTOR: Yes, yes, I'm afraid so. Sara, bring me that fake taranium."
2453,"Yes, yes, yes. Now, listen to me, Steven. Try and understand. This is"
2454,very important so you must trust me. You do understand? Just try and
2455,indicate. 
2456,"(With a struggle, Steven manages to blink his eyes.)"
2457,
2458,[Kembel landing pad]
2459,
2460, BLACK: Pursuit ship is landing at precise point
2461,calculated. 
2462,CHEN: Well it appears that everything's going according to plan. 
2463,BLACK: The taranium will be recovered. 
2464,CHEN: I hope you are right. 
2465,"BLACK: This time, there will no error. "
2466,(The pursuit ship lands.)
2467,
2468,[Dalek Pursuit ship]
2469,
2470, DOCTOR: We're here. Now we've got to face the
2471,"Daleks. Open the doors, please. Steven will lead the way. This way,"
2472,Steven. 
2473,"(Blank-faced, Steven walks ahead carrying the box containing the fake"
2474,taranium core.) 
2475,"SARA: But it won't, it can't work! "
2476,"DOCTOR: It's our only chance, my dear. And remember, I will do all the"
2477,talking. 
2478,(They follow Steven out of the ship.)
2479,
2480,[Kembel landing pad]
2481,
2482,(Chen watches as Steven comes down the ramp and
2483,instantly recognises the box he is carrying.) 
2484,"CHEN: The taranium! I would suggest that you give that to me, young"
2485,man. 
2486,"DOCTOR: No. And remember, you cannot fire because of the taranium."
2487,You'd have another fifty years work. 
2488,"CHEN: Possibly, But you are still in no position to bargain. "
2489,"DOCTOR: I will hand over the taranium outside my ship, the Tardis. "
2490,CHEN: You heard the condition. 
2491,BLACK: It is not acceptable. 
2492,CHEN: You heard what the Dalek Supreme said. 
2493,"DOCTOR: Outside my ship, the Tardis, or nowhere! "
2494,CHEN: He seems determined. Does it really matter? 
2495,BLACK: Very well. In front of his ship. 
2496,DOCTOR: Thank you. Steven? 
2497,(Steven sets off into the jungle and the Doctor follows with Sara. Chen
2498,catches sight of his former agent.) 
2499,CHEN: Kingdom. 
2500,SARA: Traitor. 
2501,(The Guardian is taken aback by Sara's venom and follows behind with
2502,the Daleks.)
2503,
2504,[Outside the Tardis] 
2505,(After a tense trek through the jungle they reach
2506,the Tardis. The Doctor gives Sara the key.) 
2507,"DOCTOR: Sara, open the door please. The young man will give you the"
2508,"taranium when the girl and I are safely inside my ship, the Tardis. "
2509,BLACK: Very well. 
2510,"CHEN: Making sure of your escape, eh, Doctor? "
2511,"DOCTOR: Remember to do exactly as I say, Steven. I will give you"
2512,further instructions from inside my Tardis. 
2513,(Steven nods. The Doctor and Sara go inside.) 
2514,"DOCTOR : Steven, hand the box over to Chen. Then come inside the"
2515,Tardis. 
2516,(Steven offers the box to Chen who snatches it from him. Chen is
2517,delighted when he opens the box and has to shield his eyes against the
2518,fierce glow.) 
2519,CHEN: This is it! The core of the Time Destructor! 
2520,(The Daleks turn on Steven.) 
2521,BLACK: Exterminate him! 
2522,(As the Daleks open fire Steven dives with inside the Tardis with the
2523,"rays bouncing off his forcefield, and the door slams shut. The Tardis"
2524,dematerialises.) 
2525,BLACK: The ray guns did not take effect! 
2526,DALEK: All were operated at full power. 
2527,BLACK: No human being can withstand their fire. 
2528,CHEN: What happened is unimportant! We have the taranium! The invasion
2529,can go ahead. The Universe will be ours!
2530,
2531,[Tardis]
2532,
2533,(Steven is recovering quickly.) 
2534,SARA: Are you sure you're all right? 
2535,"STEVEN: Yes, more or less. "
2536,DOCTOR: The Dalek guns must have destroyed that forcefield completely.
2537,It's a good thing they didn't fire a second time. 
2538,STEVEN: I don't really know what happened. 
2539,SARA: You were enclosed in a field of Gravity force and reliance power.
2540,
2541,"DOCTOR: You had a shield round you. You know, similar to that one that"
2542,"protects the Tardis. Oh, that's remind me. Where is that genuine"
2543,Taranium? 
2544,SARA: Over here. 
2545,"STEVEN: It's a pity I blacked out. I mean, if I knew the ratio"
2546,"readings, we could use the same force again to protect us from the"
2547,Daleks. 
2548,DOCTOR: Certainly not! What you did was very dangerous and extremely
2549,stupid. 
2550,"STEVEN: Oh, come off it. It worked. "
2551,DOCTOR: One more experiment like that and you really will be dead. 
2552,"STEVEN: Oh, nonsense. "
2553,"DOCTOR: Now, now, now, you listen to me, young man. I warned you it was"
2554,dangerous before you tried it. You might have killed yourself and blown
2555,"up the space-ship. Then, where would we all be? "
2556,STEVEN: I know where I'll be. I don't know about you lot. 
2557,"DOCTOR: Now, now, now, now don't be cheeky. "
2558,"STEVEN: Look, if it haven't been for me, how would you have charged the"
2559,taranium and carried out the hand-over? I think we should experiment
2560,further. 
2561,DOCTOR: I don't care what you think. We're not going to repeat it. Why
2562,do you think science turned down your discovery? Because it isn't safe.
2563,So perhaps in future you'll pay attention to what I say and remember
2564,that I happen to be the leader of this expedition and I don't want to
2565,keep on repeating myself. 
2566,STEVEN: But Doctor 
2567,"DOCTOR: Never mind the buts! If you don't like it, you can get off! "
2568,"STEVEN: All right Doctor, I promise that I won't experiment with it any"
2569,further. 
2570,DOCTOR: I hope not. 
2571,SARA: Something's gone wrong. 
2572,DOCTOR: What's the matter? 
2573,SARA: It's stopped going up and down. 
2574,STEVEN: That's means that we've landed. 
2575,"DOCTOR: Oh, tut, tut, tut. That scanner's not working. "
2576,SARA: Can you mend it? 
2577,"DOCTOR: Yes I shall have to repair it, of course, yes, yes, but that"
2578,means checking up on the whole circuit. 
2579,"STEVEN: Well, let's get on with it. "
2580,"DOCTOR: Ah, ah, ah. Don't you dare touch that. "
2581,STEVEN: Why not? 
2582,"DOCTOR: Well, just look at those dials. Look! Look here, Sara. You see"
2583,"those dials, now you know what that means? If either of you went"
2584,"outside, it would be extremely dangerous. The whole atmosphere is"
2585,entirely poisonous.
2586,
2587,Episode 7 - The Feast of
2588,Steven
2589,
2590,(Broadcast on December 25th 1965)
2591,
2592,[Street]
2593,
2594,"(In fact, the poisonous atmosphere is no more than"
2595,1960's urban pollution.) 
2596,SERGEANT: What in the name of? 
2597,(The Tardis looks quite at home outside a Police Station somewhere in
2598,the North of England.) 
2599,SERGEANT: Who put that there? 
2600,"(Returning to the station in their car, two police officers are full of"
2601,"seasonal cheer, and singing carols.) "
2602,CONSTABLE 1 (the driver) + CONSTABLE 2 (the passenger): When a poor man
2603,"came inside, gathering winter fuel. "
2604,"CONSTABLE 1: Here, I reckon we could charm the birds of the trees. "
2605,CONSTABLE 2: I'd settle for some from the coffee bars. 
2606,"CONSTABLE 1: Here, what about 'While Shepherds Watch'? do you think"
2607,they'd appreciate that? 
2608,"CONSTABLE 2: Hey, now here's the Sergeant. Come on. "
2609,CONSTABLE 1: Oh. 
2610,"CONSTABLE 2: Hello Sergeant, what you doing out here? "
2611,"SERGEANT: Hey, come and have a look at this. "
2612,(They gather around the Tardis.) 
2613,"CONSTABLE 2: Well, where did that come from? "
2614,SERGEANT: You tell me. 
2615,"CONSTABLE 1: Oh, perhaps someone sent it to the Inspector as a"
2616,Christmas box. 
2617,SERGEANT: And perhaps you'll both just stay out here and watch it. 
2618,CONSTABLE 1: Why? Do you think it's going to fly away? 
2619,"SERGEANT: Just you stay there and keep an eye on it, right?"
2620,
2621,[Tardis]
2622,
2623," STEVEN: And just why, if it isn't safe for us, is"
2624,it safe for you? 
2625,DOCTOR: Will neither of you understand? 
2626,"SARA: For heaven's sake, let's go and fix the scanner! "
2627,"DOCTOR: No! Where you come from, in both places, the air is pure."
2628,Outside there is the worst kind of pollution I've met in years. 
2629,"STEVEN: Right, then you shouldn't go out there, either. "
2630,"DOCTOR: Ah, my dear boy, I'm used to all sorts of atmospheres. It won't"
2631,affect me. I shall have to go out and do the repairing myself. 
2632,SARA: But suppose something happens to you? 
2633,"DOCTOR: Then, and only then, can you come out. But you must be very,"
2634,very careful. 
2635,STEVEN: And how are we supposed to know that something has happened to
2636,you? 
2637,"DOCTOR: My dear young man, just give me a few minutes and if all is"
2638,"well, I shall be back inside again to tell you. "
2639,"STEVEN: And if not, we come out and find you? I seem to have been"
2640,through all this before. 
2641,"DOCTOR: Now, look here, my boy. You will do as you're told! Now you"
2642,just open the doors and remember to close them after I've gone. 
2643,"STEVEN: Yes, sir!"
2644,
2645,[Street]
2646,
2647,(The Doctor comes face to face with a policeman on
2648,guard outside.) 
2649,CONSTABLE 1: Good evening. 
2650,DOCTOR: Good evening. 
2651,"CONSTABLE 1: Hey, you! "
2652,(The Doctor ducks back inside the Tardis.) 
2653,CONSTABLE 2: What's up? 
2654,CONSTABLE 1: See that? 
2655,CONSTABLE 2: See what? 
2656,CONSTABLE 1: That then. 
2657,CONSTABLE 2: What when? 
2658,"CONSTABLE 1: That door, "
2659,CONSTABLE 2: That door? 
2660,"CONSTABLE 1: It opened, "
2661,CONSTABLE 2: Did it? 
2662,CONSTABLE 1: There's a bloke in there. 
2663,"CONSTABLE 2: Oh, aye? "
2664,CONSTABLE 1: A bloke with long white hair. I just saw him. 
2665,CONSTABLE 2: Did you? 
2666,CONSTABLE 1: Aye. 
2667,CONSTABLE 2: It's locked. 
2668,CONSTABLE 1: But I just saw him. 
2669,"CONSTABLE 2: Oh, aye."
2670,
2671,[Tardis]
2672,
2673," DOCTOR: No, police. P-O-L-I-C-E. "
2674,"SARA: Oh, I see. We've landed on your own planet. "
