,Script
598,DOCTOR: What? 
599,"AMBRIL: Yes, I'll cancel the whole thing. At once. Now my assistant"
600,will show you out. 
601,"(Tegan runs into the Hall of Mirrors, and Nyssa carries on. Tegan comes"
602,"out, then changes her mind and goes back inside.) "
603,"DOCTOR: Look, the facts are these. First of all, my companion brought"
604,"us here, to this world, without ever having been here before. Now why"
605,"should she do that? Why here, why now? Then I used hypnosis to"
606,"establish the presence of the Mara in her head. You see, she has a"
607,recurring dream 
608,CHELA: A dream? 
609,DOCTOR: And in this dream. What is it? 
610,AMBRIL: It proves nothing. Merely that he's acquainted with the legend.
611,
612,DOCTOR: The Legend of the Return? 
613,CHELA: Yes. 
614,AMBRIL: Don't encourage him. 
615,"DOCTOR: Well, tell me! Look, all I want's a little information. What"
616,possible harm is there in that? 
617,(Ambril devotes his whole attention to the artefact. The Doctor turns
618,to Chela.) 
619,DOCTOR: Tell me about the legend. 
620,(The distorting mirrors in the Hall have snake decorations round them.
621,"Tegan has fun with the first two, but the third shows a snake's skull"
622,over her head.) 
623,"AMBRIL: All right, all right, humour him, Chela. But remember, there"
624,are no actual facts to impede the full flow of the imagination. 
625,CHELA: The Legend tells that the Mara was not destroyed by the founders
626,"of the Federation, but only banished. "
627,DOCTOR: To the Dark Places of the Inside. 
628,CHELA: Yes. 
629,DOCTOR: I'm so sorry. Do go on. 
630,"CHELA: Anyway, according to the Legend, the Mara will return in a"
631,dream. 
632,DOCTOR: What does it want? 
633,"CHELA: It returns to regain its power over men, when the minds meet"
634,again in the Great Crystal. 
635,DOCTOR: The Great Crystal? 
636,AMBRIL: That's enough. 
637,DOCTOR: How can minds meet? 
638,AMBRIL: How indeed. Wishy mystical mumbo-jumbo. 
639,CHELA: What about the Snake Dancers? 
640,"AMBRIL: It appeals to a certain type of mind. Primitive, lazy,"
641,uneducated type of mind. Even my assistant here isn't immune. You'll
642,find that the Legend becomes more and more vague the closer it
643,approaches anything resembling any factual detail. 
644, [Market place] 
645, (Nyssa is outside the Fortune Teller's booth.) 
646,NYSSA: Hello? 
647, [Fortune Teller's booth] 
648, NYSSA : Hello? 
649,"(Nyssa enters. She sees the shards of the crystal ball on the table,"
650,and almost steps on the anti-dream device on the floor. She picks it
651,up.) 
652, [Director's room] 
653, (A ceremonial helmet with a crest of five faces is
654,on a display stand.) 
655,"AMBRIL: Now take this, for example. It dates from the middle Sumaran"
656,"era and unusually is mentioned quite specifically in the Legend. Oh,"
657,there can be no doubt. The reference is to the Six Faces of Delusion.
658,"Now count. One, two, three, four, five. You will observe there are five"
659,"faces, not six as the Legend would have it. Now, my point is this. I do"
660,find it quite extraordinarily difficult to take seriously a Legend that
661,"cannot even count accurately. Of course, artistically speaking, it's an"
662,entirely different matter. The piece is exquisite. An undoubted
663,masterpiece. 
664,DOCTOR: What is it? 
665,AMBRIL: Hmm? Headdress. 
666,DOCTOR: Try it on. 
667,AMBRIL: What? 
668,DOCTOR: Try it on. 
669,AMBRIL: Certainly not. Whatever for? 
670,"DOCTOR: Please. I want to show you something, then I'll go and leave"
671,you in peace. 
672,AMBRIL: Very well. 
673,(Ambril puts on the headdress.) 
674,AMBRIL: Well? 
675,"DOCTOR: Now, count the faces again. "
676,AMBRIL: Do as he says. 
677,"CHELA: One, two, three, four, five. "
678,DOCTOR: And one makes six. The sixth Face of Delusion is the wearer's
679,"own. That was probably the idea, don't you think? "
680,"AMBRIL: Get out! Go on, get out! "
681, [Hall of Mirrors] 
682," TEGAN: No, please. "
683,MARA : Face me. 
684,"TEGAN: No. No, I mustn't. I can't. "
685,MARA : Face me. 
686,TEGAN: I'm so tired. 
687,MARA : Then borrow my strength. 
688,TEGAN: How is it possible? 
689,"(The Hawker, the owner of the Hall of Mirrors, enters in the"
690,background.) 
691,"TEGAN: On the Kinda world, the Mara was repelled by mirrors. "
692,"MARA : On the Kinda world, I was trapped in a circle of mirrors."
693,There is no circle here. 
694,TEGAN: Why am I so confused? 
695,MARA : You're divided against yourself. A stranger in your own
696,mind. You are pathetic. Look at me! I can make up your mind. 
697,TEGAN: No. 
698,(Tegan faces her reflection. The snake skull speaks.) 
699,MARA: Why not? What are you afraid of? Just who do you think you are? 
700,"(The skull vanishes from the mirror, and the snake tattoo appears on"
701,Tegan's right forearm.) 
702, [Market place] 
703, CHELA: Doctor? Take this. 
704,DOCTOR: What is it? 
705,"(It is a small blue crystal, like the old man is wearing in his"
706,meditations.) 
707,CHELA: The Snake Dancers use them in their rituals. They call them
708,"Little Mind's Eye. In the Legend, the Great Crystal is named as the"
709,Great Mind's Eye. 
710,DOCTOR: Indeed. 
711,CHELA: Perhaps there's a connection. Perhaps they're even made of the
712,"same substance. I don't know, Ambril refused to let me run the tests. "
713,DOCTOR: Why are you telling me this? 
714,CHELA: I must go. 
715,DOCTOR: Do you believe in the Legends? 
716,"CHELA: No, of course not. "
717,DOCTOR: One more question. Who are the Snake Dancers? 
718,(But Chela is gone. The crowd turn to stare at the Doctor.) 
719, [Hall of Mirrors] 
720," HAWKER: Highly convincing, young lady. A trick, of"
721,"course. Voice projection, the art of the ventriloquist perhaps, but in"
722,"different registers. Oh, very original, all in all. Various"
723,"possibilities present themselves immediately, should you be, er, along"
724,"the lines of a partnership. A booth, perhaps and so forth. And me"
725,"outside enticing the passer-by. Talking them in, relieving them at the"
726,door of some small token of their sincere interest. You inside in the
727,"half dark, talking away to yourself and scaring them all half to death."
728,Highly satisfactory all round. What do you think? 
729, [Market place] 
730, DOCTOR: Nyssa! 
731,NYSSA: Doctor. 
732,(The Doctor holds up the crystal.) 
733,NYSSA: I saw Tegan. I spoke to her. 
734,"DOCTOR: Well, where is she now? "
735,"NYSSA: She ran away from me. I lost her in the crowd. But Doctor, look."
736,
737,(Nyssa hands him the anti-dream device.) 
738,NYSSA: She was behaving very oddly. 
739,DOCTOR: Was she marked? 
740,NYSSA: I don't 
741,DOCTOR: On her arm. The mark of the snake. 
742,"NYSSA: I didn't look, I didn't notice. "
743,DOCTOR: It must be the Mara. Come on. 
744, [Hall of Mirrors] 
745," HAWKER: Enough's enough. I said I was impressed,"
746,"as impressed as I need to be. I'm not a curious man. I was once, a long"
747,time ago. I was a humble student of life's mysteries. A treader of the
748,"secret pathways, a delver into the darker corners and so forth. All"
749,"rubbish, of course. At the end of the day, when the lights come up, as"
750,"in one form or another they always do, there's always somebody standing"
751,"there with their hand out, waiting to be paid. I decided long ago that"
752,"person might as well be me. Or, in present circumstances, us. "
753,TEGAN: Us. 
754,(Tegan talks with her unaccented Mara voice.) 
755,TEGAN: Who exactly are you? You're not important. There is only one.
756,Only he matters more than what is to be done here. 
757, [Federator's residence] 
758," (Lon is lying on the chaise longue, again. Tanha"
759,"enters, followed by a servant carrying her golden cloak.) "
760,LON: I'm not coming. 
761,TANHA: Good. 
762,LON: I beg your pardon? 
763,TANHA: It's probably just as well. You'd only spoil it. Your behaviour
764,in the caves this morning was unforgivable. The poor man was quite
765,disconcerted. 
766,LON: Ooo. 
767,TANHA: You were taking advantage of your position. 
768,"LON: Oh please, you're going to be dreary. "
769,"TANHA: No, I am not going to be anything. We are invited to dinner, I"
770,am going. Are you just going to lie there being bored? 
771,"LON: Yes, do you know, I rather suspect I am. After all, what else is"
772,there to do? 
773, [Cave] 
774, DOCTOR: Come on. 
775,NYSSA: Why are we here? 
776,"DOCTOR: Facts, Nyssa, facts. There's something I noticed before. I need"
777,to take another look. 
778, [Cave tunnel] 
779, NYSSA : At what? 
780,DOCTOR: The pictograms. There's a ceremony taking place commemorating
781,the supposed destruction of the Mara. 
782,NYSSA: So? 
783,DOCTOR: The Mara's waited a long time for this return. I think it plans
784,to be spectacular. 
785, [Federator's residence] 
786, (Tanha enters.) 
787,"TANHA: Oh, Lon. Do come to the party. "
788,(Lon turns his back on her.) 
789, [Cave tunnel] 
790, DOCTOR: There! Now look. What do you make of that?
791,There in the centre. Could that represent the Great Crystal? 
792,NYSSA: Could do. 
793,"DOCTOR: And these lines from the centre, energy of some sort? "
794,NYSSA: Mental energy. 
795,DOCTOR: What? 
796,"NYSSA: Well, presumably. The lines go to the heads of the figures. "
797,"DOCTOR: Hmm. Minds meet in the Great Crystal. But what are these? Now,"
798,everything in this pictogram tells us something if we know how to read
799,"it, so what are these? "
800, [Federator's residence] 
801, (A knock at the door.) 
802,LON: Who is it? 
803,(A servant lets the Hawker in.) 
804,"HAWKER: Excuse me for intruding, my Lord. Your lackey "
805,LON: The showman. 
806,"HAWKER: Oh, I'm flattered you remember me. "
807,LON: Of course I remember you. Go away. 
808,"HAWKER: Ah. Our previous encounter, rather unfortunate. Heat of the"
809,"moment, press of the crowd, various misunderstandings, so forth. "
810,LON: What do you want? 
811,HAWKER: I've been sent to fetch you. 
812,LON: Have you indeed? 
813,"HAWKER: You are, er, summoned. "
814,LON: Summoned? I am summoned? How extraordinary. By whom? 
815, [Cave tunnel] 
816, NYSSA : Doctor! 
817, [Chamber of the Mara] 
818, DOCTOR: Hmm? 
819,"NYSSA: If the Great Crystal of the Legend ever really existed, then"
820,logically there is where it would have fitted. 
821, [Market place] 
822, (The place is empty. The Hawker brings Lon to the
823,Hall of Mirrors.) 
824,"HAWKER: In here, my Lord. "
825,LON: This is your booth. I'm beginning to regret this. I hope for you
826,sake that I'm not going to be disappointed. 
827,"HAWKER: Please, my Lord. "
828,LON: Can I have your personal assurance? 
829,HAWKER: She's inside. 
830,LON: So I should hope. 
831, [Hall of Mirrors] 
832, (Tegan is still standing in front of that mirror.)
833,
834,"LON: You, er, summoned me, apparently. It's not something I'm"
835,"accustomed to, but here I am. Well, what happens now? "
836,(Tegan turns and holds out her right hand.) 
837,"LON: Yes. After all, why not.) "
838,"(He takes her hand to kiss it, but she changes the grip to interlacing"
839,fingers. Lon screams as the snake skull appears.) 
840, [Chamber of the Mara] 
841, DOCTOR: Obvious. 
842,NYSSA: What is? 
843,"DOCTOR: The Great Crystal, the Great Mind's Eye. That's the clue! The"
844,"lines do represent the flow of mental energy, but not going to the"
845,"individual figures, coming from them. "
846,NYSSA: And meeting in the Great Crystal. 
847, [Cave tunnel] 
848, DOCTOR: Just as a lens focuses the rays of the
849,"sun, the Great Mind's Eye gathered all the individual thought energies"
850,"and concentrated them, and amplified them, and redirected them there. "
851,NYSSA: But it's blank. It's been scratched out! 
852, [Chamber of the Mara] 
853," DOCTOR: Now, according to the Legend, the Great"
854,Crystal is the source of the Mara's power. But where is it now? What
855,"exactly were its properties? Oh, if only we could take a look at the"
856,"Great Crystal itself. Unless, I wonder. "
857,(The Doctor takes the Little Mind's Eye from his pocket. 
858, [Director's room] 
859, (Ambril is caressing a curved jar.) 
860,"AMBRIL: Then you see, my Lady, we draw a complete blank. It's quite"
861,clear that the Manussans of the pre-Sumaran era were a highly civilised
862,people. Their technology in some senses was considerably in advance of
863,"our own. Then, suddenly, almost overnight, the Manussan civilisation"
864,simply disappeared. It was certainly subjected to a cultural
865,catastrophe of unimaginable proportions. 
866,TANHA: Shall we eat? 
867,"AMBRIL: Yes, to such an extent that when the Federation record begins"
868,"some six hundred years later, they speak of the Manussans as a"
869,"primitive people in thrall to the Mara, sunk in barbarity, degradation"
870,and cruelty. 
871,(Tanha yawns.) 
872,"AMBRIL: Are you all right, my Lady? "
873,"TANHA: Yes, yes, of course. Please do go on. "
874,AMBRIL: A shame your son could not be with us. 
875,"TANHA: Yes, I'm sure he would have found it all most illuminating. "
876, [Hall of Mirrors] 
877," (Lon has gained a snake emblem on his arm, and is"
878,laughing at his reflection in the mirrors.) 
879,TEGAN: Silence! Follow me. 
880,(The Hawker follows them out.) 
881, [Tardis] 
882," DOCTOR: Come on, over there. Now, sit down. "
883,"NYSSA: Doctor, I'm not at all clear what we're supposed to be doing. "
884,DOCTOR: Just think about it. 
885,NYSSA: What? 
886,DOCTOR: Sit down. 
887,"(Nyssa sits on the floor, facing the Doctor.) "
888,"DOCTOR: Now, simple test. The Great Crystal focuses thought in some"
889,"way. Now, if this is the same sort of crystal, it should exhibit the"
890,same properties. We must direct our thoughts at it and observe what
891,happens. 
892,NYSSA: Now? 
893,DOCTOR: Yes. 
894, [Outside the Snake Mouth] 
895," LON: Come on, hurry up. "
896,"HAWKER: I, er, where's she taking us? "
897,LON: Come on. 
898,"HAWKER: I, I, I don't. "
899,(Lon grabs his arm.) 
900,LON: Come on. 
901, [Tardis] 
902, (Nyssa sighs and sags.) 
903,"NYSSA: I'm sorry, Doctor. I can't concentrate hard enough. "
904,DOCTOR: It doesn't matter. 
905,(Nyssa picks up the crystal.) 
906,NYSSA: I feel so foolish. 
907,DOCTOR: We'll try another way. 
908, [Chamber of the Mara] 
909, TEGAN: Where is the Crystal? Who has dared to
910,remove the Great Crystal? 
911, [Tardis] 
912, (The Doctor is wearing the anti-dream device.) 
913,NYSSA: What are you doing? 
914,DOCTOR: Hmm? I'm adjusting the frequency. I need to eliminate all
915,"unnecessary outside noise as an aid to concentration. There. Right,"
916,"let's try again. You come and stand over here, watch the crystal"
917,closely and observe any changes. You ready? 
918,NYSSA: Yes. 
919,DOCTOR: Right. 
920,"(The Doctor sits on the floor, holds the crystal in his fingers and"
921,closes his eyes. 
922,"In the Chamber of the Mara, Tegan puts her snake mark against part of"
923,"the relief, and a secret door opens. They all go through. It is a"
924,secret vault with treasures littered about. The Hawker investigates. 
925,"Meanwhile, the small crystal begins to glow.) "
926,NYSSA: It can't be. It's impossible. 
927,(The glow fades and the Doctor opens his eyes.) 
928, [Secret chamber] 
929, TEGAN: You're not impressed. 
930,"LON: Not overly, no. Why, did you expect that I would be? "
931,TEGAN: Leave them alone. 
932,LON: Toys for children. 
933,"HAWKER: Toys? You don't understand. These are the real thing, the"
934,"genuine article. They're worth money, a fortune! "
935,(The dust makes him sneeze.) 
936,LON: Now tell me about the Great Crystal. That interests me. It
937,interests me very much indeed. 
938, [Tardis] 
939, NYSSA: And then the light faded. 
940,"DOCTOR: Well, of course, it's small. It's power is obviously limited. "
941,NYSSA: But there was only a blue light. 
942,"DOCTOR: You're missing the point, Nyssa. It's not what you saw but that"
943,you saw anything at all. It proves the crystal has the quality of
944,transforming thought into energy. 
945,NYSSA: I see! 
946,DOCTOR: Perhaps even into matter itself. Just think of the power the
947,"Great Crystal must have. Whatever's in your thought, whatever in your"
948,"mind, it can actually make it occur. "
949,NYSSA: And if the Mara's in Tegan's mind 
950,DOCTOR: Exactly. The Mara needs the Great Crystal in order to make
951,"itself reoccur. Er, stay here. "
952,NYSSA: Where are you going? 
953,DOCTOR: To warn Ambril. He knows where the Great Crystal is now. He
954,must be made to listen. 
955, [Secret chamber] 
956," LON: Yes, I do know where it is. "
957,TEGAN: Where? 
958,"LON: Or rather, to be more precise, I know who knows where it is, and"
959,how he may be persuaded to tell us. 
960, [Director's room] 
961, (The guests are finally round the dining table.) 
962,AMBRIL: A toast to the Federation in the person of this charming lady 
963,(The Doctor barges in during this.) 
964,DOCTOR: I do assure you it is most important. Where is the Great Mind's
965,Eye? 
966,TANHA: The what? 
967,DOCTOR: The Great Crystal from the snake in the chamber. 
968,"AMBRIL: I beg your pardon, my Lady. "
969,"TANHA: No, really, I love surprises. "
970,DOCTOR: You know where it is. 
971,AMBRIL: I certainly do. 
972,DOCTOR: Where? 
973,"AMBRIL: Wherever it is, I can assure you it's perfectly safe. "
974,DOCTOR: The Great Crystal is the source of the Mara's power. It needs
975,that power to make itself reoccur. That's why it has returned. 
976,AMBRIL: I think we've heard enough. Take him away. 
977,(The Doctor is dragged out backwards.) 
978,DOCTOR: Through the Great Crystal the Mara will reoccur as a physical
979,fact here on Manussa! 
980, [Secret chamber] 
981, LON: Only one thing remains to be decided. 
982,TEGAN: Yes. 
983,"HAWKER: Me? Oh, er, I could assist in whatever capacity, using my"
984,discretion. 
985,(Tegan and Lon link hands.) 
986,"HAWKER: Or, or, I could simply forget. Whichever and whatever you"
987,prefer. 
988,TEGAN: He has served his purpose. 
989,LON: You are no longer necessary. 
990,TEGAN: Look at me. 
991,"HAWKER: No, no, please, what are you doing? "
992,(The Hawker tries to hide his face in his fur trimmed hat.) 
993,TEGAN: Look at me! 
994,HAWKER: No! 
995,TEGAN: Look at me. I'm not going to harm you. Look at me. 
996,(Lon speaks with the same Mara voice.) 
997,LON: That's right. Look at me. Look at me. 
998,(Tegan's eyes glow red.) 
999, Part Three
1000,
1001, [Secure area] 
1002, (The Doctor is alone in a very large cage.) 
1003,CHELA: I brought you some food. 
1004,DOCTOR: How long am I to be locked up here? 
1005,CHELA: Do you want it? 
1006,"DOCTOR: Well, come on, surely at least you can tell me that? "
1007,CHELA: You're to be kept here until after the ceremony this afternoon. 
1008,DOCTOR: That will be too late. Whatever is to happen will happen at the
1009,ceremony. 
1010, [Secret chamber] 
1011, (The Hawker is just staring straight ahead.) 
1012,LON: What about him? 
1013,TEGAN: He's not important. Only the Great Crystal is important. I need
1014,the Great Crystal. 
1015,"LON: Well, I'll have to see what I can do. "
1016,TEGAN: You must not fail me. 
1017,"LON: No. No, I understand. "
1018, [Secure area] 
1019, DOCTOR: Do you think I'm inventing all this? What
1020,would I have to gain? 
1021,CHELA: I don't know. 
1022,"DOCTOR: But you're not sure it is all nonsense, are you. "
1023,"CHELA: Yes, of course I am. "
1024,DOCTOR: Why did you tell me about the Crystal? 
1025,"CHELA: Because you're not the first. Dojjen, the Director before"
1026,"Ambril, he too was convinced that the Mara would return. "
1027,(The old man is still meditating - presumably Dojjen - and a snake
1028,watches him.) 
1029,DOCTOR: What happened to Dojjen? 
1030,CHELA: It doesn't matter. The Great Crystal is safe. Ambril has charge
1031,of it. 
1032, [Federator's residence] 
1033, (Lon enters and heads straight for the stairs.) 
1034,"TANHA: Lon, where have you been? "
1035,LON: Out. 
1036,TANHA: Come here. 
1037,LON: Whatever for? 
1038,TANHA: I want to look at you. 
1039,"(Lon returns, hiding his right arm behind his back.) "
1040,"TANHA: When I realised your room was empty, I very nearly raised the"
1041,"alarm, but I didn't want to embarrass you. "
1042,LON: Embarrass me? 
1043,"TANHA: Yes, if you were out somewhere having fun. Were you? While your"
1044,poor mother was stuck at the official dinner being bored into tiny
1045,pieces. I shall never forgive you. 
1046,"LON: No, mother, I wasn't. "
1047,TANHA: Promise me. What are you hiding? 
1048,LON: What? 
1049,TANHA: Show me. 
1050,LON: It's just a cheap fake. I picked it up at the market. 
1051,(He hands Tanha a beaker that the Hawker had picked out of the hoard in
1052,the secret chamber.) 
1053,TANHA: Since when have you been interested? 
1054,"LON: It caught my eye, that's all. "
1055,"TANHA: Well, then, why won't you "
1056,"LON: Mother, I won't have you asking questions. "
1057, [Director's room] 
1058, (Nyssa hides as Chela comes out of the Detention
1059,area and along the corridor into the Director's office. 
1060,"Ambril is at his desk, reading a small book with a magnifying glass.) "
1061,AMBRIL: Well? 
1062,CHELA: I've taken him food. 
1063,"AMBRIL: He should be grateful. Was there something else, Chela? "
1064,CHELA: I think he's harmless. 
1065,AMBRIL: Harmless? Of course the fool's harmless. 
1066,CHELA: He is a doctor. 
1067,AMBRIL: Doctor? Of what? I'm sure the man has no academic standing
1068,whatsoever. 
1069, [Institute corridor] 
1070, DOCTOR : I do not want any more blankets! I
1071,want to get out of here. Tell your master I want to see him. 
1072,"(Nyssa hides by the door as the lackey comes out, then goes inside.) "
1073, [Secure area] 
1074, DOCTOR: Nyssa! 
1075, [Federator's residence] 
1076," (Lon comes downstairs, wearing elbow-length"
1077,"gauntlets, to find Tanha still examining the beaker.) "
1078,LON: Give it to me. Thank you. 
1079,TANHA: Where are you going? 
1080,(Lon leaves.) 
1081, [Director's room] 
1082, (Ambril hands over the small book.) 
1083,"AMBRIL: Look at this, Chela. "
1084,CHELA: What is it? 
1085,AMBRIL: The meanderings of another crank. Written by Dojjen in the
1086,months before he decided his particular line of research was best
1087,pursued up in the hills with a snake wrapped round his neck. You'll
1088,"find the last entry of interest, medical interest. He addresses what"
1089,"remained of his wits to the question 'where is the Mara'. Well, read"
1090,it. 
1091,(Lon appears in the doorway.) 
1092,"CHELA: (reads) Where the winds of restlessness blow, where the fires of"
1093,"greed burn, where hatred chills the blood, here in the Great Mind's"
1094,"Eye, here in the depths of the human heart, here is the Mara. "
1095,AMBRIL: You see? 
1096,CHELA: Is it a code? 
1097,"AMBRIL: Code? Course it's not a code. It's nonsense, pure and simple"
1098,woolly minded nonsense. 
1099,LON: I'm very pleased to hear it. 
1100,"AMBRIL: Oh, my Lord. "
1101,LON: Good morning to you both. 
1102,AMBRIL: Good morning. 
1103,"LON: I need to ask a favour. A private favour, if you don't mind. "
1104,"AMBRIL: Of course, why should he mind. Chela, out, out, out, out. "
1105,(Chela bows and leaves.) 
1106,"AMBRIL: Now, my Lord, what can I do for you? "
1107, [Secure area] 
1108," DOCTOR: Oh, it's no use, Nyssa. I have tried. "
1109,NYSSA: This is so stupid. 
1110,DOCTOR: The lock is extremely primitive. It's practically a museum
1111,"piece. There's no electronic impulse matrix to decode, no sonic"
1112,"microcircuit to disrupt. Crude mechanical six barrel movement, key"
1113,"operated. Primitive but adequate. Well, it's more than adequate,"
1114,"actually, because the key is what we don't have. "
1115,NYSSA: There must be something 
1116,(A noise outside the door.) 
1117,DOCTOR: Quickly. 
1118,(Nyssa hides as Chela enters.) 
1119,DOCTOR: Have you come to let me out? 
1120,CHELA: I've brought you this. It was written by Dojjen. Look at the
1121,last page. 
1122,DOCTOR: I'd much rather you unlocked the door and let me out. 
1123,CHELA: You know I can't do that. 
1124,"DOCTOR: Why, don't you have the key? "
1125,"CHELA: No, I don't. "
1126,"DOCTOR: Ambril, I suppose. "
1127,CHELA: What? 
1128,DOCTOR: Has the key in his room. 
1129,"CHELA: Yes, I suppose so. What are you talking about? I thought you"
1130,"might be interested, but "
1131,"DOCTOR: No, wait, wait. Of course I'm interested. The last page, you"
1132,say? 
1133,"(Nyssa sneaks out, unseen.) "
1134, [Director's room] 
1135," AMBRIL: My Lord, I am bound by an oath. An oath I"
1136,had to swear on taking office. An oath dating back to the time of the
1137,destruction of the Mara. 
1138,LON: But you do know where the Crystal is. 
1139,"AMBRIL: Oh, my Lord, not even the Federator himself may see the Great"
1140,"Crystal, though I am gratified by your awakened interest. "
1141,"LON: Well, you know how it is. With time on one's hands, one pokes"
1142,around. 
1143,(Lon takes the beaker from his gauntlet.) 
1144,"LON: Surprising, really, what one can turn up. "
1145,AMBRIL: Yes. 
1146,(And does a double take at the artefact.) 
1147, [Secure area] 
1148, (The Doctor reads the last entry in the notebook.)
1149,
1150,CHELA: Well? 
1151,DOCTOR: It's a reference to the Great Mind's Eye. 
1152,CHELA: And it was the last thing Dojjen wrote before he 
1153,DOCTOR: Before he what? 
1154,CHELA: Now give it back to me. 
1155,DOCTOR: Before he what? 
1156,CHELA: Before he danced the Dance of the Snake. 
1157, [Director's room] 
1158," AMBRIL: Where did you find it? Oh, my Lord, I'm"
1159,"sorry, but you understand what a discovery like this means to me. "
1160,LON: Is it valuable? 
1161,AMBRIL: Beyond price. 
1162,LON: And rare? 
1163,"AMBRIL: It's unique, my Lord. "
1164,"LON: How strange. As far as I could see, they did seem to be scattered"
1165,around rather. 
1166,AMBRIL: Scattered? They? How many? 
1167,LON: I didn't count them. 
