,Script
557,would happen again before the week was out. 
558,"MUSS: No, she didn't. She heard them mention the name Vassy. And then,"
559,"just before she ran away, she heard them say it would happen before the"
560,week was out. 
561,GASTON: What's the difference? 
562,MUSS: It's quite likely the name Vassy had nothing to do with the
563,massacre there. And the it was referring to something else entirely. 
564,"GASTON: Look, Nicholas, you can't "
565,(Steven is shown in by a servant.) 
566,"STEVEN: Nicholas, I'm sorry to have to bother you again. "
567,"MUSS: Don't worry. Antoine, bring another glass. "
568,"ANTOINE: Yes, Monsieur. "
569,(Antoine leaves.) 
570,MUSS: You didn't find your friend? 
571,"STEVEN: Well, no, I even went to the Tard, the place where we're to"
572,leave from. There wasn't any sign of him. 
573,GASTON: Well if he's fallen foul of the Catholics who roam about the
574,"streets, heaven help him. "
575,MUSS: Many of our followers are just as bad. 
576,"GASTON: Oh, nonsense. "
577,MUSS: Pay no attention to Gaston. Now what can I do to help you? 
578,"STEVEN: Well, my friend went to the Port Saint Martin as you know. I"
579,"must try to find him there, but I'm afraid I can't remember your"
580,directions. 
581,MUSS: I'll come with you. 
582,STEVEN: Thanks. 
583,"GASTON: But before you go, I think you have a visitor. "
584,MUSS: Who? 
585,GASTON: Roger Colbert. Recently appointed temporal secretary to the
586,Abbot of Amboise during his stay in Paris. I'll wager he's come to
587,fetch the girl. 
588,(Gaston opens the door to the new arrival.) 
589,"GASTON: An unexpected visit, Monsieur Colbert. "
590,COLBERT: Nicholas Muss? 
591,MUSS: Yes? 
592,"COLBERT: Forgive me for calling on you like this, but I believe that"
593,yesterday you were put to some inconvenience by a servant from the
594,household of the Abbot of Amboise. 
595,MUSS: Inconvenience? 
596,COLBERT: I understand she overheard someone say something and was
597,frightened by it. She ran away and I hear that you kindly gave her
598,refuge in the Admiral's kitchens. 
599,GASTON: And what could the Abbot say that would frighten a servant so? 
600,COLBERT: The Abbot was not then in residence. She heard someone speak
601,of Vassy and I believe that she was there when that unfortunate
602,"business took place. She was frightened, I suspect, by her own memory,"
603,rather than by anything she heard. 
604,GASTON: And do they discuss the slaughter at Vassy so glibly? 
605,COLBERT: People can talk of the town without referring to that. 
606,(A servant enters.) 
607,"GASTON: Out, out, out, out, out. "
608,(The servant leaves.) 
609,"COLBERT: But surely, that is the very girl. "
610,GASTON: That girl? 
611,"COLBERT: Yes, her name is Anne Chaplet. Allow me take her with me. "
612,"GASTON: Oh, no, no, no, no, no, no, no, no. You really must be"
613,"mistaken. That girl is called, um, er, um, Genevieve, and she's been"
614,working here ever since the Admiral came to Paris. 
615,COLBERT: I see. Forgive me for troubling you. 
616,(Colbert leaves.) 
617,STEVEN: That is the same man who followed my friend from the tavern. 
618,MUSS: You're sure? 
619,STEVEN: I'm positive. 
620,MUSS: But what could the Abbot of Amboise want with your friend? 
621,"GASTON: Well, well, well, the Abbot has come himself, and all for the"
622,sake of a servant. 
623,"(Nicolas and Steven join Gaston at the window, from where they can"
624,observe Roger Colbert talking to the Abbot in the street below. After a
625,"moment, the Abbot turns and his face is clearly visible.) "
626,"STEVEN: But, but that's the Doctor. That's the Doctor talking to Roger"
627,Colbert. I must go to him. Thank you for all your help. 
628,GASTON: One moment! 
629,STEVEN: Yes? 
630,GASTON: You say that man is your friend? 
631,STEVEN: Yes. 
632,GASTON: And how long have you been working for the Abbot of Amboise? 
633,STEVEN: What? 
634,GASTON: The man talking to Colbert is the Abbot of Amboise. In what
635,capacity do you serve him? 
636,"STEVEN: What are you talking about? Well, that man's the Doc. At least."
637,"He's gone. It looked like the Doctor, but if you're certain "
638,GASTON: The certainty is that I don't like Catholic spies! 
639,STEVEN: I'm no spy. Listen to me. I thought that man was the Doctor. If
640,"you say it was the Abbot of Amboise, then I must be mistaken. "
641,MUSS: Perhaps. 
642,"STEVEN: Look, Nicholas, I can prove that the Doctor looks like the"
643,Abbot. Show me the way to the Port Saint Martin. We'll go to the shop
644,"of Preslin the apothecary, and you'll meet the Doctor. "
645,GASTON: And walk straight into a Catholic trap! 
646,"STEVEN: It's no trap! Nicholas, if I were a spy would I be such a fool"
647,as to betray myself like this? 
648,"GASTON: Nicholas, it's no "
649,MUSS: I think he may be telling the truth. I'll come with you. 
650,"GASTON: Yes, so will I. "
651,"MUSS: No, stay here. If I don't come back, go to the Admiral. "
652,"GASTON: Look, you're mad. Listen. "
653,"MUSS: We have to find out! Come, Monsieur. And for your sake I hope we"
654,find your friend.
655,
656, [The Louvre]
657,
658,"(In an anteroom, Marshall Gaspar Tavannes and Simon"
659,Duvall are discussing the latest turn of events.) 
660,TAVANNES: You say the Abbot went to the house himself? 
661,"DUVALL: Yes, Marshall, he felt it was imperative to get the girl back. "
662,TAVANNES: The Abbot's a fool. The girl's not important. She must have
663,told the Huguenots all that she knows. all that she overheard. If
664,they'd made anything of it they'd have acted by now. All he's done is
665,to arouse further suspicion. 
666,"DUVALL: He's an astute man in some ways. After all, without him we"
667,wouldn't have got the help of Monsieur Bondeaux. 
668,TAVANNES: Bondeaux has yet to prove himself. Other assassins might do
669,as well. 
670,DUVALL: His Eminence the Cardinal trusts the Abbot. 
671,"TAVANNES: Yes, I'm not sure that I do. There's something odd about all"
672,"this. Watch him closely, Simon. Make a note of everything he says or"
673,"does, and report it to me. "
674,"DUVALL: Yes, Marshall. There is another matter. Nicholas Muss is"
675,playing host to a young Englishman. 
676,TAVANNES: At de Coligny's house? Who is he? 
677,DUVALL: I don't know. 
678,TAVANNES: Hmm. Perhaps our fine Admiral is making secret overtures to
679,the English? 
680,DUVALL: It seems that he's a stranger to France. 
681,TAVANNES: All the more reason why Elizabeth of England should send him.
682,"Find out more about this Englishman. Go now, and stay close to the"
683,"Abbot. And Simon, tell him I shall bring word later concerning the Sea"
684,Beggar. 
685,"DE COLIGNY: Interested in the Dutch at last, Marshall Tavannes? "
686,"TAVANNES: Ah, Admiral De Coligny. I didn't hear you come in. "
687,DE COLIGNY: I hope you are looking into the plight of the unfortunate
688,Dutch. The sea beggars as you call them. My fight with Spain is a just
689,one. 
690,TAVANNES: So you frequently tell us in council. 
691,DE COLIGNY: Your only quarrel with the Dutch is that they are
692,Protestant and not Catholic. 
693,TAVANNES: That could also be the reason why you support them. But rest
694,"assured, Admiral, we are examining their claim for France's aid. "
695,DE COLIGNY: That is something I suppose. 
696,"TAVANNES: Tell me, have you any news from that other ally of yours,"
697,England? 
698,DE COLIGNY: No. Why should I? 
699,TAVANNES: Strange. I'd heard that you have an Englishman staying with
700,you. 
701,DE COLIGNY: There was a lost stranger who lodged at my house last
702,night. I believe he was English. 
703,TAVANNES: And he brought you no word? 
704,"DE COLIGNY: You are an extraordinary man, Tavannes. You see shadows"
705,where there is no sun. 
706,"TAVANNES: Perhaps. Forgive me, I have an audience with the Queen"
707,Mother. 
708,DE COLIGNY: Don't let me detain you.
709,
710, [Port Saint Martin] 
711, MUSS: We've been up and down every street in the
712,Port Saint Martin. 
713,STEVEN: Preslin's shop must be around here somewhere. Look! 
714,"(Steven rushes across the street, bumping into an old woman.) "
715,STEVEN: Sorry. 
716,(Steven knocks on a door.) 
717,"WOMAN: Rushing about knocking folks down, You young gentlemen have no"
718,sense 
719,"MUSS: Sorry, my friend's looking for someone. "
720,"WOMAN: Well, that's no reason to go pushing me over. And you can stop"
721,making all that noise. You're disturbing the whole neighbourhood.
722,Nobody lives there. 
723,MUSS: What? Monsieur Preslin doesn't use his shop? 
724,OLD LADY: Does it look like it? Nothing lives there except the rats. 
725,STEVEN: And where is Preslin now? 
726,MUSS: How long since he's lived here? 
727,"WOMAN: Oh, a long time. Two years about. He was arrested for heresy. "
728,"STEVEN: What? Do you mean, you mean he's in prison? "
729,"WOMAN: Burnt I expect. And if he isn't, he should be. "
730,MUSS: Your story is thinner than before. You say the Doctor is with
731,"Preslin, who is by all accounts dead. "
732,STEVEN: She only said he might be. 
733,MUSS: And what about the Doctor? 
734,STEVEN: I don't know. 
735,MUSS: I think I do. Your friend is the Abbot of Amboise. 
736,"STEVEN: No. At least, I don't see how he can be. Unless "
737,MUSS: What? 
738,STEVEN: It is just possible that the Doctor is pretending to be the
739,Abbot. 
740,MUSS: For what reason? 
741,STEVEN: Wait until I find the Abbot. 
742,MUSS: So that you can get further instructions? 
743,"STEVEN: Nicholas, please believe me. I know nothing about Vassy or the"
744,Catholics or half of what you talk about. If the Doctor is pretending
745,to be the Abbot then it's for a very good reason. Please let me go to
746,"him. Should I find out there is a plot of some kind, I'll come back and"
747,tell you. 
748,"MUSS: No, you'll come back with me now. There are others who should"
749,decide before I do. 
750,"(Taking Steven firmly by the arm to ensure his cooperation, Nicholas"
751,"guides him back the way they have come. But at the corner of the road,"
752,"Steven sees his chance and twists round, sending Nicolas crashing into"
753,a passer-by. Then he pelts away down the street. 
754, [Abbot's apartments] 
755, DUVALL: Where is the Abbot? He knew I might bring
756,word. I've been waiting here for over half an hour. 
757,COLBERT: He may be with Maurevert. 
758,DUVALL: Will you never learn? Call the assassin Bondeaux. If the Sea
759,Beggar should find out Maurevert is in Paris he'd be put on his guard
760,at once. Why do you think we've chosen code names so very carefully? 
761,COLBERT: I'm sorry. 
762,DUVALL: You've already been responsible for one mistake. There must be
763,no more. 
764,COLBERT: I parted with the Abbot at de Coligny's house. He did not tell
765,me where he was going. 
766,"DUVALL: Oh, very well. Tell me what you know about the Abbot. "
767,COLBERT: He's been specially appointed by the Cardinal. 
768,DUVALL: I don't mean that. How long have you known him? 
769,"COLBERT: I only met him yesterday, but he's worked for His Eminence the"
770,Cardinal of Lorraine for many years and has done him many services. 
771,DUVALL: You saw him for the first time yesterday? 
772,"COLBERT: No, I met him for the first time. I saw him once at an"
773,encyclical meeting held by the Cardinal. 
774,DUVALL: And that was the only time you've seen him? 
775,COLBERT: Yes. 
776,"DUVALL: Tell me. When you saw Nicholas Muss this morning, who else was"
777,there? 
778,"COLBERT: The Viscount de Laran, and the girl is certainly there,"
779,because I saw her. 
780,DUVALL: She's of no importance now. No one else was with them? 
781,"COLBERT: A third man, but I didn't know him. "
782,DUVALL: Was he English? 
783,COLBERT: I don't know. He didn't speak. 
784,"DUVALL: I want you to find out about him. If he is English, find out"
785,who he is and what his business is in France.
786,
787,[de Coligny's house]
788,
789," ANNE: Like I said, Monsieur, I never seen him"
790,before in my life. I just ran into him when the Abbot's guards were
791,after me and I thought he was one of them. 
792,MUSS: Why? 
793,"ANNE: Well, because I was frightened and and when he held out his arms"
794,"as if to stop me, and I thought he was one of them, but he isn't. "
795,MUSS: How do you know? 
796,"ANNE: Because he's kind, Monsieur, and gentle. "
797,(Gaston enters.) 
798,"GASTON: Nicholas, you're back. How was the Port Saint Martin? "
799,MUSS: Be quiet Gaston! Now listen. 
800,"GASTON: Well, there's a welcome. I've got good news. Henri of Navarre"
801,has decided to increase his guard. 
802,MUSS: And I have bad news. Steven's escaped. He must've been sent here
803,by the Catholics. 
804,ANNE: That's not true! 
805,GASTON: What's that? 
806,"ANNE: Forgive me, Monsieur, but, well I'm sure he's a stranger here. He"
807,"knows nothing about anything or or what's going on in Paris. Why, he"
808,don't even know about the royal wedding. 
809,GASTON: Get out of here. 
810,"ANNE: But, Monsieur "
811,GASTON: Get out! 
812,(Anne leaves.) 
813,"GASTON: You're too kind to these nothings. Now, tell me what's been"
814,happening. 
815,MUSS: We didn't find the man who's supposed to look like the Abbot. I
816,was bringing Steven back here when he got away. 
817,GASTON: How? 
818,MUSS: We were on our way back when he suddenly tripped me and pushed me
819,into a passer-by. I was taken by surprise. I went after him but it was
820,hopeless. 
821,"GASTON: I knew I should have come with you. Still, we know where to"
822,find him. 
823,"MUSS: Yes, with the Abbot of Amboise. "
824, [Outside the Abbot's apartments]
825,
826," (By early evening, Steven has found his way to the"
827,apartments where the Abbot of Amboise is lodging. He is determined to
828,"find out what is going on, and is certain that the answers lie in the"
829,house with the man he believes to be the Doctor in disguise. Lurking in
830,"the shadows, Steven cautiously approaches the house. Two guards in the"
831,Abbot's livery pass close by and he's forced to hide. When they've
832,"gone, Steven spots a lighted window. Making sure the coast is clear, he"
833,climbs up and peers over the sill. In the room he can see Marshall
834,Tavannes with Simon Duvall and Roger Colbert. There is no sign of the
835,Abbot of Amboise. Steven decides to listen for a while. Perhaps he can
836,overhear something of use.)
837,
838,[Abbot's apartments]
839,
840, TAVANNES: So my Lord Abbot is not here and you
841,don't know where he is to be found? 
842,"COLBERT: I'm afraid not, Marshall. "
843,TAVANNES: After my instructions to you earlier today I would have hoped
844,that I could put more faith in you. 
845,COLBERT: I'm sorry but we did look everywhere. 
846,TAVANNES: There's a draught in here. Close those shutters. 
847,"(Steven ducks back hurriedly as Roger closes the shutters, narrowly"
848,avoiding discovery.) 
849,"TAVANNES: Between you, you will find the Abbot and you will give him"
850,this message for me. Say the decision has been made. 
851,DUVALL: You mean 
852,"TAVANNES: You interrupt me, Simon. Tell him the Sea Beggar dies"
853,tomorrow. 
854,COLBERT: Tomorrow? Where? 
855,TAVANNES: He will attend an early council meeting at the Louvre. On his
856,"return, Bondeaux will be waiting for him. "
857,COLBERT: Do you wish that the Abbot instructs Bondeaux? 
858,TAVANNES: No. Bondeaux already has his orders. You may tell the Abbot
859,"that also, when you find him. Is that clear? "
860,"COLBERT: Yes, Marshall. "
861,TAVANNES: Good. 
862,(Tavannes leaves.) 
863,"DUVALL: So, the royal command has been given. "
864,COLBERT: What do you mean? 
865,DUVALL: That order didn't come from Marshall Tavannes. It came from the
866,Queen Mother. 
867,"(At the sound of approaching guards, Steven jumps down from the window"
868,and hurries away.) 
869, [de Coligny's house]
870,
871,(Steven is shown to Nicholas' quarters.) 
872,"ANTOINE: He won't be long, Monsieur, if you'll wait in here. "
873,STEVEN: Thanks. 
874,(Antoine leaves. After a few moments the door opens) 
875,"GASTON: Nicholas, there's. What are you doing? "
876,"STEVEN: Listen, where is Nicholas? I have some important news. "
877,GASTON: I'm sure you have. And I've got some for you too. Get out of
878,here! 
879,"STEVEN: Look, you don't understand. "
880,"GASTON: What placement are you looking for, a spy? Some more"
881,information for your Abbot? 
882,STEVEN: Listen to me! 
883,GASTON: I'd rather listen to a pack of screaming devils! 
884,STEVEN: Gaston! There is a 
885,GASTON: Get out of! 
886,STEVEN: For goodness sake. 
887,"(Gaston pulls a sword on Steven, who to his alarm is forced to draw his"
888,own sword in an attempt to defend himself. Gaston lunges forward to
889,"attack, and Steven's blocking parry succeeds only by a fluke. Gaston"
890,"continues to advance, his eyes burning with rage, but Steven retreats"
891,rapidly. He's no desire to get into a fight. At last Gaston realises
892,"that Steven will not fight him. Changing tactics, disgusted with the"
893,"Englishman, Gaston disarms him with ease. Steven's sword clatters to"
894,the floor.) 
895,GASTON: Get out of here. 
896,STEVEN: Gaston 
897,GASTON: Get out! 
898,(Steven leaves and Gaston kicks the furniture in rage.) 
899,"MUSS: Gaston, what are you doing? "
900,"GASTON: Oh, you're having a very bad effect on me, my friend. I just"
901,spared that wretch's life. 
902,MUSS: What are you talking about? 
903,GASTON: That Englishman. 
904,MUSS: Steven? 
905,"GASTON: Yes, I caught him here. "
906,MUSS: What did he say? 
907,GASTON: Say? Nothing. 
908,MUSS: But why did he come back? 
909,GASTON: He was spying. I caught him going through your papers. 
910,MUSS: He must have had a message otherwise he'd never have come back. 
911,GASTON: I tell you he was going through your papers. 
912,MUSS: Where did he go? 
913,GASTON: How should I know? Probably back to that animal from Amboise. 
914,MUSS: Steven said he'd come back here if he found out something
915,important. Did he say anything? 
916,GASTON: Nothing! Well don't tell me you still trust him! 
917,"MUSS: Oh, for pity's sake go back to the Louvre. Go back and protect"
918,your Lord of Navarre. It's almost time for the curfew.
919,
920, [Street]
921,
922,(Steven finds himself alone in Paris once more. For
923,"a while he wanders the streets aimlessly, trying to work out what his"
924,next move should be. He cannot risk returning to the house of de
925,"Coligny until he's certain Nicolas is at home, and even then he cannot"
926,be sure that Gaston will not have poisoned Nicholas against him.
927,"Despite this, Steven know that it is vital he tells the"
928,Huguenots what he's learnt about the plot to murder the Sea Beggar. As
929,darkness falls he realises that he has no alternative but to return to
930,the house. The curfew is due and he needs shelter for the night. He
931,must hope that Nicholas will be prepared to listen to him. Steven is
932,retracing his route back to the house when he senses that he's being
933,followed. Steven hurries down a flight of steps then lies in wait in
934,the shadows for his quarry to reach him. The bells are tolling.) 
935,ANNE: Oh! 
936,"STEVEN: Anne, what are you doing following me? "
937,"ANNE: I'm sorry, Monsieur, I didn't mean any harm. "
938,STEVEN: What are you doing here? The curfew's ringing. Go back to the
939,house. 
940,ANNE: No. I can't go back there now. They'll know where to find me. I
941,want to come with you. 
942,"STEVEN: But you can't, I mean, and why? "
943,"ANNE: You were kind to me. You're the first one that ever was. Please,"
944,don't send me back there. 
945,STEVEN: I can't take you with me. I've nowhere to go myself. 
946,"ANNE: Well, I know Paris, I'll help you find somewhere. "
947,"STEVEN: Well, I. Yes. Anne, do you know who the Sea Beggar is? "
948,ANNE: What? 
949,STEVEN: Who is the Sea Beggar? 
950,"ANNE: I don't know, Monsieur. Why? "
951,"STEVEN: He's going to be killed tomorrow. All right then, if you insist"
952,"on coming with me, do you know where we can spend tonight? "
953,ANNE: We can't go to my aunt's. They'll be looking for me there. There
954,must be lots of places in Paris where no one would think of finding me.
955,
956,"STEVEN: Yes, of course, Preslin's shop. Do you know how to get to the"
957,Port Saint Martin? 
958,ANNE: Of course. 
959,STEVEN: Take me there. I've only been there once. I don't think I can
960,find it on my own. 
961,ANNE: I'll show you.
962,
963, [de Coligny's house]
964,
965, MUSS: Admiral. 
966,DE COLIGNY: You're working late. 
967,MUSS: I thought you were asleep. 
968,DE COLIGNY: Nonsense. I've been with the King. 
969,MUSS: Do you wish to give me some notes? 
970,"DE COLIGNY: No, not tonight. I think I've persuaded him. "
971,MUSS: You've got the King to agree to war with Spain? 
972,DE COLIGNY: It's possible. If he doesn't change his mind by the
973,"morning, we are to join with the Dutch. Do you know, Nicholas, after"
974,"I'd explained the situation to him, he turned to me and he said, if we"
975,"do ally ourselves with the Dutch, you, de Coligny, will go down to"
976,history as the Sea Beggar. The Sea Beggar. It's a title I'd be proud
977,of.
978,
979, Episode Three - Priest
980,of Death 
981, [Preslin's shop]
982,
983,"(Anne is searching for something to eat, and"
984,disturbs Steven as he sleeps.) 
985,"STEVEN: Oh, it's only you. What's the time? "
986,"ANNE: Oh, I'm sorry, Monsieur. I didn't mean to wake you, I, I "
987,STEVEN: Never mind. What time is it? 
988,"ANNE: It's dawn, Monsieur. The tocsin's rung. Curfew's over. "
989,STEVEN: And the Sea Beggar dies today. 
990,ANNE: Are we going to leave Paris now? 
991,"STEVEN: No. No, I'm sorry, Anne, but I must go back to the Abbot's"
992,house. 
993,"ANNE: No! Monsieur, no! "
994,STEVEN: I must! Now my friend should be there by now. He may know who
995,the Sea
996,Beggar is. 
997,"ANNE: If you go back there, they'll arrest you. "
998,"STEVEN: No, they won't. The Doctor should be able to stop them. "
999,ANNE: They'll recognise you before you can find him. The Captain of the
1000,Guard and Monsieur Colbert. 
1001,STEVEN: Hmm. Perhaps if I disguise. See if we can find some other
1002,clothes. 
1003,(They rummage through a chest of clothes.) 
1004,"STEVEN: Yes, well, this should do. "
1005,"ANNE: Ugh, but it's so dirty, Monsieur. "
1006,"STEVEN: Yes, well, never mind. Now, if I can find that hat. "
1007,ANNE: Monsieur? 
1008,"STEVEN: Oh, good girl. Yes, well, I don't think the Captain'll"
1009,recognise me in this.
1010,
1011, [Council Chamber]
1012,
1013,"(In the Council Chamber at the Louvre, King Charles"
1014,"is in consultation with his advisors,"
1015,"de Coligny, Toligny and Marshall Tavannes.) "
1016,DE COLIGNY: If we ally ourselves to the Dutch in their conflict with
1017,"Spain, the common cause will unify the country, and prevent further"
1018,civil strife. 
1019,"TAVANNES: Oh, surely the marriage between Henri of Navarre and His"
1020,Majesty's sister have already put an end to the disturbances? 
1021,DE COLIGNY: For how long? As I have pointed out frequently in this
1022,"chamber, it would take but one small incident and the whole of Paris"
1023,could be in uproar. 
1024,"TAVANNES: Incidents occur daily, yet still the city does not rise. "
1025,DE COLIGNY: If we allied ourselves with the Dutch even those incidents
1026,would not take place. 
1027,"CHARLES: My Admiral has a good point there. Pray accept it, Marshall,"
1028,and let us finish with this tedious business. 
1029,"TAVANNES: Your Majesty, France cannot afford this war. "
1030,CHARLES: So we are told frequently by our mother. 
1031,TAVANNES: The recent conflicts inside the country have brought us
1032,almost to ruin. There is no money to pay for the forces that would be
1033,needed to wage war with Spain. 
1034,"TOLIGNY: But is it not so that under the treaty signed at Loire, the"
1035,English will come to our assistance? 
1036,"CHARLES: Not you as well, my little Councillor? The Admiral and the"
1037,Marshall quarrel well enough without assistance. 
1038,"TOLIGNY: I apologise, Sire. I had hoped to end the deadlock between"
1039,them. 
1040,"CHARLES: It was good to hear a different voice. So, Elizabeth of"
1041,England has agreed to help us? 
1042,TAVANNES: Does anyone here trust her? She breaks more promises than she
1043,keeps. 
1044,DE COLIGNY: She has no love for Spain. 
1045,"TAVANNES: She has yet to come out into the open and say so. However, if"
1046,"Your Majesty is so eager to fight this war, perhaps we could raise the"
1047,money by leasing the Alpine hunting grounds to Italy? 
1048,"CHARLES: Do you mock me, Marshall? "
1049,"TAVANNES: Of course not, Sire, but the war will have to be paid for."
1050,Some sacrifices will have to be made. 
1051,CHARLES: We will give away nothing of our land. 
1052,"TOLIGNY: Besides, the bears there are French. They might not like to be"
1053,sold. 
1054,CHARLES: Ha! True. Next winter you will accompany us on our hunt. 
1055,"DE COLIGNY: Your Majesty, there is enough money in France to finance"
1056,the war. 
1057,CHARLES: Enough of this war. I am bored with Spain. 
1058,DE COLIGNY: But I beg to advise Your Majesty 
1059,"CHARLES: No, Admiral, please talk of it some other time. War is so"
1060,tedious. Move to matters closer to us. 
1061,"DE COLIGNY: If the King refuses to make war, may it please God that"
1062,"another war will not be forced on him, which it will not be easy to"
1063,renounce.
1064,
1065, [Preslin's shop]
1066,
1067," ANNE: No, Monsieur. I won't stay here alone. "
1068,STEVEN: Then you must come with me. 
1069,ANNE: But they'll arrest me at the Abbot's house. 
1070,"STEVEN: They won't. Now look, I'm almost certain that my friend is"
1071,pretending to be the Abbot. Now he'll make sure that no harm comes to
1072,you. 
1073,"ANNE: Oh, but Monsieur "
1074,STEVEN: Now you must trust me. I'll take care of you. 
