,Script
566,DOCTOR: He was taking Vraxoin. 
567,"RIGG: Oh, no. "
568, [First class corridor] 
569, RIGG: None of my passengers could have brought it
570,on board the ship. 
571,DOCTOR: Dymond's ship? 
572,"RIGG: No, I've scanned it. Still, I'll scan the Empress again. "
573,"DOCTOR: Yes, the Vraxoin must be found. "
574,"RIGG: Yes, it's bad stuff. "
575,DOCTOR: Bad stuff? It's the worst. I've seen whole planets ravaged by
576,it while the merchants made fortunes. 
577,"RIGG: Your people knew it would be on board, did they? "
578,"DOCTOR: What, my people? "
579,"RIGG: Well, you're an agent, aren't you? "
580,DOCTOR: No! I'm the Doctor. I keep telling you that. 
581,"RIGG: Yes, but who do you work for? "
582,DOCTOR: Work for? I don't work for anybody. I'm just having fun. 
583,RIGG: Everybody works for somebody. 
584, [Empress bridge] 
585," RIGG: If there's any Vraxoin on board, it'll show"
586,up on the scan. 
587,"(Rigg presses buttons, and a schematic of the Empress comes up on the"
588,monitor. The scan is a pair of vertical lines slowly moving from bow to
589,stern.) 
590,DOCTOR: Can you check the whole ship with this? 
591,RIGG: Every nook and cranny. Nothing in the forward section. 
592,(The scan lines vanish briefly then restart.) 
593,DOCTOR: Secker kept his in the luggage area. I took what was left then
594,"someone took it from me. After stunning me, that is. "
595,RIGG: Who? 
596,"DOCTOR: Yes, who indeed. "
597,RIGG: Nothing. 
598,DOCTOR: Is there any possible shield against that scan? 
599,"RIGG: No, no, no. "
600,DOCTOR: Really? 
601,"RIGG: Well, any shield would be too small to hide any useful quantity"
602,of the stuff. 
603,"DOCTOR: Yes, a small thick tube. Very mysterious. "
604,RIGG: But this drug is hardly our most pressing problem. 
605,"DOCTOR: Yes, I know, I know. We've got to get the ships separated. "
606,"RIGG: Yes, but how to get through to the power unit? "
607,"DOCTOR: Yes. You know, there might be a way we can do it using my ship."
608,
609,RIGG: Your ship? 
610,DOCTOR: Yes. 
611,"RIGG: Yes, where is your ship, by the way? "
612,"DOCTOR: Oh, around. "
613,RIGG: Well there you go again. How do I know I can trust you? 
614,"DOCTOR: Yes. Or I you, Captain. "
615,"RIGG: Oh, that's hardly the point. "
616,"DOCTOR: Yes, but who's helping whom? "
617,"RIGG: All right, what do you want me to do? "
618,"DOCTOR: Right, when I give the word, I want Dymond to put his ship on"
619,"full power. Trust me, Captain. "
620, [Lounge] 
621, (Someone in heavy boots leaves Romana lying on the
622,floor just before Della comes in.) 
623,DELLA: Romana! Are you all right? 
624,ROMANA: I don't know. I think so. 
625,DELLA: What happened? 
626,ROMANA: Oh. I must have fainted. 
627,DELLA: Was it anything to do with the machine? 
628,"ROMANA: Yes. I was watching the projection, and then I. Oh. It isn't on"
629,anymore. I just felt hot. I must have fainted. 
630,DELLA: I asked you not to put that particular image on. 
631,"ROMANA: Yes, I know, but as I was on my own I thought I'd just have"
632,"another look. Besides, you assured me that it was perfectly safe,"
633,didn't you. 
634,DELLA: Of course. I'll tell you what. I'll get you something to drink.
635,You look quite pale. 
636, [Vending area] 
637, (Della goes through to the vending area just off
638,"the main lounge, opposite the projection, and punches buttons on the"
639,dispenser.) 
640,"RIGG: Ah, Della. "
641,"DELLA: Oh, hello, Captain. "
642,RIGG: That's just what I was after. 
643,(A mystery hand pours the contents of a small bottle into the dispensed
644,drink.) 
645,"DELLA: Oh, it's for Romana. She's fainted. I'll get one for you. "
646,(She takes out the glass and puts it on a table.) 
647,"RIGG: Fainted, you say? It wasn't something she saw, was it? "
648,"DELLA: No, I think she just felt hot. "
649,"RIGG: Oh, why don't I just take this one. "
650,DELLA: Help yourself. 
651,RIGG: Thanks. 
652,"(Rigg leaves with the dosed glass, and Della takes the fresh one back"
653,to the lounge proper.) 
654, [B deck] 
655, (The Doctor brings a piece of equipment out of the
656,"Tardis, with the power cord trailing inside.) "
657,DOCTOR: I want to get as close as possible. 
658,"K9: Predict only sixty percent chance of success, master. "
659,"DOCTOR: Tell me, K9, how is it that, how is it you always look on the"
660,black side of things? 
661,(The Doctor expands the equipment into a purple laser on an adjustable
662,stand.) 
663,"DOCTOR: Here am I, trying a little lateral thinking, and what do you"
664,do? You trample all over it with logic. 
665,"K9: It is a question of the localised power available, master. I"
666,predict 
667,"DOCTOR: Sixty percent. I heard you, I heard you. But it's worth a try."
668,"Now, come on. Let's go and find your mistress. Come on. Come on. "
669, [Empress bridge] 
670, DYMOND: I've got to be away soon or I'll lose my
671,contract. A year's work for nothing. Do you realise that? It's all your
672,"fault, Captain. You were off course. "
673,RIGG: And you shouldn't have been in that sector. 
674,"TRYST: Gentlemen, please. Blaming each other won't help anything. The"
675,only person who seems to be able to do anything constructive is the
676,"Doctor, and we must support him. "
677,"RIGG: Yes, yes. I just wish we knew more about him. You know he's got"
678,some bee in his bonnet about drug smuggling on the ship. 
679,TRYST: Drug smuggling? 
680,RIGG: Yes. There isn't any evidence to back up his suspicions. There
681,"isn't a trace of any drug anywhere on the ship at all. Still, I think"
682,that's the least of our worries. 
683,(And finished his dosed drink.) 
684, [Lounge] 
685, DOCTOR: Are you sure about that? That creature
686,came through the picture? 
687,ROMANA: Yes. 
688,"DOCTOR: You were right about this machine. It is unstable, and that"
689,creature's escaped from its electric zoo. I wonder where it came from? 
690,ROMANA: A planet called Eden. 
691,DOCTOR: Eden? 
692,ROMANA: Do you know it? 
693,"DOCTOR: Well, it rings a bell. "
694,(Tryst enters.) 
695,"TRYST: Ah, Doctor. I have a message for you. Oh, I'm so delighted that"
696,you are taking an interest in my CET machine. 
697,DOCTOR: I'm absolutely amazed. 
698,"TRYST: Yes. Well, it is rather impressive, isn't it. "
699,"DOCTOR: No, I mean I'm amazed at you, Tryst, using a machine like this"
700,when it's still so primitive. The whole thing's utterly unstable. 
701,"TRYST: Well, I value your opinion, Doctor. "
702,"DOCTOR: Good, good. I value my life and this machine makes me fear for"
703,it. 
704,TRYST: It does? 
705,DOCTOR: Yes. 
706,"TRYST: Well, what do you think is so wrong? "
707,"DOCTOR: Well, at a rough guess I'd say the spatial integrator,"
708,"transmutation oscillator, hologistic retention circuit. Shall I go on? "
709,TRYST: Yes. 
710,DOCTOR: Dimensional osmosis damper? 
711,"TRYST: Er, the what? "
712,DOCTOR: You mean you haven't even got a dimensional osmosis damper?
713,"Professor, you don't realise how unstable this machine is. "
714,"TRYST: Yes, yes, all right, Doctor. In spite of your interest, I have"
715,decided to shut it off until I've had a chance to make some
716,adjustments. 
717,"DOCTOR: Well, I'm delighted to hear it. "
718,"TRYST: Yes, no, no, and it doesn't matter what you are saying, I'm"
719,going to switch it off. 
720,DOCTOR: Good! 
721,"TRYST: Yes. Oh, I nearly forgot. "
722,DOCTOR: What? 
723,TRYST: The message. The separation of the ships. Dymond is waiting for
724,you. 
725,"DOCTOR: I'm on my way. Romana, off to the Tardis. I'll give you details"
726,later. Tryst! Don't you forget to switch that off. 
727, [Empress bridge] 
728, (Rigg is rather too happy with life.) 
729,"RIGG: You know what, Dymond? The Empress has eaten your ship. Ha ha!"
730,Eaten it. 
731,"DYMOND : I don't see why you find it so funny. After all,"
732,you stand to lose your Captaincy over this. 
733,"RIGG: Yeah, I know, I know, I know. I mean, that's funny in itself,"
734,isn't it. 
735,(The Doctor enters.) 
736,"DOCTOR: Stay there, K9. Stay there. Right then, Dymond. Ready for"
737,another try? I want you to put your ship on full power. Not now. When I
738,tell you. 
739,"DYMOND : Right, Doctor. "
740,"RIGG: Where are you going to be, Doctor? "
741,"DOCTOR: Here, if it's all right with you. Romana's in my ship. I can"
742,keep an eye on things from here. 
743,"RIGG: Oh, be my guest. "
744,DOCTOR: Thank you. Romana? 
745,"ROMANA : All ready, Doctor. "
746,"DOCTOR: Good, good. We're just waiting on Dymond. K9? "
747,"K9: Yes, master? "
748,"DOCTOR: Just in case your prediction is correct, go along to one of the"
749,blurred areas and take a reading for me. 
750,K9: Affirmative. 
751,DOCTOR: Good dog. 
752,K9: Success only sixty percent owing to factors of localised energy. 
753,"DYMOND : Ready when you are, Doctor. "
754,DOCTOR: Good. Start building up power. 
755,"RIGG: Well, I'll leave you to it, Doctor. I'm thirsty. "
756,(Rigg leaves.) 
757,"DOCTOR: Romana, get ready. What did you say? Romana, get ready. "
758,"(K9 arrives at an interface point, which clears. He trundles forward"
759,"towards a door labelled power unit, then it goes blurred again. He"
760,vanishes.) 
761,"DYMOND : I'll have to switch off, Doctor. My ship's"
762,breaking up. 
763,"DOCTOR: No, no. Come on, Dymond, now. Don't lose your nerve. We're"
764,almost there. Just a bit longer. 
765,"DYMOND : No, she won't take it! "
766,"DOCTOR: Romana, switch off. Something's wrong. I'll go and find K9."
767,He's taking a reading for me. 
768, [By the interface area] 
769, (K9 is at the power unit door when the Doctor
770,arrives at the blurred area.) 
771,"DOCTOR: K9? K9, where are you? K9? He must have slipped through. Good"
772,"boy, K9! "
773,A figure in passenger coveralls and dark glasses comes out of a door
774,behind the Doctor. He turns.) 
775,"DOCTOR: Ah, could I have a word with you, please? "
776,(The figure runs away. The Doctor follows. The figure runs into the
777,"lift, so the Doctor takes the stairs down. The figure gets out at a"
778,lower floor just before the Doctor gets there. The chase continues into
779,the passenger area.) 
780, [Passenger area] 
781," (The Doctor bursts into Passenger Pallets 67-90,"
782,to discover that the coveralls and glasses are what all the passengers
783,are wearing.) 
784,WOMAN: What's going on? 
785,DOCTOR: I'm looking for a man dressed just like you. 
786,MAN: When are we going to land? We've been stuck for ages. How much
787,longer? 
788,DOCTOR: Which way did he go? This way? 
789,MAN 2: Maybe that's the entertainment? 
790,(The Doctor's quarry goes out through the rear door. The Doctor follows
791,him through another compartment.) 
792,DOCTOR: Excuse me. 
793,(And another.) 
794,DOCTOR: Excuse me. 
795,(And another.) 
796,WOMAN 2: What's the meaning of this? Why aren't we going down to Azure?
797,
798,"DOCTOR: I promise you, everything possible is being done. "
799,WOMAN 2: But what are they doing about it? 
800,"DOCTOR: Here, have a jelly baby and don't forget to brush your teeth. "
801,(The running man gets back to the lift and heads back up. The Doctor
802,does not run up the stairs.) 
803, [By the interface area] 
804, (The man is waiting at the top of the stairs when
805,the Doctor arrives in the lift. He produces a gun then runs round the
806,corner to an interface area.) 
807,"DOCTOR: I only wanted a word with you, whoever you are. You took"
808,"something from me, old chap. I'd rather like to have it back. "
809,"(The man runs into the mist, and the Doctor follows.) "
810, [Lounge] 
811, (The drugged Captain Rigg is finding life highly
812,amusing at present.) 
813,"RIGG: Little ships in big ships. Ships in bottles. Russian dolls,"
814,that's what it's like. You remember those? 
815,(Tryst shakes his head.) 
816,"ROMANA: Yes, I do. I wonder if the people who made them realised they"
817,were making a model of the universe? 
818,RIGG: A what? Eh? 
819,"ROMANA: As a primitive concept, you know. "
820,TRYST: I don't think the Captain is in a mood to discuss philosophy.
821,"Can I get you anything, Rigg? A caffetine capsule, perhaps? RIGG: No,"
822,let's talk about life while I await my dismissal and eventual execution
823,for dereliction of duty and I really couldn't care less. 
824,"TRYST: Oh, come on, Captain. The Doctor may still come up with"
825,something. 
826,"RIGG: The Doctor. The enigmatic, almighty Mister Fix-it. He's failed"
827,again and I don't care about that either. 
828,ROMANA: Not yet. I'd better go and see what he's doing. 
829,"TRYST: Oh, please. "
830,(Romana leaves.) 
831,"RIGG: Hey. Hey, it's them. They're the ones who are doing the drug"
832,"smuggling, you know? So the Doctor isn't going to do anything at all,"
833,right? 
834, [In the interface] 
835, (They seem to be running forever.) 
836,"DOCTOR: I just want to talk to you. I promise you, you'll enjoy it."
837,Stop! 
838, [Lounge] 
839," RIGG: Okay, so the Doctor's an agent. Yes, that's"
840,it. He's a narcotics agent. 
841,"TRYST: And we must give him all the help that we can. Here, drink this."
842,"It'll make you feel better. There. And Romana, is she an agent too? "
843,"RIGG: What if she is? I mean, I don't care. What does it matter? I"
844,"mean, nothing matters at all. "
845, [By the lift] 
846, ROMANA: Doctor? 
847, [In the interface] 
848, (The mystery man jumps the Doctor from behind.) 
849,DOCTOR: What are you doing? 
850,"(He wrestles the Doctor to the ground, then the creature from the wall"
851,arrives.) 
852, [By the interface area] 
853, ROMANA: Doctor? Where are you? 
854,"(The growling can be heard, then the creature walks out of the mist."
855,"Someone shoots it several times before it backs away, then the Doctor"
856,crawls out.) 
857,ROMANA: Doctor! Are you all right? There's a creature in there. It's
858,horrible. We've got to get away. What were you doing in there? Come on!
859,
860,"DOCTOR: Romana, stop. Do you know I've just come through an interface?"
861,That's no mean feat. I'm not even sure I'm all here. 
862,ROMANA: You mean you've been right through to the other side? 
863,"DOCTOR: Yes, I have, I have. Did you see anyone while I was in there?"
864,"Coveralls, dark glasses. "
865,"ROMANA: Well, someone shot at that creature and drove it off. "
866,DOCTOR: It must have been the chap I was chasing. The fellow who jumped
867,"me in the luggage section. Still, I know something about him now. He"
868,dropped his radiation band in the struggle just now. Look. Volante. 
869,ROMANA: Tryst's ship? 
870,DOCTOR: Yes. 
871, [Lounge] 
872, (Tryst switches on the CET machine. It is set to
873,Eden. Della enters.) 
874,DELLA: What's the matter with Captain Rigg? 
875,"TRYST: Oh, I think he found the whole thing a little too much, but he'll be all right. "
876,DELLA: Good. I thought you told the Doctor you wouldn't use the CET
877,again? 
878,"TRYST: Ah, yes, but I'm using for his benefit, Della. "
879,DELLA: Oh? 
880,TRYST: Yes. The Doctor is looking for someone on this ship who is
881,carrying Vraxoin. 
882,DELLA: Vrax? 
883,"TRYST: Yes, Vrax. The Doctor is probably a narcotics agent, so we are"
884,all under suspicion. So I thought perhaps that we might put our own
885,"house in order, as it were. "
886,DELLA: How do you mean? 
887,"TRYST: Well, Della, I've been thinking about Stott, our sadly lamented"
888,"crewman and your close friend, and his strange behaviour on Eden. Might"
889,"it be him who discovered a new source of Vrax? But he died, of course,"
890,didn't he. 
891,DELLA: What are you suggesting? 
892,"TRYST: No, Della, I'm sorry to do this, but I must be certain about a"
893,"few things, not the least to eliminate the possibility that the Volante"
894,and my expedition was used to transport this detestable substance. Now
895,"let us assume, for a moment, that it was Stott. He must have had an"
896,accomplice. Someone who would take over from him when he died. 
897,DELLA: Are you accusing me? 
898,"TRYST: No, no, no, I'm not accusing you, Della. I'm just asking you."
899,Was it Stott? 
900,DELLA: Of course not. I knew him. He wouldn't do anything like that. 
901,"TRYST: Then why did he disappear for two hours on Eden, the day before"
902,he was killed? 
903,DELLA: I don't know. I don't know anything about that. 
904,TRYST: Of course. 
905, [First class corridor] 
906, DOCTOR: Rigg said Tryst and Della were the only
907,ones from the expedition to come aboard. 
908,ROMANA: A stowaway? 
909,"DOCTOR: Well, we have to ask Rigg. "
910,ROMANA: He's hit the bottle. 
911,DOCTOR: What? 
912,ROMANA: He doesn't care about anything anymore. He just laughs and
913,"giggles the whole time, sick grin on his face. "
914,"DOCTOR: Well, that doesn't sound like drunkenness to me. "
915,ROMANA: Vraxoin? Where from? 
916,"DOCTOR: Well, inside the projection set. It's the only place. Romana,"
917,we've got no choice. 
918,ROMANA: What do you want to do? 
919,DOCTOR: What we have to do. We've got to get inside that machine. Come
920,on. 
921,(Tryst comes round the corner behind them.) 
922,"TRYST: Ah, Doctor. Doctor, Rigg has told me about the drugs. "
923,"DOCTOR: Oh, really. "
924,"TRYST: Yes. Doctor, I believe I can help you over this problem. "
925,DOCTOR: You can? 
926,TRYST: Yes. Er. 
927,"DOCTOR: Romana, please. "
928,(Romana leaves.) 
929,"TRYST: Doctor, I'm very sad to say that I think the drugs were smuggled"
930,"on board my ship, and I'm pretty certain I know who it was. "
931,DOCTOR: You are? 
932,TRYST: Yes. One of my crew. But he was killed. But I think he passed
933,the drugs on before he died. 
934,DOCTOR: Yes. 
935,TRYST: Yes. To Della. 
936,DOCTOR: What! 
937,"TRYST: I question her, of course, but she wouldn't admit it. "
938,"DOCTOR: Well, maybe it's because she's innocent. How'd you know she did"
939,it? 
940,TRYST: Doctor 
941,(An alarm sounds.) 
942,DYMOND : Calling the Doctor. Would the Doctor please report to the
943,bridge immediately. 
944,"DOCTOR: Thank you, Tryst. "
945,(Tryst leaves the way he came. The Doctor walks round the corner to
946,Romana.) 
947,DOCTOR: Did you hear that? 
948,"ROMANA: Della, indeed. "
949, [Power unit] 
950, K9: Have located power unit. Awaiting
951,"instructions, master. "
952,(K9 sticks his laser out at the creatures surrounding him.) 
953, [Bridge] 
954, (The Doctor and Romana enter to find Dymond with
955,two black-leather clad men. The little peaked caps mark them out as
956,officious jobsworths even before they open their mouths.) 
957,"DYMOND: Ah, Doctor. This is Waterguard Fisk and Landing Officer Costa"
958,of the Azurian Excise. I've been telling them 
959,"DOCTOR: Good, good. Now listen. "
960,FISK: Can I see your ident plaque? 
961,"DOCTOR: Can I just tell you something, please? "
962,FISK: Let me see it. Now. 
963,DOCTOR: On this ship 
964,"FISK: The plaque, please, sir. "
965,"COSTA: (to Romana) And yours, please. "
966,ROMANA: I haven't got one. 
967,DOCTOR: Neither have I. 
968,FISK: That's extremely serious. 
969,DOCTOR: Drugs. Vraxoin. 
970,"FISK: Names and dates of birth. Come on, come on. "
971,ROMANA: Romana. 
972,FISK: Romana who? 
973,DOCTOR: Will you please listen? Someone aboard this ship is smuggling
974,drugs. 
975,COSTA: Name and date of birth. 
976,DOCTOR: Well how would I know? I don't even know who he is yet. 
977,COSTA: Your name and date of birth. 
978,"DOCTOR: Oh, well, I'm called the Doctor. Date of birth difficult to"
979,"remember. Sometime quite soon, I think. "
980,FISK: I would advise you not to play the fool with us. 
981,ROMANA: We wouldn't want to. 
982,DOCTOR: Would you please listen? Vraxoin is the biggest killer drug in
983,existence and it's on this ship! 
984,FISK: All in good time. 
985,DOCTOR: There's no good time. The criminals must be caught. 
986,FISK: Costa. 
987,COSTA: Right. I'll start with you. 
988,(Costa runs an electronic sniffer wand over Romana.) 
989,COSTA: She's clean. 
990,(It's the Doctor's turn.) 
991,DOCTOR: You're wasting your time. 
992,(Beep beep) 
993,FISK: What is it? 
994,COSTA: Vraxoin. Traces of it in his pocket. 
995,"FISK: So, the criminals must be caught, eh, Doctor? "
996,"DOCTOR: Oh, for heaven's sake, Fisk "
997,FISK: You're under arrest. 
998,DOCTOR: All right. Can I just say one thing at this moment? 
999,FISK: Well? 
1000,DOCTOR: It's simply that. Look! 
1001,"(The Doctor points to the monitor. Fisk and Costa turn, and the Doctor"
1002,and Romana run out.) 
1003,DOCTOR: We've only got a few seconds. 
1004,"(The Doctor hits the door close button, trapping Fisk, Costa and Dymond"
1005,inside briefly.) 
1006, [Lounge] 
1007, (The Doctor closes the door.) 
1008,"DOCTOR: Quick, Romana. CET machine, quickly. "
1009,ROMANA: It's running. 
1010,DOCTOR: Get me Eden. 
1011,(The Doctor blows the lock with his sonic screwdriver then takes a
1012,piece from the CET machine.) 
1013,ROMANA: Now what do we do? 
1014,DOCTOR: Test an old theory of mine. Come on. 
1015,ROMANA: But we can't. It's unstable! 
1016,"DOCTOR: Come on, Romana. We must, we must. "
1017,ROMANA: We'll get torn apart. 
1018,DOCTOR: We've got no alternative. Come on. Come on. 
1019,(He takes her hand and they run into the projection of the jungle of
1020,Eden.) 
1021, Part Three
1022,
1023, [Eden] 
1024," DOCTOR: Well, how do you like Eden? "
1025,ROMANA: I don't. 
1026,"DOCTOR: Might give us a few answer, though. "
1027,ROMANA: Which way? 
1028,DOCTOR: Let's go east. 
1029,ROMANA: How do you know which way is east? 
1030,"DOCTOR: Well, I don't. We'll go that way and we'll call it east. "
1031,ROMANA: Why not call it north? 
1032,"DOCTOR: All right, we'll call it north. "
1033,ROMANA: North-east? 
1034,(Something large roars nearby.) 
1035,"DOCTOR: (sotto) Can we go, please? "
1036,"(They tiptoe off into the dark jungle, followed by one of those"
1037,creatures.) 
1038, [Lounge] 
1039," (Fisk, Costa and Dymond get the doors open.) "
1040,FISK: Doctor! 
1041,(They stare briefly at the projection of Eden.) 
1042,"FISK: Come on, you may as well give yourself up. "
1043,COSTA: There must be another way out of here. 
1044,DYMOND: I don't know. 
1045,FISK: There's got to be. What's that? 
1046,DYMOND: It's a door. 
1047,FISK: It's locked. Get Tryst. 
1048,(Dymond leaves.) 
1049, [Eden] 
1050, ROMANA: How did you know we could get into the
1051,projection? 
1052,DOCTOR: The same way I knew we could get into the Tardis. Tryst doesn't
1053,"realise what he's stumbled on. At least, I don't think he has. "
1054,ROMANA: A relative dimensional field? 
1055,DOCTOR: Yes. All this is recorded on laser crystal. When it's played
1056,back 
1057,ROMANA: It's restructured on an intradimensional matrix. 
1058,"DOCTOR: Yes, well, roughly speaking. "
1059,"ROMANA: So without the dimensional osmosis damper, everything gets"
1060,mixed up together and we can just walk straight into the projection. 
1061,DOCTOR: Yes. 
1062,ROMANA: And anything else can just walk straight out. 
1063,DOCTOR: Yes. 
1064,ROMANA: I've never met such idiots as those customs men. 
1065,"DOCTOR: Idiots? They're worse than idiots, they're bureaucrats. They"
1066,"just exist to tangle people up, wrap them round and round in red tape"
1067,until they can't move. Romana? 
1068,ROMANA: Yes? 
1069,DOCTOR: I can't move. 
1070,(Roots are wrapping themselves around their legs. The Doctor has one
1071,round his throat. A giant Venus flytrap opens its mouth and starts to
1072,reel him in.) 
1073,"DOCTOR: Don't wriggle, don't wriggle. It'll realise it's got dinner. "
1074,ROMANA: Dinner? 
1075,DOCTOR: Yes. It eats people. 
1076,ROMANA: Doctor! 
1077,"DOCTOR: Quick, over there. The root. "
1078,ROMANA: Root? 
1079,"DOCTOR: Root, root! "
1080,"(Romana pulls a very big root over to the Doctor, who bites it. Green"
1081,"yuk spurts out and the plant relaxes its grip on them, then collapses.)"
1082,
1083,ROMANA: Are you all right? 
1084,DOCTOR: Yes. 
1085,ROMANA: Let's get out of here. 
1086,"DOCTOR: You know, that didn't taste at all bad. "
1087, [Lounge] 
1088, TRYST: I can't turn it off. The selector's gone.
1089,It's difficult to believe the Doctor would do this. Why? 
1090,"FISK: The man is a criminal, that's why. "
1091,TRYST: I don't see the logical connection. 
1092,"FISK: Well, criminals are like that. "
1093,TRYST: Oh. 
1094,"FISK: Now, this other exit, can you open it? "
1095,TRYST: It leads to the first class bathroom. The Doctor couldn't open
1096,"it, it opens by personal key. "
1097,FISK: It's the only way he can 
1098,(Tryst opens the door. Fisk and Costa go in to search for the Doctor.) 
1099,"TRYST: I think the Doctor is in serious trouble, Dymond. It's a pity."
1100,Such a brilliant mind. 
1101, [Eden] 
1102, (More nearby growls. The Doctor and Romana duck
1103,down by a large rock.) 
1104,ROMANA: Doctor? 
1105,DOCTOR: Shush. It's waiting for us to make any kind of sound. 
1106,(The creature lumbers slowly past.) 
1107,DOCTOR: (sotto) It's gone. Now take care. 
1108,(They take a few steps forward. The Doctor smiles then the creature
1109,leaps up in front of them. Romana squeals and they jump back. A man
1110,comes out from behind a plant and shoots at the creature.) 
1111,ROMANA: What was that? 
1112,"DOCTOR: I don't know. Hello there, thank you very much. We're terribly"
1113,grateful to you for saving our lives. 
1114,ROMANA: Who are you? 
1115,STOTT: The name's Stott. 
1116,DOCTOR: Stott! Stott of the Tryst expedition? 
1117,STOTT: Yes. 
1118,(The Doctor hands over the radiation band.) 
1119,"DOCTOR: Yours, I believe. I'm the Doctor, this is Romana. We're"
1120,travellers and 
1121,(Growls) 
1122,"DOCTOR: Come on, this way. "
1123,STOTT: I know a safe place. Follow me. 
1124, [Stott's module] 
1125, (Stott brings them into a prefabricated building
1126,"with diamond windows, shelves, table and chairs, bunk, and various bits"
1127,of equipment.) 
1128,"DOCTOR: Not bad, not bad at all. How long have you been here? "
1129,STOTT: A hundred and eighty three days. They left me for dead on Eden.
