,Script
0,
1,
2,
3,
4,
5,The Doctor Who Transcripts - The Dalek's Master Plan
6,
7,The Dalek's Master Plan
8, 
9,"Original Airdate: 13 Nov, 1966"
10,
11,
12,
13,
14,
15,
16,  (Transcribers
17,"note - There are only 3 video episodes of this story available, parts"
18,"2,5 and 10. The rest are audio only from the 2001 CD set.) "
19, Episode 1 - The
20,Nightmare Begins
21,
22,[Tardis] 
23,"(Escaping the carnage of Troy, the Doctor, Steven"
24,"and Katarina are safe aboard the Tardis, Vicki having decided to stay"
25,"behind. But Steven's battle injury's more serious than first appeared,"
26,"and blood poisoning makes him feverish. Katarina, the serving maid from"
27,"the palace of King Priam, stands by helplessly as the Doctor tries to"
28,"make Steven more comfortable. Steven lies on a divan, semi-conscious."
29,The Doctor is at the Tardis controls trying to work out where they may
30,"be heading whilst Katarina hovers, concerned.) "
31,KATARINA: He has a strange sickness. Can you not help him? 
32,"DOCTOR: I'm doing the very best I can, my child. Oh dear, dear, dear."
33,It is such a worry. This poison seems to be spreading throughout the
34,"whole of his system. Yes, we need a special drug. I shall have to land"
35,somewhere. 
36,KATARINA: What is that? 
37,"DOCTOR: Oh, we're slowing down, my dear. We're going to land in a"
38,moment. 
39,KATARINA: Can we have reached the place of perfection so soon? 
40,"DOCTOR: Ah, well, I rather doubt it. At least, that is, we shall be"
41,"stopping at a lot of places before that. Now, I want you to look after"
42,"Steven, if you will, and see that you keep that wound clean. Please?"
43,That's a good girl.
44,
45,[Kembel - Jungle clearing]
46,
47,(Bret Vyon is bent over a small transmitter as
48,large animals roar. Everyone say Hi! to Nicholas Courtney) 
49,"BRET: Five Zero Alpha to Charlo Charlo Egan, Five Zero Alpha to Charlo"
50,"Charlo Egan, come in! Charlo Charlo Egan, this is Five Zero Alpha, can"
51,you read me? Come in! 
52,"(Close by, Kurt Gantry lies on the ground, his leg in a crude splint."
53,He exchanges a look of despair with Vyon.) 
54,"BRET: Nothing! When we get back to Earth, I'll have every fool in CCE"
55,court-martialed! 
56,KURT: If we get back to earth. If Central Communications has gone dead
57,"on us, we haven't a hope! "
58,BRET: We're not dead yet. 
59,KURT: Don't fool yourself. They're out there looking for us right now.
60,"They'll find us, and then "
61,"BRET: All right, all right, they may well find us, but we've got to get"
62,through to Earth first or the whole solar system is finished. 
63,KURT: I know. I know. Try them again. 
64,"BRET: Five Zero Alpha to Charlo Charlo Egan, come in. Five Zero Alpha"
65,"to Charlo Charlo Egan, come in!"
66,
67,[Earth - Central Communications]
68,
69,"(Millions of miles away, in the central"
70,"communications control room on Earth, Vyon's call is registering on the"
71,"operations board. Unfortunately, the small flashing light that signals"
72,the incoming communication remains overlooked. The large room is
73,dominated by a map of the galaxy on one wall. Shaven-headed technics go
74,"about their tasks while the two duty officers, Roald and Lizan, return"
75,to their posts after a break.) 
76,"ROALD: So it's checkmate, isn't it? I want to see the Venus-Mars games."
77,"You want to see your hero,"
78,Mavic Chen. 
79,"LIZAN: (a woman) I just happen to admire him, that's all. Well, I'm"
80,"going to do some work now, even if you aren't. "
81,(Lizan takes an observation chart and moves across to the console.) 
82,"ROALD: I tell you what. If we tune into Channel 403, we'll get the"
83,news. That should cover both our requirements. Agreed? 
84,"LIZAN: Ah, but we may only get a report of what Mavic Chen said, not"
85,actually see him. 
86,ROALD: That's hardly likely. The Guardian of the Solar System is going
87,"away on holiday. He will, no doubt, say a few well-chosen words. Every"
88,well-chosen word will no doubt be transmitted. 
89,LIZAN: And what about the routine calls? 
90,"ROALD: Oh, you worry too much. The next one's Five Zero Alpha. "
91,LIZAN: Five Zero Alpha? 
92,"ROALD: It's not for another twenty minutes. Well, what about 403? "
93,LIZAN: Bring up 403 please. Five Zero Alpha? Is that the patrol out
94,looking for Marc Cory? 
95,"ROALD: Yes, the agent who disappeared near the planet Kembel. Probably"
96,"crashed, so they think. Hey, bring up the sound! It's Mavic Chen on"
97,holiday. 
98,CHEN : Yes. The mineral agreement with the fourth galaxy proved a
99,little more complicated than was at first expected. 
100,"INTERVIEWER : And as that has been concluded so successfully, I'm"
101,sure that no one will begrudge you little time off. Where are you going
102,to on this trip? 
103,CHEN : That I am keeping a secret. I hope to be able to get away
104,from all interviewers. I'm just going to climb aboard my Spar and drift
105,about the solar system. 
106,LIZAN: Drifting round the solar system! That's the life if you can get
107,it. 
108,"ROALD: Well, become a galactic politician and who knows? Maybe one day"
109,"you will. As far as I'm concerned, give me terra firma any day. "
110,"LIZAN: You are in a rut, my friend. Now if I had the latest Flip T-4, I"
111,
112,"ROALD: It's a trifle brash, isn't it? There are other space vessels,"
113,you know. 
114,LIZAN: You mean the Spar 740? 
115,"ROALD: Yes. If I had to travel around ultra-space, I'd think the 740."
116,"Elegance, plus ultimate technology. "
117,LIZAN: It hasn't got the speed. 
118,ROALD: Speed isn't everything. 
119,INTERVIEWER : Is there anything you would like to say to the
120,citizens before you depart? 
121,CHEN : Yes. It is my earnest hope that the solar system may
122,"continue along this path of peace, this path that was laid by the"
123,"signing of the non-aggression pact of 3975. Now, in this year of 4000,"
124,we can feel justly proud of that pact. May the past twenty five years
125,prove that they are the dawn of an everlasting peace which will spread
126,"throughout the universe. Let us go forward together, secure in the"
127,knowledge that the life ahead is built on the cornerstone of richer
128,"understanding, not only of the past or of the present, but also of the"
129,"future. And may it be this cornerstone, so firmly laid, be built upon"
130,"in brotherhood and bring peace, progress and prosperity to each and"
131,every one of us. 
132,INTERVIEWER : Thank you sir. I'm sure that all throughout our
133,system echo your thoughts. 
134,LIZAN: Even you must agree he's an impressive man. 
135,"ROALD: Yes, it's nice to hear his speech again. "
136,LIZAN: Cynic. 
137,LIZAN: Was that a flash? 
138,ROALD: Where? There's nothing coming through. 
139,LIZAN: I thought I saw one. 
140,ROALD: You're imagining things. 
141,"LIZAN: Okay, so I'm imagining things."
142,
143,[Kembel - Jungle clearing]
144,
145,(Vyon abandons the transmitter. Kurt is gazing
146,nervously into the jungle.) 
147,"KURT: They are out there, I know it. And they're getting closer. "
148,BRET: You're imagining things. Now shut up. 
149,KURT: Do you think I'm a fool? There's something out there and it's
150,close. 
151,"BRET: Look, I tell you "
152,KURT: Just listen. There. 
153,BRET: Shh! 
154,KURT: You heard it? 
155,"BRET: Yes. Come on, we've got to get out of here. "
156,KURT: I stay. 
157,BRET: What? But you know we can't fight them. Our weapons are useless
158,against those things. Now we must move out. 
159,KURT: How can I keep on the move with this? Have you got any more
160,bright ideas? All that will happen is I'll hit one of those spiked
161,plants. I nearly fell on one before. 
162,"BRET: We won't go fast, just keep moving. I'll make sure we avoid the"
163,Varga plants. 
164,"KURT: If I fall and hit one, you know what happens then. "
165,BRET: Don't be a fool! 
166,"KURT: That could be what happened to Cory. He tripped, pricked himself"
167,"on a thorn, and then he turned into one. "
168,"BRET: You're letting your imagination run riot again. Besides, we"
169,haven't seen any Varga that look like him. 
170,"KURT: Joke away, but you know I'm right. There's been no trace of Marc"
171,Cory anywhere. 
172,BRET: Perhaps they took him prisoner. 
173,KURT: You know they don't take prisoners. 
174,BRET: All the more reason for you to come with me. Now come on. 
175,"(Bret moves to help Kurt to his feet, but Kurt pushes him away"
176,angrily.) 
177,"KURT: This is no time for phony heroics. I'll just slow you down, and"
178,then we'll both get it. Now without me you've got a chance. It's not a
179,"good one, but it's a chance. Just stay alive and get that message"
180,through. 
181,"BRET: I'm not going without you, is that clear? "
182,KURT: Get out! Get out of here or I'll kill you now! 
183,"(Kurt presses his gun into Vyon's chest. Bret is shocked, but realises"
184,his friend is deadly serious and moves to pick up the transmitter
185,before walking to the edge of the clearing.) 
186,KURT: Bret. Good luck. 
187,"(Vyon nods briefly, then quickly turns and disappears into the jungle."
188,"Kurt moves awkwardly to a better defensive position, his gun levelled"
189,at the darkness of the forest.) 
190,"KURT: All right, I'm ready for you now. "
191,(There's no response from the depths of the jungle. Kurt stares around
192,"wildly, becoming more and more unsettled.) "
193,KURT: Where the devil are you? Come on! 
194,"(Behind him, there's a trembling of leaves, and a dark shape emerges"
195,"from the jungle. A Dalek. As Kurt falls lifeless to the ground, the"
196,second Dalek glides out of the forest and scans the area.) 
197,DALEK 2: One man remains. Find and destroy him! 
198,DALEK 1: I obey! 
199,"(The Daleks glide away. Dashing through the dark jungle, Bret Vyon"
200,dodges to avoid a couple of Varga plants but then trips and crashes to
201,"the ground, smashing his radio transmitter. Vyon picks up the useless"
202,piece of equipment and looks at it in despair. As he tries to work out
203,"what to do next, a strange noise disturbs him. At the edge of the"
204,"clearing, Bret watches in amazement as the Tardis materialises. He"
205,"approaches the blue box cautionsly, ducking back out of sight when the"
206,"door opens. The Doctor emerges, followed by Katarina.) "
207,KATARINA: Strange place. Can you find help here? 
208,"DOCTOR: I don't know my dear, but I must try. Now, I want you to stay"
209,here and look after Steven. I shall be as quick as I can. 
210,KATARINA: I'll do as you ask. 
211,"DOCTOR: Splendid. Now you know which switch to pull to close the doors,"
212,"don't you, so I want you to do that straight away. I have my key to let"
213,myself in. 
214,KATARINA: Key? 
215,"DOCTOR: Yes. This, child. Key. This opens the door from the outside."
216,"Now go in please, and shut the door. Charming."
217,
218,[Outside the Tardis]
219,
220,"(With Katarina safely back inside the Tardis, the"
221,"Doctor sets off into the jungle. Once he's gone, Bret comes out of"
222,hiding and examines the Tardis doors. After a moment he turns and
223,hurries after the Doctor. 
224,[Kembel - Jungle]
225,
226,"(Before long, the Doctor catches sight of lights up"
227,"ahead. Moving closer, he sees a cluster of buildings in a wide valley,"
228,surrounded by dense jungle. i
229,DOCTOR: Ah. A city or perhaps a town. I wonder where we are? All I have
230,to do is get through that jungle and perhaps then I can get some help.
231,I must say it's a strange place to put a city. 
232,"(Bret steps into the Doctor's path, gun in hand.) "
233,BRET: Keep absolutely still. 
234,DOCTOR: What is it you want? 
235,BRET: The key. 
236,DOCTOR: What key? 
237,BRET: Give me that key or I'll kill you.
238,
239,[Tardis]
240,
241,(Steven has regained consciousness.) 
242,KATARINA: The Doctor will return very soon. He will get help. 
243,STEVEN: Where are we? 
244,KATARINA: On our way through the underworld. 
245,"STEVEN: What? Look, I don't understand. Vicki. Troy. Oh. You helped me"
246,when that Trojan 
247,KATARINA: Deep calm. You must rest. 
248,STEVEN: Did the Doctor bring you on board? 
249,KATARINA: Yes. We all make the journey together. 
250,STEVEN: Who are you? 
251,KATARINA: Katarina. I served as handmaid to the High Priestess
252,Cassandra. But you must rest. The Doctor will bring help. Don't ask any
253,more questions. 
254,"STEVEN: I, I want. "
255,(Steven passes out again as the doors open. Katarina turns in surprise
256,to see Bret enter the Tardis.) 
257,KATARINA: Did the Doctor sent you? 
258,BRET: That's right. The old man sent me. 
259,KATARINA: Have you bought help? 
260,"BRET: This is fantastic. You, what's your name? "
261,KATARINA: Katarina. Did the Doctor send you to cure the sickness? 
262,"BRET: Yes, but we must shut the doors first. The old man said you knew"
263,the switch. 
264,"KATARINA: Yes, here. "
265,"(As Katarina closes the doors, Bret continues to gaze around the"
266,outsized Tardis interior in amazement.) 
267,"BRET: What sort of craft is this? I've seen most, but nothing like"
268,this. From the outside it looked so small. How do you work this thing? 
269,KATARINA: Only the Doctor works his temple. 
270,BRET: His what? 
271,(Bret tries a few switches.) 
272,KATARINA: You must help Steven. 
273,"BRET: Yes, yes, of course I'll help Steven, but we must get back to"
274,"Earth first. I explained this to the old man, the, er, Doctor. "
275,(But the agent only succeeds in unknowingly activating the exterior
276,scanner.) 
277,"KATARINA: We can't go back to Earth, we've left it. "
278,BRET: That means we can get back? 
279,"(Coming round once more, Steven struggles to understand what's"
280,"happening. On the scanner, he can see the Doctor approaching outside.) "
281,"BRET: Katarina, are you sure you don't know how to work this? "
282,KATARINA: How could I know? It belongs to the Doctor. 
283,"BRET: The old man said this was no ordinary ship, and he was right."
284,
285,[Outside the Tardis]
286,
287,"(Outraged but unharmed, the Doctor has returned to"
288,the Tardis.) 
289,"DOCTOR: So, you'd use physical violence, would you? You don't know what"
290,"you've let yourself in for. So you've left the key in the door! Well,"
291,"well, that's the first big mistake, isn't it? Yes, very foolish. Very"
292,"foolish indeed, young man. Well now, it's brain, or brawn rather,"
293,"versus brain? I've got you beaten from the start, young man! "
294,[Tardis]
295,
296,(Bret is still trying to make sense of the Tardis
297,controls when Steven attacks him with a spanner.) 
298,KATARINA: Steven?
299,
300,[Outside the Tardis]
301,
302,"(Outside, the Doctor is distracted by a roaring"
303,overhead.) 
304,DOCTOR: I wonder if that spaceship has anything to do with that violent
305,"young man, or any connection with that city below. Yes, there are one"
306,or two questions I must have answered. 
307,[Reception hall]
308,
309,"(In the reception hall of the city, a Dalek reports"
310,to the Dalek Supreme.) 
311,DALEK 2: Control reports space vessel 1-11 in landing circuit. 
312,BLACK: Is all prepared? 
313,DALEK 2: Everything is ready. 
314,(The Black Dalek waits to greet the new arrival.)
315,
316,[Tardis]
317,
318,"(When Bret comes round he has a splitting headache,"
319,and finds himself unable to move.) 
320,DOCTOR: (chuckles) I doubt that you'll be able to get out of there in a
321,"hurry, my friend. "
322,BRET: What is it? 
323,"DOCTOR: Oh, it's a little invention of mine, I call it the magnetic"
324,chair. It has a forcefield strong enough to restrain a herd of
325,"elephants, so I wouldn't waste your energy trying to escape. You will"
326,stay there until I direct otherwise. 
327,"(The Doctor crosses over to Katarina, who is tending to Steven.) "
328,"DOCTOR: How is he, my dear? "
329,KATARINA: He's asleep. 
330,"DOCTOR: Yes. Oh, by the way, I've found a city. And just as I was about"
331,"to ascertain it's locale, that young ruffian set about me. "
332,KATARINA: Can you get help for Steven? 
333,"DOCTOR: Oh yes, I hope so. Just a minute. That young man, did he say"
334,anything? 
335,KATARINA: No. 
336,"DOCTOR: That's strange. Yes, I shall have to cross-examine him when I"
337,"get back. But don't worry, he's quite safe. Our guest is quite unable"
338,to move until I press that little switch at the back. So you're quite
339,"safe. Yes, he's quite harmless. Oh, and quite comfortable, I hope? "
340,[Kembel - Jungle]
341,
342,"(Leaving the Tardis, the Doctor struggles through"
343,"the thick jungle towards the city, oblivious to the dangers around him."
344,"Narrowly avoiding a Varga plant, he approaches the city walls and"
345,stumbles across a humanoid skeleton still covered in scraps of
346,clothing. The Doctor examines the body quickly.) 
347,"DOCTOR: Well, I wonder. Is this the solar system? "
348,(A spool of tape is lying discarded a few feet away.) 
349,DOCTOR: It's very strange. 
350,"(Pocketing the tape, the Doctor continues on his way.) "
351,"DOCTOR: Yes, strange indeed. Well. "
352,[Reception hall]
353,
354, (The spacecraft that the Doctor observed lands at
355,the Dalek spaceport.) 
356,DALEK 2: Space vessel 1-11 touch down completed. 
357,BLACK: Excellent. I will await our guest here. 
358,"(Concealing in the shadows by the landing area, the Doctor is horrified"
359,by what he sees.) 
360,DOCTOR: Daleks!
361,
362,[Tardis]
363,
364,(Steven's fever is getting worse. Katarina sits at
365,his side pressing a cool cloth to his brow.) 
366,"BRET: What's the matter with him? I said, what's the matter with him? "
367,KATARINA: He's sick. The Doctor says he's poisoned in the blood. 
368,BRET: There are some tablets in the pouch of my belt. Give him two. 
369,KATARINA: But you're an enemy. The Doctor's gone to get help. 
370,"BRET: He won't find any on this planet, believe me, so why not try the"
371,tablets? I hate to see anyone die through stupidity. 
372,KATARINA: I do not understand you. 
373,"BRET: For heaven's sake, girl, take the tablets and give them to him! "
374,KATARINA: All right. 
375,BRET: Now you're showing some sense. 
376,KATARINA: Here? 
377,BRET: Yes. It's all right. I won't harm you. This chair of the Doctor's
378,seems to be everything he claimed. All right. The tablets are in that
379,tube. 
380,KATARINA: Are these tablets? 
381,BRET: What do they look like? Take two and put them in his mouth. They
382,dissolve quickly and take effect almost immediately. Praise be that
383,you're not nursing me! It's all right. He'll be all right now. You can
384,leave him alone. 
385,"KATARINA: If you're wrong, the Doctor will be angry. I've disobeyed"
386,him. 
387,"BRET: If Steven, or whatever his name is, recovers, you'll be forgiven."
388,and if the Doctor gets back here soon. 
389,"(Glancing up at the scanner, Bret sees a Dalek enter the clearing.) "
390,BRET: (sotto) No!
391,
392,[Reception hall]
393,
394,(The Doctor continues to watch the Daleks in the
395,reception area.) 
396,DALEK 2: Our new ally approaches! 
397,"(The Dalek's visitor comes into sight. Tall, distinguished, stern yet"
398,almost benign looking with grey flecked beard and slightly oriental
399,"appearance, and eyebrows permanently arched quizzically, it is Mavic"
400,"Chen, Guardian of the Solar System.) "
401,BLACK: We welcome you as we welcome all allies of the Daleks. 
402,"CHEN: I am honoured to be here, and to be part of your plan to conquer"
403,Earth and all the planets in the solar system. 
404,(The Daleks lead Chen from the reception hall and into the city. With
405,"great urgency the Doctor edges away from the city walls. Half running,"
406,"half stumbling, he retraces his steps through the jungle back to the"
407,Tardis.)
408,
409,[Outside the Tardis]
410,
411,"(Reaching the edge of the clearing, the Doctor"
412,stops in his tracks. Something is wrong. The door of the Tardis is
413,"ajar, and as he watches, a Dalek appears from behind the ship, followed"
414,by two more.)
415,
416,Episode 2 - Day of
417,Armageddon
418,(from the 'Lost in Time' DVD) 
419,[Outside the Tardis]
420,
421, DALEK 1: Inform base security that a further
422,intruder craft has been located. 
423,DALEK 2: I obey. 
424,DALEK 1: Security patrols five and seven will converge on this area.
425,Priority alert. Invaders to be located and destroyed. 
426,"(Deeply concerned for his companions, the Doctor edges back deeper into"
427,"the cover of the jungle. In the clearing, the Daleks receive their new"
428,orders.) 
429,DALEK 1: A message from the Dalek Supreme. Operation Inferno to be put
430,into execution at once. 
431,DALEK 2: Inform all units. Evacuate patrols to safety areas. Confirm
432,"with units in position. On confirmation, start abbreviated countdown"
433,for Operation Inferno.
434,
435,[Conference room]
436,
437,"(Mavic Chen is seated in solitary splendour,"
438,"writing left to right then right to left, at the head of the huge"
439,"table. Having missed the preliminary sessions of the conference, he's"
440,"spent the last hour studying transcripts of the meeting. As Chen reads,"
441,a humanoid creature wearing a full length black cloak and hood with
442,slanting gashes for eye holes sweeps down the entrance ramp into the
443,"room, a sinister menacing figure. He approaches Chen who looks up, his"
444,concentration disturbed.) 
445,"ZEPHON: Mavic Chen, Guardian of the Solar System? "
446,CHEN: Yes? 
447,"ZEPHON: I am Zephon, Master of the Fifth Galaxy. "
448,"CHEN: Of course. I had hoped to meet you once before, at the"
449,Intergalactic Conference of Andromeda. 
450,"ZEPHON: I did not attend, and now you know the reason. The Daleks held"
451,a separate council at the same time. None of us of the outer galaxies
452,went to yours. 
453,CHEN: Except Trantis. 
454,ZEPHON: We agreed to send a delegate in order that the conference
455,should not become suspicious. 
456,CHEN: I've been reading the reports on the previous meetings here. The
457,Daleks have evolved a most interesting plan. 
458,ZEPHON: We of the outer galaxies have contributed to it also. 
459,CHEN: Of course. But you must admit the Daleks have a genius for war. 
460,"ZEPHON: That is so. However, one thing surprises me. That you, Guardian"
461,"of the Solar System, have agreed to become one of us. "
462,"CHEN: Why the surprise? As you say, I am Guardian of the Solar System."
463,"But that is nothing more than a part, however influential, of one"
464,galaxy. Would you be satisfied with just a part of a galaxy? 
465,ZEPHON: The solar system is exceptional. In its power lies influences
466,far outside its own sphere. Surely by joining with the forces
467,"determined to destroy that power, you mark yourself up as a supreme"
468,traitor? 
469,CHEN: Traitor? (laughs) An archaic word for so advanced a man as
470,yourself. Considering that the planet Fisar and the Embodiment Gris
471,"have both, at different times, tried to depose you, do you still"
472,maintain that you're the mouthpiece for your own galaxy? 
473,"ZEPHON: I do, now that I am all-powerful with my position. "
474,CHEN: True. But then you do not understand the conflicting powers
475,within our solar system. Now let us go and take some air. This is
476,hardly the time or the place for so serious a discussion. 
477,ZEPHON: But first we must 
478,CHEN: Some air. 
479,"(Unaware that their conversation has been monitored, Chen and Zephon"
480,leave. 
481, [City] 
482, (A Dalek reports their exchange to the Dalek
483,Supreme) 
484,BLACK: Report. 
485,DALEK 1: Guardian of the Solar System Chen must be watched. His
486,ambitions exceed his usefulness. 
487,"BLACK: When he has served his purpose, he, like the others, will be"
488,eliminated. No power in this universe can stop the Daleks.
489,
490,[Kembel - Jungle]
491,
492,(When Steven awakes he is confused to find himself
493,in the jungle.) 
494,STEVEN: Where's the Doctor? 
495,KATARINA: He will be here soon. 
496,STEVEN: I don't understand. Where are we? I can't think straight. 
497,"KATARINA: You must rest. The tablets I gave you have made you better,"
498,but you must still rest. 
499,STEVEN: Tablets? What's going on here? What are we doing out here in
500,the jungle? 
501,KATARINA: We had to leave the temple. The Tardis. The evil ones came. 
502,STEVEN: Evil ones? 
503,KATARINA: He called them the Daleks? 
504,STEVEN: Daleks! 
505,"(Still weakened by his fevers, Steven drifts back into unconsciousness."
506,Katarina watches over him with some concern when a small sound behind
507,her makes her turn. The bushes part and the Doctor emerges.) 
508,DOCTOR: Katarina! 
509,KATARINA: My lord. 
510,DOCTOR: Doctor. Doctor. What are you both doing here? 
511,KATARINA: The evil ones searched for us but Bret helped us. He said
512,they were evil. 
513,"DOCTOR: Yes, well, whoever this Bret is, he's quite right. The Daleks"
514,are evil things. 
515,KATARINA: Bret is the man you put in your magic chair. 
516,DOCTOR: What? That young ruffian? 
517,KATARINA: But he helped us. 
518,DOCTOR: And you released him? 
519,KATARINA: Was I not right to do so? When the evil ones came he said we
520,had to flee from your temple. 
521,"DOCTOR: Girl, my Tardis, child, my Tardis. Yes, you were right. I mean,"
522,he wasn't to know that you were quite safe away from the Daleks in
523,there. How is this young man? 
524,"STEVEN: I'll be all right in a minute or two, thanks, Doc. "
525,"DOCTOR: Good, good, good. "
526,"KATARINA: Bret says the time is four thousand, and he came here and"
527,only just got away from the evil ones. He gave Steven some white
528,"tablets, and he's almost well again. "
529,"DOCTOR: I see, I see. Yes, and I clamped him in that chair, and he's"
530,"the very fellow with the antitoxin. Well, young man, you'd better pull"
531,yourself together. We've got some work to do. 
532,"(Hiding in the bushes, looking down into the clearing towards the"
533,"Tardis, Bret watches as two more Daleks, both carrying flame-throwing"
