,Script
2089,for the past. 
2090,CAROL: All that matters now is the present. 
2091,"DOCTOR: Splendid. Now sir, the antidote. I wonder if "
2092,(They move off out of shot) 
2093,JOHN: I remember another girl. 
2094,"SUSAN: Oh, that's Barbara. We both found you. She's up in the"
2095,spaceship. 
2096,JOHN: Oh I see. 
2097,"SUSAN: John, all the time you were ill, you were trying to warn us of"
2098,something. 
2099,JOHN: There was a Sensorite who was dangerous. I must try and remember
2100,what happened. 
2101,(The Administrator sneaks in quietly) 
2102,"JOHN: I know there was a plot. Yes, that's it. Someone was plotting"
2103,against you 
2104,ADMINISTRATOR: And this Sensorite. Can you identify him? 
2105,JOHN: No. 
2106,ADMINISTRATOR: Is he in this room? 
2107,"JOHN: No. There was something particularly odd about his clothes, I"
2108,remember. Exactly what 
2109,"ADMINISTRATOR: Yes, it must have been the Sensorite who just died. "
2110,SUSAN: Yes. I suppose it must. 
2111,ADMINISTRATOR: The First Elder wishes to talk to the Doctor. You will
2112,inform him. 
2113,SUSAN: All right. 
2114,(The Administrator leaves) 
2115,JOHN: He's not very friendly. 
2116,"SUSAN: Well, he's only just become Second Elder. I should think he's"
2117,trying out his new authority. 
2118,CAROL: I wouldn't like to cross him. 
2119,(Across the lab) 
2120,DOCTOR: And what is this little collection of things here? 
2121,SCIENTIST: Left behind by the humans that were killed in the spaceship
2122,explosion. 
2123,DOCTOR: I see. 
2124,"IAN: Oh, look at these, Doctor. Family snapshots. Look. "
2125,"DOCTOR: Yes, now just a moment. This is rather important. This is a"
2126,rough plan of the aqueduct. 
2127,SCIENTIST: One of the human beings was very interested in the aqueduct.
2128,
2129,DOCTOR: Is that so? 
2130,"SUSAN: Grandfather, the First Elder wants to talk to you. "
2131,"DOCTOR: Oh, yes. I have a couple of questions for him. "
2132,SCIENTIST: This is only a sketch. I can let you have a plan in detail
2133,if you need. 
2134,"DOCTOR: Very valuable, very valuable. "
2135,SCIENTIST: The City Administrator can have no objection. 
2136,SUSAN: The City Administrator! Of course! 
2137,DOCTOR: What about him? What about him? 
2138,"SUSAN: John, you know you said that there was something odd about the"
2139,Sensorite? Was it his collar? 
2140,"JOHN: Collar. Yes, that was it. "
2141,"SUSAN: You see, the City Administrator. He was our enemy. "
2142,"IAN: What, the one who's just been made the Second Elder? "
2143,"SUSAN: Yes! When John was ill, he must have given himself away. "
2144,IAN: Yes. He was certainly pretty odd with me. 
2145,"DOCTOR: If this is true what you say, Susan, there's trouble ahead for"
2146,us. That Sensorite has power now. 
2147,"IAN: Yes, and the worst of it is, we gave him the power. "
2148, [Disintegrator room] 
2149, ADMINISTRATOR: You were not to know that the
2150,Doctor had changed his coat. I managed your escape from prison and that
2151,is all that matters. 
2152,"ENGINEER: I am grateful, but what use am I now? "
2153,ADMINISTRATOR: I still have a task for you. You are accomplished in
2154,mechanical matters. 
2155,ENGINEER: Yes. What do you want me to do?  
2156,ADMINISTRATOR: (holding weapons) Can you remove the mechanisms but
2157,leave them looking perfect from the outside? 
2158,ENGINEER: Yes. 
2159,ADMINISTRATOR: Then see to it. 
2160, [Reception room] 
2161, IAN: It's no use telling him stories about the
2162,"Second Elder, Doctor. We've got to give him proof. "
2163,"DOCTOR: Yes, I quite agree. And the only way to get that proof is to go"
2164,back into the aqueduct. What about Susan? 
2165,"IAN: Look, why don't you ask the First Elder if we can have Barbara"
2166,down here again. 
2167,DOCTOR: A good idea. 
2168,1ST ELDER: Gentlemen. Be seated. 
2169,"DOCTOR: Yes, thank you. "
2170,"IAN: Well, sir, the Doctor and I have discussed this poison business,"
2171,and we are convinced that your water supply is being deliberately
2172,poisoned. 
2173,"DOCTOR: Yes, and what we propose to do, sir, is to go down into the"
2174,"aqueduct, find your enemies and stop them. "
2175,"1ST ELDER: Very well. But you will take light with you, and such arms"
2176,as we can provide. 
2177,DOCTOR: Thank you. We're making progress. 
2178,IAN: Barbara. 
2179,"DOCTOR: I wonder, sir, could I ask you a small favour? "
2180,1ST ELDER: Ask it. 
2181,"DOCTOR: We have a companion, a young lady, on the ship. Is it possible"
2182,for her to be brought down here in the Sensphere? 
2183,1ST ELDER: It will be arranged. 
2184,"DOCTOR: Splendid, sir. Splendid. "
2185,"WARRIOR: I have brought the weapons, sir. "
2186,1ST ELDER: Ah. Thank you. Warrior. Instruct them as to their use. 
2187, [Courtyard] 
2188, ADMINISTRATOR: It's done. I have arranged that the
2189,useless weapons shall be delivered to the humans. Hide yourself. 
2190,(Engineer leaves) 
2191,ADMINISTRATOR: What have you there? 
2192,"SCIENTIST: It is the plan of the aqueduct, sir. The Doctor asked for"
2193,it. 
2194,ADMINISTRATOR: Give it to me. I will deliver it. Return to your duties.
2195,
2196,"SCIENTIST: Thank you, sir. "
2197,(Scientist leaves) 
2198,"ADMINISTRATOR: The plan of the aqueduct. (Engineer reappears) Quickly,"
2199,change some of the routes on this and see that a messenger delivers it
2200,to the Doctor. 
2201,ENGINEER: It shall be done. 
2202,"ADMINISTRATOR: Now, not only shall they go down into the aqueduct with"
2203,"useless armaments, but they will be hopelessly lost as well. "
2204, [Reception room] 
2205, (They are looking at the weapons) 
2206,"IAN: Very simple to use, Doctor. "
2207,DOCTOR: Careful. 
2208,WARRIOR: The range is considerable. The ray paralyses up to a distance
2209,of thirty yards. 
2210,"DOCTOR: Yes, yes, splendid. And remember, dear boy, that I shall be"
2211,standing nearly next to you. I've never liked weapons at any time.
2212,"However, they're handy little things. Tell me, how long does this"
2213,paralysis last? 
2214,WARRIOR: One hour. 
2215,"DOCTOR: Fine, fine. These weapons are splendid, sir. And without a"
2216,doubt they'll help us to make success. 
2217,1ST ELDER: And yet I do not envy you your adventure. I still wish I
2218,could dissuade you. 
2219,"DOCTOR: Yes, and that brings me to another problem. My granddaughter,"
2220,Susan. She's bound to want to come with us. 
2221,"IAN: I don't think she ought to, Doctor. "
2222,"DOCTOR: No, I quite agree with you, my boy. We must go and not tell"
2223,"her, and save any arguments. I wonder, sir, would you mind keeping a"
2224,small secret until we're well and truly away? 
2225,1ST ELDER: Very well. 
2226,"DOCTOR: Yes, thank you. After all, there's no danger now we have these"
2227,"protectors, and I'm sure we can settle our little business in an hour"
2228,or two. 
2229,"1ST ELDER: Ah, the map of the aqueduct. "
2230,"DOCTOR: Oh, excellent, excellent, my dear sir. "
2231,"IAN: Well, let's go and make an end of it, Doctor. "
2232,DOCTOR: Are you quite sure you're up to it? 
2233,IAN: Quite. 
2234,DOCTOR: Splendid. Lead the way. Sir. 
2235,(Ian and the Doctor leave) 
2236,"WARRIOR: They are brave people, sir. "
2237,1ST ELDER: We will not regret having known them. 
2238,"WARRIOR: I am glad they were innocent of killing the Second Elder, sir."
2239,
2240,"1ST ELDER: Yes, I am still anxious about that. You realise that if they"
2241,"did not kill my advisor, then he must have been killed by a Sensorite. "
2242,WARRIOR: But who would do such a thing? 
2243,"1ST ELDER: Who, yes, but also I ask myself, why was it done? "
2244, [Laboratory] 
2245, (Food is laid out on low tables) 
2246,JOHN: I've never felt so hungry. 
2247,"CAROL: Oh, won't it be wonderful when we get back to the Earth, John?"
2248,"How I long for a thick, juicy steak. "
2249,"JOHN: Well, you'll just have to make do with a small juicy fruit. "
2250,SUSAN: I wonder where they've gone to? I don't know what they're
2251,talking about all this time. 
2252,"CAROL: Oh, I expect they're arranging for our return to the spaceship. "
2253,(Ian and the Doctor arrive at the aqueduct and go into the tunnel to
2254,the caverns) 
2255,CAROL: I think I'll go over to the Palace of the Elders and try and
2256,hurry them up. 
2257,"SUSAN: Oh, would you, Carol? Thank you. "
2258,JOHN: Tell them I'm starving. 
2259,CAROL: All right. 
2260,(Carol leaves) 
2261,"SUSAN: John, I'm so happy that you're better now. So's Carol. Well, you"
2262,can see that for yourself. 
2263,"JOHN: Hmm. She's had a bad time. You know, I've a feeling that we'll"
2264,both give up space travelling when we get back to Earth. 
2265,"SUSAN: Oh, and get married? "
2266,"JOHN: She's all I really care about. Come on, let's eat. I'm tired of"
2267,waiting. 
2268," (over in the Palace of the Elders Courtyard, Carol"
2269,is grabbed from behind and dragged off.) 
2270, Episode Six - A
2271,Desperate Venture 
2272, [Disintegrator room] 
2273, (Carol is dragged into the room and thrown to the
2274,floor) 
2275,CAROL: Why are you doing this? 
2276,ADMINISTRATOR: Pay attention to me. You write a letter to the man John.
2277,
2278,CAROL: I certainly will not. 
2279,ADMINISTRATOR: Argument is a waste of time. Two of your friends have
2280,gone up into the spaceship. They cannot help you. Two of the others
2281,have gone down into the aqueduct. 
2282,CAROL: The Doctor and Ian? 
2283,"ADMINISTRATOR: Yes. They cannot help you. The other two, the man John"
2284,"and the girl Susan, are waiting innocently in the laboratory for you."
2285,Your party is divided. 
2286,CAROL: What do you want me to do? 
2287,ADMINISTRATOR: Write to the man John. Tell him you have gone up into
2288,"the spaceship. In this way, he will not suspect your disappearance. "
2289,CAROL: You can't force me to do this. 
2290,ADMINISTRATOR: I can see that you stay alive. Your life means nothing
2291,"to me. Let us strike a bargain. You will write the note, I will see you"
2292,live. 
2293,CAROL: Very well. 
2294,ENGINEER: Be wary of her. We cannot read her thoughts. She may 
2295,ADMINISTRATOR: Be quiet. Write! You will stay here and guard her. She
2296,will guarantee the success of all my plans. 
2297,ENGINEER: And I shall be given high office? 
2298,ADMINISTRATOR: I shall reward those who are faithful to me. 
2299,(The note reads - John. Have gone to the spaceship. Carol.) 
2300, [Reception room] 
2301, (The note has been delivered) 
2302,SUSAN: She couldn't have gone up to the spaceship. 
2303,"JOHN: Either you'd have seen her, or passed her on the way. "
2304,SUSAN: Yes. 
2305,BARBARA: She was obviously forced to write this. Whoever made her do it
2306,had no idea that I was being brought down here. 
2307,SUSAN: I bet the City Administrator had something to do with it. 
2308,JOHN: But why kidnap her? 
2309,"BARBARA: I should think the why's fairly obvious, wouldn't you? "
2310,"JOHN: No, I don't think it is, Barbara. We're on good terms with the"
2311,"First Elder, the Doctor's discovered an antidote for the poison and now"
2312,he and Ian are tracking down the cause of the trouble. 
2313,"BARBARA: Look, I've been away in the ship so maybe I can see things"
2314,more clearly. And I think we're being used by one of the Sensorites who
2315,wants to gain power. 
2316,SUSAN: You mean we're not just being attacked because we're from other
2317,planets? 
2318,BARBARA: No. 
2319,1ST ELDER: I greet you. 
2320,"BARBARA: Thank you. Your friends expressed so much concern about you, I"
2321,agreed to have you brought down to the Sensphere. 
2322,BARBARA: I'm afraid we must ask for your help. 
2323,1ST ELDER: If I can. 
2324,BARBARA: The Doctor and Ian are missing. Have you any idea where they
2325,are? Well please tell me. 
2326,1ST ELDER: There is a quality in human beings which intrigues me. Your
2327,concern for each other. I assure you the two men are safe. 
2328,BARBARA: You know where they are? 
2329,"1ST ELDER: Yes, but they asked me not to tell you what their plans"
2330,were. 
2331,SUSAN: That's Grandfather. 
2332,"BARBARA: Look, would you mind reading this letter? "
2333,1ST ELDER: I gave no such order. 
2334,"BARBARA: No, we didn't think you did. "
2335,1ST ELDER: Then why does your friend write what is not true? 
2336,JOHN: Because someone made her write it. 
2337,1ST ELDER: She could not travel without my ordering it. Where did you
2338,receive this? 
2339,"SUSAN: It was given to us in the courtyard, where the arches are. "
2340,JOHN: She is being held prisoner. 
2341,1ST ELDER: Not by any Sensorite. 
2342,JOHN: Of course she is! 
2343,"BARBARA: Quietly, John. "
2344,"SUSAN: Look, whatever she wrote this with wasn't dry. I put my thumb on"
2345,it and smudged it. 
2346,1ST ELDER: And this is her writing? 
2347,ALL: Yes. 
2348,JOHN: And that smudge means that it was written just before we got it. 
2349,1ST ELDER: Are you implying that your friend Carol is being held
2350,prisoner in this palace? I assure you she is not. 
2351,"BARBARA: Well, are there any other buildings in the vicinity? "
2352,"1ST ELDER: None, except the disintegrator room. "
2353,BARBARA: Where's that? 
2354,1ST ELDER: Below the courtyard. It is rarely used now. I cannot unravel
2355,"this mystery, but I can see that it worries you. As to your other"
2356,"friends, I must tell you. They have gone down into the aqueduct. "
2357,SUSAN: What? 
2358,1ST ELDER: They were given light and a good map. Also they were well
2359,armed. They can be in no danger. 
2360, [Cavern] 
2361," IAN: There's no doubt about it, Doctor. The inside"
2362,filament's been removed. These weapons are useless. 
2363,"DOCTOR: It's only one of our troubles, dear boy. Look at this map. It's"
2364,"no good to us. Look, all the lines have been altered. Somebody's been"
2365,jiggering around with it. 
2366,"IAN: We'll get out of here somehow, Doctor. "
2367,"DOCTOR: Yes, in time. But have we got that time? Remember, we brought"
2368,no food with us and the only water available is that poisoned water out
2369,there with Deadly Nightshade. A charming outlook. 
2370, [Disintegrator room] 
2371, CAROL: How long are you going to keep me here? 
2372,ENGINEER: That is not for me to say. 
2373,"CAROL: Look, I've had nothing to eat and I'm very thirsty. "
2374,ENGINEER: It is of no consequence. 
2375,CAROL: But I wrote the letter. 
2376,ENGINEER: But surely you did not think you would be released? All human
2377,creatures are naive. They live while they have a purpose. As soon as
2378,"that purpose is achieved, then their life has no value left. "
2379,"(John tries to sneak in, but is spotted. The Engineer grabs a power"
2380,lead) 
2381,ENGINEER: Stop. I've only to touch her with this and she will die. 
2382,JOHN: Don't be foolish. Put it down. 
2383,ENGINEER: No Sensorite should be humbled before a human creature! 
2384,(Carol pulls at the other end of the cable and the machine sparks and
2385,smokes) 
2386,JOHN: Throw it down. Throw it down! 
2387,(The Senior Warrior enters) 
2388,JOHN: Take him to the First Elder. 
2389,WARRIOR: I have already imprisoned you once. This time you will not
2390,escape. 
2391,"CAROL: Oh, John. "
2392, [Reception room] 
2393, 1ST ELDER: This is very serious. That Sensorite
2394,was imprisoned on my order. Now I find he has escaped and kidnapped one
2395,of the human beings. 
2396,ADMINISTRATOR: He is a menace to our society. 
2397,1ST ELDER: I agree. 
2398,ADMINISTRATOR: Let him be punished. 
2399,1ST ELDER: He shall be. We must also find who his accomplice is. 
2400,ADMINISTRATOR: Ah. So you believe that another Sensorite is working
2401,with him? 
2402,1ST ELDER: Obviously. He had to guard the girl Carol. Who then
2403,delivered the letter she was forced to write? 
2404,(Susan and Barbara enter) 
2405,1ST ELDER: What I cannot tolerate is accusation. I must have clear and
2406,definite proof. 
2407,"ADMINISTRATOR: Yes, sir. Clear and definite proof. "
2408,"1ST ELDER: Come in, my friends. You have been questioning this"
2409,Sensorite who has acted so treacherously? 
2410,"SUSAN: Yes, and what he told us is terrifying. "
2411,ADMINISTRATOR: Has he identified his accomplice? 
2412,BARBARA: No. 
2413,SUSAN: Not yet. 
2414,BARBARA: But he did say that the maps and the guns given to the Doctor
2415,and Ian are quite useless. 
2416,1ST ELDER: Outrageous. This Sensorite will die for this. 
2417,"SUSAN: Yes, but what about Grandfather and Ian? "
2418,1ST ELDER: What can I say? Lost and unarmed in the aqueduct. 
2419,BARBARA: I'm afraid that answer isn't good enough. 
2420,ADMINISTRATOR: Do not be insolent to the First Elder! 
2421,"BARBARA: Look, you must decide who your friends are, and save them. "
2422,1ST ELDER: There is nothing I can do. 
2423,BARBARA: Is there an authentic map to the aqueduct? 
2424,1ST ELDER: Yes. 
2425,"BARBARA: Well, if Susan and I can find a way to rescue them, will you"
2426,help us? 
2427,"ADMINISTRATOR: I am suspicious of these creatures, sir. They ask too"
2428,much. 
2429,"1ST ELDER: That other human being, the Doctor, he found a cure for our"
2430,people. He has placed his life in danger for the sake of the Sensorite
2431,"nation. Yes, I will give you all the help I can. "
2432, [Tunnels] 
2433," IAN: Well, whatever's out there hasn't attacked us"
2434,yet. 
2435,(Roaring sound) 
2436,"DOCTOR: Courage, my boy, both hands. Come on. "
2437,IAN: Doctor. Something moved slightly up ahead of us. 
2438,(The Doctor rolls up the map to make a club and gives it to Ian. He
2439,sneaks up on something or someone but they get away) 
2440,"IAN: Doctor, it was a man! I know it was. "
2441,DOCTOR: Are you sure? 
2442,IAN: Yes. Look. This came away in the struggle. 
2443,"DOCTOR: It looks like a shoulder flash. I-N-E-E-R. Yes, just as I"
2444,suspected. It must be one of those survivors from the spaceship that
2445,exploded. 
2446,IAN: Why should they come here? 
2447,DOCTOR: To hide and poison the water. 
2448,"IAN: Yes, but why poison the water in the first place. "
2449,DOCTOR: Let's go and ask him. 
2450, [Reception room] 
2451, (There's a scale model on a table) 
2452,BARBARA: This is the entrance to the aqueduct. 
2453,1ST ELDER: Yes. 
2454,"BARBARA: Tell me, do you think I could use one of your mind"
2455,transmitters? 
2456,1ST ELDER: You have my permission to try. But how will it help you? 
2457,"BARBARA: John and I will go down to the aqueduct, Susan will stay here"
2458,and direct us. 
2459,"SUSAN: Yes, then we can guide them both out. "
2460,1ST ELDER: My scientists tell me that you do not require the use of our
2461,mind transmitter. 
2462,"SUSAN: Well, I've always been able to read your mind, but only when you"
2463,allowed me to. 
2464,1ST ELDER: Your mind must be finely tuned. The frequencies covering the
2465,surface of the Sensphere are numerous. You must be able to break in on
2466,the major ones. 
2467,BARBARA: Well I can't. Do you mind if I try your invention? 
2468,1ST ELDER: Hold it to your forehead and try to close your mind to
2469,everything but the person to whom you wish to communicate. It is safe
2470,provided you do not allow your concentration to slip. 
2471,"BARBARA: All right. Susan, let's try a little experiment. "
2472,SUSAN: Right. (a moment of telepathy) The entrance to the aqueduct is
2473,there. 
2474,"BARBARA: It works. Well, there's no point in delaying. As soon as John"
2475,"and I reach the entrance, you start directing us. All right? "
2476,SUSAN: All right. Carol'll be here to help me. 
2477,"BARBARA: Good. Oh, by the way, I would like one of your warriors left"
2478,here with Susan. 
2479,"SUSAN: Yes, one that you trust implicitly. "
2480,1ST ELDER: I trust all Sensorites. You will be guarded safely. 
2481,"SUSAN: Thank you. Please find them, Barbara. "
2482,(Barbara leaves) 
2483,1ST ELDER: A very capable human being. 
2484,"SUSAN: Yes, she is. "
2485,"1ST ELDER: Gentle, yet with strong determination and courage. "
2486,BOTH: I was going to 
2487,"SUSAN: I was going to say, why do you trust your people? "
2488,1ST ELDER: Why do you want to make me doubt them? 
2489,SUSAN: Trust can't be taken for granted. It must be earned. I trust
2490,"you, but only because I know you. "
2491,"1ST ELDER: But Susan, our whole life is based on trust. "
2492,"SUSAN: Yes, and that might be your downfall. Look you don't trust the"
2493,"ground you walk on until you know it's firm, do you. So why trust your"
2494,people blindly? 
2495,"1ST ELDER: When I listen to you, you who are so young among your own"
2496,"kind, I realise that we Sensorites have a lot to learn from the people"
2497,of Earth. 
2498,"SUSAN: Grandfather and I don't come from Earth. Oh, it's ages since"
2499,"we've seen our planet. It's quite like Earth, but at night the sky is a"
2500,"burned orange, and the leaves on the trees are bright silver. "
2501,"1ST ELDER: My mind tells me that you wish to see your home again, and"
2502,yet there is a part of you which calls for adventure. A wanderlust. 
2503,"SUSAN: Yes. Well, we'll all go home some day. That's if you'll let us. "
2504,1ST ELDER: I think I will. 
2505, [Tunnels] 
2506, IAN: We could be going round in circles. 
2507,"DOCTOR: No, no, my boy. No, no, no, no. I'm marking these, the"
2508,"sections, the pipes. "
2509,IAN: Uncanny. It's so quiet. 
2510,DOCTOR: Yes. Perhaps they're preparing an ambush. 
2511,"IAN: You're a cheerful soul, I must say. "
2512,"DOCTOR: I assure you, dear boy, my spirits couldn't be higher."
2513,"Collecting evidence, circumstantial or otherwise, calculating it,"
2514,pursuing it until it's inevitable. It's fascinating. 
2515,(Ian is staring at a bearded figure) 
2516,IAN: Doctor. 
2517,"DOCTOR: Oh, don't interrupt, young boy. It's most irritating. "
2518,(Then the Doctor sees a figure too) 
2519,DOCTOR: Chesterton. 
2520,IAN: I know. I've been trying to tell you. 
2521,"DOCTOR: Yes, well, it's all right. Let's back up and perhaps we can"
2522,jump out on them. 
2523,(Then they realise they are caught between two people) 
2524,"IAN: You were right about the ambush, weren't you. "
2525,DOCTOR: Yes. Don't do anything to alarm them. 
2526,MAN 1: (nearest the Doctor) You have come at last. 
2527,DOCTOR: We came to find you. 
2528,IAN: That's right. 
2529,"MAN 2; Watch them, Number One. "
2530,MAN 1: We have been waiting for you. Are they all dead? 
2531,DOCTOR: Dead? 
2532,"IAN: The Sensorites, you mean? "
2533,"MAN 1: Yes, the Sensorites. Do you have a spaceship? "
2534,DOCTOR: Yes. 
2535,MAN 1: Are there more of you? 
2536,IAN: No. 
2537,MAN 2: No others in the channels at all? You haven't brought the
2538,Sensorites with you? 
2539,IAN: No. 
2540,DOCTOR: Wouldn't you like to leave these tunnels and go out into the
2541,sunshine again? 
2542,"MAN 1: No, they would hear our minds talking. Follow me. He is going to"
2543,talk to you. 
2544,"DOCTOR: Yes, I thought there'd be a third. "
2545,"MAN 1: Yes, the Commander. You'll have to talk to him. Follow me. "
2546,"(Meanwhile, John and Barbara arrive at the aqueduct, and Barbara"
2547,contacts Susan) 
2548, [Reception room] 
2549, SUSAN: They're entering the aqueduct now. It's a
2550,little indistinct. 
2551,"CAROL: Well, tell her to speak to you. You do the same. "
2552,"SUSAN: All right. Barbara, speak the words as you think them. Oh,"
2553,that's better. 
2554, [Aqueduct] 
2555," BARBARA: Yes, all right, Susan. We're to go"
2556,"straight ahead to start with, and then keep turning to the right. "
2557,JOHN: Right. I'll lead. 
2558, [Reception room] 
2559, SUSAN: They're beginning now. 
2560, [Tunnels] 
2561, MAN 1: You'll give us your word you're alone. 
2562,"DOCTOR: Oh, yes, definitely. "
2563, JOHN: There's something here. It's the Doctor's
2564,"map, all right. I remember the senior Scientist drawing it in the"
2565,laboratory. 
2566,BARBARA: But it's all screwed up. They must have realised it was
2567,useless. 
2568,JOHN: Shall we take it with us? 
2569,"BARBARA: Yes, we'll need it as proof that the maps were tampered with. "
2570, [Reception room] 
2571, 1ST ELDER: How is it progressing? 
2572,SUSAN: They haven't found them yet. 
2573,"CAROL: Well, at least they found the map. "
2574,"SUSAN: Oh, Barbara's talking to me again. "
2575, [Tunnels] 
2576, JOHN: No doubt about it. 
2577,"BARBARA: John says this is a fresh mark, probably made by the Doctor."
2578,"We're going to try and follow these marks, Susan. So instead of you"
2579,"directing us, we'll tell you what route we're going to take. "
2580,"JOHN: Let's hope they were made by the Doctor, that's all. "
2581,
2582,"(Elsewhere, the Doctor marks another pipe with chalk) "
2583,"DOCTOR: In case we have to make a run for it, my boy. "
2584,"IAN: I'm glad you're on my side, Doctor. "
2585, [Reception room] 
2586," SUSAN: That's right, Barbara. She's going down"
2587,this channel now. 
2588,1ST ELDER: And no harm has come to them yet. Perhaps the Doctor and Ian
2589,are chasing the creatures in the aqueduct. 
2590,SUSAN: Or they've been captured. 
2591, [Tunnels] 
2592," MAN 1: Wait here. The new arrivals are here,"
2593,Commander. 
2594,COMMANDER: This is the best news I've had for a long time. (shakes
2595,their hands) I'm very glad to see you both. Did you have a rough
2596,"journey? Yes, of course. I'm sure you must have done. Let's have"
2597,"something to sit down on, Number One. "
2598,"MAN 1: Yes, sir. They're very rough quarters here. You'll have to"
2599,excuse that. But I'm sure you're both used to battle stations by now.
2600,"Yes. Excuse me. Number Two, you can take over ammunition detail now."
2601,You'll find the new supplies all ready. Hide it in pipe number seven
2602,"this time. All right, carry on. "
2603,(Man 2 leaves) 
2604,COMMANDER: Number One? 
2605,"MAN 1: Yes, sir. "
2606,"COMMANDER: Organise a lecture for Number Two, will you? Civility isn't"
2607,"for me, you understand, it's for the uniform. Understood? "
2608,"MAN 1: Yes, sir. "
2609,"COMMANDER: Have to keep discipline up, you know. But they're all good"
