,Script
1784,RAGO: Place Dominator Toba under restraint. 
1785,"TOBA: Quark, return to the prisoners. "
1786,(The Quark is confused.) 
1787,"RAGO: Quark! I am the senior Dominator, you will obey me! "
1788,(The Quark advances on Toba.) 
1789,"RAGO: Well, Toba? Shall I order molecular force, or do you submit? "
1790,TOBA: I submit. 
1791,"RAGO: Quark, return to the prisoners. "
1792,ZOE: What was all that about? 
1793,DOCTOR: A little internal dispute I fancy. Oh dear. 
1794,RAGO: You are fortunate that I still have need of your services. You
1795,will supervise work on the drilling site and make sure that nothing
1796,delays the task. 
1797,TOBA: Command accepted. 
1798,(Toba leaves quickly.) 
1799,RAGO: You two. Here. I have some questions to ask you about your
1800,"planet. You will be advised to make sure your answers are satisfactory,"
1801,for your own sakes.
1802,
1803, [Outside the museum]
1804,
1805," TOBA: You two. Clear the site. Quark, guard them."
1806,"Old man, follow me. Quark! "
1807,(Toba and Balan leave.) 
1808,QUARK: Obey the Dominator. Clear the site. Work. Work. 
1809,(Kando and Teel move rocks.) 
1810,TEEL: I wonder if Cully made it to the shelter? 
1811,KANDO: They'll almost certainly be dead if they were under that. It
1812,looks very quiet. 
1813,(But inside the ruins a piece of rubble moves.)
1814,
1815, [Bomb shelter]
1816,
1817, (Jamie is trying to push up a periscope to see
1818,what is going on.) 
1819,"JAMIE: No, no use. I can't see a thing. There must be tons of stuff on"
1820,"top of it, same as the hatch. "
1821,"CULLY: Well, we just have to sit and wait until someone comes and digs"
1822,us out. 
1823,"JAMIE: You think they'll find us, then? "
1824,"CULLY: Well of course. Balan told me where the this old shelter was, so"
1825,surely they'll be able to work it out. 
1826,"JAMIE: Oh, I wish you'd told us about this place sooner. We could have"
1827,got down here straight away. 
1828,"CULLY: What, and miss exploding that Quark? That was a tremendous shot."
1829,
1830,"JAMIE: Aye, maybe so. I just hope the Dominators don't take it out on"
1831,the others. 
1832,CULLY: I wonder if those Quarks are still hanging about up there? 
1833,JAMIE: Aye. If only we could open that hatch. 
1834,(Jamie climbs the ladder.) 
1835,"JAMIE: No, it's no good. Feels as though the whole building's sitting"
1836,on top of it. 
1837,CULLY: Perhaps it is. 
1838,(Jamie comes down again.) 
1839,JAMIE: Hey. 
1840,CULLY: What's the matter? 
1841,JAMIE: Just been thinking. Have you noticed how stuffy in here it's
1842,getting? 
1843,"CULLY: Yes, now you mention it. "
1844,"JAMIE: Aye, that's the only ventilator shaft I can see and. Hey, if"
1845,that's blocked we'll suffocate!
1846,
1847, [Saucer]
1848,
1849," RAGO: And this leader Senex, he is in the Capital"
1850,city? 
1851,DOCTOR: Well I'm not sure. 
1852,"RAGO: Quark, molecular force! "
1853,(Zoe gets stuck to a wall.) 
1854,DOCTOR: No! 
1855,RAGO: I asked you a question. 
1856,"DOCTOR: Yes, yes, yes, so you did. "
1857,RAGO: Well? 
1858,"DOCTOR: Yes. Yes, Senex is at the Capital. "
1859,"RAGO: These Dulcian travel machines, how do I summon one? "
1860,"DOCTOR: Well, you can't. The terminal at the survey unit was destroyed,"
1861,wasn't it. 
1862,RAGO: Yes. By Toba. Prepare this ship for take off! 
1863,"DOCTOR: But, are you going to take your own craft to the Capital? "
1864,RAGO: I have no alternative. 
1865,"DOCTOR: Well actually, now I come to think of it, I do know where there"
1866,is a capsule. I didn't tell you about it before because I'm not sure
1867,"that it works. It has some loose wires and things, but I'm sure that"
1868,you'll be able to fix it. 
1869,RAGO: How big is this space machine? Will it transport a Quark? 
1870,"DOCTOR: Oh dear, I don't "
1871,RAGO: Then it is useless to our purpose. We will use our own machine. 
1872,"DOCTOR: Well actually, now I come to think of it, if you were to take"
1873,"out one of the seats, a Quark might fit inside. "
1874,RAGO: You will show me this machine. 
1875,DOCTOR: Oh yes. 
1876,RAGO: Quark. Prepare to transmit recorded data on work habits of tested
1877,specimens. Contact direct Fleet Leader. 
1878,"DOCTOR: Don't worry, Zoe. The effect soon wears off. "
1879,ZOE: Why did you tell him about the capsule? 
1880,"DOCTOR: Well if he takes this craft we won't be able to investigate it,"
1881,will we? 
1882,ZOE: But why do you want to? 
1883,DOCTOR: To find out what sort of power unit it has. Then we can tell
1884,"what the Dominators are looking for on Dulkis. Besides, if they take us"
1885,"to the Capital we won't be able to search for Jamie, will we? "
1886,"ZOE: That's true. Hey, wait a minute though. He might be all right if"
1887,he and Cully 
1888,RAGO: Silence! You will lead me to this travel craft. 
1889,DOCTOR: Yes. 
1890,"RAGO: Quark, release the female. Follow. "
1891,"DOCTOR: There you are, you see? All right. It's all right! "
1892, [Drilling site]
1893,
1894," TOBA: Enough. Quarks, take up drilling positions."
1895,"Old man, stand that drill between those Quarks over the drilling site. "
1896,(Balan puts the fancy tripod drill head over the cross.) 
1897,TOBA: Attach force units. 
1898,(The Quarks fasten their arms to the drill.) 
1899,TOBA: Operate. 
1900,(Another Quark enters.) 
1901,"TOBA: Quarks, cease drilling. Report. "
1902,QUARK: Orders from Dominator Rago. Probationer Toba to report. 
1903,TOBA: Command accepted. Continue operation. 
1904,(The drilling starts up again in a blaze of light.)
1905,
1906, [Beach]
1907,
1908, (Rago examines the crashed travel capsule.) 
1909,"RAGO: Hmm. A primitive machine, but functional. The circuits need"
1910,"repairing. Minimal task. So, you were telling the truth. "
1911,DOCTOR: Of course. 
1912,RAGO: I'm glad you appreciate that to attempt sabotage would be
1913,pointless. 
1914,TOBA: You sent for me. 
1915,RAGO: Yes. I'm going to the alien leader to investigate potential slave
1916,force. You will remain here and complete the drilling operations. 
1917,TOBA: Command accepted. You are travelling in this alien machine? 
1918,RAGO: Yes. 
1919,TOBA: Is that wise? It could be dangerous. 
1920,RAGO: I have tested it. It is operable. I will take a Quark for
1921,"protection. You will command in my absence, but I expect to find the"
1922,same number of alien specimens on my return. 
1923,TOBA: Command accepted. 
1924,"(A few paces away, the Doctor and Zoe are whispering.) "
1925,DOCTOR: Why didn't you tell me about this underground shelter before? 
1926,"ZOE: Well, I'm sorry, but I haven't had a chance. Balan told us about"
1927,"it, and with any luck Jamie and Cully might have found their way down"
1928,there. 
1929,"DOCTOR: Well it's possible, it's possible. "
1930,"ZOE: And if they have, they should be all right, shouldn't they? "
1931,"DOCTOR: Well, I think. "
1932,TOBA: You two. Follow me. 
1933,DOCTOR: Oh yes. All right.
1934,
1935, [Bomb shelter]
1936,
1937, (Jamie and Cully are using a long metal section of
1938,something to try and push the hatch open.) 
1939,"CULLY: It's no good, it's stuck again. "
1940,JAMIE: Aye. 
1941,CULLY: What shall we do? 
1942,"JAMIE: Look, there's only one thing to do. Try again! Now come on, will"
1943,you. 
1944,CULLY: Three. 
1945,(They push again and this time a piece of rubble is dislodged from the
1946,hatch and it opens.) 
1947,CULLY: We did it! 
1948,"JAMIE: Aye. Well, no point in hanging around, hey?"
1949,
1950,[Museum]
1951,
1952, (Jamie puts his head out of the hatchway and looks
1953,around.) 
1954,JAMIE: All clear. 
1955,"(Jamie climbs out, then hides as he sees a Quark shepherding Kando and"
1956,Teel carrying a large rock.) 
1957,"JAMIE: Oh no, Quarks again. They must be all over the place. Hey, I"
1958,wonder how many there are? 
1959,CULLY: Why? 
1960,"JAMIE: Well the Dominators don't seem much good without them, do they? "
1961,CULLY: So? 
1962,"JAMIE: We destroyed one Quark, why not another? "
1963,CULLY: Attack the Quarks? 
1964,JAMIE: Shush! Yes. 
1965,CULLY: But we had a laser gun before. And that's hidden underneath all
1966,this lot now. 
1967,"JAMIE: There wasn't a laser gun where I come from, yet us McCrimmons"
1968,still dealt with the Redcoats right enough. 
1969,CULLY: Redcoats? 
1970,"JAMIE: Aye, they were. Och, never mind. Look, are you with me? "
1971,"CULLY: Well, why not? "
1972,JAMIE: Good. First thing to do is estimate the strength of the enemy.
1973,"Come on, through there."
1974,
1975, [Above a drill site]
1976,
1977, (Jamie and Cully peek over a cliff edge.) 
1978,"JAMIE: Five so far. Look, you take that side, I'll look around up here."
1979,
1980,"(Further on, Jamie slides down a slope to Cully.) "
1981,"JAMIE: Sorry, I slipped. How many? "
1982,"CULLY: Two more, and you? "
1983,JAMIE: Same here. 
1984,CULLY: Balan's down there with those two. They seem to be doing some
1985,sort of drilling. 
1986,"JAMIE: Aye, they're drilling in four places. It must be pretty"
1987,important to the Dominators. 
1988,CULLY: Yes. 
1989,"JAMIE: Right, let's start some trouble. "
1990,CULLY: But what can we do? 
1991,JAMIE: Oh I've a wee idea that should just stir them up a bit. Come on.
1992,
1993, [Saucer]
1994,
1995, TOBA: Report. 
1996,QUARK: Drilling in operation on all perimeter sites. 
1997,TOBA: Is the centre site cleared yet? 
1998,QUARK: Task near completion. 
1999,TOBA: Report progress to Fleet Leader direct. Operations proceeding as
2000,planned. 
2001,ZOE: What are they up to? 
2002,DOCTOR: I don't know. We must find out exactly what they're drilling
2003,for. 
2004,ZOE: Not a chance with this thing guarding us. 
2005,DOCTOR: Yes. If only we could create a diversion for a moment.
2006,
2007, [Above a drill site]
2008,
2009, (Jamie throws down a rock. The Quark and Balan
2010,look around.) 
2011,"JAMIE: Take this, you wee tin kettle! "
2012,(Jamie throws another rock. The Quark spins round. Balan moves away. A
2013,third rock and the Quark fires at the cliff face.) 
2014,"JAMIE: Ah, you missed me! "
2015,(Jamie throws another rock then runs down a gully with the Quark in
2016,"pursuit, it's shots just missing him.) "
2017,"JAMIE: Now, Cully! "
2018,(Cully sends a large boulder over the edge of the cliff. We hear a sort
2019,of high-pitched argh noise then see the Quark lying by a drill with
2020,large pieces of boulder on top of it.)
2021,
2022, [Saucer]
2023,
2024," (On the wall, a Quark symbol flashes.) "
2025,"TOBA: Another Quark has been destroyed! Quark, follow. "
2026,(Toba leaves with a Quark.) 
2027,ZOE: Somebody destroyed a Quark. But who? 
2028,DOCTOR: Only one person here's strong enough to do that. 
2029,ZOE: Jamie! Then he and Cully are alive! 
2030,"DOCTOR: Yes, alive and kicking by the sound of it. This is just what we"
2031,needed. Now there's no time to waste. 
2032,(The Doctor goes onto the central dais.) 
2033,ZOE: What are you looking for? 
2034,"DOCTOR: Well, now's our chance to investigate the power unit and find"
2035,out what fuel this ship carries. 
2036,"ZOE: Well the Quarks use ultrasound, so presumably it must be a fuel"
2037,capable of producing a high enough energy quotient to sustain an
2038,amplifying complex of considerably sophisticated design. 
2039,DOCTOR: Yes. Must be pretty powerful too. 
2040,"ZOE: Yes, well that's what. Well, if you don't want my help. "
2041,"DOCTOR: Oh I do, I do, I do, Zoe. Now, where do you think the power"
2042,cells are located? 
2043,ZOE: Well if the Quarks do use ultrasound to propel this craft. 
2044,"DOCTOR: No. Ultrasound has no horsepower, as such. "
2045,"ZOE: Oh, no. Well what do you think they use then? Not solid fuel"
2046,"rockets, surely? "
2047,"DOCTOR: No. More likely to be electromagnetic, probably produced by. Ah"
2048,"yes! Here we are, Zoe. Help me to get the inspection cover off. "
2049,(It's a large square column on a hitherto unseen side of the control
2050,room.) 
2051,DOCTOR: Here we are. Now then. Oh dear. 
2052,ZOE: What? 
2053,"(The Doctor takes a Geiger counter on a long string from his pocket,"
2054,"and lowers down the inside of the column. The further down, the faster"
2055,the clicks.) 
2056,ZOE: Atomic fission reactor? 
2057,"DOCTOR: No. No, not exactly. But it's radioactive material of some"
2058,"sort. Zoe, this is a storage unit! That accounts for the strange"
2059,disappearance of the radioactivity from the island. This unit sucked it
2060,up and stored it. 
2061,ZOE: But then why are they drilling out there?
2062,
2063, [Drilling site]
2064,
2065," TOBA: A Quark has been destroyed, old man. Who did"
2066,it? 
2067,BALAN: I don't know. 
2068,"TOBA: Quark, report. "
2069,QUARK: Alien attack. 
2070,TOBA: Who was it? 
2071,BALAN: I didn't see. I was here being guarded by your Quark. 
2072,TOBA: Is there a hostile force on this island? 
2073,BALAN: No! We have no such 
2074,TOBA: Then who destroyed the Quark? 
2075,BALAN: I don't know. 
2076,(Toba pushes Balan to the ground.) 
2077,"TOBA: Quarks, search the island. Destroy any alien unaccounted for."
2078,Destroy!
2079,
2080, [Council chamber]
2081,
2082, TENSA: To remain passive is in itself a course of
2083,action. 
2084,"BOVEM: Director, Tensa speaks for the Emergencies Committee. Who else"
2085,is competent to advise? We must do as he says. 
2086,"SENEX: Bovem, you say we must do as Tensa says, but that is negative,"
2087,for we can do nothing. This is our tragedy. Perhaps if we show these
2088,creatures we mean no harm? 
2089,COUNCILLOR 2: It's always possible that they mean harm to us. 
2090,COUNCILLOR 1: Why should they? Surely no civilised race would indulge
2091,in purposeless violence? 
2092,(Rago enters.) 
2093,TENSA: Look! 
2094,COUNCILLOR 2: What? Who? 
2095,RAGO: You are the Council of this planet? 
2096,"SENEX: Yes, I am the Director. "
2097,RAGO: You control the population? 
2098,SENEX: Yes. We presume that 
2099,RAGO: I require information. 
2100,BOVEM: If you'd care to make an appointment. 
2101,"COUNCILLOR 2: That is, I'm sure, the correct procedure. "
2102,RAGO: Listen and obey me. 
2103,TENSA: Such discourtesy to our Director is not to be borne. 
2104,RAGO: Silence! You will provide me with certain statistics. Open your
2105,files. 
2106,"TENSA: Really sir, I must protest! "
2107,RAGO: Protest? You defy me? You defy a Dominator? 
2108,TENSA: Senex is our leader and as such he demands respect. 
2109,"RAGO: I warn you, a Dominator must be obeyed. Your leader is nothing to"
2110,me. I respect only one thing. Superior force. You will obey my command.
2111,
2112,"TENSA: Sir, you would do better to request rather than command. "
2113,RAGO: Silence! 
2114,"COUNCILLOR 1: Yes, perhaps if we were to explain the correct Dulcian"
2115,procedure to you? 
2116,"COUNCILLOR 2: After all, your visit "
2117,RAGO: I will give you no further warning! 
2118,TENSA: I insist that you conduct this meeting in a manner acceptable to
2119,the Dulcian 
2120,"RAGO: Quark, destroy! "
2121,(The Quarks kill Tensa.) 
2122,RAGO: I have no wish to repeat such action. Let it serve to teach you
2123,"that a Dominator must be obeyed without question. You, Director. It"
2124,will be necessary for you to place at my disposal a certain number of
2125,the strongest of your species. 
2126,SENEX: You wish our assistance? 
2127,RAGO: Assistance. You are indeed an ingenuous race. I require slaves.
2128,"Nothing more, nor less. "
2129,SENEX: Slaves? But 
2130,"RAGO: Do not defy or question a Dominator. Obey, unless you wish to"
2131,join your fellow countryman. 
2132,SENEX: Had you come here in peace we'd have done our utmost to assist
2133,"you, but "
2134,RAGO: Dominators do not seek assistance. What we need we take. 
2135,SENEX: Always by force? 
2136,RAGO: If necessary. We control an entire galaxy. Our war mission is
2137,spreading to colonise others. Our Quarks must be released for this
2138,"task, therefore we must replace their workforce on our home planets. "
2139,SENEX: So you require our people as slaves? 
2140,RAGO: Yes. 
2141,SENEX: So we shall be transported to your planet? 
2142,RAGO: Those who are selected will be fortunate. They will be saved. 
2143,SENEX: Saved? From what? What of the rest of our people? 
2144,RAGO: Enough questions. You will obey my commands! I shall require only
2145,the strongest of your species. You will be informed exactly how many I
2146,"require. Remember, you can be crushed as simply as that if you do not"
2147,"cooperate. Quark, follow."
2148,
2149,[Outside the museum]
2150,
2151, TOBA: A drilling site has been attacked and a
2152,Quark destroyed. Who is responsible? 
2153,"KANDO: Cully, it must be! "
2154,TOBA: What do you know about this? 
2155,TEEL: How can we know anything? We've been here working. 
2156,TOBA: Silence! 
2157,(Toba twists Kando's arm.) 
2158,TOBA: Talk. 
2159,TEEL: Leave her alone. 
2160,TOBA: Do you dare to defy a Dominator? 
2161,TEEL: Just leave her alone! 
2162,(Teel tries to grab Toba but is brushed off with one hand.) 
2163,"TOBA: Obviously you must be taught a lesson. Quarks, target! "
2164,KANDO: Oh no! 
2165,"TOBA: No-one attacks a Dominator! Quark, power! "
2166,(Teel screams.) 
2167,"KANDO: Oh, stop! "
2168,TOBA: Well? Who was it that attacked and destroyed the Quarks? 
2169,KANDO: I think it must have been Cully. 
2170,TOBA: The man Cully is destroyed! 
2171,KANDO: Then he must have escaped. There's no one else on the island. 
2172,"TOBA: Yes, there is. The other stupid one, the boy. Where would he"
2173,hide? 
2174,KANDO: I don't know! 
2175,TOBA: Bring these back to the Dominator's craft. Help him. One of you
2176,"creatures must know where the boy is, and you will tell me. Follow."
2177,
2178, [Saucer]
2179,
2180, ZOE: And Jamie really destroyed another Quark? 
2181,"BALAN: Yes, I feel sure it was Jamie. "
2182,"DOCTOR: Yes. Er, Balan. Oh. (nearly walks into a Quark) Balan, can you"
2183,remember where the scientists who exploded that first atomic device got
2184,their materials from? 
2185,"BALAN: Many years ago, but I think that it was somewhere in the"
2186,Northern hemisphere. 
2187,ZOE: That's the other side of the planet. Then why are the Dominators
2188,drilling here? 
2189,"BALAN: Oh, they can't drill too deep here because the crust is too"
2190,thin. 
2191,"DOCTOR: But perhaps that's why they've chosen this place! The magma,"
2192,"the molten core of the planet, could that be radioactive? "
2193,BALAN: No. If so we'd have been aware of it from the minor eruptions we
2194,have from time to time. 
2195,ZOE: But this whole operation was to refuel their fleet? But how? 
2196,DOCTOR: It's these drill holes that intrigue me. One at each corner of
2197,"a square, and one directly in the middle. But why? Why? "
2198,(Toba enters with Kando and Teel.) 
2199,"TOBA: Put them with the others. Now, I want to know where the other"
2200,"creature is, the boy. The other stupid one. He has destroyed a Quark"
2201,and defied the Dominators. Where is he? Quark! You will die one by one
2202,unless you tell me. Kill! 
2203,(The Quark kills Balan.) 
2204,TOBA: You. You're next. You know the boy. Where is he? Answer or you
2205,will die. 
2206,(Kando and Teel move away from his target - the Doctor.) 
2207, Episode Five
2208,
2209,[Saucer]
2210,
2211, TOBA: Quark 
2212,RAGO: Toba! What is the meaning of this? Explain. 
2213,TOBA: We were being attacked and a Quark was destroyed. It was an
2214,emergency. 
2215,RAGO: Emergency? A few hostile primitives manage to destroy a Quark and
2216,you expend time and power chasing them. 
2217,TOBA: Don't you see 
2218,RAGO: Why has the drilling stopped? All finished? 
2219,TOBA: All perimeter bores are complete. 
2220,RAGO: And the centre bore? 
2221,TOBA: The centre bore is 
2222,"RAGO: Not even started. The Quark's power cells are dangerously low,"
2223,and yet you send them scuttling all over the island on a pointless
2224,search and killing harmless aliens. 
2225,TOBA: I considered it was my 
2226,RAGO: Silence! Have the rockets been inserted into the perimeter
2227,boreholes yet? 
2228,TOBA: No. 
2229,RAGO: Do it. Is the seed device at a critical mass? 
2230,TOBA: There has not been enough time. 
2231,RAGO: Time? You have jeopardised this most vital part of the
2232,Dominator's war mission. You will remain on this planet and die with
2233,it. 
2234,"TOBA: Navigator Rago, I have been "
2235,RAGO: You are useless unless you obey the Navigator's orders. Now check
2236,that seed device. 
2237,ZOE: Oh. 
2238,(Toba goes over to an egg shaped object in a clear box.) 
2239,RAGO: Well? 
2240,TOBA: Seed device is almost at critical mass. 
2241,"RAGO: You are fortunate, Toba. Now, time is running short. You must"
2242,complete the operation with maximum speed. Has there been a reply from
2243,Fleet Leader concerning the potential use of slave labour force? 
2244,TOBA: I will check. 
2245,"RAGO: No, I will. Take these aliens and place them under guard."
2246,"Complete the centre borehole and place rockets in all perimeter holes,"
2247,understood? 
2248,TOBA: Command accepted. 
2249,RAGO: Recall all Quarks from this ridiculous search and conserve their
2250,power. We can afford no more delays.
2251,
2252, [Island]
2253,
2254, (A Quark wastes energy shooting at a running Jamie
2255,and Cully. They duck down a sharp incline.) 
2256,JAMIE: That was too close for comfort. 
2257,CULLY: They're all around us. 
2258,JAMIE: Aye. 
2259,"CULLY: Wait a minute. They're leaving, I think. Look! "
2260,"JAMIE: Hey, you're right. Come on, let's get back to the shelter while"
2261,there's still a chance.
2262,
2263, [Bomb shelter]
2264,
2265," JAMIE: All right, Cully? "
2266,CULLY: Yes. 
2267,JAMIE: I've unblocked that ventilator shaft. At least we can breathe
2268,now. 
2269,"CULLY: Oh, I haven't have so much running about for years. Still, it"
2270,was worth it. 
2271,"JAMIE: Aye, we certainly stirred them up, didn't we. Anyway, we'll lie"
2272,low a wee while and then nip out and get another Quark. 
2273,"CULLY: Oh, you don't believe in half measures, do you. "
2274,"JAMIE: Well, it's important to keep the enemy guessing. Oh, I wish we"
2275,had some food though. I'm fair famished. 
2276,"CULLY: Hold on, I seem to remember "
2277,JAMIE: What? 
2278,(Cully goes to a cupboard.) 
2279,"CULLY: Yes, survival kit. It goes with the shelter. Food, medicines,"
2280,all that sort of thing. Ah! 
2281,(Cully puts an oblong slab on the table.) 
2282,"JAMIE: Well, what's that? "
2283,"CULLY: Try it. Basic nutriments. Vitamins, carbohydrates, proteins. You"
2284,can live on it for years. 
2285,"JAMIE: Oh, I hope I'll not need to do that. Here, did you unblock that"
2286,periscope? 
2287,CULLY: Yes. 
2288,JAMIE: Good. Let's see if we were followed. 
2289,(Jamie pulls down the periscope and looks around.) 
2290,"CULLY: Hey Cully, would you look who's here. "
2291,"(It's the Doctor, Teel and Kando.) "
2292,JAMIE: Any Quarks? 
2293,"CULLY: Yes, one. "
2294,JAMIE: Oh. 
2295,"(The periscope looks further to the left, where Toba is instructing a"
2296,pair of Quarks at the drill head.) 
2297,"CULLY: No, there's more. Can't quite see but I think they're working at"
2298,something just outside the building. 
2299,"JAMIE: Let's have a look. Aye, they don't seem to have harmed anybody. "
2300,"CULLY: Well, Balan isn't there. "
2301,"JAMIE: Aye, he's probably working somewhere else. "
2302,(Jamie pushes the periscope back into the roof.) 
2303,"JAMIE: Look, Cully "
2304,CULLY: What now? 
2305,"JAMIE: We can't just let them stay up there, can we. "
2306,"CULLY: Well, what can we do? "
2307,JAMIE: Get them down here with us. 
2308,CULLY: But what about the Quarks? 
2309,"JAMIE: Well, we'll just "
2310,CULLY: Here we go again. But how? 
2311,"JAMIE: Aye well, I don't know yet. Ah, wait a minute. "
2312,(Jamie takes a sheet off a bunk.) 
2313,JAMIE: Yes.
2314,
2315, [Outside the museum]
2316,
2317, TOBA: Operate. 
2318,(Two Quarks power the drill.)
2319,
2320, [Museum]
2321,
2322, (One Quark stands guard.) 
2323,ZOE: Doctor? 
2324,DOCTOR: Hmm? 
2325,ZOE: What are they doing? 
2326,DOCTOR: They're drilling. 
2327,"ZOE: Well, yes, I know that, but what for? "
2328,"DOCTOR: Hmm? Oh, I don't think they want to take anything out of the"
2329,"earth, Zoe, rather put something into it. "
2330,"ZOE: Well, what? "
2331,"DOCTOR: Well, if I'm right. Oh no! "
2332,(Jamie has come up from the shelter and is creeping up on the Quark. He
2333,has the sheet twisted up into a rope and is about to throw it round its
2334,'neck' when the Quark moves forward. Jamie moves forward and instead
2335,ties it around the robot's 'ankles'. Then it stands on Jamie's hand.
2336,The Doctor gets up.) 
2337,DOCTOR: Excuse me. I wonder 
2338,QUARK: Do not move! 
2339,"(The Quark moves towards the Doctor and Jamie pulls on the sheet rope,"
2340,toppling it over onto it's side. Jamie sits on it as it makes beeping
2341,noises.) 
2342,"JAMIE: Right, Cully. "
2343,(Cully puts another sheet over the Quark's head.) 
2344,"CULLY: Quick, follow me! "
2345,"JAMIE: Doctor, go on! "
2346,CULLY: Quick! 
2347,"(When the others have run off, Jamie gets off the Quark.)"
2348,
2349, [Outside the museum]
2350,
2351, TOBA: Cease drilling. A Quark is being attacked.
2352,Follow!
2353,
2354, [Museum]
2355,
2356, (Everyone is safely in the bomb shelter as Toba
2357,and the Quarks enter.) 
2358,TOBA: Quarks. Search and destroy. 
2359,(Toba takes the sheet off the Quark and puts it on its feet. It stops
2360,beeping.) 
2361,"TOBA: Quark, where are the prisoners? "
2362,QUARK: Sensor out of action. No recorded data. 
2363,"TOBA: They can't be far away. They must be hiding. Quarks, search and"
2364,destroy! 
2365,"RAGO: Command countermanded! Why has the drilling stopped again, Toba? "
2366,TOBA: The prisoners have attacked a Quark and escaped. 
2367,RAGO: And once again you drop everything to hunt them. I have just
2368,completed calculating the remaining power levels of the Quark force.
