,Script
580,ZARGO: In any society there is bound to be a division. The rulers and
581,the ruled. 
582,"DOCTOR: A division? Yawning chasm, I'd say. Wouldn't you? "
583,"ROMANA: No, I'd say a sociopathetic abscess. "
584,"DOCTOR: Oh, I wish I'd thought of that. That's a good diagnosis. Yes,"
585,I've never seen such a state of decay. 
586,"CAMILLA: Be careful, Doctor. We have acquired great powers. "
587,DOCTOR: Ah. 
588,ZARGO: There must be rulers. A ship of state must have a pilot. 
589,DOCTOR: What did you say? 
590,ZARGO: Ship of state. 
591,CAMILLA: No. 
592,DOCTOR: Ship of state? 
593,ZARGO: A metaphor. 
594,"DOCTOR: Ah. It's just odd, you see, that he should mention that,"
595,because Romana and I have just been at your ship's old manifest and I
596,can't remember what the ship was called but Romana might be able to
597,"remember. What was it called, Romana? "
598,ROMANA: Hydrax. 
599,"DOCTOR: Yes, Hydrax. Does that mean anything to you? Hydrax? Hydrax? "
600,ZARGO: Where did you see this? 
601,CAMILLA: Be silent. 
602,ZARGO: Those records were destroyed. 
603,CAMILLA: I said be silent. 
604,"DOCTOR: No, please don't be silent. It's so fascinating. "
605,(Habris enters.) 
606,"HABRIS: My lord, it is time. "
607,ZARGO: How dare you interrupt us! 
608,HABRIS: Aukon has seen the sign. The Arising is at hand. 
609,CAMILLA: The Arising? Leave us. 
610,(Habris leaves.) 
611,ZARGO: We must go to him. 
612,"CAMILLA: We shall resume this later. If you need anything, there are"
613,guards outside the door. Many guards. 
614,(The doors slam shut behind Zargo and Camilla.) 
615,DOCTOR: You know something? I don't think they want to be followed.
616,Let's sit down. 
617,"(The Doctor tries Camilla's throne, then Zargo's.) "
618,"DOCTOR: Oh yes, this is much more comfortable. What were those Hydrax"
619,officers called? 
620,"ROMANA: Captain Miles Sharkey, Navigation Officer Lauren MacMillan,"
621,Science Officer Anthony O'Connor. 
622,DOCTOR: That's very good. Have you ever heard of the Brothers Grimm? 
623,ROMANA: This is no time for fairy tales. 
624,DOCTOR: They also discovered the Law of Consonantal Shift. How language
625,changes over the years. 
626,"ROMANA: You mean the hard sounds softening, B's becoming V's and so on."
627,
628,DOCTOR: Hmm. 
629,"ROMANA: Camilla, Aukon and Zargo. Wait a minute. Sharkey, Zharkey,"
630,"Zarkey, Zar, Zargo. The same name passed down through generations. "
631,DOCTOR: That's right. And MacMillan becomes? 
632,ROMANA: Camilla. 
633,DOCTOR: And O'Connor becomes? 
634,ROMANA: Aukon. The descendants of the original ship's officers. 
635,"DOCTOR: Yes. And this is the original ship. The pilot here, co-pilot"
636,"there. No, no, no, pilot there, co-pilot here. Instrument banks there,"
637,control panels there. 
638,"ROMANA: You mean this is the Hydrax, the explorer ship? "
639,DOCTOR: Yes. Do you fancy exploring it? 
640,ROMANA: Mmm. 
641,(The Doctor gets up.) 
642,DOCTOR: Inspection hatch. 
643,ROMANA: Ahem. Doctor? 
644,(Romana has found something by the side of the wooden throne.) 
645,DOCTOR: Shush. Inspection hatch. 
646,ROMANA: Doctor. 
647,DOCTOR: Hmm? 
648,(The Doctor goes to where Romana is pointing.) 
649,"DOCTOR: Romana, I've found the inspection hatch. "
650, [Resting place] 
651," AUKON: When my servants were seeking the Doctor, I"
652,sensed another alien mind not far away. I traced it to the village and
653,"here he is. The first of the Chosen Ones, at last. "
654,ZARGO: But he is an alien. He must have come with the two strangers. 
655,CAMILLA: The Chosen Ones were to be from amongst the peasants. 
656,"AUKON: We have bred dullness, conformity, obedience into those clods"
657,"for twenty generations. Unfortunately, we have also bred out just those"
658,qualities we need for other purposes. 
659,"ZARGO: This disturbs me, Aukon. "
660,CAMILLA: We have been talking to this Doctor and his companion. 
661,"ZARGO: The Doctor's mind is powerful, but he is dangerous. He must die."
662,
663,AUKON: Not before I have questioned him. 
664,ZARGO: I say he is dangerous and must die. The boy too. We need no
665,aliens to join us. Let him feed the Great One with his blood. 
666,(Adric stares blankly ahead as Zargo waves his dagger in front of his
667,eyes.) 
668,"AUKON: The boy is still young. His mind is strong, clear, but"
669,malleable. We can make of him what we wish. 
670,CAMILLA: Aukon is right. What does it matter where he comes from? Once
671,"he is initiated, he is ours. We must increase our numbers as the Great"
672,One commands or he will be angry. And such a handsome child. 
673,AUKON: I will take him to be prepared. Come. 
674,"(Meanwhile, the Doctor and Romana make their way through the innards of"
675,the space rocket.) 
676, [Rebel's cave] 
677," KALMAR: They're taken, then. Captives in the"
678,"Tower, all three. "
679,TARAK: What are we going to do about it? 
680,KALMAR: What do you mean? 
681,TARAK: This Doctor is our only gleam of hope in a thousand years. Are
682,you going to let Zargo and the rest destroy him? 
683,KALMAR: Perhaps they won't harm him. 
684,"TARAK: They'll kill him, Kalmar. Him and the girl. You know their"
685,powers. They'll sense he's a danger to them and they'll destroy him. 
686,KALMAR: Perhaps. It's out of our hands now. 
687,TARAK: It needn't be. 
688,KALMAR: What can we do? 
689,"TARAK: Attack the Tower, rescue them. "
690,"KALMAR: A handful of men with knives and bows and spears, and the power"
691,of the three to face if we do get past them? 
692,TARAK: Will you stay here forever fiddling with this technological
693,junk? 
694,KALMAR: We need knowledge to attack the Lords. We must wait until we
695,are ready. 
696,TARAK: Wait? For how long? A few more generations? 
697,"KALMAR: If necessary, yes. "
698,(Veros turns to the other rebels in the shadows.) 
699,TARAK: And you think the same? Will anyone come with me to the Tower?
700,Or must I go alone. 
701,VEROS: Kalmar is right. It's too soon. 
702,"TARAK: Too soon. Kalmar, you are right. "
703,KALMAR: I am? 
704,TARAK: To attack the Tower now would be suicide. 
705,KALMAR: Glad you realise it. 
706,"TARAK: But if I go in alone, rescue the Doctor, bring him back here, he"
707,"will have discovered their weaknesses, and with the knowledge he can"
708,"give us, then will you attack? "
709,KALMAR: How will you gain entrance to the Tower? 
710,"TARAK: I was a guard once, remember? "
711,KALMAR: So? 
712,"TARAK: So, I can be one again. "
713, [State room] 
714," HABRIS: I swear to you, my lord, the state room"
715,was guarded at all times. 
716,ZARGO: Then where are the Doctor and the girl? 
717,"HABRIS: My lord, they are aliens. Who knows what powers they might"
718,have? 
719,"ZARGO: Absurd. They are weaponless. Find them, Habris, or you shall go"
720,to feed the Great One. 
721,"(Habris makes the ears, eyes, mouth gesture.) "
722,ZARGO: Search the Tower. Search the lands around. 
723,HABRIS: My lord. 
724,(Habris leaves.) 
725,CAMILLA: You're wrong. 
726,ZARGO: What? 
727,(Camilla is standing by the inspection hatch.) 
728,CAMILLA: The Doctor is not weaponless. He has the greatest weapon of
729,all. Knowledge. 
730, [Flight deck] 
731, (The Doctor and Romana reach the top of a very
732,long ladder.) 
733,ROMANA: We must be right inside the turret. 
734,"DOCTOR: Yes. It's an Arrow class scout ship, Romana. It detaches from"
735,the main vessel for local exploration. 
736,"ROMANA: I wonder why they didn't rip out all these instruments, too. "
737,"DOCTOR: Well, why bother? No one comes here. Look! There's even a bit"
738,of power left in the energy cells. 
739,ROMANA: So it could still fly? 
740,DOCTOR: Possibly. 
741,ROMANA: Could we possibly jet our way out? 
742,"DOCTOR: Getting out is not exactly the object of our mission, is it? "
743,ROMANA: It proved your point that this is a spaceship. 
744,DOCTOR: Shush. 
745,(Faint slow rhythmic thumps.) 
746,ROMANA: Sounds like a faint engine noise. 
747,DOCTOR: Shush. 
748,ROMANA: What is it? 
749,DOCTOR: More evidence. 
750,ROMANA: Of what? 
751,"DOCTOR: I have a suspicion, but it's too horrible to think about. "
752,"(In a castle corridor, Veros pounces on a lone guard and drags him into"
753,a side room.) 
754, [Fuel tanks] 
755, (The Doctor and Romana make their way down the
756,ladder all the way to the bottom. Now we know why Romana is in
757,knickerbockers and striped socks for this story.) 
758,ROMANA: Now where are we? 
759,"DOCTOR: Right in the bowels of the ship. Disused fuel tanks, I think. "
760,ROMANA: I can hear that sound again. 
761,DOCTOR: Yes. 
762,ROMANA: What are we looking for? 
763,DOCTOR: A way out. 
764,ROMANA: Ah. 
765,"DOCTOR: I doubt very much if the creature lives in the Tower, but since"
766,the Tower feeds it I imagine it lives close by. 
767,ROMANA: Creature? What creature? 
768,DOCTOR: We'll know that when we find it. 
769,ROMANA: That's nice. 
770,(The Doctor finds the light switch. The sides of the tank are lined
771,with mummified bodies wrapped in rough cloth.) 
772,DOCTOR: They've been completely drained. Pipe leading. 
773,(The Doctor opens a hatch in the floor. The area below is full of a
774,dark liquid.) 
775,"DOCTOR: I was wrong, Romana. The fuel tanks aren't disused. Only this"
776,"isn't rocket fuel, it's blood. "
777, [Resting place] 
778, (The Doctor and Romana have climbed further down
779,into the rocky outcrop that the Hydrax is sitting on.) 
780,DOCTOR: You all right? 
781,"ROMANA: No, I'm frightened. "
782,"DOCTOR: Good, good. We'll soon be there. "
783,ROMANA: That's what frightens me. 
784,DOCTOR: Come on. Ah! 
785,ROMANA: What is it? What is it? 
786,DOCTOR: You jumped on my toe. 
787,"ROMANA: Oh, I'm so sorry. "
788,DOCTOR: Shush. 
789,ROMANA: What? 
790,DOCTOR: It's that sound again. 
791,ROMANA: That's not an engine. 
792,DOCTOR: No. The sound of a giant heartbeat. 
793,ROMANA: Doctor? 
794,DOCTOR: Yes? 
795,ROMANA: Look. 
796,(A pipe full of red liquid leading downwards.) 
797,DOCTOR: Do you know what that is? 
798,ROMANA: A feeding system for something that lives on human blood. 
799,DOCTOR: Exactly. Come on. 
800,ROMANA: What is it? 
801,"DOCTOR: Do you know, it just occurs to me. There are vampire legends on"
802,almost every inhabited planet. 
803,ROMANA: Really? 
804,DOCTOR: Yes. Creatures that stalk in the night and feast on the blood
805,of the living. Creatures that fear sunlight and running water and
806,certain herbs. Creatures that are so strong they can only be killed by
807,"beheading, or a stake through the heart. "
808,"ROMANA: Or? Please, say something. "
809,"DOCTOR: Whatever it is, we want to find it, don't we? "
810,ROMANA: No. 
811,DOCTOR: Good. Come on then. 
812,"(They walk on a little way. Ahead, the ground is gently pulsing in time"
813,to the beat.) 
814,"ROMANA: Where are we, Doctor? "
815,AUKON: You are in the resting place. 
816,(They turn around to see him.) 
817,DOCTOR: Where? 
818,AUKON: The resting place. 
819,DOCTOR: Ah. 
820,AUKON: I am Aukon. Welcome to my domain. 
821, Part Three
822,
823, [Resting place] 
824," DOCTOR: Well, I'm glad to catch someone at home."
825,Are we in time for a guided tour? 
826,"AUKON: You're a fool to mock, Doctor. There is power here such as you"
827,have never dreamed of. Can you not feel it? 
828,(The Doctor wets his finger and holds it up.) 
829,DOCTOR: No. 
830,"AUKON: Power, Doctor! It is the only reality. Why fight it when you"
831,could share it? 
832,DOCTOR: Me? 
833,"AUKON: When I sent my winged messengers to hunt you down, I sensed the"
834,power of your mind. We seek such minds for our great purpose. 
835,DOCTOR: What purpose? 
836,"AUKON: At the time of Arising, we servants will swarm. You could be one"
837,of us. 
838,"DOCTOR: I could? Well, you know, I've never been a great one for"
839,"swarming. It's awfully kind of you to offer, but where were you"
840,thinking of swarming to? 
841,AUKON: Out of this universe and back to our own. 
842,ROMANA: You know the way out of E-space? 
843,AUKON: That is the secret of him who brought us here. 
844,DOCTOR: Ah ha! So there was a guided tour. 
845,"AUKON: We were summoned, the whole ship, to be his servants. "
846,DOCTOR: Was that when you were just plain Science Officer O'Connor? 
847,AUKON: What? 
848,ROMANA: He was O'Connor? 
849,"DOCTOR: Yes. Those officers aren't the descendants of the originals,"
850,they are the originals. 
851,AUKON: He has given us unending life. He summoned us here speaking to
852,the others through my mind. We fed and nourished him until now he is
853,ready to arise. 
854,ROMANA: (sotto) Suppose we pretended to cooperate till we get the data
855,on E-space? 
856,DOCTOR: (sotto) Yes. No. Too dangerous. 
857,"AUKON: Consider well, Doctor. Won't you join us, like your other"
858,companion? 
859,DOCTOR: Who's he talking about? 
860,ROMANA: Can't even count on this planet. 
861,AUKON: The boy will be the first of the Chosen Ones. 
862,ROMANA: Boy? What boy? 
863,AUKON: He came here looking for you. The name he used was Adric. 
864,ROMANA: Adric? 
865,DOCTOR: Adric? 
866,"AUKON: You will all serve the Great One, Doctor, one way or another. If"
867,"you do not join us, you will feed him with your blood. "
868,DOCTOR: No. There is a third choice. 
869,AUKON: What is that? 
870,"DOCTOR: I can destroy the Great One. Off you go, Romana! "
871,(Romana runs.) 
872,"AUKON: Stop, Doctor! By the power that is mine, I command you. "
873,(The Doctor is forced to his knees by the power of Aukon's mind.) 
874,DOCTOR: I will not serve. I will not serve. 
875,"AUKON: Come, Doctor. "
876,(Romana breaks off a sharp stalagmite and throws it at Aukon. It
877,"breaks, and so does his gaze at the Doctor.) "
878,"DOCTOR: Cover your eyes, Romana. That might be all right for"
879,"half-starved peasantry, Aukon, but it doesn't scare Time Lords. "
880,AUKON: Time Lords! The ancient enemies! 
881,"ZARGO: Always so anxious to leave, Doctor? "
882,CAMILLA: Now is the time of our feast. 
883,ZARGO: We shall drain the blood from your bodies slowly. 
884,CAMILLA: Drop by drop. 
885,"AUKON: Silence! I hear you, O great One. Your ever faithful servant"
886,"Aukon awaits your command. Yea, O Great One. Preparations are complete."
887,"Sacrifice will be made. At the time of your Arising, you shall drink"
888,the blood of Time Lords! 
889,(Romana and the Doctor cover their eyes as Aukon turns back to them. He
890,pulls their hands away.) 
891,AUKON: You have been chosen. You have both been chosen. 
892,"(Tarak, now dressed as a guard, watches as the Doctor and Romana are"
893,marched through a castle corridor. Zargo and Camilla take a different
894,"turn and, using a keycard held by a guard, open a metal door and go"
895,through. The guard retrieves the keycard and puts it back in his belt.)
896,
897, [Inner sanctum] 
898, CAMILLA: Courage. It will not fail. 
899,(They wash their hands in a metal bowl.) 
900,ZARGO: Aukon still retains the power he promised to share. He swore to
901,us. 
902,"CAMILLA: It hardly matters now. The time of the Arising is at hand, and"
903,all are equal before the Great One. 
904,"ZARGO: And this Doctor, what is he doing here at this time? "
905,"CAMILLA: We have him safe now. Tomorrow, his spirit will be one with"
906,"ours. Come, we must rest. And when we wake, we shall feed. "
907,ZARGO: Why am I still afraid? 
908, [Cell] 
909," (A guard paces outside the small metal room, and"
910,another one inside watches the Doctor and Romana like a hawk.) 
911,DOCTOR: There was once an old hermit from the mountains of south
912,Gallifrey. 
913,ROMANA: Did he lead a very sheltered life? 
914,"DOCTOR: Yes. Yes, he did. He used to tell me ghost stories. I like a"
915,ghost story. Do you want to hear one? 
916,ROMANA: No. 
917,DOCTOR: It's about a race of giant vampires. 
918,ROMANA: Vampires? 
919,"DOCTOR: Mmm. They came out of nowhere, and swarmed and swarmed "
920,"ROMANA: What did they do, Doctor? "
921,DOCTOR: Swarmed. That was the word he used. 
922,ROMANA: Oh. 
923,DOCTOR: They swarmed all over the universe. And they were so strong
924,that one single vampire could suck the life out of an entire planet. 
925,ROMANA: One single vampire could suck the life out of an entire planet?
926,
927,DOCTOR: Yes. 
928,ROMANA: Rubbish. 
929,"DOCTOR: Well, he wasn't a scientist. There are other ways of looking at"
930,"life, you know. Anyway, according to the story, we Time Lords hunted"
931,them down across the universe in a war so long and so bloody that we
932,were sickened of violence forever. 
933,ROMANA: So they were all destroyed? 
934,"DOCTOR: One of them escaped, I think. "
935,ROMANA: And? 
936,DOCTOR: Just vanished into thin air. Poof. 
937,ROMANA: Like the Hydrax into E-space. 
938, [Outside the cell] 
939, TARAK: I've been sent to relieve you. Give me your
940,keys and report to Habris. 
941,GUARD: Why? 
942,"TARAK: Don't argue with me, argue with Habris. "
943,GUARD: I know you. You're Tarak. Tarak the traitor. You ran out to join
944,the rebels. 
945,(Tarak fights the guard.) 
946, [Cell] 
947, ROMANA: When was all this supposed to have
948,happened? 
949,DOCTOR: Hmm? When was all what supposed to have happened? 
950,ROMANA: The legend. 
951,"DOCTOR: Oh, that. Oh, in the misty dawn of history, when even Rassilon"
952,was young. 
953,"ROMANA: I once worked in the Bureau of Ancient Records, for a time. "
954,DOCTOR: So? 
955,"ROMANA: Oh, nothing. It's just that I once came across a reference to"
956,something called the Record of Rassilon in one of the old data books. 
957,DOCTOR: And? Shush. 
958,(The noise from the fight outside has reached them. Tarak wins.) 
959,ROMANA: And it was an emergency instruction. A copy of the book was to
960,be installed in certain time vehicles. 
961,DOCTOR: What time vehicles? 
962,"ROMANA: Oh, I don't know. I forget. "
963,DOCTOR: What time vehicles? 
964,"ROMANA: Type Forty, I think. "
965,DOCTOR: Psst. The Tardis is a Type Forty. 
966,ROMANA: Is it? Oh. 
967,DOCTOR: Yes. Psst. You are wonderful. 
968,ROMANA: Me? Wonderful? I suppose I am. I've never really thought about
969,it. 
970,"(The Doctor beckons to the guard, who kneels to listen and gets knocked"
971,"out for his trouble. Then Tarak bursts in, hitting the Doctor hard in"
972,"the face with the door and stunning poor old Tom, who falls to his"
973,knees and misses his cue.) 
974,"TARAK: Quick, the corridor. Where's the Doctor? Are you all right? "
975,"DOCTOR: Yes, I'm fine. "
976,TARAK: Down the corridor to the left. 
977, [Rebel's cave] 
978, (Veros wakes.) 
979,"VEROS: Still poring over those old scientific records, Kalmar? "
980,"KALMAR: No, something new. Look. "
981,"VEROS: Oh, you've improved the picture. What's that, more history? "
982,"KALMAR: Not history, Veros, the present. We're scanning the surrounding"
983,countryside. 
984,VEROS: A scanner cover. 
985,KALMAR: With a full choice of frequencies. I only discovered the
986,facility by accident. There's not much to see on the visible spectrum
987,now that night is falling. 
988,VEROS: Something's moving. Can it detect life forms? 
989,"KALMAR: I'll switch in infrared. Yes, someone's heading this way. "
990,(Veros picks up a spear and goes to the cave entrance.) 
991,"VEROS: It's Ivo, Kalmar. "
992,KALMAR: Let him in. 
993,(Ivo enters.) 
994,KALMAR: It's dangerous for you to come here. Why didn't you use the
995,communicator? 
996,IVO: I have to talk face to face. 
997,"VEROS: Look, Ivo, Kalmar's discovered a scanner. "
998,KALMAR: We cover all the surrounding area. Maybe reach the village and
999,the Tower if I can boost the range. 
1000,VEROS: We'll be safe now. We'll have warning of an attack if the guards
1001,come snooping. 
1002,KALMAR: It's heat-sensitive. It measures the presence of life. 
1003,IVO: Then it can't help me find my son. 
1004,KALMAR: Karl? 
1005,"IVO: He's dead. Those fiends drank his blood. But you're safe, aren't"
1006,you. Technological rats living safely in their little hole. 
1007,KALMAR: I'm sorry. 
1008,"IVO: Anyway, that's not what I came to talk about. Look, something's"
1009,"happening in the Tower tonight. Some kind of ceremony. They'll be busy,"
1010,preoccupied. 
1011,"KALMAR: No, it's too soon. We must have more information. "
1012,"IVO: For me, Kalmar, it's already too late. I shall wait until tonight,"
1013,gather my people together and attack the Tower. 
1014,"VEROS: Ivo, no! "
1015,"KALMAR: No, you mustn't. "
1016,"IVO: You and your heroes can watch it on the scanner, Kalmar. But"
1017,"remember this. When they've finished with us, they'll come for you. "
1018, [Tower] 
1019, (Tarak leads the Doctor and Romana to a door.) 
1020,"DOCTOR: Tarak, now listen. We're going back to our ship for some"
1021,"information. I want you to tell Kalmar. No, wait. Tell Kalmar to"
1022,"prepare an attack, but not to move until I join you, all right? "
1023,TARAK: Right. 
1024,"DOCTOR: Good. Come on, let's go. "
1025,ROMANA: We've forgotten about Adric. He's still a prisoner somewhere.
1026,We've got to find him. 
1027,DOCTOR: Adric? Adric? Where can we start? 
1028,"TARAK: Well, there is an inner sanctum. It's where nobody's allowed but"
1029,the three. 
1030,"DOCTOR: If that thing down there's what I think it is, and if it"
1031,"escaped into our universe, billions of lives would be lost. Could you"
1032,take me there? 
1033,"TARAK: Of course, Doctor. "
1034,"DOCTOR: Come on. No, no. Romana, you take the Tardis and I'll take the"
1035,inner sanctum. 
1036,"ROMANA: No, you take the Tardis. I'll take the inner sanctum. "
1037,DOCTOR: Good. 
1038,(The Doctor leaves.) 
1039,"ROMANA: Inner sanctum, please. "
1040,TARAK: Certainly. 
1041, [Tardis] 
1042, (The Doctor returns safely.) 
1043,"K9: Master, the young humanoid Adric "
1044,"DOCTOR: Yes, I know, I know. What do you mean, letting stowaways aboard"
1045,"the Tardis? It isn't a number nine bus, you know. "
1046,"K9: Culpability factor zero, master. "
1047,"DOCTOR: Yes, well, never mind about that. We've got work to do. "
1048,"K9: Please specify task, master. "
1049,"DOCTOR: I want you to help me tap the memory core of the Tardis. Now,"
1050,the information I want will be on the earliest section of the data
1051,core. It's called the Record of Rassilon and it's to do with (strokes
1052,his throat where the bat bit him) 
1053,K9: Master? 
1054,DOCTOR: Vampires. 
1055, [Tower corridor] 
1056, TARAK: That's the entrance to the inner sanctum.
1057,It's always guarded. 
1058,"ROMANA: Time for the old prisoner trick, wouldn't you say? "
1059,(Romana raises her arms.) 
1060,TARAK: Come on! 
1061,(He marches her up to the door at knifepoint.) 
1062,TARAK: Come on! Lord Zargo wishes to see the prisoner. 
1063,GUARD: Zargo sleeps. It's forbidden to disturb him. 
1064,TARAK: I have my orders. 
1065,GUARD: And I have mine. No one must pass this door. 
1066,"TARAK: I will take full responsibility. The code key, please. "
1067,(The guard hands it over. Tarak puts it in the reader upside down. It
1068,beeps.) 
1069,"ROMANA: No, not like that. "
1070,(Romana turns it over and the door opens.) 
1071,GUARD: Just a minute. Who are you? 
1072,ROMANA: Do you know the Lady Camilla? 
1073,GUARD: Of course. 
1074,ROMANA: I just happen to be her blood group separator. 
1075,"GUARD: What? Hey, you "
1076,(Tarak knocks the guard out.) 
1077,TARAK: Okay? 
1078,ROMANA: Well done. 
1079, [Inner sanctum] 
1080, TARAK: This way. We have to move quietly. 
1081,ROMANA: Shush. Let's hope they're sleeping. 
1082,"TARAK: Let's hope they don't wake up. I've heard that when they wake,"
1083,they wake hungry. 
1084, [Tardis] 
1085, (K9 is plugged in to the console.) 
1086,DOCTOR: Well? 
1087,K9: Nothing. 
1088,(The Doctor flicks switches.) 
1089,DOCTOR: Well? 
1090,K9: Nothing. 
1091,"DOCTOR: Nothing? What do you mean, nothing? "
1092,"K9: Nothing, master. There is mention of the Record of Rassilon. "
1093,"DOCTOR: Have you tried Rassilon, Record of? "
1094,K9: Access attempted under all permutations. 
1095,DOCTOR: Vampires. 
1096,K9: Information on vampires totally absent from Tardis databanks. 
1097,"DOCTOR: Okay, try your folklore section. "
1098,K9: My folklore section contains vampire lore from seventeen inhabited
1099,"planets. I will begin with Earth, the legend of Count Dracula. "
1100,"DOCTOR: No, thank you. Not Dracula. Emergency instructions. "
1101,K9: There are eighteen thousand three hundred and forty eight emergency
1102,instructions. I will now list them in code order. One 
1103,"DOCTOR: No, no, no, thank you. No, thank you. "
1104,"K9: There is a magnetic card system on this vehicle, master. "
1105,"DOCTOR: Well, why didn't you say? Of course! "
1106,(The Doctor goes deeper into the Tardis.) 
1107, [Inner sanctum] 
1108, (Zargo and Camilla lie with their arms crossed
1109,over their chests like tomb effigies.) 
1110,"TARAK: We could destroy them now, while they're sleeping. "
1111,ROMANA: They can only be destroyed with a wooden stake. 
1112,TARAK: There's this. 
1113,(His knife.) 
1114,"ROMANA: It's not a wooden stake, Tarak. We're supposed to be looking"
1115,"for Adric, remember? "
1116,"(Romana opens a curtain and finds Adric lying on a bed, dressed like"
1117,the three.) 
1118,TARAK: Your friend? 
1119,ROMANA: I'm just wondering if we've found him in time. 
1120, [Tardis] 
1121, (The Doctor wheels in an ornate book trolley.) 
1122,DOCTOR: The Record of Rassilon. 
1123,(A punch card falls off. He picks it up and inserts it into the
1124,console.) 
1125,"DOCTOR: Oh, good. The Record of Rassilon. "
1126,(A paper readout is printed.) 
1127,"DOCTOR: Got it! Vampire army. Phew, listen to this, K9. So powerful"
1128,"were the bodies of these great creatures, and so fiercely did they"
1129,"cling to life, that they were impossible to kill, save by the use of"
1130,bow ships. Bow ships? What are bow ships? 
1131,"K9: Bow ships, unknown. "
1132,"DOCTOR: Never mind. Yet slain they all were, and to the last one, by"
