,Script
1130,"I tried to get back here to call the ship, and I got caught up in the"
1131,event transmuter. 
1132,ROMANA: How did you get those marks? 
1133,"(Three scars on his face, like Secker had.) "
1134,STOTT: A mandrel. The thing I saved you from. 
1135,"ROMANA: Mandrel. Doctor, they're called mandrels. "
1136,"DOCTOR: Well, Stott, you've got some explaining to do. A hundred and"
1137,eighty three days here? 
1138,STOTT: Yes. I thought I was going to be stuck here for the rest of my
1139,life. There were a few times when I felt like blowing my brains out.
1140,The hardest thing was being able to look out and see Della. 
1141,"DOCTOR: Yes, yes, quite. Tell me, when did you first discover you could"
1142,get out of the projection? 
1143,STOTT: After the accident. Something must have gone wrong with the CET
1144,machine. The edge of the projection was shimmering. 
1145,DOCTOR: Really? 
1146,"STOTT: I decided I had nothing to lose, so I walked straight through it"
1147,and found myself on the Empress. Then I took one of the passenger
1148,coveralls so I could walk about unnoticed. 
1149,DOCTOR: Why didn't you tell Tryst and Della you'd got out? 
1150,STOTT: Because of what I am and what I'm doing. 
1151,DOCTOR: Really? 
1152,"STOTT: I'm a Major in the Intelligence section of Space Corps, on a"
1153,special assignment to find out who's drug running. 
1154,"DOCTOR: Ah ha. You thought it was me, didn't you. "
1155,STOTT: For a while. Then I overheard you and Romana talking in the
1156,lounge. 
1157,"ROMANA: Tryst thought it was you, and now he thinks it's Della. "
1158,STOTT: Tryst's a fool. He knows nothing. He didn't even realise his
1159,expedition was being used to transport a new sort of Vrax that someone
1160,had found. 
1161,"ROMANA: Yes, if you store in on crystal in the CET machine, it can't"
1162,possibly show up on a molecular scan. 
1163,STOTT: He must have arranged somewhere along the line for a pick-up.
1164,They'd have to get the stuff out of the projection and pass it on. 
1165,DOCTOR: Yeah. You've got the stuff I had? 
1166,STOTT: Just a tiny sample. Secker must have found it. He may even have
1167,been involved himself. 
1168,"DOCTOR: Yes, but more important is where the main supply is hidden and"
1169,where it comes from. 
1170,STOTT: All I know is that it's in Eden somewhere. I've been searching
1171,all this time. No result. 
1172,DOCTOR: Then we've got to get the dimension projection sealed off
1173,"again, which means doing what we first came to do. "
1174,STOTT: And what's that? 
1175,"DOCTOR: Separate the ships. Tell me, if we go out of the projection in"
1176,"that direction, do we come to the power unit? "
1177,"STOTT: Yes, you can get out of the projection any way you want. "
1178,"DOCTOR: Good, good. Then that's what we'll do. Come on. Well, come on. "
1179,(Stott turns the lights out and shuts the door after himself.) 
1180, [Outside the Power unit] 
1181, (K9 is there when Stott walks through the wall.) 
1182,K9: Identify. 
1183,(The Doctor and Romana come out.) 
1184,"STOTT: Look out, Doctor. "
1185,"DOCTOR: It's all right, he's mine. "
1186,STOTT: What is it? 
1187,DOCTOR: It's just a perfectly ordinary electric dog. 
1188,"K9: Master, I have located the power unit. "
1189,"DOCTOR: Good, good. Now listen, K9. This is Stott. He's a friend. All"
1190,right? 
1191,K9: Affirmative. 
1192,DOCTOR: Good. Let's get to work. (Stott and K9 stand guard.) 
1193, [Power unit] 
1194," DOCTOR: Liquid hydrogen, turbopump exhaust,"
1195,"reactor core, pressure shell. Right. "
1196,"ROMANA: Doctor, do you really know how to get this thing going? "
1197,DOCTOR: Of course I do. I can start anything from a steam engine to a
1198,Tardis. Have you got a match? 
1199,ROMANA: What for? 
1200,DOCTOR: I want to jam this switch down. 
1201,ROMANA: Would a toothpick do? 
1202,(The one in the Doctor's mouth.) 
1203,DOCTOR: Perfect. 
1204,"K9: Master, during your absence I encountered alien creatures in this"
1205,area. 
1206,"ROMANA: Mandrels, K9. "
1207,"K9: Name noted, mistress. "
1208,"DOCTOR: You'd better guard the door, K9. How many were there? "
1209,"K9: Five units, master. "
1210,DOCTOR: Five! I'd better get a move on or they'll be all over the ship.
1211,
1212,ROMANA: Hadn't we better deal with them first? 
1213,"DOCTOR: No, no, no. Until the ships are separated and the projection is"
1214,"stabilised, it'd be like trying to bail out a small boat with a "
1215,ROMANA: Sieve? 
1216,DOCTOR: Yes. 
1217," [Passenger corridor, by the lift]"
1218,
1219, ATTENDANT: We're doing everything we can. The
1220,skipper's got 
1221,WOMAN 2: We should have been on Azure hours ago. My passengers asked me
1222,"to represent them, to take our complaint to the Captain. "
1223,"ATTENDANT: You must understand, he's very busy in the emergency. He's"
1224,doing everything possible to get you to Azure. 
1225,(The flight attendant presses the lift button. The doors open and a
1226,mandrel pounces on the woman. A second one gets him as he sounds the
1227,alarm.) 
1228, [Empress bridge] 
1229, (Rigg laughs at the scenes of carnage on the
1230,"monitor, as mandrels attack the helpless passengers.) "
1231,"COSTA: What's going on, Captain? "
1232,"RIGG: Nothing much, nothing much. "
1233,COSTA: What's happening? What are those things? 
1234,RIGG: They're a sort of judgment on us all. 
1235,"COSTA: What? I'll have you shot for this, Captain. "
1236,(He uses the intercom.) 
1237,COSTA: Bridge here. Emergency. The passengers on pallet sixty seven are
1238,under attack. All armed crewmembers proceed to pallet sixty seven
1239,immediately! (to Rigg) I shall be charging you with gross neglect of
1240,"duty. The passengers should be your first concern, yet I find you"
1241,drunkenly looking on as they are attacked and killed! Well? 
1242,RIGG: They're only economy class. What's all the fuss about? 
1243, [Power unit] 
1244, (The Doctor is working inside a control unit.) 
1245,"DOCTOR: Is that the one, Romana? Romana, was that "
1246,ROMANA: Mandrel! 
1247,DOCTOR: K9! 
1248,(The mandrel grabs the Doctor in a bear hug.) 
1249,"DOCTOR: K9, quickly! "
1250,(K9 shoots the mandrel and it falls.) 
1251,"STOTT: Doctor, they're coming from both ways. "
1252,"DOCTOR: I've got to get this finished. Romana, did you check the cable"
1253,to the reactor? 
1254,"ROMANA: Yes, I'm pretty sure it was that one. "
1255,"DOCTOR: Well, check it. I need to be absolutely sure. "
1256,(She hesitates at the mandrel. The Doctor kicks it.) 
1257,DOCTOR: It's perfectly all right. It's quite dead. 
1258,ROMANA: If you say so. 
1259,(She jumps over the body.) 
1260,DOCTOR: Was it the one? 
1261,"ROMANA: No, sorry. It's the one below. "
1262,DOCTOR: It's a good thing you checked. I could have caused a
1263,spectacular explosion. 
1264,ROMANA: All ready to go now? 
1265,"DOCTOR: Nearly. Two things. One, I need to know whether the power on"
1266,"the bridge is on maximum. Two, the demat has to be switched on from the"
1267,Tardis at exactly the same time I switch on this old gas oven. All
1268,right? 
1269,ROMANA: All right. 
1270,DOCTOR: Good. 
1271, [Bridge] 
1272," FISK: Captain, this ship is a disaster area. I'm"
1273,placing you under arrest for gross neglect of duty. 
1274,(Costa twists Rigg's arm behind his back.) 
1275,"RIGG: Hey, it's really nice being arrested. "
1276,(Costa takes Rigg out.) 
1277,"FISK: Now, about the, er, mandrels? "
1278,TRYST: Yes. 
1279,FISK: Mandrels. We need to seal them off and then destroy them. I'll
1280,send for heavy weapons. 
1281,"TRYST: I'd rather if they're not killed, if that's possible. "
1282,"FISK: The things are killing our people, man. What do you suggest? "
1283,TRYST: Some sort of tranquillising drug? 
1284,FISK: We haven't got time for pussyfooting around! I can't think why
1285,"you care so much about such ugly, disgusting things. "
1286,"TRYST: It's all a matter of conservation. If they are killed, the whole"
1287,species will have gone. 
1288,"FISK: Look, I'm in charge here. I'll do what I think is best. "
1289,CREWMAN : Level B. Two mandrels have got into the fuel
1290,section. 
1291,FISK: Then kill them. 
1292,"CREWMAN : Well, we're worried about hitting the fuel tanks"
1293,if we fire. 
1294,"FISK: You see what I mean, Tryst? Keep them under surveillance, and if"
1295,"they move out of there, destroy them. "
1296,"CREWMAN : Aye, aye, sir. "
1297,FISK: Has the Doctor been seen in that sector? 
1298,"CREWMAN : No, sir. "
1299,"FISK: Yes, well, pass the word around that if he offers the slightest"
1300,"resistance to arrest, shoot him. "
1301,"CREWMAN : Shoot him, sir? "
1302,"FISK: He's a criminal, isn't he? What else do you do with criminals? "
1303,CREWMAN : Sir. 
1304, [Power unit] 
1305," DOCTOR: Stott, I want you and Romana to go back"
1306,"through the jungle. K9, I want you to go back the way you came. "
1307,"K9: Negative, master. Blurred zone still operative. These zones are"
1308,matter interfaces. 
1309,"DOCTOR: Will you listen to me, please? Stott and I came through one."
1310,It's perfectly all right if it's on the edge of a hull. All you need is
1311,a little determination. 
1312,"K9: Affirmative. Determination, master. "
1313,"DOCTOR: Good. Now, when you get through, I want you to go back to the"
1314,"demat machine set up near the Tardis, and when I whistle, you switch it"
1315,on. Right? 
1316,K9: Affirmative. 
1317,DOCTOR: Good. 
1318,ROMANA: What about you? You're not going to be here when the power unit
1319,"comes on, are you? "
1320,"DOCTOR: No, no. I'm going to rig myself a little time device. Could I"
1321,"borrow your watch, please? "
1322,(The Doctor takes the timepiece from Stott's wrist.) 
1323,STOTT: Certainly. 
1324,"DOCTOR: Good. Is that on ship's time? Right. Now, I'll give you till"
1325,20-25 to reach the bridge and put the power on. I'll set my device so I
1326,can escape in good time. 
1327,ROMANA: What about the mandrels? You won't have K9 or a gun. 
1328,DOCTOR: I'll have to use my wits. Off you go. Take care. Look out for
1329,excisemen. I don't think they like us very much. Off you go then. 
1330,"(Stott, Romana and K9 leave.) "
1331,DOCTOR: Twenty oh one. 
1332, [By the lift] 
1333, (Fisk has assembled all four of the ship's crew to
1334,give them his orders.) 
1335,FISK: I want this ship searched from top to bottom. If you see the
1336,"Doctor or his lady companion, arrest them. If they resist, kill them."
1337,"Right, get on with it. "
1338,(Fisk gets into the lift.) 
1339, [By the airlock] 
1340, DYMOND: Shall I put it on destruct? 
1341,TRYST: I think not. We'll see how things develop. We'll keep in touch. 
1342, [Eden] 
1343, (Roar!) 
1344,ROMANA: Look out! 
1345,"(Stott shoots at the mandrel, making it stagger just enough for them to"
1346,run past and away. Then it collapses.) 
1347, [Power unit] 
1348, (The Doctor has taken Stott's watch apart and is
1349,"putting pieces into the control unit. Behind him, the 'dead' mandrel"
1350,stirs. The time is 20:16.) 
1351,DOCTOR: Plenty of time. 
1352,(The Doctor bends down for a piece of equipment just as the mandrel
1353,takes a swipe at him. 
1354,(K9 enters the interface.) 
1355, [Eden] 
1356, ROMANA: You go back and guide the Doctor through. 
1357,STOTT: What about the excisemen? 
1358,ROMANA: I'll manage. 
1359,STOTT: Right. 
1360,(Stott turns back. Romana runs out of the projection and through the
1361,lounge. 
1362, [Power unit] 
1363, (The Doctor slips through a gap between two
1364,control units which is too small for the mandrel to follow. He goes
1365,"back behind the units to where he was working, gives it a final blast"
1366,of sonic screwdriver then switches on the countdown. The ticking
1367,attracts the mandrel.) 
1368,DOCTOR: No! No! 
1369,(The mandrel smashes the annoying timer. The flash and bang finally
1370,kills it. The Doctor stares as the creature crumbles into a heap of
1371,steaming powder.) 
1372,DOCTOR: Vraxoin. Of course! So that's it. 
1373, [First class corridor] 
1374, (Romana ducks out of sight into a cloakroom when
1375,she hears voices approaching.) 
1376,COSTA: How much longer do we have to stay up here? 
1377,FISK: Until the job's finished. How many casualties so far? 
1378,"COSTA: Here's the list. Twelve dead, twenty nine injured. Enough for a"
1379,small war. 
1380,FISK: You know what this means? 
1381,(Costa uses a drinks dispenser in the wall opposite the cloakroom.) 
1382,COSTA: What? 
1383,FISK: Almost certain promotion. 
1384,COSTA: Promotion? 
1385,"FISK: It's bound to be, a situation as big as this. It'll sort itself"
1386,"out and in the end we'll have two tailor-made suspects, the Doctor and"
1387,the girl. We'll be the golden boys of the day. 
1388,COSTA: We don't actually know anything about those two. 
1389,FISK: You found the traces of Vrax in the Doctor's pocket. What more do
1390,you want? 
1391,(Fisk and Costa move off towards the lounge. Romana comes out of hiding
1392,and heads carefully for the bridge.) 
1393, [By the Tardis] 
1394," (Everything is as the Doctor left it, with the"
1395,Tardis door wide open.) 
1396,K9: In position. Waiting. 
1397, [Power unit] 
1398, (The Doctor is trying to repair the damage to the
1399,controls that the mandrel caused.) 
1400,DOCTOR: Twenty twenty-one? I'll never do it. 
1401, [Empress bridge] 
1402," (Rigg is there, and coming down from his high with"
1403,a crash.) 
1404,ROMANA: The Doctor's got into the power unit. 
1405,"RIGG: Good, good. "
1406,ROMANA: We're going to separate the ships now. 
1407,RIGG: Have you got something for me? Something I need? 
1408,"ROMANA: I must put full power on. Please, let me pass, Captain. "
1409,"RIGG: I must have something for this terrible feeling, don't you"
1410,understand? 
1411,ROMANA: I haven't got anything. 
1412,"RIGG: You're lying. I know you've got the stuff, now tell me where it"
1413,is. 
1414,"ROMANA: Please, let me just set the controls and I'll help you. Now let"
1415,me go. 
1416,"RIGG: I don't care about the stupid ship, woman. I want something for"
1417,"this feeling! Now you can help me. Please, I'll give you money. I've"
1418,got money. How much? How much? 
1419,"ROMANA: Let me just get the ship operating, and then I'll see that you"
1420,get medical help. 
1421,RIGG: Just a little bit. I know you've got it. Now let me have some or
1422,I'll kill you! 
1423,ROMANA: I haven't got anything! 
1424,(Rigg tries to hit her. She ducks under his arm and runs for the
1425,control console. He grabs her wrist as she reaches for the button.
1426,20:23. The Doctor is sweating as he works.) 
1427,RIGG: Give it to me! 
1428,(Fisk shoots Rigg.) 
1429,"ROMANA: Oh, thank you. He was going to kill me. "
1430,"FISK: Well it wouldn't have mattered much, since you're going to die"
1431,anyway. Trafficking in drugs is punishable by death on Azure. 
1432,ROMANA: Whereas bureaucratic murder is rewarded with promotion. 
1433,"FISK: I didn't invent the rules, I just enforce them. Don't touch those"
1434,controls. 
1435,ROMANA: But you don't understand. The Doctor is in the power unit.
1436,We're going to separate the ships now. I must operate the drive. 
1437,"FISK: I don't know what you're up to, but I intend to stop you. Touch"
1438,those controls and I shoot! 
1439,ROMANA: I thought you were going to kill me anyway. 
1440,FISK: Don't touch them! 
1441,(20:24. The Doctor has finished and put the toothpick in place. He
1442,blows his dog whistle. K9 switches on the demat machine which sends a
1443,beam into the blurred area. 20:25. Romana hits the power control.
1444,Everything shimmers and the Doctor runs out of the Power unit into a
1445,"blurred area, and disappears.) "
1446, Part Four
1447,
1448, [Empress bridge] 
1449, (The two ships are separated. Romana picks herself
1450,"up from the floor. Fisk is still down, so she kicks his gun out of his"
1451,hand and runs out. Fisk is about to follow when - ) 
1452,"DYMOND : He's done it! Empress, this is Hecate. Full"
1453,"separation has been achieved. No damage to report. Empress, this is"
1454,Hecate. Respond please. 
1455,"FISK: I read you, Dymond. What are you doing on your ship? "
1456,DYMOND : I came aboard to get a couple of GP guns to help
1457,against the mandrels. The ships separated whilst I was here. 
1458,"FISK: Yeah, right. I'll check the Empress for damage. "
1459,(He punches a row of buttons.) 
1460,FISK: Good as new. 
1461,"DYMOND : Waterguard Fisk, sir. I request your permission to"
1462,continue my journey. I will not be pressing any claim on the Empress. 
1463,"FISK: No, no, no, no. I might need you as a witness. There's bound to"
1464,be an enquiry. 
1465,DYMOND : But if I delay my departure for even an hour I'll
1466,lose my contract! 
1467,"FISK: Look, Dymond, I haven't raised this with you before, but now I'm"
1468,"telling you officially. When this accident occurred, you, as Rigg"
1469,"rightly pointed out, was in a prohibited area. Now that makes you"
1470,"liable to at least a considerable fine. Now, if you try to get away,"
1471,"I'll nail a writ to your bulkhead! Do you understand, Dymond? "
1472,DYMOND : Yes. 
1473,FISK: Right. Come back aboard as quick as you can. 
1474,"DYMOND : Yes, right away. "
1475, [By the Tardis] 
1476," K9: Operation one hundred percent successful,"
1477,mistress. 
1478,"ROMANA: Yes, I know, but I can't find the Doctor. Can you locate him,"
1479,K9? 
1480,K9: Affirmative. Sensors indicate that the master is not aboard the
1481,"ship, mistress. "
1482,ROMANA: What! 
1483,(The Doctor is lying unconscious in a dark room.) 
1484, [Sickbay] 
1485, (An injured passenger is wheeled into the room
1486,opposite the Tardis. Romana enters.) 
1487,"ROMANA: Della, have you seen the Doctor? "
1488,"DELLA: No, I've been too busy with the casualties. The Excisemen want"
1489,"him shot on sight, and you. "
1490,"ROMANA: Yes, I know. I wonder, could you bare to talk about Stott? "
1491,DELLA: Why? 
1492,"ROMANA: Well, Tryst told us that you and he might be implicated in the"
1493,"drug smuggling. Now, we know it's not you and Stott, but it would help"
1494,if you could tell me what happened. 
1495,DELLA: All right. Stott and I were together. He was acting very
1496,strangely. He kept telling me to go back to the shuttle. I could see he
1497,"was worried. There were mandrels prowling about, but I know it wasn't"
1498,that. He was looking for someone. 
1499,ROMANA: For whom? Did he say? 
1500,DELLA: No. Then it happened. A shot came from the forest. He was only
1501,"stunned, but a mandrel came out from behind. I ran. I ran. I couldn't"
1502,"help myself, I just ran. I was so afraid. "
1503,"ROMANA: It's all right, Della. Anyone would have done the same. "
1504,DELLA: The mandrel killed him. 
1505,ROMANA: How do you know? 
1506,DELLA: Tryst told me. He showed me a visprint. It was horrible. 
1507,ROMANA: Stott didn't die. He's here on this ship. 
1508,DELLA: What? He can't 
1509,ROMANA: He is. 
1510,DELLA: But where? I must see him. 
1511,"ROMANA: Not yet. Now, we must find out who is smuggling the Vraxoin. We"
1512,know it's something to do with the Eden projection. Stott may be able
1513,to help us. 
1514,"DELLA: I knew it was him looking at me. In the Eden picture, someone"
1515,"staring out, only I couldn't believe it. I thought I was seeing a"
1516,"ghost. Romana, what can I do to help? "
1517,"ROMANA: First of all, we'd better find the Doctor. "
1518, [Hecate] 
1519, (The Doctor wakes up. The first thing he inspects
1520,is a wicked looking free standing laser-like device.) 
1521,DOCTOR: How very odd. How very strange. 
1522,(He looks out of the porthole to see the Empress a short distance
1523,away.) 
1524,DOCTOR: How very clever. 
1525,"(He hides as Dymond enters. Dymond uses a small keyboard, smiles at the"
1526,"results on the screen, and leaves again. The Doctor crawls over and"
1527,calls up the results again. Eden Project: projected turnover Gal
1528,"Credits: z13,000,000. Overheads z3,900,000. Profit margin: 9,100,000.) "
1529,DOCTOR: The profits on human suffering. 
1530,"(The Doctor leaves that room, and ducks behind a bank of equipment as"
1531,Dymond goes past. He tiptoes through the airlock where Dymond is
1532,"suiting up again, and gets into the back of the shuttle. Dymond gets in"
1533,and plugs his helmet into the shuttle air supply. The Doctor puts
1534,himself into suspended animation. The shuttlebay doors open and Dymond
1535,"flies back to the Empress, as promised to Fisk.) "
1536, [Empress bridge] 
1537," FISK: Right. Dymond's on his way. Now, any sign of"
1538,the Doctor? 
1539,COSTA: No. They're searching A deck at the moment. 
1540,TRYST: I think I know where the Doctor went. 
1541,FISK: Where? Why didn't you say so before? 
1542,TRYST: You may find it hard to believe. 
1543,"FISK: Make me believe, professor. "
1544,TRYST: I think he went into the projection. 
1545,FISK: What projection? 
1546,TRYST: The CET machine. The image has become an unstable dimensional
1547,field. 
1548,"FISK: Oh. If he went into it, he's got to come out the same way. Costa,"
1549,check the guard on the lounge. 
1550,COSTA: Right. 
1551,FISK: I'll join you later. 
1552,(Costa leaves.) 
1553,"FISK: Tryst, what would the Doctor want inside the projection? "
1554,TRYST: I can only imagine that one of the crew of my expedition found a
1555,"new source of this er, what is this thing called? "
1556,FISK: Vrax. 
1557,"TRYST: Ja, Vrax. Yes, Vrax, and placed it in the transmute location."
1558,"Yes, then he informed the Doctor. So the Doctor comes on board and"
1559,"makes the pick-up, which fits in with your own wonderful theory, does"
1560,it not? 
1561,"FISK: Yes, yes. Only, why did he bother to separate the ships? "
1562,"TRYST: Perhaps it's because, as you say, he is a criminal. "
1563,FISK: That would be it. 
1564, [By the Tardis] 
1565, (Della comes running up.) 
1566,ROMANA: Did you find anything? 
1567,DELLA: Only a mandrel. 
1568,"ROMANA: Oh, he must be somewhere. "
1569,"K9: Negative, mistress. I have scanned the ship and I detect no "
1570,(K9's 'ears' whirr.) 
1571,"ROMANA: What is it, K9? "
1572,K9: This way. The Doctor has just come aboard. 
1573, [Outside the airlock] 
1574," (Dymond's shuttle has docked, and Dymond heads for"
1575,"the lift. Romana, K9 and Della hide round the corner.) "
1576,"DOCTOR: Hello, K9. "
1577,"ROMANA: Hello, Doctor. "
1578,"DOCTOR: Hello, Romana. Everything all right? "
1579,ROMANA: What happened to you? 
1580,DOCTOR: I got caught in the interface when the two ships separated.
1581,"Hello, Della. "
1582,(The lift arrives.) 
1583,DOCTOR: Look out! Quick! 
1584,(Two armed crewmen are there. One catches Della but the other is
1585,stunned by K9 as the Doctor and Romana duck into the stairwell. K9
1586,leaves. The crewman checks on his fallen colleague then returns to
1587,Della.) 
1588,CREWMAN: What were you doing with them? 
1589,DELLA: Finding out a few things. 
1590,"CREWMAN: Well, you'd better tell Fisk about it. Come on. "
1591,(The Doctor and Romana return.) 
1592,"DOCTOR: Bit uncivil of them, pointing their guns at us like that. "
1593,ROMANA: They've had orders to shoot. 
1594,"DOCTOR: Yes. Tell me, what would you use an inchuka laser for? "
1595,ROMANA: An inchuka laser can be used to carry thousands of telecom
1596,messages 
1597,DOCTOR: Shush. Could it carry a CET projection crystal? 
1598,"ROMANA: From what I've seen of Tryst's set up, I should think so. Why? "
1599,DOCTOR: Because Dymond's got a CET projection machine aboard the Hecate
1600,with an inchuka laser attached. 
1601,ROMANA: Then Tryst and Dymond are the smugglers? 
1602,DOCTOR: It looks like it. The only way of convincing Fisk is to catch
1603,them in the act of transferring the Vraxoin. 
1604,"K9: Master, detect units approaching. "
1605,"(It is Stott, backing away as he fires at a mandrel.) "
1606,"DOCTOR: Stott, leave it to K9! "
1607,(K9 zaps the creature to the floor.) 
1608,"STOTT: What happened to you, Doctor? "
1609,DOCTOR: Never mind about us. We know who the smugglers are. 
1610,STOTT: Who? 
1611,"DOCTOR: Dymond's the pick-up man, and the smuggler's Tryst himself. "
1612,STOTT: Tryst? 
1613,DOCTOR: Yes. The Vraxoin's kept on the Eden crystal. They're about to
1614,transfer that crystal to the Hecate. 
1615,STOTT: Do you know what the source is? 
1616,ROMANA: Yes. Those things. 
1617,STOTT: The mandrels? 
1618,DOCTOR: Yes. One of them attacked me in the Power unit. Poor thing was
1619,"electrocuted, burnt to a powder. "
1620,STOTT: A powder? You mean? 
1621,DOCTOR: Vraxoin. 
1622,STOTT: No wonder I couldn't find it. 
1623,DOCTOR: Yes. They can make the transference across space by means of
1624,the inchuka laser. 
1625,STOTT: Can you prove it? 
1626,DOCTOR: Yes. 
1627,STOTT: How? 
1628,DOCTOR: I let them do it. 
1629, [Empress bridge] 
1630, (Della's crewman escort is grabbed by a mandrel
1631,out in the corridor. She screams and runs into the bridge where Tryst
1632,is putting on a spacesuit like Dymond's.) 
1633,"DELLA: Tryst, there's a mandrel out there! "
1634,"TRYST: It's all right, Della. Dymond has a gun. "
1635,"DELLA: What are you doing, Tryst? You weren't thinking of leaving the"
1636,"ship, were you? You've got to help the Doctor. You knew the CET was"
1637,unstable so it's all your fault. You must help them get the mandrels
1638,back into the projection. 
1639,TRYST: Is that what he's doing? 
1640,DELLA: Yes! 
1641,"TRYST: Good. In that case, I'm right behind him. "
1642, [Lounge] 
1643, (The Doctor is examining the CET machine when
1644,"Costa and two crewmen burst through the main door, and Fisk in from the"
1645,washroom with anther two. The Eden projection is running.) 
1646,"FISK: Put your hands up, Doctor! "
1647,"DOCTOR: You're arresting the wrong man, you know, Fisk. "
1648,"FISK: That's enough, Doctor. "
1649,STOTT: Stop! 
1650,(Stott runs out of the projection. 
1651,FISK: Who are you? Keep your hands up! 
1652,(Fisk takes Stott's proffered ID.) 
