,Script
578,DOCTOR: Stop it. 
579,JAMIE: Doctor! 
580,"DOCTOR: Jamie, don't do it. "
581,"JAMIE: Doctor, look! "
582,DOCTOR: Oh my word! (Looking down from the next hill are two
583,rectangular beings with round heads with points sticking out of them.
584,Their voices sound like sweet little girls.) 
585,QUARK: Do not move. Do not move. 
586,(Toba appears.) 
587,QUARK: Next task? Shall we destroy? Shall we destroy? 
588,(One Quark unfolds a weapon arm from its body.) 
589, Episode Two
590,
591, [Saucer]
592,
593, RAGO: Bring them inside. 
594,(A Quark hustles the Doctor and Jamie out of the airlock and into the
595,"massive control room, followed by Toba. There is a raised dais in the"
596,middle with a separate control unit.) 
597,"DOCTOR: Oh, good heavens. "
598,"JAMIE: Look, what's going on? Who are you? "
599,(Rago and Toba step onto the dais.) 
600,RAGO: We are Dominators. Both of you stand by that wall. 
601,JAMIE: I will not. 
602,"DOCTOR: Now, Jamie. "
603,"JAMIE: Oh no, they're not going to "
604,TOBA: We are meant to be obeyed. 
605,JAMIE: Not by me you're not. 
606,DOCTOR: Jamie! 
607,(A Quark moves towards Jamie with two weapon arms pointing at him.) 
608,"JAMIE: Wha? Oh, if you insist. "
609,"(Jamie goes towards the wall then is suddenly pulled onto it, stuck"
610,like glue.) 
611,"JAMIE: Doctor, I can't move. Help me! "
612,(But the Doctor is pulled to the wall as well.) 
613,RAGO: It is pointless to struggle. My Quarks have used a molecular
614,force to bind your bodies to the wall. 
615,JAMIE: What's he going do with us? 
616,(Toba touches a control and the piece of wall Jamie is stuck to turns
617,into a table.) 
618,RAGO: Alien races are occasionally of use to us. I intend to probe your
619,physiological make up. 
620,DOCTOR: Do what? 
621,"JAMIE: Doctor, can you not do anything? "
622,"DOCTOR: Don't struggle, Jamie. Keep still. "
623,RAGO: Toba. 
624,"TOBA: Quarks, attach force units. Activate. "
625,(The Quarks put their arms on the bottom of the table.) 
626,RAGO: Visor! Transmatter focus probe. 
627,(Rago looks through the visor at Jamie.) 
628,RAGO: Brittle skeletal structure. Reasonable flexibility. A certain
629,"amount of muscular force. Could be marginally useful. Vulnerable, only"
630,one heart. 
631,TOBA: Intelligence? 
632,"RAGO: A simple brain. Signs of recent rapid learning. Still, somewhat"
633,crude. 
634,TOBA: Shall I prepare the other specimen for scrutiny? 
635,"RAGO: No, they will be identical. Conserve power. "
636,(The Quarks disconnect and the table becomes a wall panel again.) 
637,TOBA: Are they dangerous? 
638,"RAGO: No, they are physically inferior. "
639,TOBA: So we destroy them? 
640,RAGO: No. It is possible we may use them. 
641,TOBA: What for? 
642,RAGO: Workforce. 
643,TOBA: We've got the Quarks. 
644,"RAGO: We must conserve their power, you know that! "
645,TOBA: But why do you want? (gets a Look from Rago) Command accepted. 
646,RAGO: Set up a reaction test. 
647,(Rago goes over to the Doctor.) 
648,RAGO: Test this one.
649,
650, [Survey unit]
651,
652, (The video connection is very poor.) 
653,"SENEX : Your picture is fading, Balan. Your picture is"
654,fading. 
655,"CULLY: Never mind the picture, Father. The important thing is, what are"
656,you going to do? 
657,"SENEX : I can't hear you, Balan. Send Cully and the"
658,strangers to the Capital. I'll question them there. 
659,(Transmission ends.) 
660,CULLY: Father? Father! Can't you get them back? 
661,TEEL: They've switched off the reception I'm afraid. 
662,"CULLY: Oh, switched off? That's typical, isn't it. Typical Dulcian"
663,"behaviour. Something strange, something you don't understand and you"
664,switch off. (taps his head) Up here. 
665,"BALAN: We don't all have your childish curiosity, Cully. "
666,CULLY: You'd have more fun out of life if you did. 
667,TEEL: The power units of the travel capsule are charging now. 
668,CULLY: You ever travelled in a capsule before? 
669,ZOE: I can't say that I have. How do they work? 
670,"CULLY: Don't know. Can't stand the things myself. Hey, you asked a"
671,question. 
672,ZOE: Yes. 
673,"CULLY: There you go, Balan, that proves it. This girl's got an"
674,enquiring mind. She can't possibly come from Dulkis. 
675,BALAN: That will be for your father to decide. As soon as your friends
676,return they will follow you and Cully in the second capsule. 
677,ZOE: Wouldn't it be better if all four of us went together? 
678,KANDO: Travel capsules only take two. 
679,TEEL: Number one ready. 
680,"KANDO: It's nothing to be afraid of, you know. "
681,"ZOE: Oh, I'm not frightened. I'm looking forward to it. "
682,"CULLY: Come on, let's try and stir up a little action in the Capital. "
683,KANDO: You really mustn't believe Cully's wild tales. 
684,(A wall panel opens to reveal two padded seats. Cully and Zoe enter and
685,sit.) 
686,"BALAN: I will dial for the Capital, Cully, if you don't mind. "
687,"CULLY: I see. Frightened I might disappear, eh? "
688,"BALAN: Well, it has been known, hasn't it, Cully. "
689,"CULLY: It'd be a joke if it happened this time though, wouldn't it? "
690,(Balan closes the door and the windowless bullet with fins hurtles off
691,through the air.)
692,
693, [Capsule]
694,
695, CULLY: The selector's a bit warm. Soon reach the
696,ceiling. It'll be all right when we level off. There you are. Sit back
697,and relax. Won't take long. 
698,ZOE: Does this land on automatic control as well? 
699,"CULLY: Oh yes, the whole thing's automatic. Dial where you want to go"
700,and in less than eight minutes you're there.
701,
702,[Saucer]
703,
704," JAMIE: Look, how long are you going to keep us"
705,like this? 
706,TOBA: Silence! 
707,"JAMIE: Oh, if I could only get away from this wall. "
708,"DOCTOR: Shush, Jamie. I am trying to listen. "
709,"JAMIE: Oh, everyone wants me to shut up. All right, I will. "
710,RAGO: And if we are to use these Dulcians as slaves there are certain
711,"qualities you must look for. Obedience, strength, sufficient"
712,"intelligence to make them of use, but not so much as to make them"
713,dangerous. Is that clear? 
714,TOBA: Yes. 
715,"JAMIE: Er, what are they saying? "
716,DOCTOR: I think they're arranging for some sort of tests. 
717,JAMIE: Tests? What for? 
718,DOCTOR: I don't know. I thought I heard them mention the word
719,intelligence. 
720,"JAMIE: Oh, you mean they're going to find out how clever we are? "
721,DOCTOR: Yes. Or how stupid. I wonder which is the more important to
722,them? 
723,[Capsule]
724,
725, ZOE: Will it take long to reach the Capital? 
726,CULLY: Reach it? We're there. Door to door service. 
727,[Council chamber]
728,
729, (Through the picture window we can see travel
730,capsule tubes. There are large bromeliads in pots for decoration. The
731,Council meets lounging in easy chairs. They are all older men in long
732,dresses.) 
733,"BOVEM: Very well, then. It is agreed that the area in question be"
734,converted for holiday and relaxation purposes. This is now agreed?
735,Subject of course to the approval of Director Senex. 
736,COUNCILLOR 1: Oh I'm sure the Director will approve our decision. After
737,"all, he considers the Caves of Arick "
738,COUNCILLOR 2: Has he sufficiently considered the case of the residents 
739,"BOVEM: Really, gentlemen, we've debated this matter for several months."
740,"I don't wish to hurry you, indeed, but at least. "
741,(Intercom chime.) 
742,"BOVEM: Yes, what is it? "
743,SECRETARY : Cully has arrived with a stranger. They're here in the
744,antechamber. 
745,"BOVEM: Ah yes. Well, you'd better keep them out there. Has the Director"
746,been informed? 
747,SECRETARY : Not yet. 
748,CULLY : I will not stay here. I'm going in. I want to see my
749,father. 
750,BOVEM: What is going on out there? 
751,(Cully and Zoe enter.) 
752,CULLY: If you think that I'm going to stay out there for hours on end
753,"kicking my heels, you're very much mistaken, Bovem! "
754,BOVEM: Will you tell the Director his son has arrived? 
755,"SECRETARY : Yes, of course. "
756,"BOVEM: You realise, of course, that you've interrupted a most important"
757,meeting. 
758,CULLY: Not nearly as important as the news I've got. 
759,BOVEM: Oh really? And what adventure have you dreamt up for us this
760,time? Who is this young person? 
761,CULLY: Zoe. I met her on the island with two of her friends. They're
762,coming on later. 
763,"BOVEM: Oh, I see. Doubtless none of you had permits? "
764,"CULLY: Oh, don't be stupid, man. How could they have permits? They've"
765,come from another planet! 
766,"COUNCILLOR 1: Oh, nonsense. The existence of life on another planet was"
767,conclusively disproved! 
768,"COUNCILLOR TWO: Oh, come now "
769,COUNCILLOR 1: By scientific. 
770,COUNCILLOR 2: It is perfectly possible that life does exist. 
771,"CULLY: Look, there's no time for the usual Dulcian debate. Don't you"
772,realise what's happened? 
773,BOVEM: And what's that? 
774,CULLY: A space vehicle has landed. 
775,COUNCILLOR 2: A space vehicle? 
776,COUNCILLOR 1: Ridiculous! 
777,"BOVEM: Oh really, Cully. You're wasting this Council's valuable time"
778,"with these ridiculous stories. Just because you're the Director's son,"
779,does not mean 
780,"CULLY: Hello, Father. "
781,(Everyone stands.) 
782,"BOVEM: I'm sorry, Director Senex. I was not aware that "
783,SENEX: So I observed. I think it would be better if I speak to Cully
784,and the young lady alone. 
785,"BOVEM: Of course, yes. "
786,"SENEX: Well, wait in the antechamber. "
787,COUNCILLOR 1: I told you the commission specifically stated that there
788,was no life on other planets than this! 
789,(Bovem and the Councillors leave.) 
790,"CULLY: Look father, I "
791,"SENEX: Cully, do you enjoy being treated like a clown? Your name? "
792,ZOE: Zoe. 
793,"SENEX: Well then, Zoe, what were you doing on the island? "
794,"ZOE: Nothing, really. Just looking around. "
795,SENEX: But didn't you know it was dangerous? 
796,"ZOE: No. At least, not at first. "
797,"SENEX: Oh, Cully. How can your conscience allow you to expose innocent"
798,and foolish people to such dangers? 
799,CULLY: But I didn't take her to the island. 
800,"SENEX: Oh ho, nonsense. I know all about Cully's Adventures Unlimited. "
801,CULLY: You know? But why didn't you 
802,"SENEX: Well, you weren't doing any harm. At least we thought you"
803,weren't. 
804,CULLY: But it's illegal. 
805,"SENEX: But to prosecute would have given you open publicity, and it"
806,wouldn't have reflected very well on me either. 
807,CULLY: I see. Why can't I be treated as an individual and not always as
808,the son of the Director? 
809,"SENEX: Now then, young lady. Tell me exactly what happened. "
810,"ZOE: Well, I landed with the Doctor and Jamie "
811,"SENEX: In Cully's ship, yes? "
812,"ZOE: Cully? Oh, no. We came in the Tardis. "
813,SENEX: What is that? 
814,ZOE: It's an advanced craft for travel. 
815,CULLY: It goes through time and space. 
816,SENEX: I think this joke has gone far enough. 
817,CULLY: There you are. I knew he wouldn't believe it. 
818,ZOE: But it's true! You can ask the Doctor and Jamie. They'll be here
819,soon. 
820,SENEX: What do you hope to gain by this foolishness? 
821,CULLY: But it's not. I told you when we spoke on the vision link. Three
822,"people have been killed, a spacecraft has landed, radioactivity has"
823,"disappeared, and there are robots on that island. Now I may have a"
824,"pretty inventive mind, but I wouldn't have dreamt up that lot, now"
825,would I? 
826,SENEX: And no doubt you will confirm all this? 
827,"CULLY: Er, well, I haven't actually seen the spacecraft and robots. "
828,"SENEX: Oh! So it seems we only have your word for it, Cully. And"
829,experience has taught us how little that can be relied upon.
830,
831, [Saucer]
832,
833, JAMIE: What's he up to now? 
834,"DOCTOR: He's arranging some sort of intelligence test, Jamie. "
835,JAMIE: You mean those wee shapes in that big box? What for? 
836,"DOCTOR: Yes, well, you have to put the right shapes into the correct"
837,holes. It's quite simple. 
838,"JAMIE: Och, if that's all it is, a kid of two could do it. "
839,"DOCTOR: Yes, that's what's bothering me. It's too simple. "
840,(The Doctor scratches his nose.) 
841,JAMIE: You moved. 
842,DOCTOR: I'm free. What about you? 
843,JAMIE: Me too. 
844,DOCTOR: Come on. 
845,(The Doctor and Jamie start to slide to their right but the Quark
846,bleeps.) 
847,TOBA: Well? 
848,QUARK: Molecular force expended. Order required. Are the specimens to
849,be re-fused? 
850,TOBA: No. 
851,DOCTOR: What are you going to do with us? 
852,TOBA: Quiet! Over there. 
853,(The Doctor goes to the test box.) 
854,TOBA: Sit! 
855,"DOCTOR: Oh, thank you. "
856,TOBA: Attach force units. 
857,(A Quark fastens its arms to the box.) 
858,TOBA: Hands! Through there. 
859,(The Doctor puts his arms through holes into the box.) 
860,TOBA: Power. 
861,(The Doctor gets an electric shock.) 
862,TOBA: That will be repeated again at regular intervals until the puzzle
863,is reassembled. 
864,DOCTOR: Oh. Oh no! 
865,TOBA: Begin! 
866,"JAMIE: Hurry up, Doctor. "
867,(The Doctor fumbles with the shapes and gets another shock.) 
868,"DOCTOR: Oh, my hands! "
869,"JAMIE: No, the square bit, not the star. The square bit "
870,(Another shock.) 
871,TOBA: Detach. 
872,(The Quark moves back and Toba pulls the Doctor's hands from the box.
873,Jamie comes to help.) 
874,JAMIE: Doctor! Doctor. Now where's that? 
875,(Jamie takes a bottle of smelling salts from the Doctor's pocket.) 
876,"JAMIE: Here. Quick. Sniff, sniff. That's it. Come away. Come away from"
877,that fearful contraption. Are you all right? 
878,(Out of Toba's hearing.) 
879,"DOCTOR: Yes, I'm all right. "
880,JAMIE: What were you up to? That puzzle was easy! 
881,DOCTOR: An unintelligent enemy is far less dangerous than an
882,"intelligent one, Jamie. "
883,JAMIE: Eh? 
884,DOCTOR: Just act stupid. Do you think you can manage that? 
885,"JAMIE: Oh aye, it's easy. "
886,TOBA: Attach force units. 
887,(The Quarks fasten themselves to the metal rails of the dais.) 
888,TOBA: You two over here. Sit. 
889,"JAMIE: Oh, thank you. "
890,DOCTOR: Oh. 
891,"(Jamie and the Doctor sit on the edge of the dais, feet off the floor.)"
892,
893,"TOBA: Power. Now, get up. "
894,(The Doctor puts a foot down and gets an electric shock.) 
895,"TOBA: I said, get up! "
896,"DOCTOR: Oh, but "
897,"(Jamie puts his foot down, creating a circuit, then grabs the Doctor's"
898,arm to pass the shock onto him before letting go again.) 
899,JAMIE: Try around here. 
900,TOBA: You are surrounded. 
901,JAMIE: Well how do we get off? 
902,TOBA: There is a way. Find it! 
903,(Rago enters.) 
904,RAGO: Test complete? 
905,TOBA: These creatures are useless. 
906,RAGO: Strange. 
907,"TOBA: You question my report, Navigator Rago? "
908,RAGO: I find it at variance with what we already know. 
909,TOBA: I don't understand. 
910,RAGO: The weapons we saw earlier. Could they have been devised by such
911,apparent simpletons? 
912,TOBA: You think that there were other 
913,RAGO: That we will find out. Message to Fleet Leader. Materials readily
914,accessible. Fleet proceed to refuel. Investigating potential slave
915,labour. Transmit! 
916,(A Quark beeps.) 
917,RAGO: Come with me. 
918,"DOCTOR: But every time we try and get up, there's a "
919,RAGO: Jump! 
920,DOCTOR: Jump? Jump. 
921,"(The Doctor and Jamie climb up onto the dais, hold hands then jump"
922,forward past where the Quarks were standing.) 
923,RAGO: A simple circuit completed by your bodies. You obviously know
924,little of electricity. 
925,DOCTOR: Elec? Elec? 
926,RAGO: Are you such a fool? You have intelligent eyes. I will continue
927,the test personally. Bring! 
928,(The Quark sticks out its arms.) 
929,"DOCTOR: All right, we'll go."
930,
931, [Survey unit]
932,
933," KANDO: The strangers are a long time returning,"
934,Balan. 
935,BALAN: Yes. Doubtless searching the whole island in search of something
936,"which doesn't exist. Teel, have you finished that graph? "
937,"TEEL: Yes, sir. "
938,"BALAN: Show it me, please. "
939,"TEEL: Well, it doesn't seem logical somehow, sir. We all know that"
940,there's been a steady uniform decrease in radiation during the past
941,"hundred and seventy two years, and suddenly it all disappears. "
942,"BALAN: Well it has happened, therefore it is a fact. We now know that"
943,the effects of an atomic explosion lasts for a hundred and seventy two
944,years. 
945,"TEEL: But why, sir? "
946,"BALAN: Oh, I dare say our atomic experts could provide a reason, but it"
947,seems pointless to spend time searching for reasons to prove facts. A
948,fact is a truth. 
949,KANDO: But the spacecraft that Cully saw? 
950,"BALAN: Oh, there is no such spacecraft, nor are there any robots."
951,
952, [Museum]
953,
954," RAGO: I said, what is that? "
955,"DOCTOR: Well. Well, it's some sort of gun, isn't it? "
956,(The Doctor picks up the laser rifle.) 
957,RAGO: Explain it to me. 
958,"DOCTOR: Well, I don't know that I "
959,RAGO: Firepower potential? 
960,DOCTOR: Hmm? 
961,RAGO: What does it do? 
962,"DOCTOR: Oh, oh, I see. Well, guns kill people. Is that what you wanted"
963,to know? 
964,RAGO: Fire it. 
965,"DOCTOR: Well, I don't think I. You have to put something into it first,"
966,"And it comes out here, as far as I remember. "
967,(Rago hands the rifle to Jamie.) 
968,RAGO: You. Fire it. 
969,"JAMIE: Oh, I wouldn't know how it works. "
970,TOBA: Do as Dominator Rago says! Fire it! 
971,"JAMIE: Well I'll try. Er, you put a cork or something in there and"
972,something 
973,(The rifle is pointing at the Doctor.) 
974,"DOCTOR: Jamie. Jamie, be careful. "
975,"JAMIE: Oh, I'll get the hang of it, Doctor. "
976,"DOCTOR: Jamie, be careful! "
977,DOCTOR: We don't understand guns on Dulkis! We haven't used them for
978,hundreds of years! 
979,(Rago takes the rifle.) 
980,"RAGO: So, you don't understand guns. "
981,"(Rago fires it, just missing the Doctor and blasting a hole in the wall"
982,behind him.) 
983,RAGO: Are you sure? 
984,DOCTOR: Yes! It was the Clever Ones who invented them! 
985,RAGO: Clever Ones? 
986,"DOCTOR: Yes! They lived long ago, you see. There aren't many of them"
987,left. They stopped us using guns and things. 
988,RAGO: There are two distinct types on this planet? 
989,DOCTOR: Yes! 
990,RAGO: How many of these Clever Ones are there? 
991,"DOCTOR: Well, there are, there are not many. We don't like them much."
992,"They tell us what to do, you see. "
993,RAGO: Good. I see. 
994,(Rago puts the rifle back on its display stand.) 
995,RAGO: There is nothing to fear from these primitives and the others
996,sound as if they're pacifists. 
997,TOBA: So they are useless. 
998,"RAGO: They have a small labour potential, nothing more. "
999,TOBA: Shall I destroy them? 
1000,"RAGO: No, we must conserve power. "
1001,TOBA: But why 
1002,RAGO: We have nothing to fear from such creatures. It would be a waste
1003,of energy to destroy them. Leave them! Stay away from us and the
1004,"Quarks. DOCTOR: Oh yes, sir. "
1005,"JAMIE: Yes, Master. "
1006,"(Rago, Toba and the Quarks leave.) "
1007,JAMIE: Am I glad that's over. 
1008,"DOCTOR: Me, too. They're a bloodthirsty lot these Dominators, aren't"
1009,they? 
1010,JAMIE: Aye. What do you think they're after? 
1011,DOCTOR: I don't know. That message they sent. Material readily
1012,"accessible. Some sort of mineral deposits, do you think? "
1013,"JAMIE: And then this fleet of theirs would refuel, land and pick it up."
1014,It makes sense. 
1015,"DOCTOR: Well, what do they want the Dulcians as slaves for? They've got"
1016,the Quarks. 
1017,"JAMIE: Aye, nasty little beasties. Hey, Doctor, they've gone. We'd"
1018,better get back to that survey place. Zoe'll be wondering what's
1019,happening. 
1020,"DOCTOR: Yes, I think you're right."
1021,
1022, [Council chamber]
1023,
1024, CULLY: I've got to make them believe me before
1025,it's too late. 
1026,"ZOE: Well, what are you going to do? "
1027,CULLY: Get some evidence. Will you come back to the island with me? 
1028,ZOE: All right. But how do we get past the Council out there? 
1029,CULLY: Through my father's rooms. Come on. We'll have to steal a travel
1030,"capsule somehow. Well, I can manage that all right but er "
1031,"ZOE: Well, what's the matter? "
1032,"CULLY: Your clothes. Not exactly Dulcian, are they? "
1033,ZOE: So? 
1034,CULLY: They'll attract too much attention. We'd never get past the
1035,"capsule managers. Still, no problem. We can always fix you up with some"
1036,Dulcian garments. 
1037,ZOE: Where from? 
1038,"CULLY: Clothing dispenser unit. There's one in my father's rooms, come"
1039,on.
1040,
1041, [Survey unit]
1042,
1043, (Another capsule is waiting for its passengers.) 
1044,"BALAN: This will take you direct to the Capital, Doctor. Your young"
1045,friend Zoe is already there. No doubt Director Senex is awaiting your
1046,arrival. 
1047,"DOCTOR: Oh, this is splendid! "
1048,"JAMIE: Look, Doctor, what is this? You know I hate being cooped up. "
1049,(The door slides shut.) 
1050,BALAN: Now perhaps we can get on with our work. 
1051,KANDO: What are you thinking? 
1052,TEEL: They seem so positive that they'd seen robots. 
1053,KANDO: I almost believed them. 
1054,"TEEL: Balan, we may be in great danger. Would it not be wise to check"
1055,for ourselves? 
1056,BALAN: I can see I shall get no work from you two until you have got
1057,positive proof. Come along.
1058,
1059, [Council chamber]
1060,
1061," CULLY: Hey, come on. Nearly ready? "
1062,"ZOE: Yes, just about. "
1063,(Zoe enters in the female Dulcian outfit of one piece body and gauze
1064,"skirt, and flat sandals.) "
1065,CULLY: Good. 
1066,ZOE: I'm not sure I pressed the right button. 
1067,"CULLY: Why not? It's not bad, even for an automatic machine. "
1068,"ZOE: Well, they're not very efficient garments, are they. "
1069,"CULLY: Well, at least you look more like a girl now. "
1070,ZOE: Oh I'm not sure. They feel impractical. 
1071,CULLY: Never mind. The main thing is that now you'll pass as a Dulcian.
1072,Let's go and get a capsule.
1073,
1074, [Saucer]
1075,
1076, RAGO: Drill depth on fourth bore? 
1077,TOBA: Eighteen thousand. 
1078,RAGO: Link feeds to your seismographic readings. Inform explosive
1079,force. Enquire time and depth. Feed into calculator now. 
1080,TOBA: Command accepted. 
1081,QUARK: Unknown creatures approaching. 
1082,"(Balan, Kando and Teel are on a video screen.) "
1083,TOBA: Destroy? 
1084,"RAGO: No, investigate."
1085,
1086, [Outside the saucer]
1087,
1088, KANDO: It's enormous! 
1089,TEEL: So Cully was telling the truth. 
1090,BALAN: Was he? 
1091,"KANDO: But, Balan. "
1092,BALAN: Where are the robots? 
1093,"KANDO: Inside, perhaps."
1094,
1095, [Saucer]
1096,
1097, KANDO : Oh please may we go in? 
1098,BALAN : Oh very well. 
1099,"(Teel, Kando and Balan enter.) "
1100,KANDO: But it's empty. 
1101,(They walk past a Quark.) 
1102,"BALAN: Look, there's a map of the island. "
1103,QUARK: Stand still. 
1104,(Rago and Toba appear from nowhere.) 
1105,"BALAN: But, you are not Dulcians! "
1106,"(The Quark beeps, and Balan is sucked onto the dais, face down.) "
1107,BALAN: I can't move! 
1108,"KANDO: Oh, what have they done? "
1109,RAGO: Stand quite still! (to Teel) You. Move over there. Activate. 
1110,(Teel is stuck to the wall. Kando screams.) 
1111,RAGO: Silence. Toba? 
1112,(Teel's wall becomes an examination table.) 
1113,TOBA: Attach force units. 
1114,RAGO: These look different. Visor. 
1115,BALAN: Leave that boy alone! 
1116,KANDO: What do you want from us? 
1117,TOBA: Silence! 
1118,"RAGO: As I thought, they are different. Greater brain power, two"
1119,hearts. There are two distinct species on this planet. 
1120,TOBA: Dangerous? 
1121,RAGO: No. 
1122,TOBA: Then we might have the labour force we need after all. 
1123,"RAGO: Yes, if there are more on the island. We will search."
1124,
1125, [Capsule]
1126,
1127," ZOE: Well, what's funny? "
1128,CULLY: I just thought. Your friends are probably on their way back to
1129,the Capital. We'll have passed them going the other way. 
1130,ZOE: I hope not. 
1131,"CULLY: Oh, it doesn't make much difference. We can always turn around"
1132,again. As long as those robots don't appear. 
1133,(The Dominators are searching the island using three Quarks. They split
1134,up.) 
1135,CULLY: Hold on. Deceleration. Another minute or so and we'll land
1136,safely at the survey unit. 
1137,[Survey unit]
1138,
1139, TOBA: Record all technical data. 
1140,(The Quarks pirouette.) 
1141,QUARK: Scan completed. 
1142,TOBA: Good! Follow.
1143,
1144, [Island]
1145,
1146, TOBA: Recharge. 
1147,(Two Quarks open and close their arms.)
1148,
1149, [Survey unit]
1150,
1151, (The capsule has arrived. Cully gets out.) 
1152,ZOE: Where do you think everybody is? 
1153,"CULLY: I don't know. Come on, out you get. "
1154, [Island]
1155,
1156, (Across a valley from the Survey unit.) 
1157,"TOBA: Destroy, destroy! "
1158,(Three Quarks open fire. There are explosions at the unit building.)
1159,
1160, [Survey unit]
1161,
1162," ZOE: Cully, what's happening? "
1163,CULLY: I don't know. 
1164,(A console explodes.) 
1165,"CULLY: The door, quick! "
1166,(But the opening mechanism doesn't work.) 
1167,CULLY: It's stuck. It's stuck! We're trapped! 
1168,(There is another big bang. Zoe screams and Cully grabs her as the
1169,ceiling starts to fall in.) 
1170, Episode Three
1171,
1172, [Island]
1173,
1174, TOBA: Recharge. Complete destruction! 
1175,RAGO: Toba! 
1176,(Rago and a Quark are nearby.) 
1177,"RAGO: Quarks, wait. "
1178,
1179, [Survey unit]
1180,
1181, CULLY: Maybe you'll believe in my robots now. 
1182,"ZOE: I don't know about robots, but something was attacking us, and"
1183,with pretty sophisticated weapons too. 
1184,"CULLY: Well whatever it was, we'd better get out of here fast. Let's"
1185,try and move this door.
1186,
1187, [Island]
1188,
1189, TOBA: I wanted to prevent their escape. 
