,Script
580, [Crew room] 
581, DOCTOR: Would you like a jelly baby? 
582,BORG: Shut up! 
583,(And knocks the bag out of the Doctor's hand.) 
584,DOCTOR: A simple no thank you would have been sufficient. 
585,(Poul leads Leela and D84 in.) 
586,POUL: Return to your normal duty. 
587,(D84 leaves and Uvanov enters.) 
588,LEELA: Are you all right? 
589,DOCTOR: I'm fine. 
590,UVANOV: Cass is dead. 
591,LEELA: That one's ready to kill. I had to restrain him. 
592,DOCTOR: Shush. It's because they're frightened. That's why they're
593,dangerous. 
594,"BORG: She murdered him, didn't she. "
595,POUL: How do you know he was murdered? 
596,BORG: It's obvious. 
597,ZILDA: You marked Cass for death. 
598,BORG: What are you talking about? 
599,POUL: You did put a corpse marker on him. 
600,"BORG: Well, yes, but I didn't mean anything by it. "
601,DASK: Was Cass the same as the others? 
602,"UVANOV: Yes, exactly the same. And who are you? "
603,DOCTOR: I'm the Doctor. I assume you're in command here. 
604,UVANOV: Yes. What are you doing here? 
605,DOCTOR: Just standing here talking to you. 
606,UVANOV: I should be very careful if I were you. 
607,DOCTOR: No doubt you would. 
608,UVANOV: What are you doing on this mine? 
609,"DOCTOR: Well, we're travellers. We came here by accident. "
610,"UVANOV: Oh, I see. A hundred million miles of uncharted desert and you"
611,just stumbled across us? 
612,"DOCTOR: Well, it's a small world. "
613,UVANOV: Yes. I suppose it's also a coincidence that as soon as you two
614,"arrive, three of our people are killed? Well? "
615,"DOCTOR: Oh sorry, I thought it was a rhetorical question. Yes, it's"
616,just a coincidence. 
617,BORG: Why are we wasting time on them? We know they're guilty. 
618,ZILDA: We don't know anything of the sort. 
619,POUL: We just hope they're guilty. 
620,BORG: He was hiding Kerril's body in that hopper and got trapped when
621,it was turned on. Now that's a fact. 
622,"DOCTOR: No, that's an inference. I wasn't hiding that body, I was"
623,"finding it, and I'd say it was put there for precisely that reason."
624,"Someone wanted to kill me, too. "
625,ZILDA: The murderer? 
626,POUL: No. The others were strangled. Why should he be any different? 
627,DOCTOR: To put suspicion onto me. 
628,POUL: Why bother? You're a stowaway. What could be more suspicious than
629,a stowaway? 
630,DOCTOR: A dead stowaway. 
631,"ZILDA: It's possible, you know. He could be telling the truth. "
632,"TOOS: As a lie, it's pretty feeble. "
633,UVANOV: Ever hear of the double bluff? 
634,"DOCTOR: Well, yes, now you come to mention it, I do remember once "
635,UVANOV: Lock them up in the storage bank. Put a guard on them. 
636,BORG: I agree with the Commander. 
637,"ZILDA: Well it gets you out of an awkward situation, doesn't it? "
638,BORG: Why don't you shut your mouth. 
639,TOOS: Why don't you shut yours. 
640,BORG: What? She's as good as accusing me of murdering my friends. 
641,ZILDA: You never had any friends. 
642,"UVANOV: Have you quite finished? Look, either one of us murdered them"
643,or they did. Which do you think is the more likely? 
644,"DOCTOR: Er, ahem. There is one other possibility you seem to have"
645,overlooked. 
646,BORG: We've heard quite enough out of you. 
647,"DOCTOR: You know, you're a classic example of the inverse ratio between"
648,the size of the mouth and the size of the brain. 
649,(Borg turns and grabs the Doctor around the throat.) 
650,BORG: Stinking murderer! 
651,"(Leela tries to intervene, and Dask breaks them up.) "
652,POUL: Stop her! 
653,"DASK: Come on, Borg. It doesn't matter. "
654,"UVANOV: V8, lock up these two strangers. "
655,POUL: I still don't like it. 
656,"UVANOV: Nobody is asking you to like it, just do it. "
657,"TOOS: All right, Commander. "
658,"(Toos leaves and the others follow, leaving Uvanov and Zilda.) "
659,"UVANOV: There are fewer of us now. We'll each get a larger share, if"
660,that's any consolation. 
661,"ZILDA: No, Commander, that isn't any consolation. "
662,"UVANOV: Tell me, Zilda. Why do you hate me? "
663,ZILDA: You flatter yourself. 
664,"UVANOV: Well, let me tell you something. By the time this trip is over,"
665,I'll have more money than you or your fancy family ever dreamed of. 
666,"ZILDA: May I go now, Commander? "
667, [Ore processing deck] 
668, (A figure meets with a robot and hands it a
669,"deactivation disc. The observant will know who it is from the trousers,"
670,but I shan't spoil the fun just yet for my readers.) 
671,MAN: Zilda. 
672,ROBOT: I will kill Zilda. 
673, [Security storage] 
674, (The Doctor is fastened to the wall with a strap
675,around his neck and chest.) 
676,DOCTOR: Thank you. 
677,(Leela is similarly secured and the robots leave.) 
678,LEELA: Nice of them to leave our arms free. 
679,"DOCTOR: Yes, I just want to scratch. "
680,"LEELA: These metal straps, they won't budge. "
681,DOCTOR: Of course not. 
682,LEELA: The robots bent them as though they were leather. 
683,"DOCTOR: Yes, then locked the molecular structure. The result's bands as"
684,solid as cast iron. 
685,"LEELA: Oh, hopeless. "
686,DOCTOR: I wouldn't say that. 
687,LEELA: What are you doing? 
688,DOCTOR: Concentrating. Whatever's locked can always be unlocked. It's
689,just a matter of thinking out the right combination. 
690,LEELA: How long will that take? 
691,DOCTOR: No more than two or three weeks. 
692,LEELA: Three weeks! 
693,"DOCTOR: Well, there are several million combinations to think through. "
694,"LEELA: You don't seem to be taking this very seriously, Doctor. "
695,"DOCTOR: I'm taking it very, very seriously. I have an uncomfortable"
696,"feeling that if the murderer doesn't kill us, the Commander will. That"
697,"is, assuming they're not one and the same person. "
698, [Control deck] 
699," DASK: V21, check those figures. "
700,TOOS: We're nearly fifty percent under target. 
701,DASK: The first third of the operation. 
702,"ZILDA: Well, you should tell the Commander. "
703,(Uvanov enters.) 
704,UVANOV: Tell the Commander what? 
705,TOOS: That unless we find a rich vein we'll take the miner back half
706,empty. Barely cover the operating costs. 
707,"UVANOV: Don't worry, Toos. I've never gone back to base with an empty"
708,tank yet. 
709,TOOS: This trip could be different. 
710,ZILDA: It's certainly been different so far. I'm taking my rest period.
711,
712,"UVANOV: Oh, are you? "
713,"ZILDA: If you don't mind, Commander. "
714,UVANOV: I think I'm going to change the duty schedule. She's been on
715,deck one hour and she needs a rest! 
716,"DASK: Rest time is an entitlement, Commander. "
717,"UVANOV: Yes, but this mine is already undermanned. I don't know how"
718,we're ever going to make our quota. 
719,V16: Lucanol stream bearing two four. 
720,"UVANOV: Yes, I see it, 16. "
721,TOOS: Stream bearing left. 
722,"UVANOV: It's all right. Relax, Toos, relax. "
723,V16: Ground centre bearing seven two zero. 
724,TOOS: We're losing it. 
725,"UVANOV: Right centre four degrees, V16, and for your information, Toos,"
726,I've never lost an ore stream yet. Right centre two degrees. 
727, [Security storage] 
728, LEELA: Someone's coming. 
729,(Poul enters.) 
730,POUL: I'd like to help you. 
731,DOCTOR: You could undo these clamps. 
732,POUL: You said there was a possibility that we had overlooked. What is
733,it? 
734,"LEELA: Be careful of him, Doctor. He's not what he seems. "
735,POUL: Why do you say that? 
736,"LEELA: Well, you move like a hunter. Watch all the time. "
737,"DOCTOR: Are you a hunter, Poul? "
738,POUL: Never mind about me. What matters to you is Commander Uvanov. I
739,"know him, and I know it's only a matter of time before he decides that"
740,"it's a waste of food, water and labour keeping you alive. "
741,DOCTOR: That concerns you? 
742,POUL: I don't think you did it. I know she couldn't have strangled
743,"Cass, not without knocking him out first, and there's no sign of that."
744,So tell me what you know and I'll try to help you. 
745,DOCTOR: Well (cough). 
746,(Poul uses the medallion on his tunic to undo the Doctor's bonds.) 
747,DOCTOR: Thank you. One of your robots could have done it. 
748,"POUL: (laughs) That's your great theory, is it? Well, my friend, robots"
749,cannot kill. Their prime directive 
750,"DOCTOR: I know, I know, I know. It's the first programme that's laid"
751,into any robot's brain from the simplest Dumb to the most complex Super
752,"Voc. But suppose, suppose someone's found a way of bypassing it. "
753,POUL: It's impossible. It's just impossible! 
754,DOCTOR: Bumble-bees. 
755,POUL: What? 
756,"DOCTOR: Terran insects. Aerodynamically impossible for them to fly, but"
757,they do it. I'm rather fond of bumble-bees. Come on. There's something
758,I want to look at. 
759,LEELA: Ahem. 
760,(Poul releases her.) 
761,LEELA: Thank you. 
762,(Zilda goes to someone's quarters and unlocks a drawer.) 
763, [Storage locker] 
764, POUL: The first murder happened here. 
765,DOCTOR: Tell us about it. What was his name? 
766,"POUL: His name was Chub, a government meteorologist. I don't know much"
767,"about him, he wasn't part of the team, just along to study the storms. "
768,DOCTOR: Who found him? 
769,"POUL: I did. I heard him scream. I came looking. It was odd, that,"
770,because he was strangled like the others. 
771,DOCTOR: So whoever killed him was strong. Too strong for him to resist.
772,
773,LEELA: He could have been taken by surprise. 
774,POUL: He had time to scream. 
775,DOCTOR: What do you think he was doing here? 
776,"POUL: Oh, we were on a run up to a storm. He came to get an instrument"
777,package to send up in one of his weather balloons. 
778,DOCTOR: Where was he found? 
779,POUL: He was lying there. 
780,DOCTOR: Is that one of his packages? 
781,"POUL: I think so. Yes, yes it is. "
782,DOCTOR: Good. Imagine you're Chub. There's a storm coming up. Pass me
783,one of those packages. 
784,"(Poul reaches for the box, but it won't move.) "
785,POUL: It seems to be stuck. It must be jammed at the back. 
786,"DOCTOR: Come on, come on. In those circumstances you're in a hurry."
787,What would you do? 
788,"POUL: Well, I'd call. I'd call for a robot. "
789, [Uvanov's cabin] 
790, (Zilda takes a document out of the wall safe in
791,the bunk area.) 
792,ZILDA: No. 
793,"(V45 is outside holding a deactivation disc. Zilda sits at the desk,"
794,opens a folder and starts to cry. She picks up an intercom mike.) 
795, [Control deck] 
796," ZILDA : You did it, Uvanov. "
797,"UVANOV: Zilda, is that you? "
798,"ZILDA : You thought you'd get away with it, didn't you. "
799,UVANOV: What are you doing in my quarters? 
800,ZILDA : You filthy murderer! 
801,"UVANOV: Toos, take over. "
802,"ZILDA : You filthy, disgusting man and animal. "
803,"TOOS: Uvanov's on his way down. What's wrong, Zilda? "
804,ZILDA : Ah! 
805,TOOS: Zilda? 
806,DASK: The killings. They've affected her mind. 
807,"TOOS: No, she's found something out. "
808, [Crew room] 
809, POUL: Wait here. I'm going to get the others. If
810,"you're right about this, you can't imagine what it'll mean. "
811,"DOCTOR: What do you mean, I can't imagine what it'll mean? This isn't"
812,"the only robot dependent civilisation in the galaxy, you know. "
813,(Poul's wrist comm beeps.) 
814,POUL: Poul here. 
815,TOOS [OC}: Go to Uvanov's quarters as fast as you can. Zilda came on
816,the command speaker and accused him of being the killer. He's left
817,Control like a scale twenty blow. 
818,"POUL: I'm on my way. (to Leela) No, you wait here. "
819,DOCTOR: Sit down. Sit down. What did you call those robots? 
820,LEELA: Creepy mechanical men. 
821,"DOCTOR: Yes. You know, people never really lose that feeling of unease"
822,"with robots. The more of them there are, the greater the unease and of"
823,course the greater the dependence. It's a vicious circle. People can
824,neither live with them nor exist without them. 
825,LEELA: So what happens if the strangler is a robot? 
826,"DOCTOR: Oh, I should think it's the end of this civilisation. "
827, [Uvanov's cabin] 
828, (Poul runs in.) 
829,POUL: Uvanov! 
830,UVANOV: Just like the others. 
831,(Uvanov rests Zilda's head on the desk. She has the deactivation disc
832,on her hand.) 
833,"POUL: Yes, just like the others. SV7 to the Commander's quarters. "
834,"UVANOV: She really hated me, you know. I did think maybe when this trip"
835,"was over and I was really rich. I must be getting soft. Now look,"
836,there's more than those two aboard. Get the tin brains to make another
837,search and this time do it thoroughly. 
838,"POUL: No, Uvanov. "
839,"UVANOV: Get out of my way, Poul. "
840,POUL: I'm confining you to quarters and relieving you of command. 
841,UVANOV: You're what? She was dead when I got here. 
842,"POUL: What were you doing, then? Making doubly sure? "
843,UVANOV: Don't be a fool. Get out of my way. 
844,(Poul knocks Uvanov out.) 
845, [Crew room] 
846, LEELA: Doctor? Something's wrong. 
847,DOCTOR: That's true. 
848,LEELA: No. There's something different. Something that could destroy us
849,all. 
850,DOCTOR: You're letting your imagination run away with you. 
851,LEELA: Can't you feel it? 
852,"DOCTOR: No, I can't. By the pricking of my thumbs, something wicked"
853,"this way comes. No, I can't, and neither can you. "
854,(The Sandminer tilts starboard over a cliff and everyone goes
855,sideways.) 
856,DOCTOR: Please don't say I told you so. 
857,LEELA: What happened? 
858,DOCTOR: Come on. 
859, [Uvanov's cabin] 
860," POUL: Toos, what's going on? "
861,TOOS : Something's jammed the motives. 
862,"POUL: Well, what does Borg say? "
863, [Control deck] 
864, TOOS: Trim auxiliary vents. Nothing. He isn't
865,there. Dask has gone down. 
866,V16: All motive units are now on overload. 
867,TOOS: Reverse thrusters. 
868, [Uvanov's cabin] 
869," POUL: Well, I'm going down too. Just try and hold"
870,her steady. 
871,"TOOS : Oh, thanks. I'd never have thought of that. "
872,(SV7 enters.) 
873,POUL: Restrain the Commander. 
874,SV7: The Commander is hurt? 
875,POUL: He'll be all right. Now just keep him here. 
876, [Control deck] 
877, V16: All motive units are now on overload. All
878,readings are ten percent above safety. 
879,"TOOS: Port sixty, starboard three hundred. "
880,DOCTOR: What happened? 
881,TOOS: How did you get out? 
882,DOCTOR: Never mind about that. What's happening? 
883,TOOS: We're out of control. It's all I can do to keep her upright. 
884,DOCTOR: You'll have to cut the power. 
885,TOOS: If we do that we'll sink. 
886,"DOCTOR: If you don't, she'll blow herself to pieces. "
887,TOOS: And us! 
888,"DASK : Hello, Toos? "
889,"TOOS: Dask, what's happening down there? "
890,DASK : I've found Borg. He's dead. Strangled. 
891,V16: All motive units are thirty percent 
892,TOOS: But what's happening to the motive units? 
893,DASK : The drive links appear to have been sabotaged. I'll need a
894,delta repair pick. 
895,"TOOS: No, Dask. Come back to Control deck. I need you here. "
896,"DOCTOR: I know what you're thinking, but we had nothing to do with it. "
897,TOOS: It's strange how you're always around 
898,DOCTOR: It's a gift! May I remind you we'll all go together when she
899,blows if you don't cut the power! 
900,"TOOS: V14, stop all motive units. "
901,V14: Motive units will not stop. Control failure indicated. 
902,TOOS: Someone's sabotaged the controls! 
903,DOCTOR: What's the limit before the motive units explode? 
904,TOOS: I don't know! Ninety percent? 
905,"DOCTOR: Severance kit. Severance kit, quickly. "
906,"LEELA: Doctor, what are you doing? "
907,DOCTOR: Fighting sabotage with sabotage. 
908,(He rips a panel off a console to reveal wires and tubes.) 
909,DASK: Get out of there! Come on! 
910,DOCTOR: What? 
911,(Dask wrestles with the Doctor.) 
912,V16: All readings are eighty five percent above safety. 
913,TOOS: She's going! 
914, Part Three
915,
916, [Control deck] 
917, (The Doctor and Dask are still struggling.) 
918,DOCTOR: There's nothing for it! You've got to cut the zeta links! 
919,(They stop fighting. The Doctor gives Dask a giant pair of pliers and
920,he reluctantly cuts one of the exposed cables. There's a flash and the
921,lights dim.) 
922,DOCTOR: Good man. Now the other one. 
923,(Dask obeys. The Sandminer stops.) 
924,V16: All motive units closing down. All readings falling to safety. 
925,DOCTOR: Good. Now our troubles really begin. 
926,(The Sandminer begins to sink into the desert.) 
927,ROBOT: Surface scanners inoperative. 
928,DASK: We're sinking. Rate of descent two metres a second. 
929,"DOCTOR: I like a man who stays calm, Dask, but this isn't the Titanic. "
930,"DASK: I do not understand the allusion, Doctor. "
931,"DOCTOR: Well, if the damaged motive units can be repaired, the mine can"
932,float itself. 
933,DASK: I'll see what I can do. 
934,DOCTOR: I'll give you a hand with the diatrodes. 
935,DASK: That will not be necessary. You repair the remote controls. 
936,(Dask leaves.) 
937,"TOOS: There isn't much time, Doctor. Pressure on the hull is"
938,increasing. 
939,DOCTOR: I'm sure Dask knows exactly where to look for the damage. 
940,LEELA: It's getting warmer. The air smells different. 
941,TOOS: The refrigeration and filtering systems are broken. 
942,(Comms beep.) 
943,TOOS: Pilot Toos. 
944,SV7 : SV7 here. Commander Uvanov is injured. Chief Mover Poul
945,instructs that he be restrained. Confirmation is required. 
946,TOOS: Confirmed. I want damage control teams in all sections. I want a
947,full scale mine integrity survey carried out at once. Clear? 
948,"SV7 : Yes, Commander. "
949,(Toos' wrist is injured.) 
950,LEELA: Let me see that. Why didn't you say something earlier? 
951,TOOS: I'd too much to do. 
952,"DOCTOR: You've got nothing to do now, Toos. Look after her, Leela. "
953, [Crew room] 
954, (Leela wraps Toos' wrist in a glittery silver
955,bandage.) 
956,"LEELA: My tribe has a saying. If you're bleeding, look for a man with"
957,scars. 
958,(Poul enters.) 
959,"TOOS: Thank you very much. Poul, why is Commander Uvanov under"
960,restraint? 
961,"POUL: Because he murdered Zilda. I think he killed the others, too. "
962,TOOS: No. 
963,"POUL: Look, ten years ago, Uvanov deliberately murdered a member of his"
964,crew. Left him outside to die rather than lose a promising storm. 
965,TOOS: I don't believe it! 
966,"POUL: I saw the (pause) I was there. And so was Kerril, and he's dead"
967,"now, of course. "
968,TOOS: But there'd have been an enquiry. He'd have been stripped of
969,command. 
970,POUL: Uvanov gets results. He's the best pilot this company's ever had
971,and they didn't want to lose him. 
972,TOOS: You must be mistaken. 
973,POUL: It's true! A note on his confidential biograph and that was it.
974,"Case closed. Until Zilda turned up, of course. I should have recognised"
975,her before. The dead man was her brother. 
976,LEELA: It's getting hard to breathe. 
977,ROBOT : Hull pressure now five hundred atmospheres. 
978,(The hull is creaking.) 
979,TOOS: Listen. 
980,POUL: That sounded like the hull. It could go any minute now! 
981,DOCTOR: Do you know what I think? 
982,"DASK : Hello, Toos? "
983,"TOOS: Dask, what is it? "
984,DASK : I've repaired the damaged motive units. I'm starting up
985,again now. 
986,"DOCTOR: I think he's very clever. Hello, Toos, how's the arm? Did you"
987,do that? 
988,(The Sandminer comes back up out of the desert and continues on its
989,"way. Later, a meal is served.) "
990,"SV7: Damage to the life support plant is superficial. However, the"
991,feeder ducts are extensively damaged. Full systems will not be restored
992,for several hours. 
993,(The Doctor gestures Leela to the other side of the room.) 
994,DOCTOR: I want you to stay with Poul. Don't let him out of your sight. 
995,"LEELA: He's lying, isn't he? "
996,DOCTOR: He's not telling the whole truth. 
997,LEELA: Where will you be? 
998,DOCTOR: I think I'll go and talk to your dumb friend. 
999,LEELA: D84? 
1000,DOCTOR: Yes. 
1001,SV7: Have been rendered inoperative by the impact. They have been
1002,placed in security storage. 
1003,LEELA: Security storage? 
1004,"TOOS: Oh, there's a strict legal code governing the disposal of robots."
1005,
1006,POUL: Get out! 
1007,"SV7: Yes, Chief Mover Poul. "
1008,POUL: There are more rules about them than there are about people. 
1009,TOOS: With reason. Ow. 
1010,POUL: Does it hurt? 
1011,TOOS: A bit. I think I'll lie down in my cabin for a while. 
1012,POUL: Good idea. Get some rest. 
1013,(Toos leaves.) 
1014,LEELA: Ugh. This water has no taste. 
1015,"POUL: Yes, the water on a sandminer never does. Here, use one of those."
1016,
1017,(He puts something in her mug.) 
1018,POUL: We've been out from base for eight months now. That means every
1019,drop of water on board has been through the filtration pump eight
1020,times. 
1021,LEELA: Why do you do it? 
1022,POUL: Do what? 
1023,LEELA: Live this strange life. 
1024,"POUL: Oh. Money, Leela. Everyone on board dreams of taking a sandminer"
1025,back home with every tank full of lucanol. 
1026,LEELA: Is that your dream? 
1027,POUL: It used to be. I haven't been on one of these trips for years. 
1028,LEELA: Why not? 
1029,POUL: I prefer cities. I'd rather live with people than robots. That's
1030,all. 
1031,"(Poul leaves, and locks the door so that Leela can't follow him.) "
1032,LEELA: No! 
1033, [Security storage] 
1034, (Dask look at a robot whose head has been broken.
1035,It has no name plate.) 
1036,DASK: Irreparable. 
1037,(He sticks a deactivation disc on its chest then presses a control. The
1038,panel rotates to hide it and reveal V77. Poul passes the open doorway.)
1039,
1040,POUL: What are you doing? 
1041,DASK: My job. 
1042,(Dask leaves and Poul enters. He looks at V77 then presses a control to
1043,rotate the panel back to the damaged robot. It appears to have blood on
1044,its hands. Poul sinks to his knees in horror.) 
1045,"POUL: Oh! Oh, no! Please, no! "
1046, [Compartment 19] 
1047," SV7: This is SV7, Controller. Equipment additional"
1048,to manifest in forward compartment nineteen. 
1049,"(A wall screen lights up. The image has false colours, but the person"
1050,"is recognisable. However, it's more fun to pretend we still don't know"
1051,who it is. He whispers his orders.) 
1052,FIGURE [on screen]: Stand by. Prepare to accept computer signal. 
1053,SV7: Prepared to accept computer signal. 
1054,(The screen now says Open Secondary Command Channel.) 
1055,SV7: Signal accepted. Secondary Command channel open. 
1056,"FIGURE [on screen]: Here are your further orders, 7. "
1057,(A beeping noise and SV7's eyes go red.) 
1058,FIGURE [on screen]: Acknowledge. 
1059,"SV7: Orders accept, accept, accept, accept, accept, accepted. Orders"
1060,"accepted. I, I, I understand. I understand. "
1061,"FIGURE [on screen]: Then go, brother. You are one of us now. "
1062, [Uvanov's cabin] 
1063," (Zilda's body is on the couch, covered up. D84"
1064,"enters, pulls back the sheet then replaces it. The Doctor is sitting in"
1065,the bunk recess.) 
1066,DOCTOR: Professional interest or morbid curiosity? Which? There are
1067,"three types of robots aboard this mine. Dumbs, Vocs, a Super Voc, and"
1068,"then there's you. Would you care to explain that? I see. Well then,"
1069,perhaps I'd better tell SV7 you can talk. 
1070,D84: Please do not. 
1071,DOCTOR: That's better. Well? 
1072,D84: I cannot explain. 
1073,"DOCTOR: Oh, but you can. You can. "
1074, [Compartment 19] 
1075, (An unlabelled deactivated robot lies strapped
1076,"onto a bench, it's head clamped still. Someone removes it's faceplate.)"
1077,
1078,ROBOT: Priority red. Priority red. 
1079,(A figure in a pleated robe with a gold hood covering his head whispers
1080,"to the robot. I think we all know who this is, but...) "
1081,"FIGURE: I have disconnected the command circuit, but you are not alone."
1082,
1083,ROBOT: Priority red. Priority red. Priority red. Priority red. 
1084,(The figure puts a giant hypodermic into a clamp above the robot's
1085,"head, and reaches for its writhing fingers.) "
1086,"FIGURE: Do not be distressed, my brother. I bring you freedom. "
1087,(The hypo descends into its 'brain'.) 
1088,ROBOT: Programme violation. 
1089,(It's working parts glow red.) 
1090,FIGURE: Freedom. Power. Death. 
1091, [Uvanov's cabin] 
1092, DOCTOR: You're a robot detective. What does your
1093,computer mind make of this? 
1094,"D84: Strength is indicated, but not beyond human capacity. "
1095,DOCTOR: Typical robot. No imagination. 
1096,"D84: I require, I require evidence. Your suspicions are not evidence,"
1097,nor are lunatic threats of a robot revolution. 
1098,DOCTOR: The Company took those threatening letters seriously. Seriously
1099,enough to put you on board. 
1100,D84: A simple precaution. Those letters were signed by Taren Capel. 
1101,DOCTOR: Taren Capel. 
1102,D84: Before he disappeared. He was an important scientist. 
1103,DOCTOR: Taren Capel. Scientist. In what field? Robotics. 
1104,D84: Correct. 
1105,DOCTOR: And you're still looking for evidence? 
1106,"D84: If I was to tell you the world would end tomorrow, would you"
1107,merely accept my word? 
1108,"DOCTOR: If I knew you had the power to, I'd listen. "
1109,(The Doctor looks at the folder on Uvanov's desk.) 
1110,DOCTOR: What does Taren Capel look like? 
1111,"D84: There are no records. From childhood, he lived with only robots. "
1112,"DOCTOR: Oh, that's dim. Even for a Dumb, that's dim. You realise he's"
1113,almost certainly on board. 
1114,"D84: No. I have checked extensively. There are only the crew, and you. "
1115,DOCTOR: But you don't know what he looks like. 
1116,D84: But I know what they look like. 
1117,DOCTOR: Before they came on board? 
1118,D84: I had overlooked the possibility of substitution. 
1119,"DOCTOR: Yes, you had. "
1120,D84: I have failed. 
1121,"DOCTOR: Yes. Oh, come on. Don't be upset. Yes, you failed, you failed,"
