,Script
530, (The Doctor collects his jacket and umbrella from
531,a chair.) 
532,DOCTOR: Lovely dance. 
533,"MURRAY: Oh, it's hot in there. "
534,"DOCTOR: Ah, you Navarinos have a notoriously high metabolic rate. "
535,MURRAY: That hula hoop competition nearly finished me off. 
536,(Delta pushes between them and walks out.) 
537,"DOCTOR: Excuse me, Murray. "
538,"MURRAY: Hey, you'll miss the last dance, Doctor! "
539, [Laundry store] 
540, (The music is being piped through the camp
541,speakers. It's Mister Sandman. The Doctor finds Ray crying inside the
542,Laundry store.) 
543,"RAY: Oh, hi. I was just, er "
544,(Ray cries on the Doctor's shoulder.) 
545,"RAY: Oh, Doctor, am I being a fool? Billy didn't even offer to take me"
546,home. 
547,"DOCTOR: There, there. There's many a slap twixt a cup and a lap, Ray. "
548,RAY: But somehow I always thought Billy and me would end up together.
549,"Oh, it shows how wrong you can be. Oh, listen to me. "
550,(The door opens.) 
551,RAY: We're not supposed to be in here. 
552,(They hide behind racks of pink bed sheets. The thin faced man from the
553,bus comes in and extends the aerial of a large radio telephone.) 
554,KEILLOR: Connect me with the Bannerman leader. 
555,GAVROK : Gavrok here. Go ahead. 
556,KEILLOR: I understand you're offering a reward for the Chimeron queen. 
557,GAVROK : Affirmative. One million units. 
558,"KEILLOR: I've found her. Repeat, I've found her. "
559,GAVROK : What is your status? 
560,"KEILLOR: I'm a soldier of fortune. Now, do you want to trade or not? "
561,GAVROK : Affirmative. 
562," KEILLOR: She's at a place called Shangri La, in South"
563,"Wales, Western Hemisphere, Earth. Now lock into this signal to guide"
564,you in. 
565,GAVROK : The reward will be yours when we arrive. End transmission.
566,
567,(The Doctor sneezes. Keillor pulls out a gun and goes searching.) 
568, [Mel and Delta's chalet] 
569, DELTA: Thank you. 
570,MEL: What for? 
571,DELTA: For lending me your dress. For making an effort to be kind. 
572,"MEL: Oh, I'd help anyone in trouble, if I could. "
573,"DELTA: Mel, there's something you should know. "
574,(The egg starts to hatch. Mel screams as a green face emerges. Billy
575,bursts in with the bouquet he has brought for Delta.) 
576,DELTA: My baby. My beautiful baby. 
577, [Laundry store] 
578, (Keillor has found the eavesdroppers.) 
579,KEILLOR: What an unexpected bonus. You're the traveller in time they
580,call the Doctor. Your death will make me richer still. 
581,"DOCTOR: If you kill for money, let the girl go. She's worth nothing to"
582,you. 
583,KEILLOR: I don't just kill for money. It's also something I enjoy. 
584, Part Two
585,
586, [Gavrok's spaceship] 
587, GAVROK: My bounty hunter will be paid off sooner
588,than he thinks. Arm the beacon hunter. 
589,"(Gavrok presses a red button. In the Laundry store, Keillor goes up in"
590,a flash of flames. Ray screams. Only a pair of blue suede shoes and a
591,mangled radio telephone remain. The blast has knocked the Doctor and
592,Ray unconscious.) 
593, [Mel and Delta's chalet] 
594, (To the strains of Goodnight Campers aka Goodnight
595,"Sweetheart over the camp speakers, Billy approaches their door with a"
596,"bouquet and slicks back his hair. Inside, Delta is cradling her little"
597,green offspring. Billy enters without knocking.) 
598,"DELTA: My life's at risk. I'm going to trust you, and I think you"
599,deserve a full explanation. I think you'd better close the door. 
600,(Billy does so.) 
601, [Goronwy's cottage] 
602," (As dawn breaks and the cock crows, an old bee"
603,keeper is smoking his hives whilst singing that wartime favourite - You
604,"are my honey, honeysuckle. The two Americans drive up and stop outside"
605,the wall to talk to the venerable  Hugh Lloyd.) 
606,GORONWY: Good morning. What a beautiful morning it is. 
607,"WEISMULLER: Sure is. By the way, have you er, have you seen anything"
608,weird fall out of the sky? 
609,"GORONWY: Oh dear me, no. I've seen many things fall out of the sky, but"
610,nothing which could be described as weird. 
611,HAWK: What about lights? Anything like that? 
612,"GORONWY: Oh, there are strange lights in the night sky all the time."
613,"Not just the Aurora Borealis, mind, but low pulsing lights on occasions"
614,and low shooting stars. 
615,"WEISMULLER: Uh huh. Er, anything in the last day or so? "
616,GORONWY: I shall ask my bees. They know everything that happens. 
617,"HAWK: Sure. Well, I reckon we've taken up enough of your time. "
618,"GORONWY: If you stayed a bit longer, young man, you might understand. "
619,(A butterfly lands on Goronwy's palm.) 
620,GORONWY: Take a look at this butterfly. Arguably one of the most
621,beautiful creatures in the whole of nature. Yet if you were to see a
622,"pupa, you'd think it was the ugliest sight you've ever seen. But you"
623,can't have one without the other. 
624, [Mel and Delta's chalet] 
625, (The baby is maturing into something more humanoid
626,very quickly.) 
627,"DELTA: And so, I'm the last Chimeron queen. My planet is right now in"
628,the grip of the invaders. My people are dead. Poor Mel's exhausted. I
629,"think we'd better let her get some sleep. Billy, I feel like a walk. "
630,BILLY: Sure. The hills around here are beautiful. We can go somewhere
631,really special. 
632,DELTA: But I can't walk too far with the baby. 
633,BILLY: I never said anything about walking. 
634,(The baby frets in a rather high pitch as they leave Mel to her rest.) 
635, [Garage] 
636, (Billy has a bike and sidecar.) 
637,DELTA: What is it? 
638,BILLY: She's a Vincent. My pride and joy. 
639, [Laundry store] 
640, (The noise of the beast starting up wakes the
641,"Doctor, who runs out of the Laundry store in time to see them driving"
642,away. He runs back inside to Ray.) 
643,"RAY: Oh, my head. "
644,DOCTOR: Do you feel all right? Nothing hurt or broken? 
645,"RAY: But, but what happened to that guy with the gun? "
646,DOCTOR: I'm afraid he was paid in kind. You see this signal beacon? It
647,exploded from the inside. Obviously the Bannermen locked into his
648,signal and fired off a high impulse beam right along his transmission
649,track. 
650,"RAY: So they, they killed him? "
651,DOCTOR: I'm afraid so. Ionised. 
652,RAY: And this is all that's left of him. 
653,DOCTOR: Yes. A poignant reminder that violence always rebounds on
654,itself. But we must warn the others that an attack is imminent. 
655, [Office] 
656," (The camp announcer checks his vocal chords, sits"
657,at the sound desk and strikes a gong.) 
658,"VINNY: Good morning. Let's start with a song. When the red, red robin"
659,"comes bob, bob, bobbing along. "
660, [Mel and Delta's chalet] 
661, (The Doctor and Ray run inside. She has changed
662,into her biker leathers.) 
663,"DOCTOR: Mel, Mel, are you all right? "
664,"MEL: Hmm? Oh, nothing a good night's sleep wouldn't cure. "
665,"DOCTOR: Well, I'm afraid that'll have to wait. Do you know where Delta"
666,and Billy have gone? 
667,"MEL: They didn't tell me. Billy was taking her to some beauty spot, I"
668,think. 
669,"DOCTOR: Well, we've got to find them as quick as we can. And organise"
670,an evacuation of the camp. The Bannermen are on their way. 
671,MEL: I'll get Murray to organise the tour party. 
672,DOCTOR: Good. But they'll be one short. 
673,RAY: He was ionised. 
674,DOCTOR: Yes. But I must try and find Delta and Billy. Do you know where
675,"they might be, Ray? "
676,"RAY: Well, there are a couple of beauty spots in the area we could try."
677,And also a few special places only known to Billy and me. 
678,"DOCTOR: Well, we're going to have to keep looking for them until we"
679,"find them. But first we must convince Burton to evacuate the camp. Mel,"
680,"you find Murray. Ray, come with me. "
681,MEL: Right. 
682, [By the river] 
683, (Delta hands the baby to Billy while she gets out
684,of the sidecar.) 
685,"BILLY: Oh, you're a bit of a heavyweight, aren't you? "
686,DELTA: The most rapid growth occurs in the lymphoid state. She'll
687,double her size and her weight in the next few hours. 
688,BILLY: Come on. 
689, [Office] 
690, (Burton is still in a garish silk dressing gown.) 
691,"BURTON: Now, let me try and get this right. Now, are you telling me"
692,"that you are not the Happy Hearts Holiday Club from Bolton, but instead"
693,"are spacemen in fear of an attack from some other spacemen, and because"
694,"of the danger, you want me to evacuate the entire camp? "
695,"DOCTOR: An excellent summary, Mister Burton. Now, if you start right"
696,"away, then we'll be able to get them to safety. "
697,"BURTON: Oh well, if that is all that is needed, it should be easy. Oh,"
698,"by the way, can we have space buns and tea afterwards? Or don't they"
699,drink tea on Mars? 
700,DOCTOR: I thought you might be a little skeptical. What can I do to
701,convince you? 
702,"BURTON: Oh, this is a waste of time, Doctor. "
703,"DOCTOR: Listen, Mister Burton. If you don't act right away, innocent"
704,people will die! I will do whatever I can to convince you I'm not
705,suffering from some sort of delusion. 
706,"BURTON: All right, Doctor. Dan das sochivy. "
707,"RAY: Meinwyr, meinwyr. "
708,"BURTON: How about showing us your spaceship, eh? "
709,"RAY: Oh, can I come too, Doctor? "
710,"DOCTOR: Of course, but let's go quickly. "
711, [Outside chalet 108] 
712, (Mel has changed into embroidered denim shirt and
713,"jeans, and is hammering on the door.) "
714,"MEL: Murray! Murray, wake up! "
715,(Sleepy Murray opens the door. He is reading the Eagle comic.) 
716,MURRAY: What's the matter? 
717,"MEL: There's an emergency, Murray. We have to get ready to leave as"
718,soon as the bus is fixed. 
719,MURRAY: What kind of emergency? 
720,MEL: The Bannerman warfleet's on its way. 
721,MURRAY: You stay there. I'll get changed. 
722,MEL: Okay. 
723, [Outside Shangri La] 
724," (Burton, Ray and the Doctor come out of the Tardis"
725,after their guided tour.) 
726,"DOCTOR: It's called a Tardis, an acronym for Time And Relative"
727,Dimensions In Space. 
728,"BURTON: Really? Couldn't we take it for a bit of a spin, Doctor? "
729,"DOCTOR: Yes, with pleasure, but first things first. We must clear the"
730,camp. 
731,BURTON: Right. 
732, [Chalet area] 
733," MURRAY: Everybody out, campers! Attention!"
734,"Everybody out! Listen, everybody out! Now look, we should quickly pack"
735,and then wait at the bus until we're ready to leave. 
736,"BOLLIT: (a lady) Well, what's the big rush, Murray? It's nice here. "
737,"MURRAY: Truth is, there's a Bannerman war fleet on its way here. Nice"
738,"and easy, folks. Don't panic! Nice and easy, nice and easy, don't"
739,panic. 
740,(All the alien visitors rush back into their chalets to pack.) 
741,"DOCTOR: I see you've got everything under control, Murray. We must go"
742,"and see the crystal. If it's ready, then you must leave. "
743,"MURRAY: You won't see me for dust, Doctor. "
744, [Office] 
745, (Burton makes an announcement over the speakers.) 
746,"BURTON: Good morning, everyone. This is a matter of some urgency. "
747, [Chalet area] 
748," BURTON : Could all staff, without exception,"
749,assemble in my office immediately. Could all employees 
750, [Outside Shangri La] 
751, (The Doctor hands over a large container two
752,thirds full of red liquid.) 
753,DOCTOR: It's almost re-grown. Just another half hour. And then you've
754,"got to leave, whether I come back or not. "
755,MURRAY: Back from where? 
756,"DOCTOR: I've got to find Delta. Mel, you stay here and organise things."
757,"Come on, let's go, Ray. "
758,(Ray puts on her crash helmet as the Doctor gets onto the passenger
759,seat of her scooter.) 
760,DOCTOR: Take care of the crystal! 
761,"MURRAY: Count on me, Doctor. "
762, [Office] 
763, BURTON: I've call you all here at such short
764,"notice because we are facing a crisis. Now, what I would like you all"
765,to do is to go back to your chalets and pack whatever you need for one
766,night. I have already ordered a bus to take us all away from here. You
767,will spend the night in Llandrindod Wells and return in a day or so.
768,Any questions? Splendid. 
769,"VINNY: I don't normally like running away, sir. What's up? "
770,"BURTON: Ah, well, it's because we're facing an attack. It's because we"
771,"are er, well, we are in danger, you know. Well, it's top secret. I've"
772,"got a man here now from the Ministry of Defence, so look sharp, will"
773,you? 
774,"VINNY: Are you staying, sir? "
775,"BURTON: Well, of course. They would have to drag me away from here,"
776,man. 
777,"VINNY: Then I'll stay too, Major. "
778,"BURTON: Thank you, Vinny, but you will all have to go, and that is an"
779,order. Look sharp now. Off you go. 
780, [By the river] 
781, (The lovebirds have spread a blanket on the ground
782,"and have a transistor radio with them. The girl is growing fast, and"
783,making musical chime noises.) 
784,BILLY: That noise she makes. It's almost like singing. 
785,"DELTA: It's partly a song, and partly a defence mechanism. "
786,BILLY: Against the Bannermen. 
787, [Fern Dell] 
788, (Looking down into a steep valley.) 
789,DOCTOR: Did you come here with Billy often? 
790,RAY: We called it Fern Dell. We used to play here as children. But I
791,don't see his bike anywhere. 
792,DOCTOR: Could it be hidden? 
793,"RAY: Oh no, not the Vincent. It's just too big. "
794,"DOCTOR: Well, they're not here. Come on. "
795, [Outside Shangri La] 
796, (Burton is loading his customers on the bus.) 
797,"BURTON: Come on! Don't stand about, but come on. Go on now. Come on,"
798,come on. 
799,"(Murray is pacing up and down, watching the crystal finish growing.) "
800,MEL: Fortunately they didn't have much packing to do. How's the crystal
801,coming? 
802,"MURRAY: I'm trying to use mind power to make it grow faster, but I"
803,haven't had much luck. 
804,(Burton comes over.) 
805,"BURTON: I'm doing this with grave misgivings, but I cannot risk my"
806,staff for it. 
807,"MURRAY: Just like a captain, Mister Burton. "
808,"BURTON: Major, actually. I am still not sure what I saw in that police"
809,"box, but I cannot risk my staff for it. "
810,MEL: You're doing the right thing. 
811,(Vinny runs onto the bus as it pulls away.) 
812, [Gavrok's spaceship] 
813, (A grid map of Wales is on the viewscreen. A light
814,is flashing on the south coast.) 
815,GAVROK: She's somewhere in that quadrant. It's a pity we had to destroy
816,the beacon when we killed that mercenary. We'll have to scan the whole
817,area until we find some trace of advanced technology emissions. But she
818,will soon be dead. 
819, [Welsh countryside] 
820, (The American agents have returned to their
821,campsite. Hawk is holding up the aerial again while Weismuller is
822,cooking sausages.) 
823,"WEISMULLER: You're wasting your time, Hawk. "
824,"HAWK: Well, it's better that stopping every stranger we find and asking"
825,them if they've seen our lost satellite. 
826,WEISMULLER: But there's no point in listening to that radio. It stopped
827,transmitting. That's why you and I have to look for that satellite. 
828,HAWK: Then I'll listen to Voice of America. Anything's better than your
829,yammering. 
830,(The Doctor and Ray pull up by the gate to the field they are in.) 
831,DOCTOR: Excuse me! Have you seen a couple go by? A fellow on a big
832,black bike and a lady with a green polka dot dress. 
833,"WEISMULLER: Mister, we haven't even seen a squirrel this morning. "
834,"DOCTOR: Are there any other places, Ray? "
835,"RAY: Well, there is just one last chance. "
836,"DOCTOR: Well, let's give it a try. "
837, [Outside Shangri La] 
838, (The aliens are all gathered at the back of the
839,Nostalgia Trips bus.) 
840,"MEL: Well, I don't know much about crystalline structures, but that"
841,looks about cooked. 
842,"MURRAY: Yes, looks ready to me, Mel. Well, here goes. "
843, [Country lane] 
844, (Ray stops at a gate across their path.) 
845,"RAY: Oh, this is the end of the road, Doctor. I don't know where else"
846,to try. 
847,"DOCTOR: Ah, these tyre marks show a heavy motorcycle and sidecar. Come"
848,on. 
849,"(He opens the gate for her, and shuts it after.) "
850, [By the river] 
851, (The not so little girl is feeding.) 
852,"DELTA: If I can get the hatchling safely to the Brood planet, then I"
853,can take my case to judgement. They will then send an expeditionary
854,force to get rid of Gavrok and his Bannermen. 
855,"BILLY: Well, I'll do whatever I can to help, Delta. "
856,(The scooter comes slowly down the track and stops behind the Vincent.)
857,
858,BILLY: That's Ray and the Doctor. They're sure in a hurry. 
859,DELTA: The Bannermen! 
860,"RAY: Oh, thank heavens! "
861,BILLY: Why is everyone in such a lather? 
862,DOCTOR: Found you at last. 
863,DELTA: Gavrok? 
864,DOCTOR: Yes. We overheard a space mercenary give the position of the
865,camp. There's a price on your head. 
866,"BILLY: Yeah? Well, where is this guy? I reckon we've got a score to"
867,settle. 
868,RAY: He's been ionised. 
869,DOCTOR: Murray's fixing the bus. He shouldn't be long. Then you can
870,leave. So we've got to go back now. 
871, [Gavrok's spaceship] 
872, GAVROK: Transmitter identified. Triangulate and
873,set course. 
874,"(To the strains of the Dick Barton theme, our heroes drive back to the"
875,camp.) 
876, [Welsh countryside] 
877, (Gavrok's spaceship comes in for a silent landing
878,as Hawk gives up with the radio.) 
879,"HAWK: Ain't no use, Weismuller. There's nothing out there. "
880,"WEISMULLER: Well, I don't want to be an old I told you so, but if you"
881,had listened to me before 
882,(They watch the spaceship touch down across the stream.) 
883,"HAWK: Hey, Weismuller, do you think that's it? "
884,"WEISMULLER: Well, I don't know. I ain't never seen a satellite before. "
885,(The Bannermen come out.) 
886,"WEISMULLER: I always thought that they'd be smaller, somehow. Look, I"
887,"don't know what's going on around here, but I think we'd better get out"
888,of here real fast. 
889,(Gavrok sounds his horn.) 
890,GAVROK: Halt! 
891,"WEISMULLER: Oh, hi there. We weren't going anywhere. "
892,GAVROK: Where is the Chimeron queen? 
893,"HAWK: Beats me, chief. "
894,"(At Gavrok's signal, a Bannerman shoots the radio set into ions.) "
895,"WEISMULLER: Hey, that's the property of Uncle Sam. "
896,"GAVROK: Where is he, your Uncle Sam? "
897,"HAWK: No, you don't understand. "
898,(Their tent is destroyed.) 
899,"WEISMULLER: Boy, you sure get sore real quick. "
900,"(Gavrok aims his own weapon, then changes his mind.) "
901,"GAVROK: I will lead the main party. You two, guard them. Come. "
902, [Outside Shangri La] 
903," MURRAY: Well, we're all gassed up and ready to go."
904,
905,"MEL: Then you must leave at once, Murray. "
906,MURRAY: What about the Doctor and Delta? 
907,"MEL: We can follow you in the Tardis, wherever you go. "
908,"MURRAY: I know, but I feel bad about leaving you here. It's your last"
909,chance to hitch a ride. 
910,"MEL: No, I made an arrangement. I'd better stick to it. Thanks anyway. "
911,"MURRAY: Well, it's time to get this show on the road. As they say"
912,"around here, see you later, alligator. "
913,"MEL: In a while, crocodile. Bye! "
914,MURRAY: Bye! 
915,MEL: Bye-bye! 
916,"(But just as the bus engines fire up, Gavrok and the Bannermen arrive"
917,and disintegrate the whole thing. Mel is knocked to the ground.) 
918,"GAVROK: So, one of them escaped. "
919,MEL: You killed all those innocent people! 
920,GAVROK: Was the Chimeron queen amongst them? 
921,"MEL: Yes. Yes, she's dead. "
922,GAVROK: Would you lie? 
923,MEL: You saw what happened to the bus. No one could have survived that!
924,
925,GAVROK: That's right. The Chimerons are finished! 
926,(The Bannermen hiss in delight. Then the motor convoy comes up onto the
927,car park.) 
928,DELTA: The Bannermen! 
929,(They swerve away.) 
930,GAVROK: Attack! 
931,MEL: No! 
932,GAVROK: You lied! 
933,BURTON: Stop! It would be extremely foolish of you to kill her. Keep
934,her as a hostage. She's far more use to you alive. 
935,GAVROK: Kill any other survivors. Tie these two up. They will not be
936,"hostages, but bait. "
937, [Country lane] 
938," DOCTOR: Stop, stop. Stop! Stop! He's not following"
939,us. 
940,"RAY: Mel's still in there, Doctor, and Burton. "
941,DOCTOR: My immediate objectives are to set them free and find Delta and
942,the baby somewhere safe. 
943,BILLY: Can you hear something? 
944,RAY: I can't hear anything. 
945,DOCTOR: Shush. Those marks behind her ear are high frequency antennae.
946,What are you picking up? 
947,"DELTA: It's not clear, but it's coming from down there. "
948,BILLY: There's nothing there except old Goronwy's place. 
949,DOCTOR: Does he keep bees? 
950,BILLY: Yeah. How did you know that? 
951,DELTA: It's his bees who are telling us to come. 
952,DOCTOR: Quick. 
953, [Welsh countryside] 
954, WEISMULLER: You think they would? 
955,(Hawk shakes his head.) 
956,"WEISMULLER: Nah, I don't think they would. "
957, [Outside Goronwy's cottage] 
958, DOCTOR: I wonder if you could help us. 
959,"GORONWY: Of course, of course. I am Goronwy. "
960,"DOCTOR: Oh, and I'm the Doctor. "
961,(Billy brings the hatchling. Goronwy gives her the remains of his
962,lunch.) 
963,"GORONWY: Oh, there you are. Have some of that. Lovely. "
964,DOCTOR: Is it possible for these people to stay with you for a few
965,hours? 
966,"GORONWY: Yes, of course. Come inside and have a cup of tea. Come along."
967,There we are. I take it she likes a bit of honey. 
968,DOCTOR: I'm going to have to leave at once. I wonder if you could lend
969,me a pillowcase and a broom handle. 
970,"GORONWY: Oh, I should think so. "
971,"DOCTOR: Splendid. Oh, Billy, may I borrow your bike? "
972,"BILLY: All right, Doctor, but try and be careful though, won't you? "
973,DOCTOR: I'll treat it as if it were the Tardis. 
974, [Chalet area] 
975, (Gavrok is snacking on a leg of lamb. Burton and
976,Mel are tied back to back to the bottom of a staircase railing. The
977,Doctor drives up under a flag of truce. Gavrok shoots at it.) 
978,DOCTOR: How dare you! The white flag is the accepted signal for truce
979,"throughout the civilised universe! You may think that might is right,"
980,"but I can assure you, you won't get away with it. "
981,"GAVROK: Who will stop me? You, with your puny flag and your appeals to"
982,"fair play and justice, huh? I spit on your justice. "
983,DOCTOR: Your charm is only matched by your compassion. 
984,GAVROK: Why should I not kill you right now? 
985,"DOCTOR: Because you're in enough trouble already, Gavrok. Release those"
986,prisoners and I will testify that you showed some mercy. 
987,GAVROK: Testify? You'll never get me to trial. 
988,DOCTOR: We agree to differ. But you should know that Delta has sworn a
989,statement alleging invasion and genocide of the Chimerons. You will be
990,"brought to account, Gavrok, and made to pay for your actions. "
991,GAVROK: Give me Delta and I will give you your life. 
992,"DOCTOR: Life? What do you know about life, Gavrok? You deal in death."
993,"Lies, treachery and murder are your currency. You promise life, but in"
994,the end it will be life which defeats you. 
995,GAVROK: You have said enough. I have traversed time and space to find
996,the Chimeron queen. I will not be defeated. 
997,DOCTOR: As you will. I came here under a white flag and I will leave
998,"under that same white flag, and woe betide any man who breaches its"
999,integrity. Now step aside! Release those prisoners. 
1000,(A Bannerman moves to obey.) 
1001,"DOCTOR: Gavrok, it's over. You're finished, and we're leaving. "
1002,"(But as the Doctor, Mel and Burton walk to the motorbike and sidecar,"
1003,they hear the sound of cocking weapons behind them.) 
1004,"DOCTOR: Actually, I think I may have gone a little too far. "
1005, Part Three
1006,
1007, [Welsh countryside] 
1008," (At Shangri La, Gavrok raises his weapon. Mel gets"
1009,into the sidecar while the Doctor starts the engine and Burton gets on
1010,the pillion. Then they drive away. Gavrok fires his weapon into the
1011,air. The red flare is seen by the two Bannermen guarding Weismuller and
1012,Hawk.) 
1013,CALLON: Up. 
1014,"ARREX: Up, up. "
1015,"HAWK: What's happening now, Weismuller? "
1016,(The Bannermen put metal collars linked by a yoke around their necks.) 
1017,"WEISMULLER: I don't know, but whatever it is, it's, it's better than,"
1018,than just sitting around. Hey! Holy mackerel. 
1019,(The Bannermen run off.) 
1020,"WEISMULLER: Boy. Listen, let's try sitting down again, eh? "
1021,HAWK: Okay. 
1022,"WEISMULLER: All right. One, two, three. "
1023,(Ray climbs over the gate and runs up to them.) 
1024,RAY: I thought they'd never go. Can you move? 
1025,"HAWK: Sure, if I leave my neck behind. "
1026,"WEISMULLER: Oh, gee. It's no use, lady. They've got a special kind of"
1027,wrench. It's sort of like a dinky Allen key. 
1028,(Ray rummages in her tool bag.) 
1029,RAY: Is this dinky enough? 
1030,"HAWK: It's looking good, sister. "
1031,"RAY: I'll have you out in a minute, then follow me in your car. "
1032,(The yoke falls to the ground.) 
1033,WEISMULLER: Who is she? 
1034, [Country lane] 
1035," MEL: We did it, Doctor! Free! "
1036,"DOCTOR: Yes, there's more to this than we can fry, Mel. "
1037,(The two Bannermen take up positions behind some large stepping stones
1038,by a ford.) 
1039,DOCTOR: Duck! 
1040,(Bang! Mel screams.) 
1041,"MEL: Did they get you, Doctor? "
1042,"DOCTOR: No, and I don't think they intended to. "
1043,MEL: You could have fooled me. 
1044,(There is a tracker on the bike.) 
1045, [Goronwy's cottage] 
1046, (Goronwy has got Billy into the bee keepers net
1047,hat. The hatchling now stands as tall as Delta's shoulder.) 
1048,GORONWY: This is the queen's hive. 
1049,BILLY: What's that white stuff? 
1050,"GORONWY: Oh, royal jelly. It's a superfood created by the bees"
