,Script
1123,JO: This may be your chance. Good luck. 
1124,DOCTOR: See you later. 
1125,JO: Bye.
1126,
1127, [President's office]
1128,
1129, PRESIDENT: I'm giving you a final chance to tell
1130,me the truth. 
1131,DOCTOR: Madam President. I've been telling you the truth for some
1132,"considerable time, but you just won't believe me. "
1133,"PRESIDENT: I can't think why you chose to work for the Draconians, but"
1134,"whatever it is, I'll double any offer that they have made to you. "
1135,"DOCTOR: Well, that's very generous of you, Madam, but you'd only be"
1136,buying information that doesn't exist. 
1137,PRESIDENT: You leave me no alternative. Under the powers invested in me
1138,"by the Special Security Act, I'm sending you to the Lunar Penal Colony."
1139,
1140,"DOCTOR: What, without a trial? Without even a chance to state my case?"
1141,"So, you're just tucking me quietly away, are you? What about my"
1142,companion? 
1143,PRESIDENT: She will remain here. I have hopes that away from your
1144,"influence, I might be able to make her see the error of her ways. "
1145,DOCTOR: But you will see that she comes to no harm? 
1146,"PRESIDENT: We are not barbarians. If you want to help her, why don't"
1147,you tell me where she comes from? I'd like to inform her family. 
1148,"DOCTOR: I'd like to, Madam. I really would, but there's nothing that I"
1149,can say that you'd believe. May I say goodbye to her? 
1150,WILLIAMS: No! You'll be leaving immediately for the penal colony. We're
1151,putting you where your Draconian friends will be unable to reach you.
1152,
1153, [Penal colony association area]
1154,
1155, (The large windows look out over the cratered
1156,surface of the moon. A perfect prison - no where to run to. The Doctor
1157,"and three other prisoners, two men and a woman, are brought in. They"
1158,are wearing mid-blue judo suits.) 
1159,WARDER: Over there. Get in line and face the front! Face the front! 
1160,PATEL: What did they get you for? 
1161,"DOCTOR: Oh, it's a long story. I don't think you'd believe me even if I"
1162,told you. 
1163,"PATEL: You are a political, aren't you? "
1164,"DOCTOR: Not particularly, no. "
1165,"PATEL: Oh, come off it. Only politicals get sent to the moon, none of"
1166,your common criminals. 
1167,DOCTOR: Have you got many political prisoners here? 
1168,"PATEL: Thousands. Well, I mean, criticise the government and you're for"
1169,"it, aren't you? You a member of the Peace Party? "
1170,"DOCTOR: Well, you might put it like that, yes. Yes, I tried to stop a"
1171,war. 
1172,"PATEL: Me, too. I tried to sabotage a military base. "
1173,DOCTOR: Did you? How long is your sentence? 
1174,PATEL: Sentence? Where have you been? There are no sentences. Once they
1175,"send you to the moon, it's forever. "
1176,CROSS: No talking! 
1177,WARDER: Get in line! 
1178,(An elderly bearded man enters and sits at a table.) 
1179,CROSS: What have you got in there? 
1180,PATEL: Nothing. 
1181,CROSS: Show me. 
1182,PATEL: Chocolate. My allowance from the remand prison. 
1183,CROSS: No chocolate allowed here. 
1184,"DOCTOR: Now that's stealing, you know. "
1185,"CROSS: That's what I'm in for. Got a trouble maker, have we? "
1186,DOCTOR: That's what I'm in for. 
1187,CROSS: I'll remember you. 
1188,"DOCTOR: Good, I'm glad to hear it. "
1189,WARDER: Attention! 
1190,(Cross talks to a man in a light blue prison 'judo suit'.) 
1191,"CROSS: New arrivals, sir. "
1192,GOVERNOR: I am the Governor of this penal colony. There's one rule
1193,"here. You do as you're told. If you behave yourselves, you'll be"
1194,"reasonably treated, but you have no rights and there is no means of"
1195,escape. You'll do well to remember that you're here for the rest of
1196,your lives. Why is that man not in uniform? 
1197,"CROSS: Don't know, sir. That's how they sent him. Special security"
1198,prisoner. 
1199,GOVERNOR: See he's kitted out immediately. 
1200,CROSS: Sir. 
1201,"PATEL: We won't be staying here forever, you know! The Peace Party will"
1202,win one day. 
1203,"GOVERNOR: Very well, Cross, I'll leave them to you. "
1204,(The Governor leaves.) 
1205,CROSS: Sir. That's probably the last time you'll see the Governor. But
1206,you'll see me every day. Now I run a nice quiet tidy section here. Any
1207,"trouble, it's a black mark on my records, so there's, er, never any"
1208,trouble. Got it? 
1209,"PATEL: Look, don't you realise that you're one of us? We're all"
1210,prisoners here! Victims of the system! 
1211,"CROSS: Shut up, you! (to the old man) You, kit out that man. (to the"
1212,guard.) Come with me. 
1213,(Cross and the guard leave.) 
1214,DOCTOR: I thought you said there were no common criminals here? 
1215,DALE: Cross is a trusty. They are all hardcore criminals specially
1216,imported from other prisons. 
1217,PATEL: Professor Dale? 
1218,"DALE: You were on our youth committee, were you not? "
1219,"PATEL: That's right, sir. We met last year, just before your arrest. "
1220,"DALE: Well, you'll find yourself in very good company here, my boy. I"
1221,sometimes think there are more members of the Peace Party up here than
1222,back on Earth. 
1223,DOCTOR: Don't any of you try to escape? 
1224,DALE: Escape? Occasionally. Why do you ask? 
1225,DOCTOR: It seems a perfectly natural question. 
1226,DALE: Do you know this man? 
1227,"PATEL: Er, no, sir. I met him on the shuttle. "
1228,DALE: I'd better get you a uniform. Come this way. 
1229,(The Doctor makes a V for Victory sign and Patel returns it.)
1230,
1231, [President's office]
1232,
1233, (The Doctor's official mug shots are on the wall
1234,screen.) 
1235,PRESIDENT: There's no doubt about it. These are the same people. 
1236,(The list of charges appears. he did on the 51st Smalk defraud the
1237,Sirius Union Bank the sum of 1023Sc. he did evade payment of planetary
1238,"income tax in the sum of 3,948.6 Sc. he did on the above date commit"
1239,assault and battery upon the person of ) 
1240,WILLIAMS: No doubt. But that doesn't mean we should hand them over to
1241,anyone. 
1242,(It's Jo's turn.) 
1243,PRESIDENT: I'm surprised. Especially about the girl. 
1244,(that the person known as Jo Grant be apprehended forthwith and brought
1245,"to appear at the High Court of Bassett, being required to answer the"
1246,following charges. She is accused of being the Doctor's accomplice.) 
1247,PRESIDENT: All these crimes! 
1248,WILLIAMS: Just the sort of people the Draconians would employ. 
1249,PRESIDENT: Nevertheless the dominion government of Sirius 4 does have a
1250,claim to them. 
1251,WILLIAMS: And so do we. They have vital information. 
1252,PRESIDENT: They must be very important to them. I think I'd better see
1253,"their representative. Send in the Commissioner from Sirius 4, please. "
1254,WILLIAMS: Surely you're not going to hand them over? 
1255,"PRESIDENT: Well, we'll have to see, won't we. Relationships with the"
1256,"colony of planets are always difficult. And if there is a war, we'll"
1257,"need all the allies we can get, won't we? "
1258,"SECRETARY: The commissioner, Madam. "
1259,(A man in black enters.) 
1260,MASTER: Madam President. This is indeed a great honour.
1261,
1262, [Penal colony association area]
1263,
1264, (Patel is playing a variation of 3D chess.) 
1265,PATEL: Check and mate. 
1266,(There are a lot of prisoners here now. Dale and the Doctor enter.) 
1267,"DALE: Yes, there's an excellent library. There are books, videofilms,"
1268,handicrafts and discussion groups. All sorts of ways of passing the
1269,time. 
1270,DOCTOR: Including planning to escape? 
1271,DALE: That's not one of the things we discuss. 
1272,"DOCTOR: Oh, why? Doesn't anybody ever try? "
1273,DALE: Occasionally. There was an attempt last month. 
1274,"PATEL: Yes, what did happen? "
1275,DALE: What always happens. They are dead. No one escapes from here. 
1276,"DOCTOR: No. No, quite so. But there's got to be a first time for"
1277,"everything, hasn't there? Come on, Professor, come and tell me all you"
1278,know about the layout here.
1279,
1280, [President's office]
1281,
1282," MASTER: Truly, Madam President, I sympathise with"
1283,"your position, but my government has sought these criminals throughout"
1284,the galaxy. 
1285,WILLIAMS: There are now prisoners of the government of Earth. That's
1286,good enough. 
1287,"MASTER: With the greatest respect, General Williams, I must disagree."
1288,They are citizens of Sirius 4. 
1289,WILLIAMS: Part of Earth's empire. 
1290,"MASTER: Yes, but it has been granted dominion status. "
1291,"PRESIDENT: He has a point, General Williams. Once a colony has been"
1292,"raised to dominion status it enjoys certain autonomous rights,"
1293,including the right to try and punish its own citizens. 
1294,MASTER: Exactly. But I feel assured that once these two have come to
1295,"trial, my government will be only too happy to send them back to you"
1296,"for further interrogation. But meanwhile, my orders are clear. I must"
1297,take them back with me to Sirius 4. 
1298,WILLIAMS: I will not hand over vital prisoners to some tin-pot colony! 
1299,"PRESIDENT: As the Commissioner has pointed out, General Williams,"
1300,Sirius 4 is no longer a colony. It is a dominion. Your request is
1301,granted. 
1302,MASTER: Madam President. I am most grateful. 
1303,WILLIAMS: Heaven help you if you let them escape! 
1304,"MASTER: You may rest assured, General Williams, they will be perfectly"
1305,safe with me.
1306,
1307, [Penal colony association area]
1308,
1309, (Beakers of liquid are being handed out.) 
1310,"WARDER: Right, keep it moving! "
1311,DOCTOR: Is this all we get? 
1312,DALE: It contains all the elements to support life. 
1313,"DOCTOR: Mmm, and absolutely nothing to make it enjoyable, eh? "
1314,"DALE: You get used to it after a month or two. Anyway, it's all we ever"
1315,get. 
1316,WARDER: Keep moving! 
1317,CROSS: You heard him. Move! 
1318,"DOCTOR: Not exactly friendly, are they. "
1319,DALE: One gets used to it. 
1320,PATEL: What time do we get to bed? 
1321,DALE: Anytime. There's no day or night here. 
1322,"DOCTOR: No. Tell me, Professor, when do you plan to escape? "
1323,DALE: No one escapes from here. 
1324,DOCTOR: But you're going to try? 
1325,"DALE: For all I know, you could be a spy for the Governor. "
1326,"DOCTOR: If I were, I'd hardly be drawing attention to myself quite so"
1327,"quickly, now would I? "
1328,"DALE: No, a valid point of logic. I wonder if I can trust you? "
1329,"DOCTOR: You've little or no alternative, Professor. We're all in this"
1330,"sector together. Whatever you do, I shall know about it. "
1331,"PATEL: Yes, but we don't know you. Why did they send you here? "
1332,"DOCTOR: Oh, I was sent here at the express wish of a certain General"
1333,Williams. 
1334,DALE: We have no proof of that. We have no reason to tell you anything.
1335,
1336,DOCTOR: I'll tell you something. There is a conspiracy to start a war
1337,between Earth and Draconia. 
1338,DALE: There are warmongers on both sides. We are aware of that. 
1339,"DOCTOR: But there's also a third party, Professor, who is plotting to"
1340,set the two empires at each others throats.
1341,
1342, [Outside the cell]
1343,
1344," MASTER: No, I'll see her alone."
1345,
1346,[Cell]
1347,
1348," MASTER: Penny for them, Miss Grant? "
1349,JO: You. What are you doing here? 
1350,MASTER: To coin a phrase. I've come to take you away from all this. 
1351,JO: What are you talking about? 
1352,"MASTER: Well, surely you don't want to spend the rest of your life in"
1353,"here, do you? "
1354,"JO: Well, I'm not going anywhere with you, that's for sure. "
1355,"MASTER: Oh, but you are, you know. Believe it or not, I am a fully"
1356,"accredited Commissioner from the planet Sirius 4, and you and the"
1357,Doctor are two dangerous criminals being handed over into my custody. 
1358,JO: So it was you! You ordered those Ogrons to attack the ships and
1359,pretend they were Draconians! 
1360,MASTER: But of course. Those lumbering idiots could never have thought
1361,up such a brilliant scheme by themselves. 
1362,JO: Why did you want to start a war? 
1363,"MASTER: Now, come on, Miss Grant, be reasonable. You want to see the"
1364,"Doctor again, don't you? "
1365,JO: Where is he? 
1366,"MASTER: He's in another prison, on the moon. We're going to collect"
1367,him. 
1368,JO: How do I know you're telling the truth? 
1369,MASTER: You don't. And the only way you'll find out is by coming with
1370,me. Well? 
1371,JO: How did you know we were here in the first place? 
1372,"MASTER: Well, after they'd attacked the cargo ships, the Ogrons"
1373,"returned to their planet, taking their loot with them. Now imagine my"
1374,"surprise, and my delight, when I found that they'd brought me the"
1375,Doctor's Tardis. 
1376,JO: And why are you taking us with you? 
1377,"MASTER: Oh, need you ask? How could I leave two dear friends in such"
1378,dire straights? 
1379,"JO: Oh, you don't seriously think that I'm going to believe that you"
1380,want to help us 
1381,"MASTER: Believe what you like, Miss Grant. I have my reasons. Now, are"
1382,"you coming, or do you really wish to vegetate in this hole for the rest"
1383,of your natural? 
1384,JO: Very well. I'll come. 
1385,"MASTER: Excellent! The prisoner and I are ready to leave now, guard. "
1386,JO: Anywhere is better than here. 
1387, [Penal colony association area]
1388,
1389," DOCTOR: Well, there you are. There you have it."
1390,That's how I came to be here. 
1391,"PATEL: It's fantastic! I mean, our people seeing Draconians, Draconians"
1392,seeing Earthmen. I can't believe it. 
1393,"DALE: Well, I can. "
1394,"DOCTOR: Good grief. Do you know, sir, you're the first person who's"
1395,believed me? 
1396,DALE: It would explain a great deal. After the stupidity of the
1397,"Draconian war, the bitterness eventually died down and we had many"
1398,"years of peace. There were trade treaties, cultural exchanges and then"
1399,"for no reason at all, these sudden acts of hostility. "
1400,(A warder and Cross enter.) 
1401,WARDER: Dale! Over here! 
1402,"DALE: Yes, what is it? "
1403,WARDER: Spot check. You ought to know. 
1404,DALE: If you'll excuse me. One of our little prison rituals. 
1405,"(Cross searches Dale, whilst muttering under his breath.) "
1406,CROSS: (sotto) This is it. There's a VIP landing in his spaceship in
1407,"ten minutes time, bay seven. You can pinch it. I've set up two space"
1408,suits for you. 
1409,DALE: (sotto) I can't believe it. 
1410,"CROSS: (sotto) Well, I keep my promises, now you keep yours. When you"
1411,"get back to Earth, don't forget who your friends are. "
1412,"DALE: (sotto_ When the Peace Party takes over, you'll be given a free"
1413,pardon. You have my word. 
1414,"CROSS: Right, you're clean. Report to airlock three for maintenance"
1415,"work. You and one other. You can choose him yourselves, okay? "
1416,DOCTOR: What is it? What's up? 
1417,"DALE: Oh, just a search. All part of the routine. "
1418,(Cross and the warder leave.) 
1419,"DOCTOR: Come on, Professor. Come on. You were giving off conspiracy in"
1420,"waves over there. You can trust me, you know. "
1421,"DALE: The escape plan. It's now. We have to walk from the airlock,"
1422,across the moon's surface. We are going to steal a spaceship. They have
1423,left two spacesuits for us. 
1424,DOCTOR: Who are you taking with you? 
1425,"DALE: Well, I had planned to take another member of the Peace Party"
1426,"committee, but I'm afraid he'll have to give up his place. Doctor, I"
1427,want you to come with me. 
1428,"DOCTOR: Well that's very generous of you, but "
1429,DALE: We must get you back to Earth so that you can tell your story. 
1430,"DOCTOR: Well, it was telling my story on Earth that got me sent here in"
1431,the first place. 
1432,"DALE: We have contacts everywhere. Journalists, broadcasters, even"
1433,friends in the government. We'll make them believe you. 
1434,"DOCTOR: Thank you, Professor. You don't know what it means to me to"
1435,have found allies at last. 
1436,"DALE: Well, we'd better be going, Doctor. This spaceship will be"
1437,landing any moment.
1438,
1439, [Outside the Lunar airlock]
1440,
1441, DALE: Good! He's left it open.
1442,
1443, [Lunar airlock]
1444,
1445, (The Doctor shuts the door behind them as Dale
1446,goes over to the oxygen units.) 
1447,"DALE: Excellent! Excellent! Come on, Doctor, we haven't got long. "
1448,DOCTOR: Take this one? 
1449,(They start to climb into space suits.) 
1450,DALE: We can't use the main entrance to the space port. It's too well
1451,guarded. All we have to do is to walk across the moon's surface. About
1452,ten minutes and we're there. 
1453,"DOCTOR: Tell me, Professor, why is Cross helping you? "
1454,"DALE: A kind of bribery, I'm afraid. I promised to get him a free"
1455,pardon once we get into power. 
1456,DOCTOR: That's extraordinary. I would have thought he would have wanted
1457,something far more positive than promises.
1458,
1459, [Outside the Lunar airlock]
1460,
1461," DALE : Oh, he's not a bad fellow when you get"
1462,to know him.
1463,
1464, [Lunar airlock]
1465,
1466," DALE: I appealed to his better self. Now do hurry,"
1467,Doctor. 
1468,"(Outside, Cross looks through a panel in the door then goes to a large"
1469,dial on the wall and turns it. Dale and the Doctor are fully suited
1470,up.) 
1471,DOCTOR: What's that? I thought I heard something. 
1472,"DALE: Yes. Now, Doctor, clip my cylinder on the back of my suit and"
1473,then I'll fix up yours. 
1474,DOCTOR: All right. 
1475,(The Doctor picks up an oxygen pack.) 
1476,"DOCTOR: Well, this one's empty. "
1477,DALE: It can't be. 
1478,"DOCTOR: Well, it certainly is. Take a look for yourself. There, look at"
1479,"the gauge. Yes, and so is this one. They're both empty, Professor. "
1480,(Cross turns the dial outside again and the liquid in a tube rises
1481,rapidly as the pressure drops.) 
1482,DOCTOR: The door. It's locked! 
1483,DALE: Listen. 
1484,"DOCTOR: They're depressurising. Don't you understand, man? They're"
1485,pumping out the air! 
1486, Episode Four
1487,
1488, [Lunar airlock]
1489,
1490, DALE: We're going to suffocate! 
1491,(The Doctor hits the door with one of the empty cylinders.) 
1492,DALE: That's no good. They'll never hear us. 
1493,DOCTOR: They certainly won't if we don't try. 
1494,DALE: Help! Help! Help! 
1495,"DOCTOR: Professor, don't shout. You'll just waste oxygen. "
1496,(Dale collapses.) 
1497,"DOCTOR: Come on, Professor, come on. Come on, up you get. "
1498,"(Outside, a hand in a black glove turns the pressure dial back.) "
1499,"DOCTOR: Listen. Listen, it worked! "
1500,(The inner airlock door opens.) 
1501,"MASTER: I do hope that you're all right, Doctor. "
1502,"DOCTOR: You. Yes, I might have guessed. "
1503,"MASTER: I'd hate you to come to any harm, you know/"
1504,
1505, [Governor's office]
1506,
1507, DOCTOR: It was a deliberate attempt at
1508,"cold-blooded murder, Governor. And I demand an enquiry. "
1509,GOVERNOR: You were trying to escape. You've only yourselves to blame
1510,for the consequences. 
1511,DOCTOR: I also believe there was a conspiracy to destroy this man
1512,because he's politically dangerous to you. 
1513,GOVERNOR: How dare you! 
1514,"DALE: Cross said he would help us to escape, and he left spacesuits for"
1515,us in the airlock. 
1516,DOCTOR: With no oxygen in the cylinders. 
1517,GOVERNOR: Is there any truth in this? 
1518,"CROSS: No, sir. They stole the suits. Must have messed it up and taken"
1519,ones with empty cylinders. 
1520,DOCTOR: And I take it we that also locked ourselves in the airlock from
1521,the outside and switched off the air supply? 
1522,"MASTER: He does have a point there, you know, Governor? Had it not been"
1523,for my time 
1524,"CROSS: Maybe another prisoner did it? You know, one who had it in for"
1525,them? 
1526,GOVERNOR: You are both guilty of attempting to escape. You'll both be
1527,placed in solitary confinement for the next year. 
1528,"MASTER: Er, just a moment, Governor. Do what you will with the old man"
1529,but that one comes with me. 
1530,"GOVERNOR: Out of the question, I'm afraid. He's committed an internal"
1531,offence and is subject to prison discipline. Take them away. 
1532,(Dale and the Doctor are led out by warders.) 
1533,"CROSS: Sorry about this, sir. I'll see it doesn't happen again. "
1534,"GOVERNOR: Yes, it had better not. All right, you can go. "
1535,CROSS: Sir. 
1536,(Cross leaves.) 
1537,"MASTER: You know, I do wish that you'd reconsider, Governor. Obtaining"
1538,custody of that prisoner is very important to me. And I do have a
1539,warrant. 
1540,"GOVERNOR: It's out of the question, I'm afraid. You see, he's under"
1541,"punishment. When he's completed his solitary confinement, I'll"
1542,reconsider. 
1543,"MASTER: I see. You know, I have a theory about this incident. "
1544,GOVERNOR: It's no concern of yours. 
1545,MASTER: I think that those two prisoners were telling the truth. I
1546,"think that your trusty, Cross, was helping them. "
1547,GOVERNOR: Why should he do that? 
1548,MASTER: On your instructions. 
1549,GOVERNOR: That is an outrageous suggest 
1550,"MASTER: Oh come, Governor. You rid yourself of a politically dangerous"
1551,"prisoner, and foster the legend that escape is impossible in one go. I"
1552,must congratulate you. 
1553,GOVERNOR: You're being very impermanent. 
1554,MASTER: Suppose I were to support the Doctor's demand for an official
1555,enquiry? Some very awkward questions could be asked. 
1556,GOVERNOR: I have nothing to fear. 
1557,"MASTER: Haven't you? Oh, come, Governor. Hand the Doctor over to me and"
1558,I promise you he'll be no further trouble to you. 
1559,"GOVERNOR: Well, I've no wish to be uncooperative. What would you do"
1560,with him? 
1561,"MASTER: Oh, take him back to Sirius 4 and see that he stands trial. You"
1562,wouldn't believe the list of crimes he's committed.
1563,
1564, [Solitary confinement]
1565,
1566,(The Governor and the Master enter.) 
1567,GOVERNOR: I'm releasing you into the custody of this Commissioner. He
1568,will fly you back to Sirius 4 to stand trial. 
1569,DOCTOR: And may I ask what I'm supposed to have done there? 
1570,"MASTER: Defrauding the Sirius 4 Dominion Bank, evasion of planetary"
1571,income tax. Assault and battery committed upon the person of a Sirius 4
1572,police official. Taking a spaceship without authority and piloting the
1573,said spaceship without payment of tax and insurance. Landing the said
1574,spaceship on an unauthorised area of Sirius 3. Need I go on? 
1575,"DOCTOR: I seem to be quite the master criminal, don't I? You don't mean"
1576,"to say that you really believe all this nonsense, do you, Governor?"
1577,Whatever credentials that he's shown you are forged. 
1578,"MASTER: Oh come, Doctor, you know the game's up. Why not admit defeat?"
1579,"You know, this man always works with an accomplice. A girl. I've got"
1580,"her under lock and key in my ship. Well, Doctor, are you coming"
1581,quietly?
1582,
1583, [Police spaceship brig]
1584,
1585,(In a hold is a barred cage with two beds. Jo is
1586,"there. The Doctor is brought in, wearing his usual clothes.) "
1587,"DOCTOR: Hello, Jo. "
1588,JO: Doctor! 
1589,DOCTOR: How are you? All right? 
1590,JO: Well 
1591,"MASTER: Right, they'll be plenty of time for the exchange of social"
1592,pleasantries. Put him inside. 
1593,"(A guard opens the cage, the Doctor enters and is locked in.) "
1594,"MASTER: Thank you, gentlemen. You can leave them to me now. "
1595,(The guards leave.) 
1596,"MASTER: Well, Doctor, this is an interesting reversal. I remember your"
1597,once visiting me when I was in prison. 
1598,"DOCTOR: You know, I'd very much like to know why? "
1599,MASTER: Why you've been locked up? 
1600,DOCTOR: No. Why I'm still alive. 
1601,"MASTER: Oh, your health is very precious to me, for the moment. You"
1602,"see, my employers are most interested in you. "
1603,JO: The Ogrons? 
1604,"MASTER: Miss Grant, please. I employ them. "
1605,"DOCTOR: Yes, well whatever it is you're up to, you needn't expect any"
1606,help from me. 
1607,MASTER: I don't need any help. Your simple presence will be quite
1608,"enough. Oh, by the way, I need hardly warn you there is no point in"
1609,"trying to escape. This is an interplanetary police spaceship, specially"
1610,"built for carrying prisoners, as you can see. "
1611,"DOCTOR: Stolen, of course? "
1612,"MASTER: Of course. Oh, and another thing. There's a closed circuit"
1613,"television camera trained on you from up there, so you will be under"
1614,"continuous observation. I think that's all. Well now, if you'll excuse"
1615,"me, I have some rather complicated astro-navigational calculations to"
1616,work out. 
1617,"DOCTOR: Er, may I ask where we're going? "
1618,"MASTER: Certainly. To the home of our friends, the Ogrons. A barren and"
1619,uninteresting planet on the remote fringes of the galaxy. 
1620,JO: Why are you taking us there? 
1621,"MASTER: That, Miss Grant, you will discover when you arrive. "
1622,(The Master leaves.) 
1623,"DOCTOR: Right, now listen to me. We haven't got much time before he"
1624,"gets back to the flight deck. Now, the first thing we've got to do is"
1625,"to escape. Now they took my sonic screwdriver from me in the prison,"
1626,but they didn't get a hold of this. 
1627,(The Doctor takes a piece of wire from his boot.) 
1628,DOCTOR: A steel file. 
1629,"JO: Right, let's go. "
1630,"DOCTOR: No, not yet. Let's wait until he gets back to the flight deck,"
1631,"then he'll set the controls. Now, this is an automatic spaceship. Once"
1632,"we're underway, the computers take over, right? "
1633,"JO: Okay, so what's the plan? "
1634,DOCTOR: Now this is what we're going to do.
1635,
1636, [Police spaceship bridge]
1637,
1638, (It has the same layout as the cargo ship. The
1639,Master changes a numerical display from 46487 to 68110 and straps
