,Script
584,"JO: Well, yes, but why do they keep telling lies about us? "
585,"DOCTOR: They don't know that they're lying, Jo. They're desperately"
586,trying to fit us into their version of things. 
587,"JO: Well, what are we going to do, then? "
588,"DOCTOR: Well, when we get back to Earth, we've got to reach someone in"
589,authority whose mind isn't already closed. 
590,JO: Closed to what? 
591,"DOCTOR: Jo, look, these people believe that the Draconians are"
592,"attacking their spaceships, right? "
593,JO: Right. 
594,"DOCTOR: And we know that they're wrong, don't we? "
595,"JO: Well, yes, it was Ogrons. "
596,"DOCTOR: Well, we also know that the Ogrons couldn't possibly have"
597,created that hallucinatory device that makes the Earthmen think they're
598,Draconians. 
599,"JO: Oh. Oh, well that's simple then. I mean, all we've got to do is"
600,"find out what's going on, who's behind the Ogrons, where they've taken"
601,"the Tardis, go and get it back and then we can all go home. Right? "
602,DOCTOR: Right. 
603,JO: Oh. I don't know what I've been worrying about 
604, [President's office]
605,
606, (Kemp is reporting in on the President's intercom
607,monitor screen.) 
608,KEMP : We are now in space port ten. The ship will land in
609,"fifteen minutes. The crew are safe. Also aboard, two human stowaways,"
610,origins unknown. 
611,WILLIAMS: I want a cordon around the landing area the minute that ship
612,"touches down. Nobody on, nobody off till I get there. "
613,KEMP : Sir. 
614,WILLIAMS: I'd better get down there. I want to handle the preliminary
615,interrogations myself. 
616,"PRESIDENT: Good. General Williams? Whatever you find out, you'll report"
617,directly to me. 
618,WILLIAMS: Naturally. And now if you'll excuse me? 
619, [Spaceship room]
620,
621, JO: What do they think they're doing? We've been
622,landed for simply ages. 
623,"DOCTOR: Well, twelve minutes to be exact, Jo. "
624,JO: Shush. Someone's coming. 
625,(Kemp enters.) 
626,KEMP: Outside. 
627,JO: We want to see somebody in authority. 
628,KEMP: You're going to. Outside.
629,
630, [Spaceship cargo hold]
631,
632," WILLIAMS: Now then, what's all this about?"
633,
634, [President's office]
635,
636, PRESIDENT: Draconian agents? Are you sure? 
637,WILLIAMS: What else can they be? Their story is obvious nonsense. 
638,PRESIDENT: But why? Why would the Draconians leave them on board the
639,ship? 
640,WILLIAMS: The Draconians are preparing for war. 
641,PRESIDENT: You're still only suspecting them. There is no proof. 
642,"WILLIAMS: Then they need to plant human agents, traitors, on this"
643,planet to sabotage our war effort. 
644,PRESIDENT: But we are bound to suspect them. They must have realised? 
645,WILLIAMS: The Draconians probably thought the crew was dead. We could
646,easily have accepted those two as passengers. Two unfortunate refugees
647,"from a Draconian attack, ideally placed for espionage. "
648,"PRESIDENT: If you are right, the sooner we confront the Draconians with"
649,"this, the better. Bring the prisoners in. We'll bring them face to face"
650,with the Draconian ambassador.
651,
652, [Outside the cell]
653,
654, (Gardiner leads the Doctor and Jo down a dark
655,concrete corridor.) 
656,GARDINER: In there.
657,
658, [Cell]
659,
660, GARDINER: When did you last eat? 
661,JO: Quite some while ago. 
662,"GARDINER: Well, I'll see they send you some food. "
663,DOCTOR: I'd like to get a message through to your President. 
664,GARDINER: Not a chance. I'm going straight back to my ship. Don't want
665,"to get mixed up with security. It's not healthy. Look, I'll give you a"
666,piece of advice. 
667,DOCTOR: Yes? 
668,"GARDINER: Sooner or later, you're going to tell them everything."
669,They'll use the mind probe. You talk to them now. You'll save
670,yourselves a lot of trouble. 
671,(Gardiner leaves. The metal door slides shut.) 
672,JO: A mind probe? 
673,"DOCTOR: Oh, you don't want to worry about those things, Jo. As long as"
674,"you tell them the truth, they can't do you any harm. "
675,JO: They can't? 
676,"DOCTOR: No, of course not. Well, they're only sort of computers with a"
677,"few extra knobs on. And you know how stupid computers can be, don't"
678,"you? Now come and sit down, stop worrying. Come on. Sit down. Did I"
679,ever tell you the story about how I was once captured by the Medusoids?
680,
681,JO: What are they? 
682,"DOCTOR: Medusoids? How can I describe them to you? Well, they're a sort"
683,"of hairy jellyfish with claws, teeth and a leg. "
684,JO: Erk! 
685,"DOCTOR: Anyway, they put me under one of these mind probes things, you"
686,"see, and tried to get me to tell them where I was going. So, I said I"
687,"was on my way to meet a giant rabbit, a pink elephant and a purple"
688,horse with yellow spots. 
689,JO: What happened? 
690,"DOCTOR: Well, the poor old machine just couldn't believe it, had a"
691,nervous breakdown. 
692,JO: And then what happened? 
693,"DOCTOR: Well, they put me under another one of these mind probe things"
694,and the same thing happened. 
695,"JO: But you weren't telling the truth. I mean, you weren't really going"
696,"to meet a giant rabbit, a pink elephant and a, what was it? "
697,"DOCTOR: A purple horse with yellow spots. Yes, I was. You see, they"
698,were all delegates for the third Intergalactic Peace Conference. 
699,JO: How did you get away from these things? 
700,DOCTOR: Well they had to turn me loose eventually. 
701,JO: Why? 
702,DOCTOR: They ran out of mind probes.
703,
704, [President's office]
705,
706, PRESIDENT: And you are quite sure it was a
707,Draconian battle cruiser. 
708,"STEWART: Of course, Madam. "
709,HARDY: They locked on and boarded us. We saw them. They were
710,Draconians. 
711,PRESIDENT: Thank you. That will be all. I hope you will soon recover
712,from your ordeal. 
713,(Hardy and Stewart leave. The Draconian Prince and an aide have been
714,listening.) 
715,"PRESIDENT: Well, your Highness? "
716,PRINCE: These men are your servants. They are saying what they have
717,been ordered to say. 
718,"WILLIAMS: On this occasion, we have more than our servants to confront"
719,you with. We have captured two of your human agents. 
720,PRINCE: We have no human agents. Subversion and espionage are expressly
721,forbidden by the treaty of peace between our two empires. 
722,WILLIAMS: A treaty which you have flagrantly broken. 
723,PRINCE: I shall return to my embassy. 
724,"PRESIDENT: Just a moment please, your Highness. Bring them in. "
725,(The Doctor and Jo are brought in at gunpoint.) 
726,WILLIAMS: These people stowed away on the cargo ship. They transmitted
727,signals which enabled your battlecruiser to home in on its prey. 
728,PRINCE: I know nothing of this. 
729,"PRESIDENT: Perhaps you do not, but some servant of the Draconian empire"
730,employed them. 
731,"DOCTOR: Madam, I can assure that I've never been employed by anybody."
732,Least of all by the Draconians. 
733,PRINCE: Your servants should have been better rehearsed in their lies. 
734,WILLIAMS: Or they're showing a misguided loyalty to their Draconian
735,masters. 
736,"DOCTOR: If we really were working for the Draconians, why did they"
737,leave us in your ship? 
738,WILLIAMS: To act as spies when you were brought back to Earth. 
739,"DOCTOR: Allow me to congratulate you, sir. You have the most totally"
740,"closed mind that I've ever encountered. Madam, I beg of you to listen"
741,to me. Some third party is trying to provoke war between Earth and
742,Draconia. You are both being duped. 
743,WILLIAMS: Take them away. 
744,"PRESIDENT: Just a minute, please. Why should a third party wish to do"
745,this? 
746,"DOCTOR: I've no idea, Madam, but believe me, that is what is happening."
747,
748,WILLIAMS: Take them away! 
749,DOCTOR: Now please listen to me! If you don't you'll be involved in a
750,war that could cause the death of millions! 
751,(The Doctor and Jo are hustles out.) 
752,PRINCE: Is this the evidence upon which you accuse me? 
753,PRESIDENT: I must ask you to convey a formal protest to your Emperor. 
754,PRINCE: I shall inform him of this latest insult to the honour of the
755,Draconian empire. 
756,(The Prince and his aide leave.) 
757,WILLIAMS: We should have used the mind probe before we saw the
758,Ambassador. If we'd had a full confession. 
759,PRESIDENT: Has it occurred to you that they might have been speaking
760,the truth? 
761,WILLIAMS: Is it likely? Mysterious alien giants that can change their
762,form? A pocket spaceship that appear inside another? 
763,PRESIDENT: I suppose you're right. It is nonsensical. 
764,"WILLIAMS: Just you leave them to me. I'll get the truth out of them,"
765,eventually.
766,
767, [Cell]
768,
769," (The Doctor and Jo are put back in the cell, which"
770,"it turns out is in the concrete monstrosity of the South Bank Centre,"
771,London) 
772,"JO: Well, we've seen the President. "
773,"DOCTOR: I've got to get them to listen to me, for their sakes as well"
774,as ours. 
775,"JO: Well, why their sakes? "
776,"DOCTOR: Well, that was a Draconian with the President, you know."
777,Obviously an Ambassador of some kind. 
778,JO: So? 
779,"DOCTOR: Well, clearly Earth and Draconia are on the brink of war, and"
780,they both believe it's the others fault. 
781,"JO: Well, never mind about that. What about getting us out of here? "
782,"DOCTOR: Well, I can but try. Yeah, seems a fairly conventional type of"
783,electronic lock. Rather old-fashioned really. Here goes. 
784,"(The Doctor turns on his sonic screwdriver, and an alarm sounds.) "
785,"DOCTOR: Yes, well, I think we'll sit here for a while after all."
786,
787, [Draconian Ambassador's office]
788,
789, PRINCE: But why? Why should they produce such an
790,elaborate lie? 
791,AIDE: The ways of the Earthmen are devious. They're an inscrutable
792,species. 
793,PRINCE: Obviously they are preparing the next stage of their plan.
794,"First, the attacks on our ships and now this. "
795,"AIDE: Is it possible, your Highness, that for once the Earthmen spoke"
796,the truth? Some plan of the Emperor of which your Highness has not been
797,informed? 
798,PRINCE: The Emperor would not possibly contemplate such a plan. We do
799,not break the treaty of peace. 
800,AIDE: Shall I prepare your Excellency's report to the Emperor on this
801,meeting? 
802,PRINCE: I must have more information. 
803,AIDE: It would be useful to question the humans who were found on the
804,ship. 
805,PRINCE: They are supposed to be prisoners. 
806,"AIDE: Prisoners have been known to escape, your Highness. "
807,PRINCE: Not without help. And that would be a grave act of hostility. I
808,could not possibly countenance such a plan. 
809,"AIDE: But should two escaping prisoners seek sanctuary in this Embassy,"
810,it would be uncivilised to turn them away. 
811,PRINCE: I must not detain you longer. No doubt you have duties
812,demanding your attention? 
813,AIDE: Your Highness.
814,
815, [President's office]
816,
817,(The intercom beeps.) 
818,PRESIDENT: Yes? 
819,SECRETARY : The First Secretary from the Draconian embassy
820,"wishes to speak you, Madam President. "
821,PRESIDENT: Very well. 
822,"AIDE : I'm honoured that you consent to speak to me, Madam"
823,President. 
824,PRESIDENT: What is it that you wish to say? 
825,AIDE : It concerns the two Earthmen who were found on board
826,your cargo ship. 
827,PRESIDENT: Well? 
828,AIDE : His Highness would like to question them. In your
829,"presence, of course, Madam President. "
830,PRESIDENT: For what purpose? 
831,AIDE : His Highness feels that such an interrogation would
832,help to convince you that they are not agents of Draconia. 
833,PRESIDENT: I shall have them brought here immediately. I suggest his
834,Highness joins me here. We shall question them together.
835,
836,[Cell]
837,
838, GUARD: On your feet. 
839,DOCTOR: Why? 
840,GUARD: You heard me. Move. 
841,DOCTOR: Not unless you give me some good reason. 
842,GUARD: The President wants you. Is that good enough? 
843,JO: Perhaps she believed you? 
844,DOCTOR: Are you sure it's the President and not another ridiculous
845,interrogation. 
846,GUARD: I said move! 
847,"DOCTOR: Come on, Jo, Perhaps we can convince them after all."
848,
849, [Security building walkway]
850,
851," (Out in the open, someone takes a shot at the"
852,group from a high vantage point. One guard falls. The Doctor spots the
853,weapon and pushes Jo aside as the guards return fire.) 
854,"DOCTOR: Move, Jo! Get up and run! "
855,(Draconians come out of concealment to grab the Doctor. Jo runs.) 
856,JO: Quickly! The Doctor! 
857,(The Earth guards follow her and catch her.) 
858,JO: But you don't understand! It's the Draconians. They've got the
859,Doctor!
860,
861, [President's office]
862,
863, WILLIAMS: We must demand the immediate withdrawal
864,of the Draconian embassy. 
865,PRESIDENT: Break off diplomatic relations completely? 
866,WILLIAMS: What diplomatic relations? The embassy staff have behaved
867,like criminals. 
868,PRESIDENT: We don't know that the Ambassador was behind this! 
869,WILLIAMS: The attackers were Draconians. They were clearly seen. The
870,"Draconian embassy tricked you into moving the prisoners, then mounted"
871,an armed attack in order to rescue their agents. 
872,PRESIDENT: Is the girl here? 
873,WILLIAMS: She's outside now. 
874,PRESIDENT: Bring the girl in. I wish to question her. 
875,WILLIAMS: And the closing of the Draconian embassy? 
876,PRESIDENT: I do not intend to break off diplomatic relations! 
877,WILLIAMS: But surely there's no alternative once this news gets out? 
878,"PRESIDENT: Then it mustn't, General Williams. It is your responsibility"
879,to ensure a complete security blackout on this incident. 
880,"WILLIAMS: Very well, Madam. Under protest. "
881,(Jo enters with a guard.) 
882,PRESIDENT: You can go. 
883,(The guard leaves.) 
884,"PRESIDENT: Come forward, my dear. You realise that the escape of your"
885,colleague has left you in a very serious position? 
886,"JO: But he didn't escape, he was kidnapped. "
887,WILLIAMS: He was rescued by your Draconian paymasters. 
888,PRESIDENT: The wisest course you can take now is to make a full
889,confession. Remember your colleague has left you to your fate. 
890,"JO: Oh, but you've got it all wrong. You see, the Doctor was pleased"
891,"when you sent for him because he wanted to talk to you, and "
892,WILLIAMS: We have eye witness reports on what occurred. 
893,PRESIDENT: We need to know how you came to work for the Draconians. 
894,WILLIAMS: When were you recruited? How many agents do they have on
895,Earth? What are their plans? 
896,"PRESIDENT: If you tell us everything, I'll promise you I'll see to it"
897,personally that you will be treated leniently. JO: But I don't know
898,"what you're talking about. Look, we told you the truth when we first"
899,came here. We're not working for the Draconians. 
900,WILLIAMS: We're wasting time. I suggest you let me apply depth
901,interrogation techniques without delay. 
902,"JO: Look, you can use your mind probe or whatever. I'm telling you the"
903,truth.
904,
905, [Draconian Ambassador's office]
906,
907," DOCTOR: Well, I must say it's very nice of you"
908,gentlemen to invite me here. And where is Miss Grant? 
909,AIDE: Your companion is still with your fellow Earthmen. 
910,DOCTOR: Don't you realise what you've done? You've now finally
911,convinced them that we're both Draconian agents. 
912,PRINCE: There is no need to maintain this pretence. We know that you
913,are both agents of the Earth government. 
914,AIDE: You're part of a plot against the Draconian empire. 
915,"DOCTOR: My dear chap, I've already been through all this with the"
916,President of Earth. She thinks I'm working for you. 
917,PRINCE: You are working for General Williams. 
918,DOCTOR: I'm what? 
919,"PRINCE: General Williams hates out people. Once before, he caused war"
920,between us and the Earthmen. Now he plans to do so again. 
921,AIDE: Such a war would be madness since both empires would be
922,destroyed. 
923,"DOCTOR: Yes, I couldn't agree with you more. That's exactly what I've"
924,been trying to say to you. The Earth cargo ship was not attacked by
925,Draconians. 
926,AIDE: It was not attacked at all. The whole story is a lie! 
927,"DOCTOR: I can assure you that it was attacked, but by Ogrons. "
928,PRINCE: Ogrons? 
929,DOCTOR: Yes. Some third party's employing them trying to make trouble
930,between Earth and Draconia. 
931,"PRINCE: If you tell us the details of General Williams' plan, we shall"
932,be able to expose him to your President. There will still be a chance
933,for peace. 
934,"DOCTOR: My dear chap, nobody is more devoted to the cause of peace than"
935,I am. But I cannot tell you something that I don't know. 
936,AIDE: We have mind probing techniques just as efficient as those
937,"employed by you Earthmen. If you do not speak now, we shall force you"
938,to confess! 
939,DOCTOR: Don't you realise you're completely on the wrong tack? There is
940,"a plot, yes, but the Earthmen are not behind it any more than you are. "
941,AIDE: Take him away! 
942,(Two Draconian guards approach from either side. The Doctor grabs them
943,and pushes them forward into the Aide and onto the Prince's desk. In
944,his rush to escape he falls over the chair he was sitting in and a
945,guard aims his weapon.) 
946,PRINCE: No! 
947,(The Doctor runs outside and the guards follow.)
948,
949, [Draconian Embassy]
950,
951, (The Doctor leads the chase through the terraces
952,"of Fitzroy Park, Highgate.) "
953,GUARD: Stop him! 
954,GUARD 2: Halt! 
955,(The Doctor disposes of two more Draconians and runs across the lawn
956,where he is surrounded by Earth guards.)
957,
958, [Cell]
959,
960," DOCTOR: Hello, Jo. "
961,"JO: Doctor, where've you been? "
962,DOCTOR: I've been paying a brief but unwilling visit to the Draconian
963,embassy. And I'm afraid I had to leave in rather a hurry and found
964,myself back here. 
965,JO: What happened? 
966,"DOCTOR: Well, believe it or believe it not, Jo, they think we're"
967,working for General Williams and trying to provoke a war. 
968,JO: Oh no! 
969,"DOCTOR: Yes, Earth is blaming Draconia and Draconia is blaming Earth. "
970,JO: And both sides are blaming us. 
971,DOCTOR: That's about it. What's the matter? 
972,(A noise has started up somewhere.) 
973,"JO: Well, that sound. The one I heard on the cargo ship. I think I can"
974,hear it again. 
975,(So can all the people in and around the security building. A guard
976,"briefly sees an Ogron, but it turns into a Draconian and he gets shot."
977,"Weapons fire continues as a pair of Ogrons lope through the stairways,"
978,burst into the cell block and shoot the guards outside the cell before
979,blasting open the door.) 
980,JO: Ogrons! 
981,"OGRON: You, come. "
982, Episode Three
983,
984, [President's office]
985,
986, (The President is enjoying the perks of high
987,office. She has changed into a blue dress and is having her temples
988,"massaged - to cure her headache, presumably - while her secretary goes"
989,through her messages.) 
990,PRESIDENT: What's next? 
991,SECRETARY: The Historical Monuments Preservation Society wants you to
992,address their annual meeting on the tenth of January. 
993,"PRESIDENT: Hmm. Clashes with a cabinet meeting. Er, express apologies."
994,Congratulate them on their good work. 
995,SECRETARY: And there's an enquiry report in on the anti-Draconian riots
996,in Peking last week. The petitioners seek your support for
997,compensation. 
998,PRESIDENT: Pass that on to the Treasury with my recommendation. All
999,claims to be sympathetically considered. Anything else? 
1000,SECRETARY: General Williams requires an interview. He says it's
1001,extremely urgent. 
1002,PRESIDENT: I see.
1003,
1004, [Security building]
1005,
1006, (Earth troops are fighting back at the Ogrons. The
1007,Doctor and Jo manage to make a run for it.) 
1008,DOCTOR: Get down. That was close. 
1009,(A guard comes up behind them.)
1010,
1011, [President's office]
1012,
1013, (The wall television is on mute as the President
1014,"works at her desk, with a tickertape commentary running across the"
1015,"bottom of the screen, saying 'reports are coming in of Anti-Draconian"
1016,riots in Tokio. No loss of life but property extensively damaged. In
1017,several other cities de ) 
1018,"SECRETARY : General Williams to see you, Madam. "
1019,"PRESIDENT: Will you ask him to come in, please? "
1020,(She switches the television off as Williams enters.) 
1021,WILLIAMS: Vanished. The Draconian kidnappers have completely
1022,disappeared. No trace of them at all. 
1023,PRESIDENT: Have some wine? 
1024,"WILLIAMS: Thank you. Well, at least they didn't get away with it. Those"
1025,two traitors are back in their cell and that's where they'll stay. The
1026,time has come for extreme measures. 
1027,PRESIDENT: I know. You want me to break off diplomatic relations. 
1028,WILLIAMS: I want more than that. This is a military situation. We
1029,should attack now. 
1030,PRESIDENT: No! I will not be responsible for starting a war! 
1031,"WILLIAMS: There is one thing worse than war, Madam President, and that"
1032,is defeat. You must think of your own position. 
1033,PRESIDENT: What about my position? 
1034,"WILLIAMS: If you're not seen to act decisively against the Draconians,"
1035,"you can, and will, be replaced. "
1036,"PRESIDENT: By you, perhaps? "
1037,WILLIAMS: We used to be friends once. I know what's happened has
1038,"changed all that, but do you really think I'd betray you? "
1039,"PRESIDENT: No. No, I've never doubted you. I'm sorry. "
1040,WILLIAMS: There are certain senior officers who feel that a military
1041,dictatorship is needed. Your political opponents are clamouring for
1042,war. You must act now or they will bring you down. 
1043,PRESIDENT: I shall break off diplomatic relations. The Draconian
1044,Ambassador and his staff will be expelled from this planet. I shall
1045,inform the Emperor that his actions will no longer be tolerated. But
1046,"unless you give me conclusive evidence about their intentions, I shall"
1047,not strike the first blow. 
1048,WILLIAMS: The proof you need is in the minds of those two traitors. We
1049,shall have to use the mind probe. 
1050,PRESIDENT: Not on the girl. Perhaps I can make her see reason. 
1051,WILLIAMS: I doubt that. I prefer to put my faith in the mind probe.
1052,
1053, [Cell]
1054,
1055, (The Doctor is lying on the bench with a dish-like
1056,device on his forehead. Jo is not there. A woman in purple dress and
1057,over the elbow gloves is operating a console.) 
1058,"WILLIAMS: Well, Doctor, shall we try again? "
1059,"DOCTOR: You can suit yourself. But I warn you, you're wasting your"
1060,time. 
1061,WILLIAMS: Are you a member of the Draconian secret service? 
1062,DOCTOR: No. 
1063,"TECHNICIAN: No change in the rhythm, sir. He must be telling the truth."
1064,
1065,WILLIAMS: How did you get on the cargo ship? 
1066,"DOCTOR: I came here in my own ship, the Tardis. "
1067,WILLIAMS: Tardis? 
1068,"DOCTOR: Yes, my own spaceship. "
1069,(The monitor shows the Tardis whirling through space.) 
1070,WILLIAMS: Why did you help the Draconians attack the cargo ship? 
1071,"DOCTOR: I didn't. In any case, it wasn't the Draconians, it was the"
1072,Ogrons. 
1073,(The screen shows the fight with the Ogrons.) 
1074,"WILLIAMS: Your machine can't be working properly, or else he's"
1075,controlling it. 
1076,"TECHNICIAN: I've checked all the circuits, sir. Those are his thoughts."
1077,
1078,WILLIAMS: We know that this man is a Draconian agent. He must be lying.
1079,
1080,"TECHNICIAN: Perhaps he's already been brainwashed, sir. But as far as"
1081,"he's concerned, what he's telling us is the truth. "
1082,WILLIAMS: Then we must break through his conditioning. Unless you tell
1083,"me the truth, the real truth, I shall be forced to use increased power."
1084,
1085,"DOCTOR: I wouldn't do that, old man. I know these machines. They aren't"
1086,"awfully reliable, you know. "
1087,WILLIAMS: You'd do better to worry about the effect on your mind. 
1088,"DOCTOR: There's just no telling some people, is there, my dear. "
1089,WILLIAMS: Step up the power. Increase to twelve. Now! Are you an agent
1090,of the Draconians? 
1091,DOCTOR: No. 
1092,WILLIAMS: When do they plan to attack us? 
1093,DOCTOR: They don't. 
1094,WILLIAMS: How did you board the cargo ship? 
1095,DOCTOR: In the Tardis. 
1096,WILLIAMS: Who first recruited you to serve the Draconians? 
1097,DOCTOR: No one. 
1098,WILLIAMS: Who are the other Draconian agents on Earth? 
1099,DOCTOR: I don't know. 
1100,"WILLIAMS: The truth, man. I want the truth! "
1101,DOCTOR: I'm telling you the truth. 
1102,WILLIAMS: I will get the truth! 
1103,"(And the mind probe machine explodes. Later, the Doctor is still on the"
1104,"bench but the mind probe equipment is gone and Jo is back, now wearing"
1105,a black judo suit.) 
1106,JO: Doctor? Are you sure you're all right? 
1107,DOCTOR: Mmm hmm. Apart from a bit of a headache. I like the new outfit.
1108,"Who are you fighting tonight? What happened to you, anyway? "
1109,"JO: Oh, they kept going on at me to confess. "
1110,"DOCTOR: Yes, awkward, isn't it? Well, they've made up their minds, you"
1111,see. They'll only believe us if we tell them what they want to hear.
1112,It's a pity really that the Ogrons didn't succeed in kidnapping us.
1113,Perhaps we should have been more helpful. 
1114,JO: Why? 
1115,"DOCTOR: Well, if they had succeeded, presumably they'd have taken us to"
1116,"where the Tardis is. I'm sorry, Jo. I'm afraid another kidnapping"
1117,attempt is our only ray of hope. 
1118,"JO: So, we just sit around here waiting for those jolly old Ogrons to"
1119,turn up again. 
1120,"DOCTOR: That's about it, yes. "
1121,(A guard enters.) 
1122,GUARD: The President wants to see you. Get moving. Not you. (Jo) You. 
