,Script
1168,"AMBRIL: Many, though? Many? Lots? My Lord, tell me! "
1169,LON: Perhaps you'd like me to show you where they are. 
1170,"(Lon and Ambril leaves, passing Nyssa hiding in the corridor. She"
1171,enters the Director's room.) 
1172, [Secure area] 
1173, CHELA: The Snake Dance was banned by the
1174,Federation nearly a hundred years ago. 
1175,"DOCTOR: Why, what was the function of the Dance? "
1176,"CHELA: Well, according to the Legend, the Mara's return may only be"
1177,resisted by those of perfectly clear mind. The Dance was a dance of
1178,"purification in readiness for the return. However, the Federation held"
1179,that the Mara no longer existed. That's why they drove the Snake
1180,"Dancers into the hills. Oh, apparently it involved the use of certain"
1181,powers. 
1182,(The Doctor looks at his Little Mind's Eye.) 
1183,DOCTOR: What kind of powers? 
1184,"CHELA: Mental powers, easily misunderstood. "
1185,"DOCTOR: Yes, of course. "
1186, [Director's room] 
1187, (Nyssa finally finds a key in a pyramid shaped box
1188,on Ambril's desk. She turns to see Tanha and a masked guard.) 
1189,TANHA: What do you think you're doing? 
1190, [Market place] 
1191, (Adults and children alike are watching a Punch
1192,and Judy show.) 
1193,PUNCH: That's the way to do it! 
1194,JUDY: He struck me! 
1195,(Judy fetches a large saucepan.) 
1196,JUDY: Don't care. Was made to care. 
1197,(And the Judy puppet fetches Punch a clout on the head. Punch fetches
1198,his large club and battle is joined until Judy is dead.) 
1199,"PUNCH: Wake up, Judy. "
1200,CROWD: Aw. 
1201,(Ambril and Lon enter.) 
1202,PUNCH: Oh dear. Oh dear oh dear. 
1203, [Director's office] 
1204, TANHA: Where is Ambril? He should be here. I am
1205,really not sure what to do with you. It is hardly a situation one
1206,meets. Ah. 
1207,(Tanha takes the key from Nyssa.) 
1208,TANHA: I think perhaps you had better come with me. Isn't that what one
1209,usually says in this kind of situation. 
1210, [Market place] 
1211," PUNCH: Oh, I've been naughty. "
1212,LON: Just what we need. 
1213,AMBRIL: My Lord? 
1214,LON: Wait here. 
1215,(Lon picks up candlesticks from a nearby stall. A snake appears on the
1216,Punch and Judy show instead of a crocodile.) 
1217,"PUNCH: What is it? Go away, go away. "
1218,(The snake takes firm hold of Punch's nose.) 
1219,"PUNCH: Go away, go away. "
1220,(The snake chases Punch until it can drag him down out of sight. The
1221,audience applauds.) 
1222,LON: Right. 
1223,"AMBRIL: What are they for, my Lord. "
1224,LON: We must be equipped. 
1225,AMBRIL: Where are we going? 
1226,LON: Just you wait and see. Come on. 
1227, [Secure area] 
1228," DOCTOR: So, Dojjen believed the legend of the Mara"
1229,"to such an extent that he gave up everything, went up into the hills to"
1230,purify himself in readiness. 
1231,"CHELA: Doctor, nobody these days believe in legends. "
1232,(Tanha enters.) 
1233,CHELA: My Lady. 
1234,TANHA: Bring her in. 
1235,(The guard brings Nyssa in.) 
1236, [Outside the Snake Mouth] 
1237, (Ambril walks straight past the steps up to the
1238,entrance.) 
1239,LON: Ahem. 
1240,"AMBRIL: In there? Oh no, it's impossible, my Lord. All the passages"
1241,have been thoroughly explored over the years. 
1242,"LON: Come on. No, wait. We may as well do this properly. "
1243,(Lon hands the candlesticks to Ambril and takes out a kerchief.) 
1244,AMBRIL: What's that? 
1245,LON: A blindfold. 
1246,"AMBRIL: No, certainly not. "
1247,LON: You don't have to. It all depends on how badly you want the honour
1248,of having made this discovery on your own. 
1249,AMBRIL: You'd allow me to take the credit? 
1250,LON: Certainly. It's up to you. 
1251,(Ambril turns around and Lon blindfolds him.) 
1252, [Secure area] 
1253," (Nyssa is now in the cage with the Doctor, who is"
1254,lying on a bench reading Dojjen's notebook.) 
1255,NYSSA: What are we going to do? 
1256,DOCTOR: Shush. 
1257,NYSSA: Doctor! 
1258,DOCTOR: What do you suggest? 
1259,NYSSA: We've got to get out of here. 
1260,DOCTOR: How? 
1261,NYSSA: If only we still had the sonic screwdriver. 
1262,"DOCTOR: Well, we haven't, so for the time being we must make use of"
1263,what we do have. 
1264,NYSSA: What. 
1265,DOCTOR: This. 
1266, [Director's room] 
1267, (Tanha puts the key on Ambril's desk.) 
1268,TANHA: I was actually looking for my son. 
1269,"CHELA: Oh, he was here, my Lady. He had something to discuss with the"
1270,Director. 
1271,TANHA: Did he? How very odd. 
1272, [Chamber of the Mara] 
1273, (The candlesticks shine like glow-sticks.) 
1274,LON: And another three steps. That's it. Now forwards. Wait there. 
1275,(Lon removes his right gauntlet and places his snake against the
1276,relief. The secret door slides open.) 
1277,AMBRIL: What is it? 
1278,"LON: Don't worry, it's all right. Now, over the step, and stop. "
1279,(The door closes behind them.) 
1280, [Secret chamber] 
1281, LON: You've done splendidly. 
1282,AMBRIL: Where are we? 
1283,LON: Where do you think? 
1284,AMBRIL: We're there? 
1285,LON: You can take off your blindfold now. Look. I trust you're not
1286,disappointed? 
1287,"AMBRIL: Not disappointed, my Lord. "
1288,"LON: So it was all worth it, then? "
1289,"AMBRIL: Oh, my Lord, the existence of these objects is entirely"
1290,"unsuspected. Oh, my Lord, this is genuine. It's amazing. This is the"
1291,greatest hoard of all 
1292,(Ambril comes up against the Hawker's boots. Lon laughs.) 
1293,HAWKER: Entertainment. Children half price. Step this way please for
1294,the spectacle of a lifetime. Tread the mystic corridors of time to
1295,visit the dark and distant shores of the imagination. 
1296,AMBRIL: What is this place? 
1297,TEGAN: Silence! Stop wasting time. Where is the Great Crystal? 
1298, [Secure area] 
1299, (Nyssa is looking through the notebook.) 
1300,DOCTOR: Well? 
1301,"NYSSA: Doctor, what exactly are you asking me? "
1302,"DOCTOR: This is a record of a journey, a private mental journey. Now,"
1303,he must have discovered something that finally decided him. 
1304,NYSSA: To do with what? 
1305,"DOCTOR: Oh, I don't know. The Mara, the history of the planet, the"
1306,origins of this crystal. 
1307,"NYSSA: To function as they do, the crystals must possess a perfect"
1308,molecular structure tuned to the exact wavelengths of the human mind.
1309,"Doctor, the crystal is man made! "
1310,DOCTOR: What? 
1311, [Secret chamber] 
1312," AMBRIL: It's all a hoax, isn't it, my Lord? This"
1313,"is just a prank at my expense. These are friends of yours, aren't they?"
1314,"It's just an elaborate hoax, isn't it? "
1315,LON: And these? 
1316,AMBRIL: These? 
1317,"LON: Are they a hoax? After all, you're the expert. "
1318,(Lon smashes a bowl.) 
1319,AMBRIL: No! 
1320,TEGAN: Where is the Great Crystal? 
1321, [Secure area] 
1322," DOCTOR: Yes, of course, I should have realised."
1323,Structurally perfect. It has to be free of all flaws and distortions.
1324,Even the minute distortions produced by the effects of gravity. 
1325,NYSSA: What are you saying? 
1326,DOCTOR: The crystals were designed and built by a people who had
1327,mastered the techniques of molecular engineering in a zero gravity
1328,environment. 
1329,NYSSA: But the Manussans are not that advanced. 
1330,"DOCTOR: No, and according to Chela this crystal is eight hundred years"
1331,old. 
1332, [Secret chamber] 
1333, AMBRIL: No! Why is everyone suddenly interested in
1334,the Great Crystal? 
1335,LON: Everyone? 
1336,TEGAN: Who else? 
1337,AMBRIL: Some crank. 
1338,TEGAN: His name? 
1339,"AMBRIL: He calls himself the Doctor, although personally I rather doubt"
1340,it. 
1341,TEGAN: The Doctor must not interfere. He must be killed. 
1342,AMBRIL: Killed? 
1343,"LON: Take no notice. My friend has a theory, and in order to test it"
1344,the Great Crystal must be placed in its socket during the ceremony. 
1345,"AMBRIL: No, it's quite impossible. "
1346,TEGAN: Nothing is impossible. 
1347,"AMBRIL: Please, my Lord. "
1348,"LON: Now listen to me. If you don't cooperate, I promise you you'll"
1349,never set eyes on any of these trinkets ever again. You'll always know
1350,"that they existed somewhere, that you discovered them once, held them"
1351,"in your hands once, and then lost them forever. It's up to you. "
1352,(Smash!) 
1353,"AMBRIL: Oh! No! Wait! All right, I agree. "
1354, [Secure area] 
1355, NYSSA: But there would be records. A people eight
1356,hundred years ago capable of molecular engineering? 
1357,DOCTOR: Not necessarily. I suspect that when they built the Great
1358,Crystal they overlooked one vital factor. The nature of the mental
1359,energy would determine the nature of the matter created. The Great
1360,"Crystal absorbed what was in their minds. The restlessness, the hatred,"
1361,"the greed. Absorbed it, amplified it, reflected it. "
1362,NYSSA: And created the Mara. 
1363,DOCTOR: Indeed. And in the reign of evil which followed they must have
1364,"forgotten the most important thing of all, that the Mara was something"
1365,they themselves had blindly brought into being. 
1366, [Outside the Snake Mouth] 
1367, (Lon removes Ambril's blindfold. Ambril's coat is
1368,covered in dust and cobwebs.) 
1369,AMBRIL: Where are they? 
1370,"LON: They're quite safe. If you cooperate, you can discover them again"
1371,after the ceremony. 
1372,AMBRIL: Your friend? 
1373,LON: She's looking after them for you. Come on. You can discover them
1374,again after the ceremony. 
1375, [Secure area] 
1376," (While Dojjen meditates, and the snake on Tegan's"
1377,arm comes alive - ) 
1378,NYSSA: But if Dojjen had worked out what had happened 
1379,DOCTOR: Only some of it. The rest he must have learned from the Snake
1380,"Dancers who kept the knowledge alive, hidden in traditions and legends."
1381,
1382,NYSSA: And if he became convinced that the Mara would return 
1383,"DOCTOR: He didn't know exactly when, and nobody would listen, just as"
1384,no one will listen to us. 
1385,NYSSA: Then why didn't he simply destroy the Great Crystal when it was
1386,in his charge? 
1387,DOCTOR: Good question. I don't know. 
1388,NYSSA: And in the meantime? 
1389,DOCTOR: We wait. 
1390, [Director's room] 
1391," TANHA: It is difficult for him, isn't it. He is"
1392,"young, impatient. He knows that one day he will be Federator and rule"
1393,"over the three worlds. My husband is an old man, but he is lingering on"
1394,"rather. He could live for years, and so my son must wait. The young do"
1395,"not like to wait, do they. As a rule. You may speak freely. Strictly"
1396,between ourselves. 
1397,(The door opens.) 
1398,TANHA: Lon! Where've you been? 
1399,"LON: Nowhere, Mother. Just exploring. "
1400,(Ambril enters.) 
1401,"LON: Ambril has been showing me around, haven't you. "
1402, [Secure area] 
1403, (Nyssa hits the cell door.) 
1404,DOCTOR: Patience. 
1405,NYSSA: How can you be so calm? What if Chela doesn't help? 
1406,DOCTOR: I think he will. 
1407,NYSSA: You can't be certain. 
1408,DOCTOR: No. 
1409,NYSSA: And meanwhile the Mara could destroy Tegan. 
1410, [Director's office] 
1411, (Lon tries to brush the dust off Ambril.) 
1412,"LON: My fault, I'm afraid. I did rather insist, and he's got a little"
1413,dusty in the process. Ambril has an announcement to make. 
1414,AMBRIL: Do I? 
1415,"LON: Yes, you do. "
1416,"AMBRIL: Oh. Oh yes. In honour of the special esteem, esteem "
1417,LON: Ceremony. 
1418,"AMBRIL: Yes, in the ceremony this afternoon Lon, the son of the present"
1419,"Federator, will play the part of his illustrious ancestor who five"
1420,hundred years ago defeated the Mara and founded the Federation. In
1421,"honour of this special occasion, the Great Crystal, the Great Mind's"
1422,"Eye, will for the first time be inserted into its rightful place "
1423,CHELA: No! 
1424,LON: Oh? Will that be difficult? I know sometimes these last minutes
1425,changes of plan 
1426,"CHELA: Director, it is expressly forbidden. "
1427,"AMBRIL: Superstition, just foolish superstition. "
1428,"LON: It's my fault, I'm afraid. You see, it was my idea. "
1429,CHELA: My Lord. 
1430,"LON: Mother, do you have any objection? "
1431,AMBRIL: Those are my instructions and I will have them obeyed to the
1432,letter. 
1433,"LON: Then fetch the Great Crystal, would you? "
1434,AMBRIL: Now? 
1435,"LON: Yes, why not? We may as well have a look at it. "
1436,(Ambril leaves. Chela looks at the Director's desk.) 
1437,"LON: Well, I think a drink while we're waiting. Will you join us? "
1438,"CHELA: Er, no, my Lord. I'm afraid I have other duties. "
1439,LON: Of course. Highly commendable. You mustn't neglect your duties. 
1440,"(Behind Lon and Tanha's back, Chela takes the key.) "
1441,"TANHA: Lon, will you please tell me what is going on? "
1442,"LON: Of course, Mother, I'd be only too pleased. "
1443,"CHELA: Excuse me, my Lord, my Lady. "
1444,(Chela leaves.) 
1445,LON: What was on the table? He picked something up off the table. What
1446,was it? 
1447, [Secret chamber] 
1448," TEGAN: Well, showman, do you still dream of my"
1449,"success? Perhaps you do. After all, you have no choice. You have got to"
1450,look. 
1451,(Venom drips from the snake's fangs.) 
1452, [Secure area] 
1453, (Chela unlocks the cage.) 
1454,DOCTOR: Well done! 
1455,"CHELA: Quiet, there's no time. "
1456,DOCTOR: What made you change your mind? 
1457,CHELA: Come on. 
1458, [Director's room] 
1459, (Lon is watching the corridor.) 
1460,TANHA: Are you sure? He seemed such a pleasant young man. 
1461,LON: He's taken the key. That proves he's involved. 
1462, [Institute corridor] 
1463, CHELA: We must get out of the building at once. 
1464,NYSSA: And back to the Tardis? 
1465,DOCTOR: You're forgetting Tegan. 
1466, [Director's room] 
1467, (Lon speaks to a guard at the door.) 
1468,LON: I want all the entrances sealed. They must not escape. 
1469,(The guard leaves.) 
1470,"TANHA: Oh, Lon, I really do feel "
1471,"LON: Mother, do you expect me to allow those who plot my death to go"
1472,free? 
1473,TANHA: Your death? 
1474,LON: Isn't it obvious? 
1475, [Institute corridor] 
1476," (Chela, the Doctor and Nyssa are confronted by a"
1477,guard wearing a sword behind his back.) 
1478,DOCTOR: Back the way we came. 
1479,(There is another one behind them.) 
1480,"DOCTOR: All right, all right, we give in. "
1481,LON: Give in? You talk as though you had a choice. Kill them. 
1482,(The guards draw their swords. Nyssa screams.) 
1483, Part Four
1484,
1485, [Institute corridor] 
1486, TANHA: You can't do that! 
1487,LON: Why not? 
1488,"TANHA: It is preposterous to think that anyone is plotting against you,"
1489,least of all these people. 
1490,DOCTOR: Your mother is right. 
1491,LON: I'd expect you to say that. 
1492,DOCTOR: My only concern is for Tegan and the Great Crystal. 
1493,(Ambril comes round the corner carrying an ornate wooden box.) 
1494,AMBRIL: Why should the Great Crystal concern you? 
1495,"DOCTOR: If I'm allowed to live long enough, I'll explain. "
1496, [Secret chamber] 
1497," (In the market place, a giant stuffed snake with a"
1498,blue crystal in its mouth is carried in and put on the ground. 
1499,Mara Tegan has a real snake coiled around her arm. The hawker can't
1500,take his eyes off it.) 
1501,"TEGAN: Puzzling, isn't it. How can it be happening? Can you believe"
1502,your eyes? You have no choice. 
1503, [Director's room] 
1504, DOCTOR: You must not do that. 
1505,TANHA: And why not? 
1506,LON: Mother. 
1507,"TANHA: No, no, the man is entitled to his say, however preposterous. Of"
1508,"course we can do it. And the Director has agreed, haven't you. "
1509,AMBRIL: The Great Crystal will be returned to its rightful place during
1510,the ceremony. 
1511,DOCTOR: But why? 
1512,LON: Why what? 
1513,"DOCTOR: Why did you request it, and why did he agree? "
1514,TANHA: Why not? It is actually one of the few advantages of being a
1515,member of the Federator's family. 
1516,CHELA: But it's forbidden. It's forbidden by tradition going back five
1517,hundred years! 
1518,LON: Is that why you propose to assassinate me? 
1519,TANHA: I thought we'd cleared that up. 
1520,DOCTOR: Who said we wanted to assassinate you? 
1521,LON: I'm not here to be questioned by you. 
1522,"DOCTOR: No, of course not. How foolish of me. I've been very stupid. Do"
1523,"you remember me telling you, Nyssa, on the Kinda world, the mark of the"
1524,Mara? I should have realised. 
1525,LON: They'd never believe you. 
1526,TANHA: What are you two talking about? 
1527,DOCTOR: Where's Tegan? What have you done with her? 
1528,TANHA: Tegan? Who is Tegan? 
1529,LON: Another of the Doctor's companions who apparently he has lost. 
1530,TANHA: Why is he asking you about her? 
1531,"LON: How should I know, Mother? The man's a complete fool. "
1532,"DOCTOR: You won't succeed. In the end, evil never does. "
1533,"TANHA: What does he mean, evil? Who is evil? "
1534,"LON: Oh, I am, Mother. Isn't it obvious? Your son is evil. After all,"
1535,why else would they want to kill me. Don't you see? 
1536,TANHA: I most certainly do. Take them away. Take all of them away. 
1537,"LON: No, I think we can afford to be generous on today of all days. At"
1538,"least let them see the Great Crystal just once, just for a moment,"
1539,don't you think? 
1540,AMBRIL: My Lord. 
1541,LON: Indulge me. That's close enough. Right. 
1542,AMBRIL: Shall I? 
1543,LON: If you wouldn't mind. 
1544,(Ambril raises the lid of the box.) 
1545,DOCTOR: Now! 
1546,(The Doctor and Nyssa run for the door while Chela tries to get the
1547,"Crystal away from Lon, who has picked up the box.) "
1548,"DOCTOR: Come on, there's no time for that! "
1549,"LON: Well, don't just stand there, after them! "
1550,AMBRIL: Me? 
1551,"LON: Yes, you, and take that fool with you. "
1552, [Market place] 
1553, (They hide behind a stall.) 
1554,CHELA: Where are we going? 
1555,DOCTOR: To find Tegan. 
1556,CHELA: We don't even know if she's still alive. 
1557,DOCTOR: Tegan won't die until the Mara within her is free. 
1558,"NYSSA: If Lon has been affected by the Mara, why hasn't he changed? "
1559,DOCTOR: Same reason as Tegan. He still has a lot of his own
1560,personality. 
1561,CHELA: But he is influenced? 
1562,DOCTOR: Very much so. 
1563,(A guard walks past.) 
1564,DOCTOR: Come on. 
1565, [Director's office] 
1566," (Lon holds the Great Crystal, which is still only"
1567,a fraction of the size of the Metabelis crystal. Ambril enters.) 
1568,LON: Well? 
1569,"AMBRIL: No sign, my Lord. I'm afraid they seem to have got away. "
1570,LON: Do they. 
1571,AMBRIL: Yes. I've issued the necessary instruction. A search party is
1572,being organised. 
1573,LON: It doesn't matter. What can they do now? 
1574,"AMBRIL: As you say, my Lord. "
1575,LON: Well? 
1576,"AMBRIL: I only wish to remind you, my Lord "
1577,LON: I've not forgotten. 
1578,AMBRIL: Our arrangement. 
1579,LON: Yes. 
1580,"AMBRIL: You promised immediately after the ceremony, my Lord. "
1581,LON: Go away. 
1582,(Ambril leaves.) 
1583,"TANHA: Lon, what arrangement? What did you promise him? "
1584,"LON: Nothing, Mother. It doesn't matter. "
1585,"TANHA: I know you, you're planning something. Is it to be a surprise? "
1586,"LON: Yes, Mother. "
1587, [Market place] 
1588, DOCTOR: In here. 
1589,"CHELA: It's all right, I think we've managed to lose them. "
1590,(A masked figure jumps out and shakes its maracas at them. They all
1591,yelp.) 
1592,"CHELA: I'm sorry, Doctor, it's just the surprise. "
1593,DOCTOR: What is it? 
1594,(The figure touches the Doctor with a maraca.) 
1595,CHELA: You've been touched by an attendant demon. You must forfeit a
1596,"coin. It's the custom, I'm afraid. "
1597,DOCTOR: Custom? 
1598,"CHELA: On the day of the ceremony, the attendant demons seek out the"
1599,"unwary. Anyone they touch with the evil must pay up or, er. "
1600,DOCTOR: Or what? 
1601,CHELA: Have water tipped over their heads. It's part of the fun. 
1602,DOCTOR: I'm afraid I don't have a coin. 
1603,(Chela pays up for the Doctor.) 
1604,CHELA: Here you are. May you never feel the serpent's tooth. 
1605,(The 'demon' rattles its maracas and leaves.) 
1606,DOCTOR: I wish it was that easy.) 
1607,"NYSSA: Doctor, what are we going to do? "
1608,DOCTOR: How long have we got? When does the actual ceremony begin? 
1609,"CHELA: Well, first the Great Snake is taken in procession through the"
1610,streets before going up to the cave. 
1611,DOCTOR: How long? 
1612,CHELA: A few hours. 
1613,DOCTOR: I wonder if there's still time. There must be. It's our only
1614,hope. Come on. 
1615,(The Doctor puts the Little Mind's Eye round his neck.) 
1616,CHELA: Where are we going? 
1617,DOCTOR: Change of plan. To find Dojjen. 
1618, [Director's room] 
1619," TANHA: But if it's nothing, why won't you let me"
1620,see it? 
1621,"LON: I told you, Mother, it's just a scratch. "
1622,TANHA: It could become infected. How did it happen? Why didn't you tell
1623,me? 
1624,LON: It was an accident. 
1625,TANHA: What sort of an accident? I would just like to check 
1626,"LON: Mother! For the last time, will you leave me alone! "
1627, [Market place] 
1628," (The procession has begun, and the snake we saw"
1629,earlier being laid out on the ground is accompanied by a man with a
1630,megaphone.) 
1631,MAN: Now the Great Snake has come to claim his own. Who has the power
1632,to turn away his face? Which one of you has the strength to turn away?
1633,Who can protect us now? Submit! Submit! 
1634, [Outside the Snake Mouth] 
1635, DOCTOR: Come on. 
1636,"CHELA: If you'd let me steal the Great Crystal, this trek wouldn't be"
1637,necessary. 
1638,DOCTOR: It's not as simple as that. 
1639,NYSSA: Why not? 
1640,"DOCTOR: We wouldn't be preventing the Mara's return, only postponing"
1641,"it. It would continue to exist as a mental force. No, this time we must"
1642,destroy it completely. 
1643,NYSSA: But how? 
1644,DOCTOR: I don't know. 
1645,NYSSA: And you think Dojjen will be able to tell us? 
1646,DOCTOR: I hope so. 
1647,"CHELA: Dojjen hasn't been seen for ten years. He could be anywhere,"
1648,assuming he's still alive. 
1649,DOCTOR: You're forgetting we do have this. 
1650,(The crystal.) 
1651,CHELA: How will that help to find him? 
1652,DOCTOR: It won't. It will help him find us. Trust me. 
1653, [Director's room] 
1654, (Ambril enters carrying a golden headdress with a
1655,"'little' crystal in it, and followed by a servant bearing a cushion"
1656,with some regalia on it.) 
1657,LON: Well? 
1658,AMBRIL: I've taken the liberty of bringing the costume that you must
1659,"wear for the ceremony, my Lord. "
1660,"LON: Oh good. Look, Mother. "
1661,"AMBRIL: It's an exact replica of the costume worn by your ancestor, the"
1662,"Founder of the Federation, when he destroyed the Mara five hundred"
1663,years ago. 
1664,LON: How very appropriate. 
1665,"AMBRIL: I beg your pardon, my Lord? "
1666,"LON: Don't you think so, Mother? "
1667,"(Tanha stands at the window with her back to them, very still.) "
1668,"LON: Well, I'm going to try it on. Are you coming? "
1669,"(Lon picks up the box containing the Great Crystal, and leaves. The"
1670,servant follows.) 
1671, [Ruins] 
1672, (Looking just like the place where Dojjen has been
1673,"seen meditating, except there is no one here.) "
1674,CHELA: How far are we going? 
1675,DOCTOR: This should be fine. 
1676,(The Doctor sits on the ground.) 
1677,NYSSA: What now? 
1678,DOCTOR: Sympathetic resonance. 
1679,NYSSA: Doctor? 
1680,DOCTOR: Thought directed at this crystal should set up a resonance
1681,which is picked up and echoed by another. 
1682,CHELA: So? 
1683,"DOCTOR: Well, the Snake Dancers wear these, don't they? "
1684,CHELA: So I gather. 
1685,"NYSSA: Of course. The crystal will act like a radio wave, transmitting"
1686,thoughts instead of words. 
1687,CHELA: Establishing a mental link. 
1688,DOCTOR: Hopefully. 
1689,CHELA: Will it work? 
1690,(The Doctor closes his eyes and concentrates. The crystal begins to
1691,"glow. There is a hum, then it fades.) "
1692,NYSSA: Well? 
1693,DOCTOR: Now we wait. 
1694, [Director's room] 
1695, (Lon has returned in a bizarre short white tunic
1696,"with blue clouds on it, the gold sunburst headdress with blue crystal,"
1697,gold roman sandals and red gauntlets.) 
1698,LON: Mother? 
1699,TANHA: Let me look at you. 
1700,LON: Am I forgiven? 
1701,"TANHA: What? Oh yes, of course. Aren't you always? Come here. "
1702,"LON: Well, what do you think? "
1703,"TANHA: You look splendid. It fits exactly, don't you think so? "
1704,"AMBRIL: Remarkable fit, my Lady, truly remarkable. "
1705,"TANHA: Let me look at you. Oh, I am going to be so proud. "
1706, [Ruins] 
1707," CHELA: If what you say is true, why didn't Dojjen"
1708,destroy the Great Crystal while he was still Director? 
1709,DOCTOR: Good question. Nyssa asked exactly the same thing. 
1710,CHELA: Well? 
1711,DOCTOR: I don't know. Perhaps we'll find that out too. 
1712,(The crystal glows.) 
1713,NYSSA: Doctor! 
1714,(A skinny old man with a large staff and a bag has arrived.) 
1715,CHELA: Dojjen. 
1716, [Market place] 
1717, (The snake is still whirling amongst the crowd.) 
1718,MAN: Abandon yourselves and follow the path of the snake. Follow the
1719,path. Who dare resist the power of the snake? 
1720, [Ruins] 
1721," (Dojjen sits opposite the Doctor, takes a small"
1722,snake out of his bag and lets it bite his wrist. Then he hands it to
1723,the Doctor.) 
1724,"NYSSA: Doctor, no. What are you doing? "
1725,DOCTOR: I'm afraid we have no choice if we're to have any hope of
1726,saving Tegan. 
1727,NYSSA: But its bite could be deadly. 
1728,"DOCTOR: Yes, I do know. "
1729,(And he puts the snake to his wrist. 
1730,"(Ambril leads Lon, Tanha and a guard through the cheering crowd outside"
1731,"the cave, followed by local dignitaries.) "
1732,"DOJJEN : No, look into my eyes. You have come this far. You must"
1733,not now give in to fear. Look. 
