,Script
1075,"ANNE: You've been very kind to me, Monsieur, but, well, I'm afraid to"
1076,go back to that house. 
1077,"STEVEN: Look, I'll be with you. Besides, you won't stay here, so where"
1078,will you go? 
1079,"ANNE: Well, all right. I'll come with you. "
1080,"STEVEN: Look, if anything happens on the way to the Abbot, if I'm"
1081,"recognised then we'll have to run. Now you must come back here, do you"
1082,understand? 
1083,ANNE: But supposing they catch me? 
1084,"STEVEN: No, they won't. I'll be the one they chase. Now if you come"
1085,"back here I'll know where to find you, and I can join you as soon as"
1086,possible. 
1087,ANNE: All right. 
1088,STEVEN: Good girl. Come on.
1089,
1090, [Council Chamber]
1091,
1092, DE COLIGNY: How much longer are the Huguenots to
1093,suffer these frequent violations of their rights? 
1094,TAVANNES: The treaty drawn up by the Queen Mother to conclude the
1095,religious difficulties of the country was generous in the extreme to
1096,the free thinkers. 
1097,DE COLIGNY: Words were spoken. Signatures were exchanged. But they did
1098,not prevent many acts against the Huguenots. 
1099,"TAVANNES: Do you question the promises of the Queen Mother, Admiral? "
1100,DE COLIGNY: It is easy to promise. 
1101,TAVANNES: You speak treason! 
1102,CHARLES: Enough! Why is it not possible for our councillors to talk
1103,without quarrelling? 
1104,"DE COLIGNY: Sire, it is imperative that the religious differences of"
1105,the country be fully discussed. 
1106,"CHARLES: Admiral, grant me but a few days more in which to amuse myself"
1107,"and then I promise you, as King, that I shall make you happy and all"
1108,those of your religion. 
1109,DE COLIGNY: Kings are recognised only by the power they wield. The
1110,"Queen Mother seems to claim this power. Take care, Your Majesty, that"
1111,"it does not prove detrimental to yourself, and to France. "
1112,TAVANNES: Your Majesty 
1113,"CHARLES: Tavannes, no more. "
1114,CATHERINE: Marshall. 
1115,"(Taking their leave, Marshall Tavannes escorts the Queen Mother,"
1116,"Catherine de Medici, from the council chamber.) "
1117,CHARLES: This meeting is over. Since my noble mother's seen fit to
1118,"depart, let us do likewise. We need to get on the Feast of Saint"
1119,"Bartholomew, so until the day after tomorrow, let us enjoy ourselves. "
1120,TOLIGNY: Was that wise? To insult the Queen will only make her work
1121,harder against you. 
1122,DE COLIGNY: It was time her power was challenged. 
1123,TOLIGNY: The King still fears his mother. Surely this may damage all
1124,for which you've worked so hard? 
1125,DE COLIGNY: Let us hope not. 
1126,"CHARLES: Ha, ha! Admiral, come with us. We are going to play tennis. "
1127,"DE COLIGNY: Your Majesty, I must beg to be excused. I have work which"
1128,must be done. 
1129,"CHARLES: Oh, my dear Admiral, we are pleased with you. Since now our"
1130,"mother will not speak to us for the rest of today, you will come with"
1131,us. I have a new racquet I want you to see. Come.
1132,
1133, [Abbot's apartments]
1134,
1135, PRIEST: You will have to wait in here. The Abbot
1136,cannot be disturbed. 
1137,"STEVEN: Yes, but I must speak to him. It's most important. "
1138,"PRIEST: You do not understand, young man. The Abbot is saying his"
1139,office. 
1140,STEVEN: His what? 
1141,PRIEST: His office. We cannot disturb him while he is at prayer. 
1142,"STEVEN: Well, how long's he going to be? "
1143,"PRIEST: You must curb your impatience, young man. If you will tell me"
1144,"what your business is, then perhaps I can help you. "
1145,"STEVEN: I have a message for the Abbot, concerning a man who is to die"
1146,today. 
1147,"PRIEST: If it is a case for the last sacraments, then there is no need"
1148,"to trouble the Abbot. I, myself, will come with you. "
1149,"STEVEN: Well, no. I mean, I mean, it's very kind of you but "
1150,PRIEST: Is there something more? 
1151,"STEVEN: Well, yes. And I can only discuss it with the Abbot. "
1152,(The Abbot enters.) 
1153,ABBOT: What is this? 
1154,PRIEST: My Lord Abbot. 
1155,"STEVEN: Oh, Doctor! "
1156,"ABBOT: Silence! Who is this man, and why does he disturb my peace? "
1157,PRIEST: It appears he comes from a dying man. 
1158,ABBOT: Well? 
1159,STEVEN: I've brought back the servant who ran away. 
1160,ANNE: Monsieur! 
1161,"ABBOT: You have done well, my son. Father, you may leave us. I will"
1162,settle this matter. 
1163,"PRIEST: Very well, my Lord Abbot. "
1164,"STEVEN: I felt you would be safer here, as Bondeaux waits for the Sea"
1165,Beggar. 
1166,(Tavannes enters.) 
1167,"TAVANNES: Lord Abbot, a word with you. "
1168,"ABBOT: The young man has returned the girl to us, Marshall. "
1169,TAVANNES: What girl? 
1170,ABBOT: The one who lodged with the Sea Beggar. 
1171,"TAVANNES: Oh, she is of no importance. I must speak with you alone. "
1172,ABBOT: Very well. Take the girl and wait outside. I'll tend you later. 
1173,(We move away from the conversation and the words become more
1174,indistinct.) 
1175,TAVANNES: Is Bondeaux prepared? 
1176,ABBOT: Of course. I never fail. Neither do my servants. 
1177,TAVANNES: Is Bondeaux prepared to go to the Place Saint Germain? 
1178,ANNE: Listen! 
1179,ABBOT: Bondeaux has been prepared for the last two hours. 
1180,"STEVEN: Quick, we've got to tell Nicholas. "
1181,(We return to the Abbot's conversation.) 
1182,ABBOT: Is the Sea Beggar on his way home? 
1183,TAVANNES: I don't know. The King delayed him after the council and he
1184,had seen fit to insult the Queen Mother and His Majesty was naturally
1185,pleased with him. 
1186,ABBOT: de Coligny will allow no one to take him away from his work. I
1187,think we can take it he is on his way by now. 
1188,COLBERT: The girl. The servant who ran away 
1189,ABBOT: Colbert! How dare you interrupt us! 
1190,COLBERT: But she is with the Englishman from the Admiral's house. I've
1191,just seen them. 
1192,TAVANNES: What? 
1193,COLBERT: The Englishman with the girl. He's the one who was with the
1194,Huguenots. 
1195,TAVANNES: Who did he say he was? 
1196,ABBOT: I never asked him. 
1197,TAVANNES: Fetch them back. 
1198,COLBERT: I've sent the guards after them. He was taking her out the
1199,side door. 
1200,"TAVANNES: My Lord Abbot, what mistake have you perpetrated now? "
1201,ABBOT: He could not hear what was being said. I sent him out of the
1202,"room. In any case, it is too late for him to warn the Admiral. "
1203,TAVANNES: For your sake it had better be. 
1204, [de Coligny's house] 
1205, (Nicholas sits brooding in his room at de
1206,Coligny's house. He's certain that Steven was trying to get some kind
1207,"of message to him, whatever Gaston may believe. Then, to his amazement,"
1208,Nicholas spots the Englishman in the street below.) 
1209,STEVEN : Will you get out of my way! 
1210,"MUSS: Come in, Steven! "
1211,"ANTOINE: But Monsieur, I cannot allow "
1212,"STEVEN: Nicholas! Quickly, it's the Admiral. "
1213,"ANTOINE: Monsieur, I am sorry "
1214,MUSS: Be quiet! What's wrong? 
1215,STEVEN: The plot! 
1216,MUSS: The Catholics? 
1217,STEVEN: Yes! It's the Admiral they're going to kill! 
1218,MUSS: de Coligny? 
1219,STEVEN: Today! Now! 
1220,MUSS: But how? 
1221,"STEVEN: I don't know, but you've got to warn him. "
1222,MUSS: He's at the Louvre. There's a council meeting. 
1223,"STEVEN: No, it's over. They're going to kill him on the way back. "
1224,MUSS: Where? 
1225,"STEVEN: The Rue Saint, Saint Germain? "
1226,MUSS: The Place Saint Germain? 
1227,STEVEN: Yes! 
1228,MUSS: Stay here!
1229,
1230,[Street] 
1231,(The Rue de Foss Saint Germain is deserted at this
1232,time of day. The perfect site for an assassination attempt. In an attic
1233,"room overlooking the street, the assassin, Maurevert, codename Bondeaux"
1234,is preparing for the task ahead of him. He opens a case and takes from
1235,"it an arquebus, a hand-held rifle of the latest design. Setting the"
1236,"arquebus on the tripod-like stand, Bondeaux trains the weapon on the"
1237,"street, and smiles. From his vantage point here he cannot fail to hit"
1238,"his target. At the end of the street, the Admiral de Coligny appears,"
1239,returning home after the council meeting at the Louvre. He walks
1240,"slowly, engrossed in a report he's reading. A group of courtiers follow"
1241,"him at a distance, talking quietly amongst themselves so as not to"
1242,disturb him. Toligny is amongst them. Bondeaux fixes his sights on de
1243,Coligny and slowly squeezes the trigger. But a gust of wind snatches a
1244,page of the report from the Admiral's hand and he instinctively stoops
1245,to retrieve it just as Bondeaux fires the arquebus. de Coligny falls to
1246,the ground.) 
1247,MUSS: Admiral! Admiral! 
1248,DE COLIGNY: See how honest men are treated in France? The shot came
1249,from that window. 
1250,MUSS: Search the house! We must get him to a surgeon! 
1251,(The falling page saved de Coligny's life. The bullet only wounded him.
1252,"As others hunt for Bondeaux, Nicholas and Toligny help the Admiral to"
1253,his feet. But de Coligny is proud and shrugs off their supporting
1254,"hands. Unsteady on his feet, bleeding profusely, he walks away"
1255,unaided.)
1256,
1257, [Abbot's apartments]
1258,
1259, TAVANNES: We should have heard by now. 
1260,ABBOT: The King may have delayed him further. 
1261,TAVANNES: Due to your stupidity the Englishman has had a chance to warn
1262,him. 
1263,ABBOT: I said he did not hear anything. 
1264,TAVANNES: Then why did he run off? 
1265,ABBOT: I don't know. 
1266,"TAVANNES: If this should go wrong, you are to blame, and you will be"
1267,the one to answer for it. 
1268,ABBOT: The Cardinal 
1269,TAVANNES: Is in Rome and cannot help you now. 
1270,"ABBOT: If de Coligny is delayed by the King, then the news of his death"
1271,will be delayed also. Bondeaux is an excellent marksman. You know that.
1272,"There is only one thing for us to do, and that is to wait. Meantime, I"
1273,will retire to my room. 
1274,TAVANNES: You will not. You will wait here with me. 
1275,(Reluctantly the Abbot obeys Marshall Tavannes and returns to his chair
1276,"in silence. A moment later, the door bursts open and Roger Colbert"
1277,rushes in.) 
1278,COLBERT: Father Abbot. 
1279,TAVANNES: Well? 
1280,COLBERT: The attempt has failed. 
1281,ABBOT: I see. Was Bondeaux caught? 
1282,"COLBERT: He rode away. But the Admiral was only wounded, not killed. "
1283,"TAVANNES: So, the Sea Beggar lives. You have failed! Call the guards!"
1284,"It is strange, Father Abbot, that since you came everything which had"
1285,been so carefully planned has gone wrong. 
1286,(Colbert returns with the guards.) 
1287,TAVANNES: This man is a traitor to the Queen. Kill him. You heard my
1288,"order, kill him! "
1289,(The guards advance on the Abbot.)
1290,
1291, [Council chamber]
1292,
1293," CATHERINE: Monsieur De Toligny, I am waiting. "
1294,"TOLIGNY: I'm sorry, Your Majesty, but the news I have must be given"
1295,first to the King. 
1296,CHARLES: Now what's the matter? Why must I always be interrupted? And I
1297,was winning. 
1298,"TOLIGNY: Your pardon, Sire, but I bring news of the greatest"
1299,importance. 
1300,"CHARLES: Well, what is it? "
1301,TOLIGNY: Admiral de Coligny has been severely wounded. 
1302,CHARLES: What? 
1303,TOLIGNY: Someone tried to shoot him. 
1304,CHARLES: Will I never have any peace! 
1305,"TOLIGNY: Your Majesty, the Admiral is badly hurt. "
1306,CHARLES: What happened? 
1307,TOLIGNY: The assassins were waiting in the Rue de Place Saint Germain.
1308,As we came down the street they fired at him. 
1309,CHARLES: Were they caught? 
1310,"TOLIGNY: No, Sire. We searched the house and found the weapon, but the"
1311,men had gone. 
1312,"CHARLES: Well, they must be found. An inquiry. Call the council. The"
1313,Admiral's assassins must be caught and punished! Call the council!
1314,
1315, [de Coligny's house]
1316,
1317," DE COLIGNY: Oh, my head. "
1318,MUSS: My little father. I will see you avenged. 
1319,DE COLIGNY: Take me to my own room. Help me up. 
1320,"MUSS: No, Admiral, wait for the surgeon. He'll be here soon. "
1321,DE COLIGNY: Why did they do it? 
1322,"ANTOINE: Monsieur, are you sure we should not take him to his own room?"
1323,
1324,"MUSS: No, he's lost too much blood. Go and wait for the surgeon. Bring"
1325,him straight in. 
1326,"ANTOINE: Yes, Monsieur. "
1327,"STEVEN: Nicholas, I'm sorry. I tried to tell Gaston, he wouldn't listen"
1328,to me. 
1329,"MUSS: I know, he told me. "
1330,STEVEN: I knew that the Sea Beggar was going to be killed. Until this
1331,morning I didn't know who that was. 
1332,MUSS: I could've told you. How did you find out? 
1333,"STEVEN: Oh, when I ran away from you yesterday, I went to the Abbot's"
1334,"house. Well, the Doctor wasn't there, but I overheard some men talking"
1335,about the Sea Beggar. 
1336,MUSS: Who were they? 
1337,"STEVEN: Oh, I don't know. But, well, one of them was the same man who"
1338,came to see the Abbot this morning. 
1339,MUSS: So the Abbot is behind this. 
1340,STEVEN: No! The Abbot is the Doctor. Now that I've seen him I'm certain
1341,"of it. He's just pretending to be the Abbot, that's all. "
1342,"MUSS: Now listen, Steven. "
1343,TOLIGNY: How is he? 
1344,MUSS: He's very weak. 
1345,TOLIGNY: The King has called for an inquiry but it won't do any good. 
1346,MUSS: What do you mean? 
1347,TOLIGNY: As I left the Louvre I heard that some of our men have taken
1348,the law into their own hands. 
1349,MUSS: How? 
1350,TOLIGNY: The Abbot of Amboise was murdered just outside his own house. 
1351,STEVEN: What? 
1352,TOLIGNY: The Abbot is dead and they're blaming it on the Huguenots. 
1353,"STEVEN: But, he wasn't the Abbot! "
1354,TOLIGNY: The King has summoned the council. I must return to the
1355,"Louvre. Take care of him, Nicholas. "
1356,MUSS: Of course.
1357,
1358, [Council chamber]
1359,
1360," CHARLES: And, Marshall, since you claim to know"
1361,"nothing of this attempted assassination, I have a special charge for"
1362,you. You will be responsible for the Admiral's safety. Empty the street
1363,"of Catholics, station your men around his house, and mark me well, if"
1364,"anything further happens to him, you pay with your head. "
1365,"TOLIGNY: We do not need the Marshall's protection, Sire. To drive"
1366,Catholics from their homes will only make them hate us even more. 
1367,TAVANNES: Is that possible? Your concern for your friends does you
1368,"credit, Sire. "
1369,CHARLES: I gave you an order! See it is done! 
1370,TOLIGNY: But Sire. 
1371,CHARLES: Not another word from either side! I've had enough of your
1372,"bickering. Leave me, all of you. "
1373,"(The council withdraws, leaving the King alone. The Queen Mother"
1374,quietly enters the chamber.) 
1375,CATHERINE: You summoned the council? 
1376,CHARLES: I gave orders I was to be left alone. 
1377,CATHERINE: Without my knowledge or consent? 
1378,"CHARLES: I asked to be left alone, mother. "
1379,"CATHERINE: The threat over your friend, the Admiral. You are the King. "
1380,"CHARLES: Yes, I am the King, and to be obeyed! Now keep out of my sight"
1381,unless you care to end your days in a convent. 
1382,"CATHERINE: I would wish you have the courage, my son. "
1383,CHARLES: I have but to give the order. 
1384,"CATHERINE: Summon your guards, have me arrested. But you had better"
1385,have a good reason for the council and for the people. 
1386,"CHARLES: The attempted assassination of my Admiral, by you and"
1387,"Tavannes. Do you deny it, Madame? "
1388,CATHERINE: No. 
1389,CHARLES: Have a care. I mean what I say. I shall send Tavannes to the
1390,block! 
1391,CATHERINE: You would execute the Marshall of France for doing his duty?
1392,
1393,CHARLES: Duty? He's an assassin! 
1394,CATHERINE: He tried to rid you of a dangerous enemy. 
1395,"CHARLES: de Coligny is my friend. You, Madame, are my enemy. "
1396,CATHERINE: If ever I were to be. 
1397,CHARLES: May God help you. 
1398,(The Queen Mother throws a list of names onto the table.) 
1399,CATHERINE: Look at these before you decide who are your enemies. You
1400,think the Huguenots would stop at killing me? They want your blood too.
1401,
1402,CHARLES: So you keep telling me every day of my life. Why? I protect
1403,them. They're all my subjects. What have they to gain? 
1404,"CATHERINE: Until now, nothing. "
1405,CHARLES: And now? 
1406,"CATHERINE: We have a Protestant prince in Paris, Henri of Navarre. You"
1407,"think they give a fig for your protection, now that one of their own is"
1408,within grasp of the throne?
1409,
1410, [Street]
1411,
1412,"(Outside, a crowd has gathered around the body of"
1413,the Abbot of Amboise.) 
1414,MAN: The Huguenots must have done it! 
1415,WOMAN: The free thinkers! 
1416,MAN: They shouldn't be allowed to come here! They done it! 
1417,2ND WOMAN: It's a wicked thing. 
1418,MAN: The Huguenots will stop at nothing! They even kill our priests. 
1419,2ND MAN: Nothing is sacred to the Huguenots! 
1420,MAN: Something will have to be done! The Huguenots must be banned from
1421,entering towns! 
1422,2ND MAN: Kill the Huguenots! They will kill these poor defenceless
1423,priests elsewhere! No! Lock them up! 
1424,COLBERT: You are certain that no one saw the body brought here? 
1425,GUARD: Positive. Just look at them. They all believe the Huguenots
1426,killed him. 
1427,COLBERT: Good. 
1428,"STEVEN: Doctor, what happened? What have they done? "
1429,WOMAN: The Huguenots murdered him! 
1430,STEVEN: No! 
1431,MAN: They did. We saw them! 
1432,WOMAN: There were fifteen of them! 
1433,MAN: They struck him down! But he'll be revenged! 
1434,COLBERT: Hold that man! He's responsible! 
1435,"MAN: After him, guards! Catch him! "
1436,"(Leaving the corpse of the old man sprawled in the gutter, the crowd"
1437,"turns on Steven. He is forced, literally, to run for his life.)"
1438,
1439, Episode Four - Bell of
1440,Doom 
1441, [Preslin's shop]
1442,
1443,(Anne has spent the night alone in Preslin's shop.
1444,"Now, as morning gives way to afternoon, she despairs of ever seeing"
1445,Steven again. Then there is a knocking at the door.) 
1446,"STEVEN : Anne! Anne, you there? Anne! "
1447,(Anne opens the door.) 
1448,"ANNE: Oh, Monsieur! I'd given you up for lost when you didn't come back"
1449,last night. I thought the guards must have caught you. 
1450,"STEVEN: Yes, they nearly did. I managed to shake them off. I'm sorry,"
1451,Anne. The curfew rang before I could get back last night. The guards
1452,were still looking for me this morning. That's why I've been so long. 
1453,ANNE: Did you see Monsieur Muss and give him your message? 
1454,"STEVEN: Oh, yes. The warning was too late. "
1455,"ANNE: What will you do now? Go back to your friend, the Doctor. "
1456,STEVEN: I can't. He's dead. 
1457,ANNE: Monsieur! 
1458,STEVEN: I saw his body lying in the street by the Abbot's house. Before
1459,I could do anything Roger Colbert saw me and sent the guards after me
1460,again. Heaven knows what I do now. 
1461,ANNE: Return to England? 
1462,STEVEN: I can't. I've got to find the key to the Tardis. 
1463,ANNE: What Monsieur? 
1464,STEVEN: Ah. The Doctor has a special key. Without it I can't leave. 
1465,"ANNE: Well, do you know where it is? "
1466,STEVEN: No. If the Doctor had it with him then I'm lost. I didn't have
1467,time to look for it. My only hope is that it's still with his own
1468,clothes. 
1469,ANNE: You mean at the Abbot's house? 
1470,"STEVEN: Oh, no, no. He would have had to change before he went there."
1471,The only other place I think he's been to is this shop. 
1472,"ANNE: Oh, but we've already searched here, Monsieur, looking for"
1473,clothes here. 
1474,"STEVEN: And we must do it again! Please help me. Open every cupboard,"
1475,every box. I must find that key. 
1476,"ANNE: Right, Monsieur."
1477,
1478, [Tavannes' study]
1479,
1480,(Marshall Tavannes is in his study talking to
1481,Simon.) 
1482,TAVANNES: It may hinder the inquiry into the attempted assassination of
1483,de Coligny. 
1484,DUVALL: Surely the King is insisting that de Coligny is avenged? 
1485,TAVANNES: He is. But by blaming the death of the Abbot on the Huguenots
1486,we may be able to cover our tracks. 
1487,DUVALL: Will the King pay any attention to the Abbot's death? 
1488,TAVANNES: I don't know. Fortunately the Admiral himself is helping us.
1489,He doesn't want the inquiry yet so that may give us a little time. 
1490,DUVALL: Therefore the Englishman must be caught. 
1491,TAVANNES: And killed. He must not be allowed to get back to the Abbot's
1492,house. 
1493,DUVALL: The men are searching Paris for him. 
1494,TAVANNES: He must be found tonight. Tomorrow is Saint Bartholomew's Day
1495,and it'll be all too easy for him to evade us in the revelry. 
1496,(A messenger arrives with a note for Tavannes.) 
1497,TAVANNES: The Queen Mother. She commands me to go to her. No doubt she
1498,has thought of some further scheme to protect her good name. Wait for
1499,"me here, Simon. I may have more instructions for you when I get back."
1500,
1501, [Preslin's shop]
1502,
1503,(Evening falls. Steven and Anne have wrecked
1504,Preslin's shop in their search for the Tardis key. There are clothes
1505,"strewn about and boxes overturned, their contents littered across the"
1506,floor. Steven is beginning to get desperate.) 
1507,STEVEN: Well? 
1508,"ANNE: Nothing, Monsieur. There's no sign of your friend's clothes"
1509,anywhere. 
1510,STEVEN: They must be here. 
1511,ANNE: All I found was this. 
1512,"STEVEN: But, but this is his stick! "
1513,ANNE: Your friend's? 
1514,"STEVEN: Yes. Well, his clothes must be here somewhere! Where did you"
1515,find it? 
1516,"ANNE: In the back, Monsieur. But there are no clothes there. "
1517,STEVEN: You sure? 
1518,ANNE: Yes. I've searched everywhere! 
1519,STEVEN: Then why the stick? He couldn't have pretended to be the Abbot
1520,"dressed as he was, so he must have changed somewhere. But where? "
1521,ANNE: Perhaps he went away somewhere with the apothecary who used to
1522,live here? 
1523,"STEVEN: What, with Preslin? No, he couldn't. "
1524,ANNE: Why not? 
1525,STEVEN: Because Preslin is either dead or in prison. 
1526,DOCTOR: He is not. 
1527,STEVEN: Doctor!
1528,
1529, [de Coligny's house]
1530,
1531,"(Gaston, Toligny and Nicholas are standing vigil by"
1532,de Coligny's sick bed.) 
1533,GASTON: The Catholics will not rest until you are dead! 
1534,"DE COLIGNY: You are too impetuous, Viscount. "
1535,TOLIGNY: The King is determined to prevent a further attempt. Why else
1536,do you think he's put so heavy a guard on this house? 
1537,GASTON: A Catholic guard under a Catholic commander! The Admiral could
1538,hardly be in the care of a greater enemy. 
1539,TOLIGNY: He is under the protection of the King. 
1540,GASTON: And the Queen Mother. 
1541,"MUSS: Gaston, you are tiring the Admiral, and doing yourself an"
1542,injustice. You had better return to the Louvre. 
1543,"GASTON: Nicholas, no! If you were to leave Paris it would be better for"
1544,you and for us. 
1545,MUSS: The surgeon said the Admiral must not be moved. 
1546,GASTON: Then may God protect you. 
1547,(Gaston leaves.) 
1548,DE COLIGNY: I hope Henri of Navarre realises how dangerous it is to
1549,have such a hothead in his service. 
1550,TOLIGNY: He must be wrong. The commander wouldn't dare to disobey the
1551,King after what has happened. 
1552,"MUSS: Let's hope so. Is there anything you need, Admiral? "
1553,DE COLIGNY: Stay with me. 
1554,MUSS: Of course. 
1555,"TOLIGNY: You must be grateful that the wounds are not poisoned, so that"
1556,there is no fear of you dying. 
1557,DE COLIGNY: I do not fear death. I only hope we have nothing to fear
1558,from my staying alive.
1559,
1560, [Preslin's shop]
1561,
1562," DOCTOR: Oh, my dear boy, had you stayed at the"
1563,tavern all this mix-up could have been avoided. 
1564,"STEVEN: I did stay at the tavern, you didn't turn up! "
1565,"DOCTOR: Yes, well, I was unavoidably delayed. Never mind that now. Come"
1566,"along, we must go. Come along. "
1567,"ANNE: Oh, you cannot now, Monsieur. The curfew's rung. "
1568,"DOCTOR: What? Oh, that wretched curfew is the start of so much trouble."
1569,
1570,"ANNE: It'll be easy to leave Paris in the morning, Monsieur. Tomorrow's"
1571,Saint Bartholomew's Day and everyone will be celebrating. 
1572,STEVEN: Huh! With all the trouble that's going on I can't see what
1573,they've got to celebrate. 
1574,DOCTOR: I told you not to get involved. 
1575,"STEVEN: Look, I tried not to, but the Abbot did look like you, and if I"
1576,hadn't found out about Admiral de Coligny being the 'Sea Beggar' then 
1577,DOCTOR: What's that? 
1578,STEVEN: I tried to tell you before. Admiral de Coligny is one of the
1579,Huguenot leaders. The Catholics tried to shoot him. 
1580,"DOCTOR: Did you say tomorrow was Saint Bartholomew's Day, child? "
1581,"ANNE: Yes, Monsieur. "
1582,"DOCTOR: What year is this, my boy? "
1583,"STEVEN: Oh, I don't know. What difference does it make? "
1584,"DOCTOR: What date is it, child? "
1585,"ANNE: Date, Monsieur? August the twenty-third as "
1586,"DOCTOR: Yes, yes, yes, I know that. The year, the year, hmm? "
1587,"ANNE: Fifteen seventy two, Monsieur. But surely you know that? "
1588,"DOCTOR: Go home, Anne. You must leave here at once. "
1589,ANNE: No! I've got nowhere to go! 
1590,DOCTOR: Where were you working? 
1591,ANNE: At the Abbot's house. 
1592,DOCTOR: You go back there. 
1593,ANNE: I can't! They'll kill me! 
1594,"DOCTOR: You must leave this shop, child. "
1595,"STEVEN: Doctor, what's happening? "
1596,"DOCTOR: Oh, please don't interfere. Now, my dear, there must be"
1597,somewhere you can stay in Paris. 
1598,"ANNE: No, there's only my aunt's place, and they'll kill me there. "
1599,"DOCTOR: Oh, nonsense. Tonight you will be quite safe. Now you go"
1600,carefully through the streets. 
1601,"ANNE: Well, what about the curfew? "
